"|","|__writer_name","|__pub_date","|__snippet","|__word_count","|__score","|__source","|__section_name","|__type_of_material","|__document_type","|__main_headline","|__print_headline"
"https://www.nytimes.com/2003/07/10/technology/the-new-card-shark.html","Peter Wayner","2003-07-10","Online poker contributes to skill of players, including Chris Moneymaker, who, with no tournament experience, won $2.5 million in World Series of Poker; fees for online games are significantly lower and players are not deterred by physical element...","2099","null","The New York Times","Technology","News","article","The New Card Shark","The New Card Shark"
"https://www.nytimes.com/2003/04/06/world/hong-kong-hospitals-struggle-as-disease-cases-rise-quickly.html","Keith With","2003-04-06","New respiratory disease spreads further in Hong Kong, with sharp jump in new cases and three more deaths; hospitals struggle to cope with growing burden; more hospital nurses and doctors are falling ill (M)","584","null","The New York Times","World","News","article","Hong Kong Hospitals Struggle as Disease Cases Rise Quickly","Hong Kong Hospitals Struggle as Disease Cases Rise Quickly"
"https://www.nytimes.com/2003/04/22/business/earnings-at-3m-are-up-11.html","Bloomberg News","2003-04-22","","299","null","The New York Times","Business Day","News","article","Earnings at 3M Are Up 11%","Earnings at 3M Are Up 11%"
"https://www.nytimes.com/2003/10/31/international/asia/asias-longest-serving-ruler-steps-down-after-22-years.html","Jane Perlez","2003-10-31","Mahathir Mohamed stepped down today, leaving a legacy of a modern Muslim nation that he molded with often autocratic rule.","1239","null","The New York Times","World","News","article","Asias Longest Serving Ruler Steps Down After 22 Years","Asias Longest Serving Ruler Steps Down After 22 Years"
"https://www.nytimes.com/2003/12/29/world/5-afghan-officers-are-killed-in-attack-as-assembly-meets.html","Carlotta Gall","2003-12-29","Suicide bomber kills five Afghan intelligence officers and himself near Kabul airport, casting shadow of concern over loya jirga, grand assembly meeting in Kabul to approve new constitution for Afghanistan; two suspected accomplices of bomber esca...","786","null","The New York Times","World","News","article","5 Afghan Officers Are Killed In Attack as Assembly Meets","5 Afghan Officers Are Killed In Attack as Assembly Meets"
"https://www.nytimes.com/2003/11/30/business/edgar-bronfman-jr-s-backup-band.html","Andrew Sorkin","2003-11-30","Article on $2.6 billion buyout of Warner Music led by Edgar Bronfman Jr; Bronfman, Thomas H Lee, whose Thomas H Lee Partners played key role in deal and put $650 million of own money into it, and Scott M Sperling, Lee partner who led deal for firm...","2039","null","The New York Times","Business Day","News","article","Edgar Bronfman Jr.'s Backup Band","Edgar Bronfman Jr.'s Backup Band"
"https://www.nytimes.com/2003/04/18/business/flow-of-money-to-stock-funds-is-most-in-a-year.html","Jonathan Fuerbringer","2003-04-18","AMG Data Services says stock mutual funds had net inflow of $5.7 billion in week ended April 16; holds $1 billion went into aggressive growth funds and $472 million into technology funds; says domestic equity funds attracted $4 billion, with $1.1 ...","431","null","The New York Times","Business Day","News","article","Flow of Money to Stock Funds Is Most in a Year","Flow of Money to Stock Funds Is Most in a Year"
"https://www.nytimes.com/2003/05/03/world/aftereffects-nation-s-future-us-now-battle-for-peace-after-winning-war-iraq.html","Dexter Filkins","2003-05-03","American troops, having won war in Iraq, are straining to manage anger, frustration and competing ambitions of nation long suppressed by Saddam Hussein; new politicial parties, Kurds and Shiite religious groups are asserting virtual governmental a...","2563","null","The New York Times","World","News","article","U.S. Is Now in Battle for Peace After Winning the War in Iraq","AFTEREFFECTS: A NATION'S FUTURE; U.S. Is Now in Battle for Peace After Winning the War in Iraq"
"https://www.nytimes.com/2003/03/25/business/technology-briefing-hardware-conexant-will-spin-off-mindspeed-unit.html","Bloomberg News","2003-03-25","Conexant Systems Inc will spin off its unprofitable Mindspeed Technologies business, which makes semiconductors for Internet equipment; Mindspeed will receive $150 million in cash from Conexant in initial capital and contigent financing (S)","175","null","The New York Times","Business Day","News","article","Technology Briefing | Hardware: Conexant Will Spin Off Mindspeed Unit","Technology Briefing | Hardware: Conexant Will Spin Off Mindspeed Unit"
"https://www.nytimes.com/2003/06/19/business/rank-group-plans-hard-rock-s-growth.html","Dow Jones","2003-06-19","Rank Group is expanding its Hard Rock Hotels concept across Europe and Americas through joint venture with Sol Melia of Spain; plans to develop city and resort hotels; Becker Ventures is providing $1 billion to finance development of hotels (S)","213","null","The New York Times","Business Day","News","article","Rank Group Plans Hard Rock's Growth","Rank Group Plans Hard Rock's Growth"
"https://www.nytimes.com/2003/11/11/business/us-tariffs-on-steel-are-illegal-world-trade-organization-says.html","Elizabeth Becker","2003-11-11","World Trade Organization rules steel tariffs imposed by Pres Bush in 2002 are illegal, clearing way for European Union to impose over $2 billion in sanctions on imports from United States unless US quickly drops duties; Bush must now choose betwee...","1285","null","The New York Times","Business Day","News","article","U.S. Tariffs on Steel Are Illegal, World Trade Organization Says","U.S. Tariffs on Steel Are Illegal, World Trade Organization Says"
"https://www.nytimes.com/2003/04/23/world/despite-birth-bonuses-zoroastrians-in-india-fade.html","Amy Waldman","2003-04-23","Parsis, followers of prophet Zarathustra and descendants of Persians who took refuge in India millennium ago, seem to be dwindling despite bonuses paid by community to families that have third child; Parsis, especially in Bombay, are educated, urb...","1096","null","The New York Times","World","News","article","Despite Birth Bonuses, Zoroastrians in India Fade","Despite Birth Bonuses, Zoroastrians in India Fade"
"https://www.nytimes.com/2003/03/12/news/east-germans-hanker-after-bygone-things.html","Nora Fitzgerald","2003-03-12","","1549","null","The New York Times","World","News","article","East Germans hanker after bygone things","East Germans hanker after bygone things"
"https://www.nytimes.com/2003/02/03/world/at-least-30-killed-by-blast-in-a-dense-block-of-lagos.html","Somini Sengupta","2003-02-03","Explosion rips through dense city block in Lagos, Nigeria, killing at least 30 people, injuring many more, and setting off chaotic looting that impedes rescue efforts; Lagos Gov Bola Tinubu is careful to note that cause of blast has not yet been d...","552","null","The New York Times","World","News","article","At Least 30 Killed by Blast In a Dense Block of Lagos","At Least 30 Killed by Blast In a Dense Block of Lagos"
"https://www.nytimes.com/2003/07/26/world/world-briefing-europe-spain-eta-bombers-sentenced.html","Emma NYT","2003-07-26","Spanish court sentences ETA members Santiago Arrospide and Caride Simon to several life terms in prison for their participation in 1987 Barcelona supermarket bombing that killed 21 people and injured 44; bombing is most deadly in 35-year-old Basqu...","103","null","The New York Times","World","News","article","World Briefing | Europe: Spain: E.T.A. Bombers Sentenced","World Briefing | Europe: Spain: E.T.A. Bombers Sentenced"
"https://www.nytimes.com/2003/10/17/world/the-struggle-for-iraq-killed-in-iraq.html","null","2003-10-17","Dept of Defense confirms death of American service member in Iraq (S)","39","null","The New York Times","World","List","article","Killed in Iraq","THE STRUGGLE FOR IRAQ; Killed in Iraq"
"https://www.nytimes.com/2003/12/05/business/worldbusiness/IHT-signs-show-that-worst-is-behind-us-he-says-armani.html","Eric Pfanner","2003-12-05","At a time when many luxury goods companies are facing an unstable future, Giorgio Armani announced plans on Thursday for a further expansion of his fashion empire next year..For many luxury goods companies, the past three years have been a struggl...","3291","null","International Herald Tribune","Business Day","null","article","Signs show that 'worst is behind us,' he says : Armani plans to fashion an expansion of empire","Signs show that 'worst is behind us,' he says : Armani plans to fashion an expansion of empire"
"https://www.nytimes.com/2003/08/27/business/japan-is-spending-heavily-to-pursue-a-weak-yen-policy.html","Jonathan Fuerbringer","2003-08-27","Japanese government is defying logic of foreign exchange market by keeping yen from rising sharply in value against dollar; Japan has himited yen's rise against dollar to no more than 2.3 percent this year by spending trillions of yen to buy dolla...","1184","null","The New York Times","Business Day","News","article","Japan Is Spending Heavily to Pursue a Weak-Yen Policy","Japan Is Spending Heavily to Pursue a Weak-Yen Policy"
"https://www.nytimes.com/2003/04/06/world/a-nation-at-war-baghdad-defiant-iraqis-say-us-push-was-thwarted.html","John Burns","2003-04-06","Information Min Muhammad Said al-Sahhaf and other senior Iraqi officials remain defiant in face of display of American military might in center of Baghdad, asserting that Iraqi soldiers and suicide bombers have 'crushed' American troops at Baghdad...","1268","null","The New York Times","World","News","article","Defiant Iraqis Say U.S. Push Was Thwarted","A NATION AT WAR: BAGHDAD; Defiant Iraqis Say U.S. Push Was Thwarted"
"https://www.nytimes.com/2003/07/24/business/the-markets-stocks-bonds-stocks-rise-on-rosy-forecasts-from-amazon-and-amgen.html","Bloomberg News","2003-07-24","Dow Jones industrial average rises 35.79 points, to 9,194.24; Nasdaq composite index gains 13.08 points, to 1,719.18; Standard & Poor's 500-stock index roses 0.50 points, to 988.61; stock price graph and table (M)","676","null","The New York Times","Business Day","News","article","Stocks Rise on Rosy Forecasts From Amazon and Amgen","THE MARKETS: STOCKS & BONDS; Stocks Rise on Rosy Forecasts From Amazon and Amgen"
"https://www.nytimes.com/2003/10/19/business/market-watch-fawning-analysts-betray-investors.html","Gretchen Morgenson","2003-10-19","Gretchen Morgenson column deplores congratulatory comments by stock analysts taking part in Intel's earnings conference call, holding analysts still do not see that such fawning is inappropriate; notes their failure to ask about competitive threat...","599","null","The New York Times","Business Day","News","article","Fawning Analysts Betray Investors","MARKET WATCH; Fawning Analysts Betray Investors"
"https://www.nytimes.com/2003/11/28/business/jane-evans-59-executive-and-women-s-advocate-dies.html","Wolfgang Saxon","2003-11-28","Jane Evans, former top executive of several","563","null","The New York Times","Business Day","Obituary; Biography","article","Jane Evans, 59, Executive And Women's Advocate, Dies","Jane Evans, 59, Executive And Women's Advocate, Dies"
"https://www.nytimes.com/2003/05/02/business/auto-sales-dropped-6.1-during-april.html","Danny Hakim","2003-05-02","Ward's AutoInfoBank reports auto sales for April fell 6.1 percent to seasonally adjusted annual selling rate of 16.44 million units compared with 17.3 million units year earlier; analysts expected better numbers because General Motors extended its...","721","null","The New York Times","Business Day","News","article","Auto Sales Dropped 6.1% During April","Auto Sales Dropped 6.1% During April"
"https://www.nytimes.com/2003/10/25/business/the-markets-key-rates.html","null","2003-10-25","","121","null","The New York Times","Business Day","Statistics","article","Key Rates","THE MARKETS; Key Rates"
"https://www.nytimes.com/2003/11/14/business/worldbusiness/IHT-profit-rises-at-deutsche-telekom-telefonica-and-bt.html","Jennifer Schenker","2003-11-14","Three of Europe's biggest phone companies — Deutsche Telekom, Telefónica and BT Group — posted robust quarterly profits Thursday, a clear sign that the telecommunications sector is bouncing back after three years of losses..Deutsche Te","3749","null","International Herald Tribune","Business Day","null","article","Profit rises at Deutsche Telekom, Telefónica and BT Group : Telecoms rebound in Europe","Profit rises at Deutsche Telekom, Telefónica and BT Group : Telecoms rebound in Europe"
"https://www.nytimes.com/2003/12/25/technology/l-internet-phone-service-701564.html","null","2003-12-25","Letter from Peter Thonis, Verizon Communications, on Dec 18 article says it is difficult to compare cost of Internet telephone services; drawing","200","null","The New York Times","Technology","Letter","article","Internet Phone Service","Internet Phone Service"
"https://www.nytimes.com/2003/05/10/business/worldbusiness/IHT-investing-picks-and-pans-firstquarter-scoreboard.html","Anne Bagamery","2003-05-10","In the first quarter of 2002, global markets were coming off the sharp downturn that followed the terrorist attacks of Sept. 11, 2001, and stock investors were wrestling with a predicament: how to achieve gain without subjecting themselves to more...","2524","null","International Herald Tribune","Business Day","null","article","Investing picks and pans / First-quarter scoreboard : Safe but sorry:the difference a year can make","Investing picks and pans / First-quarter scoreboard : Safe but sorry:the difference a year can make"
"https://www.nytimes.com/2003/07/25/international/asia/world-briefing-asia.html","null","2003-07-25","TYPHOON BATTERS SOUTHEAST ASIA; JAPAN: U.S. Marine Pleads Guilty To Rape;.","145","null","The New York Times","World","News","article","World Briefing: Asia","World Briefing: Asia"
"https://www.nytimes.com/2003/10/21/business/business-digest-782564.html","null","2003-10-21","","589","null","The New York Times","Business Day","Summary","article","BUSINESS DIGEST","BUSINESS DIGEST"
"https://www.nytimes.com/2003/01/08/business/the-media-business-advertising-addenda-accounts-753564.html","Stuart Elliott","2003-01-08","Roundup of recent advertising account changes (S)ú","47","null","The New York Times","Business Day","News","article","Accounts","THE MEDIA BUSINESS: ADVERTISING -- ADDENDA; Accounts"
"https://www.nytimes.com/2003/07/15/international/middleeast/world-briefing-middle-east.html","null","2003-07-15","KUWAIT: Leadership Shift; IRAN: Journalist Arrested;.","170","null","The New York Times","World","News","article","World Briefing: Middle East","World Briefing: Middle East"
"https://www.nytimes.com/2003/09/14/business/executive-life-at-yale-a-case-study-too-close-to-home.html","Stacey Stowe","2003-09-14","Most students and professors at Yale's Management School are paying little attention to strike by Yale's technical, clerical, service and maintenance workers; topic has been largely absent from classroom discussions; photo (M)","1004","null","The New York Times","Business Day","News","article","Executive Life; At Yale, a Case Study Too Close to Home","Executive Life; At Yale, a Case Study Too Close to Home"
"https://www.nytimes.com/2003/12/05/business/worldbusiness/IHT-server-maker-defends-strategy-amid-loss-sun.html","Kevin O'Brien","2003-12-05","On the defensive, Scott McNealy, chief executive of Sun Microsystems, poked fun at his competitors and financial analysts on Thursday for painting a gloomy future for the U.S. computer server maker, which is struggling after 10 quarterly losses..I...","4029","null","International Herald Tribune","Business Day","null","article","Server maker defends strategy amid loss : Sun tackles its rivals","Server maker defends strategy amid loss : Sun tackles its rivals"
"https://www.nytimes.com/2003/12/30/world/al-qaeda-links-seen-in-attacks-on-top-saudi-security-officials.html","Douglas Jehl","2003-12-30","American officials say Islamic militants in Saudi Arabia with links to Al Qaeda are making concerted new effort to destabilize Saudi government by assassinating top security officials; cite series of assassination attempts, including failed car bo...","773","null","The New York Times","World","News","article","Al Qaeda Links Seen in Attacks On Top Saudi Security Officials","Al Qaeda Links Seen in Attacks On Top Saudi Security Officials"
"https://www.nytimes.com/2003/05/11/world/aftereffects-civilian-casualties-for-family-that-lost-10-allied-bomb-only.html","Marc Santora","2003-05-11","Iraqis tell of civilian casualties during weeks of war and allied bombing in Iraq; determining number of civilian casualties is proving difficult; photo (M)","1179","null","The New York Times","World","News","article","For Family That Lost 10 to Allied Bomb, Only Memories and Grief Remain","AFTEREFFECTS: CIVILIAN CASUALTIES; For Family That Lost 10 to Allied Bomb, Only Memories and Grief Remain"
"https://www.nytimes.com/2003/04/28/business/compressed-data-amazon-site-s-child-reviewers-spur-privacy-charge.html","Ian Austen","2003-04-28","Electronic Privacy Information Center and 11 other groups complain to Federal Trade Commission that Amazon.com violates online privacy law by letting children review products and posting their personal information; law requires owners of Web sites...","198","null","The New York Times","Business Day","News","article","Compressed Data; Amazon Site's Child Reviewers Spur Privacy Charge","Compressed Data; Amazon Site's Child Reviewers Spur Privacy Charge"
"https://www.nytimes.com/2003/07/24/business/company-news-cit-group-names-peek-as-its-new-president.html","Bloomberg News","2003-07-24","CIT Group names Jeffrey Peek, Credit Suisse First Boston official, president and chief operating officer; says he probably will succeed chairman and chief executive Albert Gamper (S)","73","null","The New York Times","Business Day","News","article","CIT GROUP NAMES PEEK AS ITS NEW PRESIDENT","COMPANY NEWS; CIT GROUP NAMES PEEK AS ITS NEW PRESIDENT"
"https://www.nytimes.com/2003/01/08/world/threats-responses-impact-un-study-sees-500000-iraqis-facing-injury-case-war.html","Julia Preston","2003-01-08","Confidential UN report predicts as many as 500,000 Iraqis could suffer injuries if US and allies launch war (S)","569","null","The New York Times","World","News","article","U.N. Study Sees 500,000 Iraqis Facing Injury In Case of War","THREATS AND RESPONSES: IMPACT; U.N. Study Sees 500,000 Iraqis Facing Injury In Case of War"
"https://www.nytimes.com/2003/06/19/world/st-petersburg-journal-oh-that-glow-white-nights-beg-for-a-painter.html","Michael Wines","2003-06-19","St Petersburg, Russia, is aglow with its famous White Nights, which begin in late May and peak at summer solstice on June 21; unearthly phosphorescence bathing city has special attraction for city's artists; photo (St Petersburg Journal) (M)","780","null","The New York Times","World","News","article","St. Petersburg Journal; Oh That Glow. White Nights Beg for a Painter.","St. Petersburg Journal; Oh That Glow. White Nights Beg for a Painter."
"https://www.nytimes.com/2003/11/17/world/okinawans-ask-rumsfeld-to-thin-out-troops.html","Thom Shanker","2003-11-17","Governor of Okinawa petitions Defense Sec Donald H Rumsfeld to reduce or relocate American military bases on island; urges removing large numbers of American marines to reduce crime there; Gov Keiichi Inamine makes unusual move of opening his meet...","659","null","The New York Times","World","News","article","Okinawans Ask Rumsfeld to Thin Out Troops","Okinawans Ask Rumsfeld to Thin Out Troops"
"https://www.nytimes.com/2003/07/07/international/middleeast/palestinians-say-israel-needs-to-release-more.html","James Bennet","2003-07-07","The Palestinians said the planned prisoner release was not nearly sweeping enough to generate support for peace talks.","713","null","The New York Times","World","News","article","Palestinians Say Israel Needs to Release More Prisoners","Palestinians Say Israel Needs to Release More Prisoners"
"https://www.nytimes.com/2003/01/11/business/business-digest-803154.html","null","2003-01-11","","533","null","The New York Times","Business Day","Summary","article","BUSINESS DIGEST","BUSINESS DIGEST"
"https://www.nytimes.com/2003/02/28/business/royal-ahold-ousts-leadership-of-its-argentine-unit.html","Tony Smith","2003-02-28","Dutch supermarket operator Royal Ahold moves to limit damage from accounting scandal by replacing chief executive and board of its Argentine unit Disco and dispatching Dutch management team to oversee unit; Garcia Pye, head of Ahold's Santa Isabel...","990","null","The New York Times","Business Day","News","article","Royal Ahold Ousts Leadership of Its Argentine Unit","Royal Ahold Ousts Leadership of Its Argentine Unit"
"https://www.nytimes.com/2003/11/26/business/rochester-utility-sells-nuclear-power-station.html","Matthew Wald","2003-11-26","Constellation Energy, Baltimore-based electric company, will buy Robert E Ginna nuclear plant from Rochester Gas and Electric for $401 million (M)","597","null","The New York Times","Business Day","News","article","Rochester Utility Sells Nuclear Power Station","Rochester Utility Sells Nuclear Power Station"
"https://www.nytimes.com/2003/03/12/world/threats-responses-overview-march-11-2003-postponed-deadline-beleaguered-blair-de.html","Daniel Wakin","2003-03-12","","696","null","The New York Times","World","News","article","A Postponed Deadline, a Beleaguered Blair and De-Frenched Fries","THREATS AND RESPONSES: AN OVERVIEW: MARCH 11, 2003; A Postponed Deadline, a Beleaguered Blair and De-Frenched Fries"
"https://www.nytimes.com/2003/03/19/business/worldbusiness/seoul-companies-given-more-time-to-pay-off-huge-debts.html","Don Kirk","2003-03-19","Creditors of SK Global today gave it another three months in which to make payments on more than $5 billion in debts.","1161","null","The New York Times","Business Day","News","article","Seoul Companies Given More Time to Pay Off Huge Debts","Seoul Companies Given More Time to Pay Off Huge Debts"
"https://www.nytimes.com/2003/03/25/world/nation-war-arab-media-arabic-stations-compete-for-attention-riveted-audience.html","Neil MacFarquhar","2003-03-25","In Middle East, Al Jazeera, satellite station based in Qatar, still dominates, but newer, smaller channels are challenging its grip on Arab viewers eager to view news of war in Iraq; photo (M)","1039","null","The New York Times","World","News","article","Arabic Stations Compete for the Attention of a Riveted Audience","A NATION AT WAR: THE ARAB MEDIA; Arabic Stations Compete for the Attention of a Riveted Audience"
"https://www.nytimes.com/2003/11/07/business/on-visit-congo-president-faults-us-farm-subsidies.html","Steven Holmes","2003-11-07","Congo's Pres Joseph Kabila criticizes US for maintaining agricultural subsidies that harm farmers in his country during visit to US; Kabila meets with Pres Bush and receives promise of continued American support for peace agreement that has brough...","479","null","The New York Times","Business Day","News","article","On Visit, Congo President Faults U.S. Farm Subsidies","On Visit, Congo President Faults U.S. Farm Subsidies"
"https://www.nytimes.com/2003/09/04/technology/what-s-next-it-s-tricky-grafting-brando-s-sneer-to-bogart-s-shrug.html","Eric Taub","2003-09-04","Researchers at Integrated Media Systems Center at University of Southern California are tring to deconstruct basis of what makes humans look human, breaking down movement and speech into comprehensible and interlocking set of patterns; filmmakers ...","1034","null","The New York Times","Technology","News","article","It's Tricky, Grafting Brando's Sneer to Bogart's Shrug","WHAT'S NEXT; It's Tricky, Grafting Brando's Sneer to Bogart's Shrug"
"https://www.nytimes.com/2003/01/11/world/venezuela-crisis-complicates-iraq-situation-experts-say.html","James Dao","2003-01-11","United States officials and industry experts say strike that has virtually shut down Venezuela's oil industry is creating major complications for Bush administration's drive to oust Iraqi Pres Saddam Hussein, causing oil shortages that would proba...","1234","null","The New York Times","World","News","article","Venezuela Crisis Complicates Iraq Situation, Experts Say","Venezuela Crisis Complicates Iraq Situation, Experts Say"
"https://www.nytimes.com/2003/07/02/business/trade-pact-with-pakistan-reflects-politics-not-economics-critics-say.html","Daniel Altman","2003-07-02","Trade and Investment Framework Agreement that was sign last month between US and Pakistan came into being largely as result of political expediency, rather than familiar economic motivation that trade helps both sides; Pakistan may realize few tan...","1247","null","The New York Times","Business Day","News","article","Trade Pact With Pakistan Reflects Politics, Not Economics, Critics Say","Trade Pact With Pakistan Reflects Politics, Not Economics, Critics Say"
"https://www.nytimes.com/2003/07/10/business/media-business-advertising-addenda-leagas-delaney-sell-us-office-managers.html","David Barboza","2003-07-10","Leagas Delaney in London is selling its sole US office, in San Francisco, to management and plans to open new American headquarters in New York; financial terms undisclosed (S)","191","null","The New York Times","Business Day","News","article","Leagas Delaney to Sell U.S. Office to Managers","THE MEDIA BUSINESS: ADVERTISING -- ADDENDA; Leagas Delaney to Sell U.S. Office to Managers"
