"|","|__writer_name","|__pub_date","|__snippet","|__word_count","|__score","|__source","|__section_name","|__type_of_material","|__document_type","|__main_headline","|__print_headline"
"https://www.nytimes.com/2003/01/14/business/technology-briefing-hardware-radisys-will-cut-17-of-work-force.html","Bloomberg News","2003-01-14","RadiSys Corp will eliminate 108 jobs, or 17 percent of its work force, by selling business and hiring another company to do more manufacturing of its computer equipment (S)","168","null","The New York Times","Business Day","News","article","Technology Briefing | Hardware: Radisys Will Cut 17% Of Work Force","Technology Briefing | Hardware: Radisys Will Cut 17% Of Work Force"
"https://www.nytimes.com/2003/04/09/world/nation-war-iraqi-capital-key-section-city-taken-street-street-fight.html","John Burns","2003-04-09","Battle for heart of Baghdad begins at dawn in sprawling gardens of Saddam Hussein's Republican Palace and tapers off later in day with US in control of area running some two miles along Tigris River's western embankment and mile or so back from ri...","1901","null","The New York Times","World","News","article","Key Section of City Is Taken In a Street-by-Street Fight","A NATION AT WAR: IRAQI CAPITAL; Key Section of City Is Taken In a Street-by-Street Fight"
"https://www.nytimes.com/2003/05/14/international/americas/world-briefing-americas.html","null","2003-05-14","PANAMA: Stolen Treasures Recovered;.","100","null","The New York Times","World","News","article","World Briefing: Americas","World Briefing: Americas"
"https://www.nytimes.com/2003/03/12/business/worldbusiness/IHT-look-before-you-email-message-board-letters-to-the.html","null","2003-03-12","I used to think that only two things made me irate: having trouble finding an address and being refused service in a public place. I now realize that Internet snafus qualify as a third, and I have devised the following guidelines:. Before sitting ...","1764","null","International Herald Tribune","Business Day","null","article","Look before you e-mail : message BOARD / Letters to the technology editor","Look before you e-mail : message BOARD / Letters to the technology editor"
"https://www.nytimes.com/2003/08/19/world/world-briefing-middle-east-egypt-the-ancient-art-of-monopoly.html","Abeer NYT","2003-08-19","Al Gumhoria, state newspaper, reports Egyptian Labor Minister Ahmed al Amawi has canceled work permits for foreign belly dancers working in Egypt; foreign dancers generally work for lower wages and local dancers have campaigned for stricter regula...","82","null","The New York Times","World","News","article","World Briefing | Middle East: Egypt: The Ancient Art Of Monopoly","World Briefing | Middle East: Egypt: The Ancient Art Of Monopoly"
"https://www.nytimes.com/2003/04/29/business/the-markets-stocks-bonds-two-earnings-reports-set-off-biggest-rally-in-a-month.html","Bloomberg News","2003-04-29","Dow Jones industrial average gains 165.26 points, or 2 percent, to 8,471.61; Standard & Poor's 500-stock index rises 16.03 points, or 1.8 percent, to 914.84; Nasdaq composite index adds 27.70 points, or 1.9 percent, to 1,462.24; prices of US Treas...","640","null","The New York Times","Business Day","News","article","Two Earnings Reports Set Off Biggest Rally in a Month","THE MARKETS: STOCKS & BONDS; Two Earnings Reports Set Off Biggest Rally in a Month"
"https://www.nytimes.com/2003/03/27/business/the-media-business-advertising-addenda-accounts-983683.html","Stuart Elliott","2003-03-27","Roundup of recent advertising account changes (S)","123","null","The New York Times","Business Day","News","article","Accounts","THE MEDIA BUSINESS: ADVERTISING -- ADDENDA; Accounts"
"https://www.nytimes.com/2003/08/10/business/l-corner-office-addictions-844683.html","null","2003-08-10","Dr Edwin A Salsitz letter holds July 20 article on executives with addictions accurately reflects stigma issues he sees in his addiction medicine practice, but does not mention stigma attached to methadone treatment for heroin and other opioid add...","103","null","The New York Times","Business Day","Letter","article","Corner-Office Addictions","Corner-Office Addictions"
"https://www.nytimes.com/2003/11/21/world/a-region-inflamed-the-president-bush-and-blair-say-bombings-fortify-resolve.html","Warren Hoge","2003-11-21","Grim Pres Bush and Prime Min Tony Blair defiantly pledge to continue fight against terrorism, news conference in London just after two truck bombings hit British targets in Istanbul; photos; London continues on high security as Bush's heavily armo...","955","null","The New York Times","World","News","article","Bush and Blair Say Bombings Fortify Resolve","A REGION INFLAMED: THE PRESIDENT; Bush and Blair Say Bombings Fortify Resolve"
"https://www.nytimes.com/2003/03/08/world/threats-responses-cost-war-troop-movement-alone-could-cost-25-billion.html","David Rosenbaum","2003-03-08","Congressional Budget Office estimates that initial cost of deploying troops and equipment to Persian Gulf to fight Iraq and returning them home would cost nearly $25 billion; estimates that cost of first month of combat would be $10 billion and ea...","661","null","The New York Times","World","News","article","Troop Movement Alone Could Cost $25 Billion, Congressional Office Finds","THREATS AND RESPONSES: COST OF WAR; Troop Movement Alone Could Cost $25 Billion, Congressional Office Finds"
"https://www.nytimes.com/2003/03/25/international/worldspecial/putin-rejects-us-claims-of-military-sales-to-iraq.html","Sabrina Tavernise","2003-03-25","President Vladimir V. Putin responded today to American accusations that Russian companies are selling advanced military equipment to Iraq, calling the claim ""unsubstantiated.""","365","null","The New York Times","World","News","article","Putin Rejects U.S. Claims of Military Sales to Iraq","Putin Rejects U.S. Claims of Military Sales to Iraq"
"https://www.nytimes.com/2003/12/27/business/he-s-the-other-force-in-the-fund-investigation.html","null","2003-12-27","Profile of David D Brown IV, head of New York State's Investment Protection Bureau, who is working with New York Atty Gen Eliot Spitzer to crack down on illicit trading practices in mutual fund industry; Brown is seen as perfectly suited to take o...","1398","null","The New York Times","Business Day","News","article","He's the Other Force in the Fund Investigation","He's the Other Force in the Fund Investigation"
"https://www.nytimes.com/2003/05/23/business/world-business-briefing-asia-japan-trade-surplus-expands.html","Ken NYT","2003-05-23","Japan's trade surplus hit 840 billion yen ($7.2 billion) in April, increase of 1.6 percent from same month year earlier, helped by strong exports to China; exports over all grew 4.7 percent; surplus with US fell 11.8 percent (S)","65","null","The New York Times","Business Day","News","article","World Business Briefing | Asia: Japan: Trade Surplus Expands","World Business Briefing | Asia: Japan: Trade Surplus Expands"
"https://www.nytimes.com/2003/10/06/business/bond-sale-schedule-for-the-week-ahead.html","null","2003-10-06","","252","null","The New York Times","Business Day","Schedule","article","Bond Sale Schedule For the Week Ahead","Bond Sale Schedule For the Week Ahead"
"https://www.nytimes.com/2003/08/28/world/33-are-killed-in-stampede-at-a-hindu-festival.html","David Rohde","2003-08-28","Thirty-three people die and 74 others are injured in stampede at Hindu festival in Nasik, India, where tens of thousands of pilgrims try to bathe in holy waters of Godavari River in single day; government officials say crowds rushed forward too qu...","473","null","The New York Times","World","News","article","33 Are Killed in Stampede at a Hindu Festival","33 Are Killed in Stampede at a Hindu Festival"
"https://www.nytimes.com/2003/11/29/business/company-news-houghton-mifflin-to-buy-educational-testing-company.html","Dow Jones","2003-11-29","Houghton Mifflin acquires Edusoft, supplier of computer software used by school districts to track test results; financial terms undisclosed (S)","79","null","The New York Times","Business Day","News","article","HOUGHTON MIFFLIN TO BUY EDUCATIONAL TESTING COMPANY","COMPANY NEWS; HOUGHTON MIFFLIN TO BUY EDUCATIONAL TESTING COMPANY"
"https://www.nytimes.com/2003/06/01/jobs/home-front-fees-from-visas-now-train-americans.html","Anthony Depalma","2003-06-01","Fees collected for special visas for foreign skilled workers are being used to train Americans at places like Manhattan Community College; photo (S)","792","null","The New York Times","Job Market","News","article","Fees From Visas Now Train Americans","HOME FRONT; Fees From Visas Now Train Americans"
"https://www.nytimes.com/2003/07/09/international/africa/bush-presses-south-africa-to-step-up-efforts-to-fight.html","Richard Stevenson","2003-07-09","AIDS was one of two issues that President Bush and President Thabo Mbeki discussed. The other was Zimbabwe, which is becoming unstable.","1188","null","The New York Times","World","News","article","Bush Presses South Africa to Step Up Efforts to Fight AIDS","Bush Presses South Africa to Step Up Efforts to Fight AIDS"
"https://www.nytimes.com/2003/06/27/business/worldbusiness/IHT-around-the-markets-suddenly-dollar-bulls-in-charge.html","Eric Pfanner","2003-06-27","Is the dollar, beaten up for much of the last year and a half, making a comeback?. The U.S. currency surged Thursday against the euro and the Japanese yen after the Federal Reserve said late Wednesday that it saw signs of improvement in the econom...","3434","null","International Herald Tribune","Business Day","null","article","AROUND THE MARKETS : Suddenly, dollar bulls in charge","AROUND THE MARKETS : Suddenly, dollar bulls in charge"
"https://www.nytimes.com/2003/03/20/world/threats-responses-intelligence-deputy-chief-army-brat-who-grew-up-became-officer.html","Bernard Weinraub","2003-03-20","Latest article in series, Tours of Duty, on Col Steven Boltz and other service members; Boltz, 48, is deputy chief of staff for intelligence of Army's V Corps, now working at corps headquarters in Kuwait; photo (M)","961","null","The New York Times","World","Series","article","An Army Brat Who Grew Up And Became An Officer","THREATS AND RESPONSES: INTELLIGENCE DEPUTY CHIEF; An Army Brat Who Grew Up And Became An Officer"
"https://www.nytimes.com/2003/03/11/world/world-briefing-americas-argentina-explanation-sought-from-iranian.html","Larry NYT","2003-03-11","Iranian response to Argentina judicial order to arrest four Iranian government officials prompts Foreign Ministry to summon Iranian envoy; continued conflict surrounds Iran's denial of involvement in 1994 bombing which killed 85 people at Jewish c...","88","null","The New York Times","World","News","article","World Briefing | Americas: Argentina: Explanation Sought From Iranian","World Briefing | Americas: Argentina: Explanation Sought From Iranian"
"https://www.nytimes.com/2003/07/05/world/enforcing-accord-palestinian-forces-arrest-4-militants.html","James Bennet","2003-07-05","Palestinian officials and militants say Palestinian security forces arrested at least four militants accused of firing antitank grenades at Kfar Darom, Israeli settlement in Gaza Strip, in first enforcement of new security accord with Israel; arre...","635","null","The New York Times","World","News","article","Enforcing Accord, Palestinian Forces Arrest 4 Militants","Enforcing Accord, Palestinian Forces Arrest 4 Militants"
"https://www.nytimes.com/2003/06/23/business/treasury-sets-sales-of-bills-this-week.html","null","2003-06-23","","310","null","The New York Times","Business Day","Schedule","article","Treasury Sets Sales Of Bills This Week","Treasury Sets Sales Of Bills This Week"
"https://www.nytimes.com/2003/02/13/international/africa/speculation-persists-that-kenyan-president-is-seriously.html","Marc Lacey","2003-02-13","Kenya's newly elected president, Mwai Kibaki, has canceled a string of recent appearances, leading to widespread speculation that his health condition is serious.","621","null","The New York Times","World","News","article","Speculation Persists That Kenyan President Is Seriously Ill","Speculation Persists That Kenyan President Is Seriously Ill"
"https://www.nytimes.com/2003/11/24/business/media-counting-cd-sales-isn-t-an-exact-science.html","Chris Nelson","2003-11-24","Nielsen SoundScan, whose tracking of CD sales is foundation of influential Billboard Top 200 album chart, does not receive reports of sales that are made through many of new, nontraditional music outlets, such as Hallmark Card stores, Starbucks, W...","916","null","The New York Times","Business Day","News","article","Counting CD Sales Isn't an Exact Science","MEDIA; Counting CD Sales Isn't an Exact Science"
"https://www.nytimes.com/2003/07/04/business/company-news-carlyle-to-sell-media-unit-to-leveraged-buyout-firm.html","Bloomberg News","2003-07-04","Willis Stein & Partners, leveraged buyout firm, agrees to buy book, music and video supplier Baker & Taylor Inc from Carlyle Group Inc for $255 million (S)","83","null","The New York Times","Business Day","News","article","CARLYLE TO SELL MEDIA UNIT TO LEVERAGED BUYOUT FIRM","COMPANY NEWS; CARLYLE TO SELL MEDIA UNIT TO LEVERAGED BUYOUT FIRM"
"https://www.nytimes.com/2003/02/03/world/volgograd-journal-recalling-a-fight-to-the-death-what-s-its-name.html","Steven Myers","2003-02-03","Ceremony in Volgograd, Russia, salutes 60th anniversary of battle of Stalingrad, which ended in Germans' surrender in World War II; city today is called Volgograd, but among veterans there is strong sentiment to name city Stalingrad again; photos;...","1048","null","The New York Times","World","News","article","Volgograd Journal; Recalling a Fight to the Death. What's Its Name?","Volgograd Journal; Recalling a Fight to the Death. What's Its Name?"
"https://www.nytimes.com/2003/07/03/business/company-news-aurora-foods-plans-to-file-for-protection.html","Bloomberg News","2003-07-03","Aurora Foods Inc will file for bankruptcy protection and replace chief executive Lawrence K Hathaway under $200 million agreement with investor J W Childs Associates; Dale Morrison will succeed Hathaway (S)","120","null","The New York Times","Business Day","News","article","AURORA FOODS PLANS TO FILE FOR PROTECTION","COMPANY NEWS; AURORA FOODS PLANS TO FILE FOR PROTECTION"
"https://www.nytimes.com/2003/09/28/business/economic-view-raising-minimum-wages-city-by-city.html","Louis Uchitelle","2003-09-28","Louis Uchitelle column notes states and lately few cities have raised minimum wage above federal $5.15 hourly minimum; New York University law school's Brennan Center for Justice is providing legal support for municipal minimum wages, holding fede...","825","null","The New York Times","Business Day","News","article","Raising Minimum Wages, City by City","ECONOMIC VIEW; Raising Minimum Wages, City by City"
"https://www.nytimes.com/2003/12/11/international/europe/french-panel-recommends-banning-head-scarves-in-schools.html","Elaine Sciolino","2003-12-11","A report on church-state relations in France was delivered today against the backdrop of a Europe struggling with the integration of Muslims and rising anti-Semitism.","1250","null","The New York Times","World","News","article","French Panel Recommends Banning Head Scarves in Schools","French Panel Recommends Banning Head Scarves in Schools"
"https://www.nytimes.com/2003/03/20/technology/privacy-is-the-employer-real-guarding-your-personal-information.html","Bill Werde","2003-03-20","Internet job sites may present opportunities for identity theft; some sites like Monster.com is warning users that there may be false job postings used to collect personal information (M)","305","null","The New York Times","Technology","News","article","Privacy; Is the Employer Real? Guarding Your Personal Information","Privacy; Is the Employer Real? Guarding Your Personal Information"
"https://www.nytimes.com/2003/10/02/world/iran-names-panel-on-nuclear-inspections.html","null","2003-10-02","Iran appoints five-member team to decide country's policy toward Oct 31 deadline that United Nations nuclear agency set for it to permit closer inspection of its nuclear activities (S)","189","null","The New York Times","World","News","article","Iran Names Panel on Nuclear Inspections","Iran Names Panel on Nuclear Inspections"
"https://www.nytimes.com/2003/06/09/business/equity-sales-set.html","null","2003-06-09","","47","null","The New York Times","Business Day","Schedule","article","Equity Sales Set","Equity Sales Set"
"https://www.nytimes.com/2003/12/12/business/eugene-a-cafiero-77-president-of-chrysler-in-time-of-crisis.html","Campbell Robertson","2003-12-12","Eugene A Cafiero, president of Chrysler Corp in late 1970's, dies at age 77; photo (S)","388","null","The New York Times","Business Day","Obituary; Biography","article","Eugene A. Cafiero, 77, President of Chrysler in Time of Crisis","Eugene A. Cafiero, 77, President of Chrysler in Time of Crisis"
"https://www.nytimes.com/2003/01/17/world/japan-s-monarchy-once-godlike-shows-its-frailty.html","Ken With","2003-01-17","Announcement that Emperor Akihito has prostate cancer and will undergo surgery is significant development in Japan, where imperial family lives closely guarded existence; Akihito has been eager to put more mortal face on often-distant family; phot...","834","null","The New York Times","World","News","article","Japan's Monarchy, Once Godlike, Shows Its Frailty","Japan's Monarchy, Once Godlike, Shows Its Frailty"
"https://www.nytimes.com/2003/01/15/business/the-media-business-advertising-addenda-webex-to-begin-8-million-campaign.html","Jim Rutenberg","2003-01-15","WebEx Communications, online-meetings company, will begin $8 million national television, radio and print campaign that features Tily Tomlin in humorous situations (S)","157","null","The New York Times","Business Day","News","article","WebEx to Begin $8 Million Campaign","THE MEDIA BUSINESS: ADVERTISING -- ADDENDA; WebEx to Begin $8 Million Campaign"
"https://www.nytimes.com/2003/09/11/business/drug-panel-rejects-pleas-to-curb-sales-of-a-widely-abused-painkiller.html","Gardiner Harris","2003-09-11","Federal drug advisory panel rejects pleas from members of Congress and drug enforcement officials that sales of widely abused painkiller OxyContin be severely restricted; Bush administration officials tell panel they are seriously considering even...","814","null","The New York Times","Business Day","News","article","Drug Panel Rejects Pleas to Curb Sales of a Widely Abused Painkiller","Drug Panel Rejects Pleas to Curb Sales of a Widely Abused Painkiller"
"https://www.nytimes.com/2003/02/07/business/worldbusiness/world-business-briefing-europe.html","null","2003-02-07","FRANCE: Airline Grounded; THE NETHERLANDS: Shell'S Profit Rises; BRITAIN: Loss At Cruise Line; OPINION ON GOLDEN SHARES;.","883","null","The New York Times","Business Day","News","article","World Business Briefing: Europe","World Business Briefing: Europe"
"https://www.nytimes.com/2003/02/21/business/telekom-malaysia-pushes-for-the-fast-lane.html","Wayne Arnold","2003-02-21","","1146","null","The New York Times","Business Day","News","article","Telekom Malaysia Pushes for the Fast Lane","Telekom Malaysia Pushes for the Fast Lane"
"https://www.nytimes.com/2003/05/12/business/glaxo-is-trying-to-appease-shareholders.html","null","2003-05-12","glaxo is trying to appease shareho8","143","null","The New York Times","Business Day","News","article","Glaxo Is Trying to Appease Shareholders","Glaxo Is Trying to Appease Shareholders"
"https://www.nytimes.com/2003/09/21/business/stock-exchange-names-exbanker-its-interim-chief.html","Landon Thomas","2003-09-21","John S. Reed, who retired from Citigroup in April 2000, said that improving governance of the exchange was his top priority.","964","null","The New York Times","Business Day","News","article","Stock Exchange Names Ex-Banker Its Interim Chief","Stock Exchange Names Ex-Banker Its Interim Chief"
"https://www.nytimes.com/2003/11/01/world/the-struggle-for-iraq-violence-revenge-drives-string-of-killings-in-basra.html","Joel Brinkley","2003-11-01","Over dozen former senior members of Saddam Hussein's government have been shot dead in streets of normally peaceful Basra in past month, including two this week, both shot in head at close range; Iraqi police, themselves former instruments of gove...","957","null","The New York Times","World","News","article","Revenge Drives String of Killings in Basra","THE STRUGGLE FOR IRAQ: VIOLENCE; Revenge Drives String of Killings in Basra"
"https://www.nytimes.com/2003/10/07/world/london-journal-car-owners-hero-dresses-for-the-job.html","Sarah Lyall","2003-10-07","London Journal on masked Englishman calling himself Angle-Grinder Man, who trawls city dressed in homemade superhero outfit, complete with gold lame pants and cape, removing security boots from illegally parked cars; photos (M)","877","null","The New York Times","World","News","article","London Journal; Car Owners' Hero Dresses for the Job","London Journal; Car Owners' Hero Dresses for the Job"
"https://www.nytimes.com/2003/05/06/business/worldbusiness/world-business-briefing-asia.html","null","2003-05-06","PHILIPPINES: Airport Contract Voided; PHILIPPINES: Profit For Foods Group; INDONESIA: Bank Stake Sold; HONG KONG: Airline Urges Dividend Cut;.","635","null","The New York Times","Business Day","News","article","World Business Briefing: Asia","World Business Briefing: Asia"
"https://www.nytimes.com/2003/10/17/business/business-digest-725463.html","null","2003-10-17","","528","null","The New York Times","Business Day","Summary","article","BUSINESS DIGEST","BUSINESS DIGEST"
"https://www.nytimes.com/2003/05/18/international/europe/french-and-american-cabinet-officers-visit-normandy.html","John Tagliabue","2003-05-18","The visit to an American military cemetery was part of an effort to mend relations between the United States and France.","435","null","The New York Times","World","News","article","French and American Cabinet Officers Visit Normandy","French and American Cabinet Officers Visit Normandy"
"https://www.nytimes.com/2003/12/08/business/worldbusiness/IHT-uk-paper-follows-rivals-into-tabloid-format-at-the.html","Eric Pfanner","2003-12-08","With their screaming headlines and Page 3 girls, Britain's tabloid newspapers long ago lost their power to shock. Still, even a few jaded Londoners must have raised their eyebrows at the arrival of a new tabloid quoting from the Most Noble Order o...","5865","null","International Herald Tribune","Business Day","null","article","U.K. paper follows rivals into tabloid format : At The Times, size matters","U.K. paper follows rivals into tabloid format : At The Times, size matters"
"https://www.nytimes.com/2003/03/04/business/worldbusiness/ahold-shares-fall-10-as-questions-about-company-grow.html","Eric Br","2003-03-04","Analysts questioned the supermarket operator's ability to survive as investigations broadened into accounting irregularities at the company.","981","null","The New York Times","Business Day","News","article","Ahold Shares Fall 10% as Questions About Company Grow","Ahold Shares Fall 10% as Questions About Company Grow"
"https://www.nytimes.com/2003/11/02/business/l-of-drug-research-and-company-mergers-953563.html","null","2003-11-02","GlaxoSmithKline chief executive Dr Jean-Pierre Garnier letter disputes Oct 5 article, holding merger that formed company has spurred creation of new drugs","155","null","The New York Times","Business Day","Letter","article","Of Drug Research And Company Mergers","Of Drug Research And Company Mergers"
"https://www.nytimes.com/2003/10/30/business/company-news-rival-s-lawsuit-against-nike-is-dismissed.html","Bloomberg News","2003-10-30","Federal Judge Lou","100","null","The New York Times","Business Day","News","article","RIVAL'S LAWSUIT AGAINST NIKE IS DISMISSED","COMPANY NEWS; RIVAL'S LAWSUIT AGAINST NIKE IS DISMISSED"
"https://www.nytimes.com/2003/02/23/business/investing-managed-accounts-get-a-scorecard.html","John Kimelman","2003-02-23","Morningstar Inc compiles data to compare returns for separately managed accounts, customized portfolios that are often administered by large brokerages but built on stock- and bond-picking judgments of asset management firms; Mark Pennington of Lo...","981","null","The New York Times","Business Day","News","article","Investing; Managed Accounts Get a Scorecard","Investing; Managed Accounts Get a Scorecard"
"https://www.nytimes.com/2003/06/13/world/the-mideast-turmoil-suicide-bomber-a-sudden-violent-end-for-a-promising-youth.html","Ian Fisher","2003-06-13","Abdel Madi Shabneh, who blew himself up on bus in Jerusalem, killing himself and 17 others, is portrayed by his baffled family as serious student, planning on going to college; to his family in Hebron on West Bank, it is mystery how he ended up on...","878","null","The New York Times","World","News","article","A Sudden, Violent End For a Promising Youth","THE MIDEAST TURMOIL: SUICIDE BOMBER; A Sudden, Violent End For a Promising Youth"
"https://www.nytimes.com/2003/10/28/business/technology-briefs-internet-financial-web-sites-studied.html","Steve NYT","2003-10-28","Study by IBM and Watchfire finds majority of nation's large banks, insurance companies and other financial institutions collect personal information on Web sites that are not properly protected from online identity thieves (S)","172","null","The New York Times","Business Day","News","article","Technology Briefs | Internet: Financial Web Sites Studied","Technology Briefs | Internet: Financial Web Sites Studied"
