"|","|__writer_name","|__pub_date","|__snippet","|__word_count","|__score","|__source","|__section_name","|__type_of_material","|__document_type","|__main_headline","|__print_headline"
"https://www.nytimes.com/2006/09/10/business/yourmoney/10tour.html","Jennifer Alsever","2006-09-10","Themed tours, often based on books, movies and historical events, are on the rise. You, too, can be a Caribbean pirate.","1186","null","The New York Times","Business Day","News","article","Taking a Vacation With Harry, Captain Jack or Frodo","Taking a Vacation With Harry, Captain Jack or Frodo"
"https://www.nytimes.com/2006/12/25/technology/25ecom.html","Bob Tedeschi","2006-12-25","Retailers are wondering whether online publishers will be so emboldened by a strong advertising market that they will raise the prices of ads sharply.","1050","null","The New York Times","Technology","News","article","Ad Costs on the Web Are Rising, but Perhaps a Bit Irrationally","Ad Costs on the Web Are Rising, but Perhaps a Bit Irrationally"
"https://www.nytimes.com/2006/09/01/world/europe/01russiansumm.html","Compiled Schwirtz","2006-09-01","A summary of the top stories in Russian newspapers on Friday.","744","null","The New York Times","World","News","article","Russia Gets Tougher on Illegal Downloading","Russia Gets Tougher on Illegal Downloading"
"https://www.nytimes.com/2006/08/07/world/africa/07cnd-ethiopia.html","Jeffrey Gettleman","2006-08-07","As the river waters began to recede, the death toll continued to rise from a flash flood that killed up to 500 people.","328","null","The New York Times","World","News","article","Ethiopian Flood Kills 191 and 300 are Missing","Ethiopian Flood Kills 191 and 300 are Missing"
"https://www.nytimes.com/2006/05/16/world/africa/16nations.html","Warren Hoge","2006-05-16","The U.S. introduced a resolution calling for strict observance of a new peace accord, and speeded-up arrangements for arrival of a U.N. peacekeeping force.","438","null","The New York Times","World","News","article","U.N. Gets Proposal to Speed New Darfur Force","U.N. Gets Proposal to Speed New Darfur Force"
"https://www.nytimes.com/2006/06/06/world/africa/06briefs-brief-007.html","null","2006-06-06","A Security Council delegation arrived in Khartoum, the capital, for the first time to try to convince the government that a United Nations peacekeeping operation in Darfur was not tantamount to an invasion force. The Security Council's 10-day trip...","72","null","The New York Times","World","News","article","Sudan: Security Council Visit on Darfur","SUDAN: SECURITY COUNCIL VISIT ON DARFUR"
"https://www.nytimes.com/2006/11/17/world/africa/17cnd-rice.html","Helene Cooper","2006-11-17","HANOI, Vietnam, Nov. 17  By agreeing in principle to allow a joint United Nations-African Union peacekeeping force into the war-stricken Darfur region, Sudanese President Omar Hassan al-Bashir has a chance to rehabilitate its image in the rest of...","199","null","The New York Times","World","News","article","Rice Praises Peacekeeping Efforts","null"
"https://www.nytimes.com/2006/05/15/world/middleeast/15funeral.html","Steven Erlanger","2006-05-15","Lior Anidzar, 26, was a gregarious man, just married, who wanted to open a restaurant. He died of wounds suffered in an April 17 suicide bombing in Tel Aviv.","1067","null","The New York Times","World","News","article","A Promising Young Life Prematurely Committed to Sand","A Promising Young Life Prematurely Committed to Sand"
"https://www.nytimes.com/2006/11/21/business/21warrior.html","null","2006-11-21","Several new or evolving plans recognize that the usual airline loyalty programs may not be enough for the extreme air traveler.","1061","null","The New York Times","Business Day","News","article","Red Carpet at the Airport Gate","Red Carpet at the Airport Gate"
"https://www.nytimes.com/2006/07/06/business/06bank.html","Bloomberg News","2006-07-06","By Bloomberg News.","243","null","The New York Times","Business Day","News","article","Wachovia Pays Fine for Research Conflicts","Wachovia Pays Fine for Research Conflicts"
"https://www.nytimes.com/2006/11/26/business/yourmoney/26psyche.html","Julie Creswell","2006-11-26","Money offers a buffer of sorts in an uncertain world. And con artists are only too happy to wear the guise of the market sage or guardian angel.","2776","null","The New York Times","Business Day","News","article","The High Cost of Too Good to Be True","The High Cost of Too Good to Be True"
"https://www.nytimes.com/2006/05/13/business/13money.html","Damon Darlin","2006-05-13","Making a choice between expensive health care for a pet or ending the life of that animal companion is a complicated dilemma most pet owners eventually face.","1395","null","The New York Times","Business Day","News","article","Vet Bills and the Priceless Pet: What's a Practical Owner to Do?","Vet Bills and the Priceless Pet: What's a Practical Owner to Do?"
"https://www.nytimes.com/2006/07/27/technology/27askk.html","null","2006-07-27","Q. What exactly does it mean when a laptop is described as having “a 17-inch diagonal widescreen display?”","687","null","The New York Times","Technology","News","article","Sizing Up a Monitor","null"
"https://www.nytimes.com/2006/07/09/business/yourmoney/09golden.html","Gary Rivlin","2006-07-09","A group of venture capitalists expect their start-up  an independent baseball league  to provide them all with a rich payout.","3181","null","The New York Times","Business Day","News","article","Root, Root, Root for the Start-Up","Root, Root, Root for the Start-Up"
"https://www.nytimes.com/2006/09/26/world/middleeast/26iraq.html","Sabrina Tavernise","2006-09-26","Omar al-Faruq engineered a brazen escape from a high-security U.S. prison in Afghanistan last year.","1414","null","The New York Times","World","News","article","Qaeda Operative Is Killed in Iraq","Qaeda Operative, An Escapee in ’05, Is Killed in Iraq"
"https://www.nytimes.com/2006/10/04/world/middleeast/04iraq.html","Michael Luo","2006-10-04","Four of the soldiers died in a roadside bomb attack; the four others were killed by small-arms fire in separate incidents.","697","null","The New York Times","World","News","article","8 G.I.’s Die in Baghdad, Most in a Day Since ’05","8 G.I.’s Die in Baghdad, Most in a Day Since ’05"
"https://www.nytimes.com/2006/12/14/world/europe/15dianacnd.html","Sarah Lyall","2006-12-14","A British police inquiry concluded that allegations of murder in a 1997 Paris car crash are unfounded.","1041","null","The New York Times","World","News","article","Inquiry Concludes Diana’s Death Was an Accident","null"
"https://www.nytimes.com/2006/07/03/business/media/03thomson.html","Ian Austen","2006-07-03","The Thomson Corporation, based in Toronto, may be the biggest media company most people have never heard of.","1463","null","The New York Times","Business Day","News","article","In Canada, the Torch Is Passed on a Quiet but Profitable Legacy","In Canada, the Torch Is Passed on a Quiet but Profitable Legacy"
"https://www.nytimes.com/2006/12/01/business/worldbusiness/01east.html","Heather Timmons","2006-12-01","Financial ties between the Middle East and Asia are strengthening by the day, threatening the flow of investment dollars to Europe and the U.S.","1358","null","The New York Times","Business Day","News","article","Asia Finding Rich Partners in Mideast","Asia Finding Rich Partners In Mideast"
"https://www.nytimes.com/2006/10/12/business/12broker.html","Bloomberg News","2006-10-12","Bank of America, seeking to attract new clients, said it was offering free online stock trades to customers with accounts of at least $25,000.","328","null","The New York Times","Business Day","News","article","Bank to Offer Free Stock Trades","Bank to Offer Free Stock Trades"
"https://www.nytimes.com/2006/10/17/business/17options.html","Eric Dash","2006-10-17","An options grant made years ago to the new chief executive of UnitedHealth Group, Stephen J. Hemsley, is raising questions.","1170","null","The New York Times","Business Day","News","article","Old Options Still Haunt an Insurer","Old Options Still Haunt An Insurer"
"https://www.nytimes.com/2006/05/27/technology/27money.html","Damon Darlin","2006-05-27","Sometimes the slow but relentless drop in electronics price turns into a torrent. That's happening now in personal computers.","1425","null","The New York Times","Technology","News","article","Timing the Electronics Market for the Best Deal on a New PC","Timing the Electronics Market for the Best Deal on a New PC"
"https://dealbook.nytimes.com/2006/12/22/former-ebay-executive-to-lead-tech-start-up/","null","2006-12-22","","89","null","The New York Times","Business Day","News","article","Former Ebay Executive to Lead Tech Start-Up","null"
"https://dealbook.nytimes.com/2006/09/07/v-c-makes-old-school-investment/","null","2006-09-07","Most venture capitalists prefer investments a bit more high-tech than specialty paper. But Northwood Ventures, an early backer of Office Depot, is betting on paper and gift retailer Swoozie’s, which closed a Series A round of about $14 million.","106","null","The New York Times","Business Day","News","article","V.C. Makes Old–School Investment","null"
"https://dealbook.nytimes.com/2006/12/26/ford-and-toyota-chiefs-met-in-tokyo/","null","2006-12-26","","208","null","The New York Times","Business Day","News","article","Ford and Toyota Chiefs Met in Tokyo","null"
"https://dealbook.nytimes.com/2006/12/22/motorola-to-buy-tut-systems/","null","2006-12-22","","42","null","The New York Times","Business Day","News","article","Motorola to Buy Tut Systems","null"
"https://dealbook.nytimes.com/2006/06/23/more-chatter-about-microsoft-yahoo-deal/","null","2006-06-23","","256","null","The New York Times","Business Day","News","article","More Chatter About Microsoft-Yahoo Deal","null"
"https://dealbook.nytimes.com/2006/12/22/for-ebay-its-about-political-connections-in-china/","null","2006-12-22","","259","null","The New York Times","Business Day","News","article","For eBay, It’s About Political Connections in China","null"
"https://www.nytimes.com/2006/07/16/business/yourmoney/16deal.html","Andrew Sorkin","2006-07-16","At Allen & Company’s conference this year, the dealmakers to watch were deep-pocketed people you may have never heard of.","1150","null","The New York Times","Business Day","News","article","The Finance Crowd Has Its Time in the Idaho Sun","The Finance Crowd Has Its Time in the Idaho Sun"
"https://www.nytimes.com/2006/06/18/business/yourmoney/18suits.html","null","2006-06-18","Two executives named in the Securities and Exchange Commission's 2004 lawsuit over mutual fund market-timing had pledged to fight. One of them threw in the towel last week.","881","null","The New York Times","Business Day","News","article","One Folds, One Fights in Market-Timing Suit","One Folds, One Fights In Market-Timing Suit"
"https://www.nytimes.com/2006/09/30/business/30auto.html","Micheline Maynard","2006-09-30","Carmakers displaying their wares at the Paris Motor Show are pushing bold, aggressive designs, even on their smallest models.","535","null","The New York Times","Business Day","News","article","The Green Flag’s Out for Bold, Fast and Highly Styled","The Green Flag’s Out for Bold, Fast and Highly Styled"
"https://www.nytimes.com/2006/05/02/business/02casino.html","Bloomberg News","2006-05-02","By Bloomberg News.","123","null","The New York Times","Business Day","News","article","Resort Bid Is Increased","Resort Bid Is Increased"
"https://dealbook.nytimes.com/2006/12/29/marsh-to-sell-putnam-investments-to-canadas-power-reports-say/","Michael DE LA MERCED","2006-12-29","","192","null","The New York Times","Business Day","News","article","Marsh to Sell Putnam Investments to Canada’s Power, Reports Say","null"
"https://dealbook.nytimes.com/2006/11/30/renault-chief-still-sees-us-alliance-but-not-now/","null","2006-11-30","","308","null","The New York Times","Business Day","News","article","Renault Chief Still Sees U.S. Alliance — But Not Now","null"
"https://www.nytimes.com/2006/10/29/world/americas/29cnd-mexico.html","Marc Lacey","2006-10-29","Federal forces bashed through barricades and pushed back activists who had seized downtown Oaxaca five months ago.","1213","null","The New York Times","World","News","article","Mexican Federal Police, Backed by Army, Retake City","Mexican Federal Police, Backed by Army, Retake Oaxaca"
"https://www.nytimes.com/2006/10/11/business/11econ.html","Bloomberg News","2006-10-11","By Bloomberg News.","374","null","The New York Times","Business Day","News","article","Wholesale Inventories Rose 1.1% in August, and Sales Kept Pace","Wholesale Inventories Rose 1.1% In August, and Sales Kept Pace"
"https://www.nytimes.com/2006/07/09/business/mutfund/09bridge.html","Tim Gray","2006-07-09","Signing on with Bridgeway Funds requires a greater leap of faith than may be necessary for an investment in many other stock funds.","1217","null","The New York Times","Business Day","News","article","Producing Strong Results With a Secret Strategy","Producing Strong Results With a Secret Strategy"
"https://www.nytimes.com/2006/11/26/business/26cnd-shop.html","Michael Barbaro","2006-11-26","Early openings, deep discounts and resurgent department stores appeared to give merchants at the mall an edge over discount retailers.","859","null","The New York Times","Business Day","News","article","Mall Stores See Strong Rise in Holiday Sales","Mall Stores See Strong Rise in Holiday Sales"
"https://www.nytimes.com/2006/12/10/business/yourmoney/10trees.html","Elizabeth Olson","2006-12-10","Point, click and add the tinsel: Christmas trees online.","1360","null","The New York Times","Business Day","News","article","The Perfect Tree Awaits in the Field, or in the Computer","The Perfect Tree Awaits in the Field, or in the Computer"
"https://www.nytimes.com/2006/05/28/business/yourmoney/28suits.html","null","2006-05-28","Peter Morton, a founder of the Hard Rock Cafe chain, agreed this month to sell the Hard Rock Hotel and Casino in Las Vegas for $770 million, but even at that price there were a few things he refused to part with.","842","null","The New York Times","Business Day","News","article","Take the Hotel-Casino but Not the Flying V","Take the Hotel-Casino But Not the Flying V"
"https://www.nytimes.com/2006/12/31/business/yourmoney/31suits.html","Micheline Maynard","2006-12-31","“The Machine That Changed the World,” the 1990 book that lifted the cover on Japanese auto plants in America, is back in vogue at the Ford Motor Company.","808","null","The New York Times","Business Day","News","article","Required Reading for Reviving Ford","Required Reading For Reviving Ford"
"https://www.nytimes.com/2006/12/04/business/media/04forbes.html","Andrew Kramer","2006-12-04","A billionaire’s attempt to block an article in the Russian language edition of Forbes magazine has raised questions about intimidation of the press in Russia.","957","null","The New York Times","Business Day","News","article","Forbes in Russia Becomes the Story Again","Forbes in Russia Becomes the Story Again"
"https://www.nytimes.com/2006/11/11/business/11five.html","Mark Stein","2006-11-11","Even more than usual, it was a good week to be an investment banker.","1127","null","The New York Times","Business Day","News","article","Jobs of Investment Bankers Appear to Be Safe","Jobs of Investment Bankers Appear to Be Safe"
"https://www.nytimes.com/2006/05/01/business/smallbusiness/01avon.html","Julie Bosman","2006-05-01","She has been sent on junkets to Hawaii, Las Vegas and Puerto Rico. Her earnings total nearly $170,000 a year. Her job title: Avon lady. ","1668","null","The New York Times","Business Day","News","article","For the Avon Lady, a World Beyond Ringing Doorbells","For the Avon Lady, a World Beyond Ringing Doorbells"
"https://www.nytimes.com/2006/05/01/business/smallbusiness/01hagerty.html","Keith Schneider","2006-05-01","Hagerty Insurance, a family-owned company in Traverse City, Mich., is commanding a place at the head of this country's multibillion-dollar collector car industry.","1111","null","The New York Times","Business Day","News","article","Love Your Classic Car? They'll Insure It for You","Love Your Classic Car? They'll Insure It for You"
"https://www.nytimes.com/2006/05/01/technology/01rfid.html","Barnaby Feder","2006-05-01","Some of the guidelines say that consumers should be notified when goods have radio tags, and business should explain how information gathered from the tags will be used.","602","null","The New York Times","Technology","News","article","Guidelines for Radio Tags Aim to Protect Buyer Privacy","Guidelines For Radio Tags Aim to Protect Buyer Privacy"
"https://www.nytimes.com/2006/05/01/business/media/01ford.html","Jeremy Peters","2006-05-01","Ford is pitching a reality show where aspiring car designers would compete to design the next hot Ford vehicle. \n","313","null","The New York Times","Business Day","News","article","Ford May Produce Its Own Reality TV Show","Ford May Produce Its Own Reality TV Show"
"https://www.nytimes.com/2006/05/01/business/01ahead.html","null","2006-05-01","BACK IN THE SPOTLIGHT Richard M. Scrushy, the HealthSouth founder, goes on trial today in federal court in Birmingham, Ala. He is charged with participating in a political bribery scheme unrelated to HealthSouth's accounting problems.","185","null","The New York Times","Business Day","News","article","Looking Ahead","null"
"https://www.nytimes.com/2006/05/01/business/media/01adco.html","Julie Bosman","2006-05-01","Miller Brewing is introducing an ad campaign that Miller says is intended to rise above the calculated inanity of most beer ads.","791","null","The New York Times","Business Day","News","article","Beer Ads That Ditch the Bikinis, but Add Threads of Thought","Beer Ads That Ditch the Bikinis, but Add Threads of Thought"
"https://www.nytimes.com/2006/05/01/technology/01yahoo.html","Saul Hansell","2006-05-01","The site, called Yahoo Tech (tech.yahoo.com), will feature blogs on technology, a weekly video program, and will display user comments.","695","null","The New York Times","Technology","News","article","Yahoo Introduces a Site on Consumer Technology","Yahoo Introduces a Site On Consumer Technology"
"https://www.nytimes.com/2006/05/01/business/01revolution.html","null","2006-05-01","Revolution Studios, run by Joe Roth, will close in October 2007, despite predictions that it would soon become profitable.","1846","null","The New York Times","Business Day","News","article","The Rise and Fall of Revolution","The Rise and Fall Of Revolution"
"https://www.nytimes.com/2006/05/01/business/media/01carr.html","David Carr","2006-05-01","Questions of truth, verisimilitude and reality are a substantial part of this year's Tribeca Film Festival, most notably in ""American Cannibal: The Road to Reality.""","1079","null","The New York Times","Business Day","News","article","Reality and Fantasy, Indivisible","Reality And Fantasy, Indivisible"
"https://www.nytimes.com/2006/05/01/business/media/01link.html","Tom Zeller","2006-05-01","Literary exegesis is no longer undertaken solely by critics, but by a global hive, humming everywhere at once, and linked to the wiki.","1159","null","The New York Times","Business Day","News","article","In Internet Age, Writers Face Frontier Justice","In Internet Age, Writers Face Frontier Justice"
"https://www.nytimes.com/2006/05/01/business/media/01adcol-webdenda.html","null","2006-05-01","","1400","null","The New York Times","Business Day","News","article","People and Account of Note","null"
"https://www.nytimes.com/2006/05/01/world/africa/01cnd-darfur.html","Lydia Polgreen","2006-05-01","The top Sudanese official at the talks, Vice President Ali Osman Taha, abruptly left Nigeria today.","1632","null","The New York Times","World","News","article","Accord Hopes Dim in Darfur With Departure","null"
"https://www.nytimes.com/2006/05/01/world/americas/01cnd-bolivia.html","Christine Hauser","2006-05-01","The move by President Evo Morales highlights Latin America's struggle over control of energy resources. ","795","null","The New York Times","World","News","article","Bolivia Nationalizes Natural Gas Industry ","null"
"https://www.nytimes.com/2006/05/01/world/asia/01cnd-afghan.html","John Holusha","2006-05-01","Edward Caraballo, a Bronx-born television cameraman,  was released on a presidential pardon.","561","null","The New York Times","World","News","article","American Returning Home After Two Years in Afghanistan Jail","null"
"https://www.nytimes.com/2006/05/01/world/01cnd-pope.html","Ian Fisher","2006-05-01","At the Vatican, a clash is shaping up between the church's ban on condom use and its advocacy of human life.","1304","null","The New York Times","World","News","article","Debate Over Condoms and AIDS Tests the Pope","Pope Seeks Survey on Condom Use in AIDS-Affected Marriage"
"https://www.nytimes.com/2006/05/02/business/media/02adco.html","Stuart Elliott","2006-05-02","Madison Avenue has become obsessed with using the word ""my"" in advertising slogans, as well as in the names of brands, products and even a new television network.","1183","null","The New York Times","Business Day","News","article","Nowadays, It's All Yours, Mine or Ours","Nowadays, It's All Yours, Mine or Ours"
"https://www.nytimes.com/2006/05/02/business/02wood.html","Andrew Pollack","2006-05-02","Dr. Alastair J. J. Wood, a prominent drug safety expert at Vanderbilt University, will leave the school to become a managing director of a biotechnology investment fund.","361","null","The New York Times","Business Day","News","article","Wall St. Calls Drug Safety Expert","Wall St. Calls Drug Safety Expert"
"https://www.nytimes.com/iht/2006/05/03/world/IHT-03globalist.html","Roger Cohen","2006-05-03","What's worse — a nuclear-armed Iran or American military action against Iran to prevent that happening?","1027","null","International Herald Tribune","World","News","article","Very Bad and Worse — the Options With Iran","Globalist: Very bad and worse - The options with Iran"
"https://www.nytimes.com/2006/05/02/world/europe/02cnd-italy.html","Ian Fisher","2006-05-02","Silvio Berlusconi's resignation will start the countdown to the formation of a new government.","569","null","The New York Times","World","News","article","Italian Premier Quits After Defying Vote","null"
"https://www.nytimes.com/2006/05/02/world/middleeast/02cnd-iran.html","Elaine Sciolino","2006-05-02","Russia and China are resisting the draft of a resolution requiring Iran to stop key nuclear activities, officials said.","1017","null","The New York Times","World","News","article","U.S. and Europe Draft U.N. Resolution  on Iran","null"
"https://www.nytimes.com/2006/05/02/world/africa/02cnd-sudan.html","Lydia Polgreen","2006-05-02","President Bush called Omar al-Bashir today, urging him to send a representative back to peace talks on Darfur.","436","null","The New York Times","World","News","article","Bush Calls Sudan's Leader About Darfur Talks","Bush Calls Sudan's Leader as Darfur Deadline Looms"
"https://www.nytimes.com/2006/05/03/world/asia/03hunger.html","Sharon LaFraniere","2006-05-03","China has made huge strides while India recorded only modest progress and eastern and southern Africa made no gains.","375","null","The New York Times","World","News","article","Unicef Cites China's Gains in Fighting Child Hunger","Unicef Cites China's Gains in Fighting Child Hunger"
"https://www.nytimes.com/2006/05/03/business/media/03adco.html","Ken Belson","2006-05-03","Marketers in crowded categories often try to avoid price wars by promoting qualities like service and convenience. Now cellphone companies have joined the fray.","1163","null","The New York Times","Business Day","News","article","Best Cellphone Company? All of Them, to Hear Them Say It","Best Cellphone Company? All of Them, to Hear Them Say It"
"https://www.nytimes.com/2006/05/03/business/03skies.html","Don Phillips","2006-05-03","The delay in turn deferred an ""open skies"" agreement that probably would have led to lower air fares and new routes across the North Atlantic.","717","null","The New York Times","Business Day","News","article","Easing of U.S.-Europe Airline Rules Is Delayed","Easing of U.S.-Europe Airline Rules Is Delayed"
"https://www.nytimes.com/2006/05/03/world/middleeast/03reporters.html","null","2006-05-03","At least 63 journalists were killed in 2005 and 1,300 were attacked, making it the deadliest year for reporters in a decade.","131","null","The New York Times","World","News","article","Reporter Group Calls Last Year a Deadly One for Journalists","Reporters Say 2005 Was Deadly Year"
"https://www.nytimes.com/2006/05/03/world/europe/03dutch.html","Marlise Simons","2006-05-03","Guus van Kouwenhoven, a Dutch lumber trader, is accused of supplying militia fighters from his lumber company to Liberia's Charles Taylor.","1070","null","The New York Times","World","News","article","The Dutch Try One of Their Own Over Links to Liberia","The Dutch Try One of Their Own Over Links to Liberia"
"https://www.nytimes.com/2006/05/03/world/middleeast/03iran.html","Elaine Sciolino","2006-05-03","Russia and China are already resisting the U.N. Security Council resolution, which will require Iran to stop nuclear activities. ","1012","null","The New York Times","World","News","article","U.S., Britain and France Draft U.N. Resolution on Iran's Nuclear Ambitions","U.S., Britain and France Draft U.N. Resolution on Iran's Nuclear Ambitions"
