"|","|__writer_name","|__pub_date","|__snippet","|__word_count","|__score","|__source","|__section_name","|__type_of_material","|__document_type","|__main_headline","|__print_headline"
"https://www.nytimes.com/2009/07/04/your-money/04shortcuts.html","Alina Tugend","2009-07-03","Philanthropy is not only for the wealthy. You can bring children into the fold by letting them figure out how they would like to contribute.","1227","null","The New York Times","Your Money","News","article","Raising Children Who Care in Times That Need It","Raising Children Who Care in Times That Need It"
"https://www.nytimes.com/2009/07/02/world/europe/02iht-inmates.html","null","2009-07-03","After less than a month, a project that enlists ex-convicts to escort tourists through Neapolitan streets with seedy reputations has caused considerable problems for its supporters.","546","null","International Herald Tribune","World","News","article","In Naples, Ex-Convicts Keep a Close Eye on Tourists","In Naples, Ex-Convicts Keep a Close Eye on Tourists"
"https://www.nytimes.com/2009/07/04/world/europe/04germanybrief.html","Nicholas Kulish","2009-07-03","Doctors have determined that John Demjanjuk, who is accused of complicity in atrocities as a guard at a Nazi death camp, is fit to stand trial.","102","null","The New York Times","World","News","article","Germany: Demjanjuk Cleared for Trial","Suspect Fit for Trial in Nazi Case, German Doctors Say"
"https://www.nytimes.com/2009/07/04/world/europe/04russia.html","Peter Baker","2009-07-03","The move is one of the most concrete achievements in the effort to rebuild strained U.S.-Russian relations.","1092","null","The New York Times","World","News","article","Russia to Open Airspace to U.S. for Afghan War","RUSSIA TO OPEN AIRSPACE TO U.S. FOR AFGHAN WAR"
"https://www.nytimes.com/2009/07/04/world/americas/04argentina.html","Alexei Barrionuevo","2009-07-04","Argentina’s president said she would not rule out closing major public venues where swine flu could spread more quickly.","604","null","The New York Times","World","News","article","Swine Flu Death Toll in Argentina Climbs","Swine Flu Death Toll in Argentina Climbs"
"https://www.nytimes.com/2009/07/04/business/media/04digital.html","Eric Pfanner","2009-07-04","The slowing growth in online advertising is pushing traditional ad agencies and Internet companies to work together.","923","null","The New York Times","Business Day","News","article","Internet Companies and Ad Agencies Go From Old Enemies to New Friends","Internet Companies and Ad Agencies Go From Old Enemies to New Friends"
"https://www.nytimes.com/2009/07/05/world/europe/05summit.html","Clifford Levy","2009-07-04","As he heads to Moscow, President Obama faces a complex political dynamic: a country with two leaders, President Dmitri A. Medvedev and Prime Minister Vladimir V. Putin.","1159","null","The New York Times","World","News","article","In Russian Trip, Obama to Take On Power Equation","Heading to Russia, Obama Is Mindful Of Its Power Equation: One Plus One"
"https://www.nytimes.com/2009/07/05/world/americas/05honduras.html","Ginger Thompson","2009-07-04","The Organization of American States voted to suspend Honduras, but stopped short of calling on member countries to impose sanctions.","1179","null","The New York Times","World","News","article","O.A.S. Votes to Suspend Honduras Over Coup","O.A.S. Votes To Suspend Honduras Over Coup"
"https://www.nytimes.com/2009/07/06/business/energy-environment/06iht-green06.html","Tom Zeller","2009-07-05","Royal Dutch Shell has long been accused of human rights and environmental abuse in Nigeria.","1010","null","International Herald Tribune","Business Day","News","article","A New Chief at Shell, and a Rocky Inheritance","A New Chief at Shell, and a Rocky Inheritance"
"https://www.nytimes.com/2009/07/06/business/media/06carr.html","David Carr","2009-07-06","Last week, Steve Jobs returned to Apple, precisely when he said he would, but that didn’t stop the prurient demands to know the details of his health.","1109","null","The New York Times","Business Day","News","article","Unhealthy Fixation on Jobs’s Illness","Unhealthy Fixation On Jobs’s Illness"
"https://www.nytimes.com/2009/07/06/business/media/06mag.html","Stephanie Clifford","2009-07-06","Some stores are treating the July cover featuring Sacha Baron Cohen as though it were a copy of Penthouse, obscuring all but the title.","399","null","The New York Times","Business Day","News","article","When a GQ Cover Boy Bares All, Some Store Managers Squirm","When a GQ Cover Boy Bares All, Some Store Managers Squirm"
"https://www.nytimes.com/2009/07/06/business/06views.html","Dwight Cass","2009-07-06","A few junk-rated borrowers have been flexing their muscles against lenders lately and winning.","656","null","The New York Times","Business Day","News","article","The Risk of Junk Upends Leverage","The Risk of Junk Upends Leverage"
"https://www.nytimes.com/2009/07/06/world/asia/06myanmar.html","Neil MacFarquhar","2009-07-06","Rather than tying negotiations to the treatment of Daw Aung San Suu Kyi, say experts, the world should engage the junta on a broad range of issues.","1049","null","The New York Times","World","News","article","With No Clear Path Out of a Diplomatic Thicket, a Push to Redraw the Map","With No Clear Path Out of a Diplomatic Thicket, a Push to Redraw the Map"
"https://www.nytimes.com/2009/07/06/business/global/06insure.html","Michael de la Merced","2009-07-06","A reinsurer based in Bermuda buys another based in Paris to become a company with $23 billion in assets.","307","null","The New York Times","Business Day","News","article","PartnerRe Buys Paris Re in Stock Deal","PartnerRe Buys Paris Re In Stock Deal"
"https://www.nytimes.com/2009/07/06/technology/business-computing/06micron.html","Brooke Crothers","2009-07-06","Micron Technology thinks the release of new Windows software and the industry’s shrinking capacity will help it survive this shakeout.","865","null","The New York Times","Technology","News","article","Despite Turmoil in the Chip Industry, Signs of Hope for Micron Technology","Despite Turmoil in the Chip Industry, Signs of Hope for Micron Technology"
"https://www.nytimes.com/2009/07/06/business/media/06video.html","Brian Stelter","2009-07-06","Producers and advertisers are discovering that users, aided by the screen-filling video that faster Internet access allows, will watch longer videos online.","1010","null","The New York Times","Business Day","News","article","Rise of Web Video, Beyond 2-Minute Clips","Rise of Web Video, Beyond 2-Minute Clips"
"https://www.nytimes.com/2009/07/07/world/asia/07korea.html","Choe Sang-Hun","2009-07-06","American officials claimed that international sanctions had forced the ship, which was suspected of carrying banned cargo, to turn back.","649","null","The New York Times","World","News","article","South Korea Says Freighter From North Turns Back","South Korea Says Freighter From North Turns Back"
"https://www.nytimes.com/2009/07/07/business/global/07fiat.html","David Jolly","2009-07-06","The Italian automaker is teaming up with the Guangzhou Automobile Group to make cars and engines for the Chinese market.","511","null","The New York Times","Business Day","News","article","Fiat and Chinese Carmaker Form Alliance","Fiat and Chinese Carmaker Form Alliance"
"https://www.nytimes.com/2009/07/01/business/media/01adco.html","Stuart Elliott","2009-07-01","Support for public service campaigns is usually stronger during economic downturns because media companies prefer to run classy-looking, altruistic ads to fill space.","854","null","The New York Times","Business Day","News","article","Pro Bono Spots Soak Up More Commercial Time","Pro Bono Spots Soak Up More Commercial Time"
"https://www.nytimes.com/2009/07/01/business/economy/01aig.html","Mary Walsh","2009-07-01","A.I.G. shareholders got apologies, but little else, from company executives at the insurer’s first annual meeting since its emergency bailout.","888","null","The New York Times","Business Day","News","article","A.I.G. Offers Shareholders Little Hope for Recovery","A.I.G. Offers Shareholders Little Hope for Recovery"
"https://www.nytimes.com/2009/07/01/business/01studio.html","Michael Cieply","2009-07-01","Some home video duties could be handed off to other studios, saving Paramount millions.","286","null","The New York Times","Business Day","News","article","Paramount Said to Plan Cost-Cutting in Video Unit","Paramount Said to Plan Cost-Cutting In Video Unit"
"https://www.nytimes.com/2009/07/02/business/media/02moneyball.html","Michael Cieply","2009-07-01","In a sign of growing caution in the industry, production was halted on a high-profile film starring Brad Pitt just days before shooting was to begin.","1042","null","The New York Times","Business Day","News","article","Money Worries Kill A-List Film at Last Minute","Despite A-List Star and Director, a Prestige Film Falls Through"
"https://www.nytimes.com/2009/07/02/business/02gm.html","Michael de la Merced","2009-07-01","General Motors must complete the sale of its best assets to a new government-financed company by July 10 or risk losing its financing, a senior Treasury official said.","568","null","The New York Times","Business Day","News","article","Clock Ticking on Accord to Sell Good G.M. Assets","Clock Ticking on Accord To Sell Good G.M. Assets"
"https://www.nytimes.com/2009/07/02/business/smallbusiness/02sbox.html","null","2009-07-07","Web sites and other training resources for small-business owners.","172","null","The New York Times","Business Day","News","article","More Information on Training for Small Businesses","More Information on Training for Small Businesses"
"https://www.nytimes.com/2009/07/02/business/02stanford.html","Clifford Krauss","2009-07-01","James Davis, the main lieutenant to R. Allen Stanford, plans to plead guilty to fraud and conspiracy after reaching a deal to cooperate against the Texas billionaire, his lawyer said.","643","null","The New York Times","Business Day","News","article","Stanford Executive to Plead Guilty, Lawyer Says","Stanford’s Financial Chief to Plead Guilty and Help the Prosecution"
"https://www.nytimes.com/2009/07/02/world/asia/02aid.html","Jane Perlez","2009-07-01","Hard-line Islamist charities are using a refugee crisis to sour public opinion about the United States.","1062","null","The New York Times","World","News","article","In Refugee Aid, Pakistan’s War Has New Front","In Refugee Aid, Pakistan’s War Has New Front"
"https://www.nytimes.com/2009/07/09/business/09madoff.html","null","2009-07-08","The holders of more than two dozen retirement accounts seek to recover $60 million from the Westport National Bank.","426","null","The New York Times","Business Day","News","article","Connecticut Bank Sued in Madoff Investment Scheme","Connecticut Bank Sued in Madoff Investment Scheme"
"https://www.nytimes.com/2009/07/09/technology/personaltech/09basics.html","Farhad Manjoo","2009-07-08","Among thousands of add-on smartphone apps, only a few prove truly useful when it comes to organization.","1081","null","The New York Times","Technology","News","article","IPhone Apps to Organize Your Life","IPhone Apps to Organize Your Life"
"https://www.nytimes.com/2009/07/09/world/asia/09han.html","Edward Wong","2009-07-09","The journey of a family trying to forge a new life in the Xinjiang region ended with the death of a son in ethnic riots.","1095","null","The New York Times","World","News","article","Migrants Describe Grief From China’s Strife","For Poor Migrants, Grief in China’s Ethnic Strife"
"https://www.nytimes.com/2009/07/10/world/middleeast/10iraq.html","Steven Myers","2009-07-09","Attacks in Baghdad and a city in northern Iraq marked the worst violence since U.S. troops withdrew from cities and towns.","1061","null","The New York Times","World","News","article","Insurgency Remains Tenacious in North Iraq","Insurgency Remains Tenacious In North Iraq"
"https://www.nytimes.com/2009/07/06/business/media/06adnewsletter1.html","Stuart Elliott","2009-07-06","Marketers have always been fond of coining words. Joining the ranks: True Value, a hardware cooperative.","1331","null","The New York Times","Business Day","News","article","Wagnerian? Vaudevillian? No, Hardwarian.","null"
"https://www.nytimes.com/2009/07/07/business/global/07stimulus.html","null","2009-07-06","France plans to spend 75 percent of its stimulus money this year; the U.S. is unlikely to accomplish that until late 2010.","1017","null","The New York Times","Business Day","News","article","France, Unlike U.S., Is Deep Into Stimulus Projects","France, Unlike U.S., Is Deep Into Work on Stimulus Projects"
"https://www.nytimes.com/2009/07/07/business/07jewelry.html","Stephanie Rosenbloom","2009-07-06","Consumers are spending less on jewelry, and the industry is feeling the pinch.","1258","null","The New York Times","Business Day","News","article","In a Downturn, Jewelers Aren’t So Precious","Too Precious for a Recession"
"https://www.nytimes.com/2009/07/07/business/07views.html","null","2009-07-07","Despite the collapse of Lehman Brothers, the wobbles of big banks and the scarcity of financing across the world, the investment banking business just keeps going.","706","null","The New York Times","Business Day","News","article","Like Roaches, Wall St. Survives","Like Roaches, Wall St. Survives"
"https://www.nytimes.com/2009/07/07/world/europe/07trafalgar.html","Sarah Lyall","2009-07-06","“One & Other” is a grand art project that places 2,400 people on Trafalgar Square’s usually vacant fourth plinth, for an hour apiece, from now through Oct. 6.","895","null","The New York Times","World","News","article","Briefly Ascending to the Spotlight, Britons Take Their Place Among Giants","Briefly Ascending to the Spotlight, Britons Take Their Place Among Giants"
"https://www.nytimes.com/2009/07/07/business/media/07adco.html","Stephanie Clifford","2009-07-07","Sprint is placing kiosks in about 500 movie theaters so customers can scan in a code from their phones to receive coupons for concessions.","958","null","The New York Times","Business Day","News","article","Lights, Camera, Action for Concession Coupons","Lights, Camera, Action For Concession Coupons"
"https://www.nytimes.com/2009/07/07/business/07goldman.html","Graham Bowley","2009-07-07","Sergey Aleynikov masterminded a dazzling bank theft, the authorities say, and he did it without brandishing a gun or cracking a vault.","904","null","The New York Times","Business Day","News","article","Ex-Worker Said to Steal Goldman Code","Ex-Worker Said to Steal Goldman Code"
"https://www.nytimes.com/2009/07/08/world/europe/08prexy.html","Peter Baker","2009-07-07","The U.S. and Russia declared a rapprochement in part by agreeing to disagree on important issues.","1122","null","The New York Times","World","News","article","Obama Resets Ties to Russia, but Work Remains","Obama Resets Ties to Russia; Work Remains"
"https://www.nytimes.com/2009/07/08/business/08markets.html","Jack Healy","2009-07-07","Talk of a second stimulus underscored worries the economy is doing worse than investors had hoped. The Dow fell 161 points.","723","null","The New York Times","Business Day","News","article","Wall St. Turns to Earnings and Starts to Worry","Wall Street Ponders Earnings and Starts to Worry"
"https://www.nytimes.com/2009/07/08/world/europe/08iht-letter.html","Celestine Bohlen","2009-07-07","Time and money are running out, and the Airbus A400M, designed to ferry troops and equipment, still hasn't even had a test flight.","843","null","International Herald Tribune","World","News","article","Military Transport Plane Should Be Dumped","Military Transport Plane Should Be Dumped"
"https://www.nytimes.com/2009/07/12/business/economy/12view.html","Robert Frank","2009-07-11","Growing evidence suggests that Darwin’s view of the competitive struggle tracks economic reality much more closely.","914","null","The New York Times","Business Day","News","article","The Invisible Hand, Trumped by Darwin?","The Invisible Hand, Trumped by Darwin?"
"https://www.nytimes.com/2009/07/08/business/media/08globe.html","Richard Pérez-Peña","2009-07-07","Potential bidders for the newspapers want more time to wait for the outcome of a concessions vote by members of the Boston Newspaper Guild.","392","null","The New York Times","Business Day","News","article","Deadline for Boston Globe Bids Is Postponed","Times Co. Extends Deadline For Bids on Boston Globe"
"https://www.nytimes.com/2009/07/08/business/economy/08deficit.html","Peter Goodman","2009-07-07","The potential perils of Washington’s staggering deficits are known, but trying to overcome them during a recession carries its own risks.","1489","null","The New York Times","Business Day","News","article","Staggering Budget Gap and a Reluctance to Fill It","A Sinking Sound, And a Test of Nerve"
"https://www.nytimes.com/2009/07/08/technology/08gps.html","Jenna Wortham","2009-07-08","The smartphone is beginning to displace the GPS receiver as a convenient way for drivers to get directions to unknown destinations.","970","null","The New York Times","Technology","News","article","Sending GPS Devices the Way of the Tape Deck?","Sending GPS Devices the Way of the Tape Deck?"
"https://www.nytimes.com/2009/07/08/world/americas/08honduras.html","Ginger Thompson","2009-07-08","The ousted president of Honduras and the leader who has succeeded him agreed for the first time to negotiate a resolution.","762","null","The New York Times","World","News","article","Two Leaders Accept Talks on Dispute in Honduras","Two Leaders Accept Talks On Dispute In Honduras"
"https://www.nytimes.com/2009/07/08/business/08auto.html","Bloomberg News","2009-07-08","An appeal of General Motors’ sale of most of its assets by asbestos claimants and car accident victims should not go directly to the United States Court of Appeals in New York, a judge ruled Tuesday.","300","null","The New York Times","Business Day","News","article","Claimants in G.M. Tort Cases Are Denied","G.M. Judge Denies Plea To Bypass Lower Court"
"https://www.nytimes.com/2009/07/08/world/asia/08hu.html","null","2009-07-08","President Hu Jintao of China cut short a trip to Italy for the Group of 8 summit meeting and flew back to Beijing early on Wednesday because of the unrest in Xinjiang.","58","null","The New York Times","World","News","article","Unrest Prompts Hu to Halt Trip Abroad","Unrest Prompts Hu to Halt Trip Abroad"
"https://www.nytimes.com/2009/07/09/business/global/09energy.html","Matthew Saltmarsh","2009-07-08","Europe’s antitrust commission accused E.On and GDF Suez of anticompetitive practices that were costing consumers more.","730","null","International Herald Tribune","Business Day","News","article","In Europe, a Regulator Penalizes Two Utilities","E.U. Issues Big Antitrust Fines Against E.ON and GDF Suez"
"https://www.nytimes.com/2009/07/09/world/asia/09riotinto.html","David Barboza","2009-07-08","An executive with Rio Tinto, one of the world’s biggest mining companies, could be charged with espionage, the Australian government said.","526","null","The New York Times","World","News","article","China Detains Mining Executive on Spy Charge, Australia says","China Detains Executive of Major Western Mining Company, Australia Says"
"https://www.nytimes.com/2009/07/09/business/economy/09euro.html","null","2009-07-08","Three institutes issued forecasts suggesting that, while the region’s activity remained subdued, the contraction was expected to be less sharp in the coming months.","626","null","The New York Times","Business Day","News","article","Europe’s Economic Downturn Stabilizes, Reports Show","Europe’s Economic Downturn Stabilizes, Reports Show"
"https://www.nytimes.com/2009/07/09/business/global/09pound.html","Julia Werdigier","2009-07-09","In a long-awaited regulatory plan, Alistair Darling, chancellor of the Exchequer, skirted turf battles by proposing a new agency to handle risk.","662","null","The New York Times","Business Day","News","article","New Panel Is Proposed to Police British Banks","New Panel Is Proposed To Police British Banks"
"https://www.nytimes.com/2009/07/01/business/01auto.html","Micheline Maynard","2009-06-30","General Motors went to bankruptcy court to begin the process of selling its best assets to a government-backed company that would become the linchpin of its turnaround plan.","896","null","The New York Times","Business Day","News","article","G.M. Pushes the Case for Its Rebirth in Court","G.M. Pushes the Case For Its Rebirth in Court"
"https://www.nytimes.com/2009/07/01/world/middleeast/01iran.html","Michael Slackman","2009-06-30","As security forces filled the streets, the government made a series of moves to close the book on weeks of protest.","754","null","The New York Times","World","News","article","Iran Seeks to Close Door on Further Protests","Police and Militias Keep Order on Streets as Iran Tries to Head Off More Protests"
"https://www.nytimes.com/2009/07/01/world/americas/01honduras.html","Marc Lacey","2009-06-30","The United Nations marshaled an unusually broad effort to condemn the military seizure of power in Honduras, turning over the podium to Manuel Zelaya.","1076","null","The New York Times","World","News","article","After Losing Honduras, Ousted Leader Wins International Support","After Losing Honduras, Ousted Leader Wins International Support"
"https://www.nytimes.com/2009/07/01/business/economy/01senior.html","Terry Pristin","2009-07-01","Tough economic times have meant that only 54 or 240 units at Fox Hill have closed in the six months since the project was completed.","1256","null","The New York Times","Business Day","News","article","A Trying Time in Housing for Elderly","A Trying Time in Housing for Elderly"
"https://www.nytimes.com/2009/07/01/technology/01china.html","Michael Wines","2009-06-30","A rule requiring manufacturers to install Internet filtering software on new computers was delayed one day before the deadline for the software to be installed on all computers sold in China.","954","null","The New York Times","Technology","News","article","After Outcry, China Delays Requirement for Web-Filtering Software","After Outcry, China Delays Requirement for Web-Filtering Software"
"https://www.nytimes.com/2009/07/01/business/global/01outsource.html","Heather Timmons","2009-06-30","Under a new deal, HCL Technologies, based in India, will manage Snapple’s computer networks, but may be hiring in the United States to do it.","301","null","The New York Times","Business Day","News","article","Snapple Deal To Outsource May Add Jobs In America","Snapple Deal To Outsource May Add Jobs In America"
"https://www.nytimes.com/2009/06/27/business/global/27nwsmart.html","Barbara Wall","2009-06-26","Joan Major, director of wealth management at Sand Aire in London, on the financial challenges that keep high-net-worth investors awake at night.","891","null","International Herald Tribune","Business Day","News","article","Wealth on the Defensive","Wealth on the Defensive"
"https://www.nytimes.com/2009/04/12/business/mutfund/12topp.html","Tim Gray","2009-04-11","How three mutual fund managers guided their portfolios to solid gains in the first quarter.","949","null","The New York Times","Business Day","News","article","Funds That Found Glimmers of Hope","Funds That Found Glimmers of Hope"
"https://www.nytimes.com/2009/04/12/business/mutfund/12active.html","null","2009-04-11","Studies have shown that, despite investors’ willingness to pay higher fees and expenses for actively managed mutual funds, these funds rarely beat the market over the long term.","901","null","The New York Times","Business Day","News","article","That Rush to Beat the Market","That Rush to Beat the Market"
"https://www.nytimes.com/2009/04/12/business/mutfund/12emerge.html","Conrad De Aenlle","2009-04-11","A cautious approach to debt has helped markets like China and Brazil better weather the global economic storm.","870","null","The New York Times","Business Day","News","article","Emerging Markets, Setting a New Pace","Emerging Markets, Setting a New Pace"
"https://www.nytimes.com/2009/04/12/business/mutfund/12muni.html","null","2009-04-11","High first-quarter returns are making investors pay attention to muni funds, but the market is hardly risk-free.","846","null","The New York Times","Business Day","News","article","Municipal Bond Funds, in Starring Roles","Muni Funds, in Starring Roles"
"https://www.nytimes.com/2009/04/11/business/economy/11charts.html","Floyd Norris","2009-04-10","A stimulus plan in China is bolstering demand for goods from some of its neighbors, including Australia.","531","null","The New York Times","Business Day","News","article","Trade Is Falling Fast Across the Globe","Trade Is Falling Fast Across the Globe"
"https://www.nytimes.com/2009/04/11/technology/companies/11soft.html","Miguel Helft","2009-04-11","The two companies, which held a series of fruitless negotiations last year, have restarted discussions, this time over a possible advertising agreement, a person briefed on the discussions said.","347","null","The New York Times","Technology","News","article","Yahoo and Microsoft Said to Be Weighing Ad Pact","Yahoo and Microsoft Said To Be Weighing Ad Pact"
"https://www.nytimes.com/2009/04/11/technology/companies/11skype.html","Brad Stone","2009-04-10","The founders of Skype are said to have approached several private equity firms to make a bid for the Internet calling service.","622","null","The New York Times","Technology","News","article","Skype Founders May Seek to Buy It Back","Skype Founders May Seek To Buy It Back From eBay"
