"|","|__writer_name","|__pub_date","|__snippet","|__word_count","|__score","|__source","|__section_name","|__type_of_material","|__document_type","|__main_headline","|__print_headline"
"https://www.nytimes.com/2009/07/27/business/media/27adco.html","Andrew Newman","2009-07-26","CytoSport, a company that has instigated many trademark battles over the word “milk,” finds itself up against a much bigger opponent.","964","null","The New York Times","Business Day","News","article","Got Milk? For Sports Drink Maker, Nestlé Says No","Got Milk? For Sports Drink Maker, Nestlé Says No"
"https://www.nytimes.com/2009/07/27/business/media/27nightline.html","Bill Carter","2009-07-26","While two talk shows scrap for viewers, a news program makes gains and, on its best nights, comes out on top.","1024","null","The New York Times","Business Day","News","article","‘Nightline’ Is Thriving in Late Night","‘Nightline’ Is Thriving In Late Night"
"https://www.nytimes.com/2009/07/27/business/media/27gannett.html","Richard Pérez-Peña","2009-07-27","Those laid off by Gannett must collect unemployment benefits before the company contributes any “transitional pay.”","925","null","The New York Times","Business Day","News","article","As It Cuts Jobs, Gannett Also Cuts Severance Pay","As It Cuts Jobs, Gannett Also Cuts Severance Pay"
"https://www.nytimes.com/2009/07/27/technology/companies/27polyvore.html","Claire Miller","2009-07-27","A fashion site is winning fans by allowing users to build collages with photos of clothing, accessories and models.","954","null","The New York Times","Technology","News","article","Site Wins Fashion Fans by Letting Them Design","Site Is Winning Fashion Fans By Letting Them Play Designer"
"https://www.nytimes.com/2009/02/06/business/worldbusiness/06micro.html","Carter Dougherty","2009-02-05","The effort by the World Bank and the German government highlights how even small banks in poor countries are getting caught in the financial crisis.","517","null","The New York Times","Business Day","News","article","Microbanks Are Getting a Cash Infusion","Microbanks Are Getting a Cash Infusion"
"https://www.nytimes.com/2009/02/06/business/media/06news.html","Tim Arango","2009-02-05","The media company, controlled by Rupert Murdoch, reported a quarterly loss of $6.41 billion on a write-down of Dow Jones & Co. and other assets, as the recession hit advertising revenue.","861","null","The New York Times","Business Day","News","article","News Corp. Loss Shows Trouble at Dow Jones","News Corp. Loss Shows Trouble at Dow Jones"
"https://www.nytimes.com/2009/02/06/business/worldbusiness/06nuke.html","James Kanter","2009-02-05","The government proposed refreshing its nuclear reactors, making the nation the latest to consider letting the technology play a major role in its energy plans.","501","null","The New York Times","Business Day","News","article","Sweden Takes Another Look at Nuclear Power","Sweden Takes Another Look at Nuclear Power"
"https://www.nytimes.com/2009/02/06/world/middleeast/06nationsweb.html","Neil MacFarquhar","2009-02-05","John Ging said that Israel’s blockade was creating growing misery there by choking off basic humanitarian supplies.","340","null","The New York Times","World","News","article","U.N.’s Gaza Refugee Director Criticizes Israel and Hamas","U.N.’s Gaza Refugee Director Criticizes Israel and Hamas"
"https://www.nytimes.com/2009/02/06/technology/companies/06rim.html","null","2009-02-06","Several executives and directors will pay penalties totaling about $62.5 million to conclude an investigation into the backdating of stock options.","137","null","The New York Times","Technology","News","article","R.I.M. Officers Settle Backdating Case","R.I.M. Officers Settle Backdating Case"
"https://www.nytimes.com/2009/02/06/business/media/06mag.html","Richard Pérez-Peña","2009-02-05","Lisa Hughes, formerly vice president and publisher of Condé Nast Traveler since 1995, will replace Drew Schutte, publisher of The New Yorker for the last year.","300","null","The New York Times","Business Day","News","article","The New Yorker’s Publisher Shifts to Web Ad Sales for Condé Nast","The New Yorker’s Publisher Shifts To Web Ad Sales for Condé Nast"
"https://www.nytimes.com/2009/02/06/business/06views.html","null","2009-02-06","Josef Ackermann, the chief executive of the giant German bank, remains confident about his investment-banking-heavy business model.","689","null","The New York Times","Business Day","News","article","Deutsche Bank Still Confident","null"
"https://www.nytimes.com/2009/02/06/world/asia/06japan.html","Martin Fackler","2009-02-06","Over two decades, Japan accumulated enormous debt while failing to generate a convincing recovery.","1859","null","The New York Times","World","News","article","Japan’s Big-Works Stimulus Is Lesson","Japan’s Big-Works Stimulus Is Lesson for U.S."
"https://www.nytimes.com/2009/02/06/business/worldbusiness/06yuan.html","Keith Bradsher","2009-02-06","The holidays over, millions of workers are returning to the Guangdong industrial region but cannot find jobs.","1202","null","The New York Times","Business Day","News","article","China’s Unemployment Swells as Exports Falter","China’s Unemployment Swells as Exports Falter"
"https://www.nytimes.com/2009/02/06/technology/internet/06google.html","Miguel Helft","2009-02-06","As more capable mobile devices become available, the market for reading on cellphones could grow.","477","null","The New York Times","Technology","News","article","Google and Amazon to Put More Books on Cellphones","Google and Amazon to Put More Books on Cellphones"
"https://www.nytimes.com/2009/02/07/business/worldbusiness/07toyota.html","Martin Fackler","2009-02-06","Toyota made the announcement less than two months after forecasting its first ever full-year operating loss.","838","null","The New York Times","Business Day","News","article","In the Red, Toyota Sees Loss Tripling","As Auto Sales Plummet, Toyota Sees a Wider Loss"
"https://www.nytimes.com/2009/02/07/business/worldbusiness/ufjbank.html","Bettina Wassener","2009-02-06","Mitsubishi UFJ Financial joined several domestic rivals in reporting dismal earnings that exposed the strains to the sector from falls in the stock market last year.","504","null","The New York Times","Business Day","News","article","Japan’s Largest Bank Cuts Earnings Outlook","Japan’s Largest Bank Cuts Earnings Outlook"
"https://www.nytimes.com/2009/02/07/business/07web-econ.html","Jeff Zeleny","2009-02-06","The outside economic advisers, led by former Federal Reserve chairman Paul Volcker, will offer independent advice.","472","null","The New York Times","Business Day","News","article","Panel to Advise Obama on Economy","Panel to Advise Obama on Economy"
"https://www.nytimes.com/2009/02/07/world/asia/07khan.html","Salman Masood","2009-02-06","Abdul Qadeer Khan, history’s most successful nuclear proliferator, was freed from house arrest on Friday.","1341","null","The New York Times","World","News","article","Pakistan Frees Nuclear Dealer in Snub to U.S.","Pakistan Frees Nuclear Dealer In Snub to U.S."
"https://www.nytimes.com/2009/02/07/world/middleeast/07israel.html","Isabel Kershner","2009-02-06","Analysts say nobody really knows what Israel’s election is about, as party leaders have avoided discussing big issues.","1034","null","The New York Times","World","News","article","Indecision Reigns as Israelis Get Ready to Vote","Indecision, Apathy and Confusion Reign as Israelis Get Ready to Vote"
"https://www.nytimes.com/2009/02/07/world/europe/07russia.html","Ellen Barry","2009-02-06","Russia’s foreign minister said Friday that Russia had given approval of a plan to allow the U.S. military to ship nonlethal equipment across Russian territory to Afghanistan.","256","null","The New York Times","World","News","article","U.S. Can Ship Afghan Aid Through Russia, Kremlin Says","Russia to Allow Equipment to Pass Into Afghanistan"
"https://www.nytimes.com/2009/02/07/business/07goatdrug.html","Andrew Pollack","2009-02-06","The drug, which prevents blood clots in people with a rare condition, is made from the milk of genetically engineered animals, which may usher a new era in pharmaceuticals.","1171","null","The New York Times","Business Day","News","article","F.D.A. Approves Drug From Gene-Altered Goats","Drug From a Goat With a Human Gene"
"https://www.nytimes.com/2009/02/08/jobs/08training.html","Marci Alboher","2009-02-07","A new jobs program in Michigan is training those laid off to work in the film industry, which is experiencing a huge growth spurt.","1033","null","The New York Times","Job Market","News","article","A Hollywood Sequel for Michigan Workers","A Hollywood Sequel For Michigan Workers"
"https://www.nytimes.com/2009/02/08/jobs/08boss.html","Raymond Bickson","2009-02-07","Raymond Bickson is the chief executive of Taj Hotels Resorts and Palaces, whose flagship hotel was a target of the terrorist attacks in Mumbai.","676","null","The New York Times","Job Market","News","article","Our Hotel Was Attacked","Our Hotel Was Attacked"
"https://www.nytimes.com/2009/02/08/jobs/08pre.html","Michael Bierut","2009-02-07","Graphic design work that required a week to finish in 1980, can now be done by computer within an hour.","949","null","The New York Times","Job Market","News","article","Drawing Board to the Desktop: A Designer’s Path","Drawing Board To the Desktop: A Designer’s Path"
"https://www.nytimes.com/2009/02/08/business/yourtaxes/08retire.html","J. Tarquinio","2009-02-07","Advice from retirement planning experts geared toward current retirees and investors of all ages.","733","null","The New York Times","Business Day","News","article","Suddenly, Retirees Need a Plan B","Suddenly, Retirees Need a Plan B"
"https://www.nytimes.com/2009/02/08/business/yourtaxes/08loss.html","Charles Delafuente","2009-02-07","Some people who lost money in the financial turmoil last year may be able to get a measure of tax relief.","1266","null","The New York Times","Business Day","News","article","Some Balm From the I.R.S. for Those 2008 Losses","Some I.R.S. Balm For 2008 Losses"
"https://www.nytimes.com/2009/02/08/business/08stream.html","Brad Stone","2009-02-07","A Web site makes donors’ information public, pitting concepts of political transparency and privacy against each other.","910","null","The New York Times","Business Day","News","article","Prop 8 Donor Web Site Shows Disclosure Law Is 2-Edged Sword","Disclosure, Magnified On the Web"
"https://www.nytimes.com/2009/02/07/business/07charts.html","Floyd Norris","2009-02-06","The Standard & Poor’s 500 just ended its worst decade ever.","535","null","The New York Times","Business Day","News","article","A 10-Year Stretch That’s Worse Than It Looks","A 10-Year Stretch That’s Worse Than It Looks"
"https://www.nytimes.com/2009/02/08/business/yourtaxes/08entre.html","Conrad De Aenlle","2009-02-07","The tax code offers small business owners many tax breaks to choose from, including some recent additions, and others may be on the way.","866","null","The New York Times","Business Day","News","article","Is More Relief Ahead for Small Business?","Is More Relief Ahead For Small Business?"
"https://www.nytimes.com/2009/02/08/business/08every.html","Ben Stein","2009-02-07","Our current situation will probably become worse in terms of unemployment, but we are not back in the bad old days yet.","996","null","The New York Times","Business Day","News","article","From Bad to Worse, but Far From the Worst","From Bad to Worse, But Far From the Worst"
"https://www.nytimes.com/2009/02/08/business/yourtaxes/08lede.html","Edmund Andrews","2009-02-07","President Obama’s tax breaks may put money directly into the hands of people at the middle and bottom rungs of the income ladder.","1701","null","The New York Times","Business Day","News","article","Changes, Up and Down the Ladder","Changes, Up and Down the Ladder"
"https://www.nytimes.com/2009/02/08/business/08feed.html","Andrew Martin","2009-02-07","More Americans are making a living from farming, but subsidizing their work with an off-the-farm job.","887","null","The New York Times","Business Day","News","article","Farm Living (Subsidized by a Job Elsewhere)","Farm Life, Subsidized By a Job Elsewhere"
"https://www.nytimes.com/2009/08/03/business/media/03askthetimes.html","null","2009-08-03","The staff members involved with One in 8 Million answered questions.","8105","null","The New York Times","Business Day","News","article","Talk to The Times: One in 8 Million","null"
"https://www.nytimes.com/2009/08/04/world/middleeast/04iran.html","Robert Worth","2009-08-03","Several opponents of President Mahmoud Ahmadinejad avoided a ceremony recognizing his re-election in Iran.","547","null","The New York Times","World","News","article","Ahmadinejad’s Opponents Snub Election Ceremony","Leader Approves Ahmadinejad, as Opponents Stay Away"
"https://www.nytimes.com/2009/08/04/business/04frustrate.html","Susan Stellin","2009-08-03","A survey finds that many consumers have grown weary of the often complicated and time-consuming process of planning and booking a trip online.","919","null","The New York Times","Business Day","News","article","Worst Part of a Trip May Be Booking It on the Web","Booking Offline"
"https://www.nytimes.com/2009/08/04/business/04bofa.html","Zachery Kouwe","2009-08-03","The S.E.C. accused Bank of America of misleading investors about plans to pay billions of dollars in bonuses at Merrill Lynch, the troubled brokerage giant it bought last year.","845","null","The New York Times","Business Day","News","article","Bank of America Settles S.E.C. Suit Over Merrill Deal","The Bottomless Headache"
"https://www.nytimes.com/2009/08/04/world/europe/04czech.html","Dan Bilefsky","2009-08-03","President Vaclav Klaus of the Czech Republic is a symbol of a union divided between leaders who favor integration and those who cling to national sovereignty.","1398","null","The New York Times","World","News","article","Czech Leader Questions Path for Europe","A Contrarian Leader Questions an Ambitious Path for Europe"
"https://www.nytimes.com/2009/08/04/business/04madoff.html","Bloomberg News","2009-08-03","Every expenditure over $100 must be tallied for Irving Picard, the trustee who is liquidating Bernard Madoff’s business.","311","null","The New York Times","Business Day","News","article","Court Orders Ruth Madoff to Report Monthly Expenses","Court Orders Ruth Madoff To Report Monthly Expenses"
"https://www.nytimes.com/2009/08/04/business/04florida.html","Damien Cave","2009-08-03","The collapse of a deal between Colonial BancGroup and a mortgage lender appears to have prompted a federal investigation.","611","null","The New York Times","Business Day","News","article","Agents Raid Bank and Lender in Florida","Agents Raid Bank and Lender in Florida"
"https://www.nytimes.com/2009/08/04/world/asia/04australia.html","Meraiah Foley","2009-08-04","Police arrested four men with suspected links to a Somalia-based Islamic organization, saying they planned to stage a suicide attack on a military base.","717","null","The New York Times","World","News","article","Australia Police Hold 4 in Terror Plot","Australian Police Arrest 4 in Terror Plot"
"https://www.nytimes.com/2009/02/05/business/worldbusiness/05bhp.html","Meraiah Foley","2009-02-04","A sharp drop in commodity prices triggered a 56.5 percent decrease in first-half profits at BHP Billiton, the world’s largest mining company.","452","null","The New York Times","Business Day","News","article","BHP Billiton Profit Falls on Lower Metal Prices","BHP Billiton Profit Falls on Lower Metal Prices"
"https://www.nytimes.com/2009/02/05/business/05warner.html","Tim Arango","2009-02-04","The media company reported a fourth-quarter loss, hurt by a $24.2 billion write-down for its cable, publishing and AOL assets.","719","null","The New York Times","Business Day","News","article","Citing Write-Down, Time Warner Posts Loss and Forecasts Flat Year","Citing Write-Down, Time Warner Posts Loss and Forecasts Flat Year"
"https://www.nytimes.com/2009/02/05/business/05markets.html","Jack Healy","2009-02-04","Wall Street veered into the red as investors cashed their profits from a day earlier and waited for a highly anticipated report on January unemployment.","687","null","The New York Times","Business Day","News","article","Markets Close on a Down Note","Discounters Slide Along With Markets"
"https://www.nytimes.com/2009/02/09/business/media/09adnewsletter2.html","null","2009-02-09","Q & A with Stuart Elliott.","321","null","The New York Times","Business Day","News","article","Q & A with Stuart Elliott","null"
"https://www.nytimes.com/2009/02/05/world/africa/05nazi.html","Souad Mekhennet","2009-02-04","Aribert Ferdinand Heim, wanted for medical atrocities at concentration camps, lived in Cairo until his death in 1992. His hiding place was unknown until now.","2058","null","The New York Times","World","News","article","Uncovering Lost Path of the Most Wanted Nazi","Uncovering the Lost Path of a Nazi Doctor in Egypt"
"https://www.nytimes.com/2009/02/05/business/05allergan.html","Natasha Singer","2009-02-04","Even less-expensive cosmetic treatments have become subject to the economic downturn.","689","null","The New York Times","Business Day","News","article","Vanity’s Downturn: Botox Use, and Allergan Sales, Dip","Vanity’s Downturn: Botox Use, and Allergan Sales, Dip"
"https://www.nytimes.com/2009/02/05/world/middleeast/05mideast.html","Isabel Kershner","2009-02-05","The United Nations agency that provides assistance to Palestinian refugees said Hamas police confiscated about 3,500 blankets and more than 400 food parcels.","662","null","The New York Times","World","News","article","Agency Says Hamas Took Aid Intended for Needy","Agency Says Hamas Took Aid Intended For Needy"
"https://www.nytimes.com/2009/02/05/technology/personaltech/05windbox.html","John Biggs","2009-02-04","MSI is releasing the WindBox, a tiny computer that can attach to the back of a monitor or television.","190","null","The New York Times","Technology","News","article","A Mini-Laptop That Operates With a TV, Discreetly","A Mini-Laptop That Operates With a TV, Discreetly"
"https://www.nytimes.com/2009/02/05/technology/personaltech/05vzhub.html","Azadeh Ensha","2009-02-05","The Verizon Hub, a home-phone system, uses Voice over Internet Protocol and high-speed fiber optic service to make calls.","180","null","The New York Times","Technology","News","article","From Verizon, a Home Phone With the Capabilities of a Cellphone","From Verizon, a Home Phone With the Capabilities of a Cellphone"
"https://www.nytimes.com/2009/02/05/world/asia/05beijing.html","Andrew Jacobs","2009-02-05","The recent censoring of a tongue-in-cheek variety show has provoked howls from China’s so-called netizens, critical of their government’s control of the Web.","1250","null","The New York Times","World","News","article","Chinese Learn Limits of Online Freedom as the Filter Tightens","Chinese Learn Limits of Online Freedom as the Filter Tightens"
"https://www.nytimes.com/2009/02/05/business/05sara.html","null","2009-02-05","The food maker Sara Lee Corporation said Wednesday that it lost $17 million in its most recent quarter.","103","null","The New York Times","Business Day","News","article","Sara Lee Posts a Loss","Sara Lee Posts a Loss"
"https://www.nytimes.com/2009/02/06/world/asia/06kstan.html","Elisabeth Bumiller","2009-02-05","Officials believe that Russia pressed Kyrgyzstan to shut the U.S. base, a supply link for Afghanistan. The Kyrgyz Parliament will vote next week on a measure to close it.","1186","null","The New York Times","World","News","article","U.S. Searches for Alternative to Kyrgyz Base","U.S. Searches for Alternative to Central Asian Base"
"https://www.nytimes.com/2009/02/06/world/europe/06council.html","Alan Cowell","2009-02-05","The British Council said that it had suspended its activities in Iran because of what it called “unacceptable” intimidation and harassment of its staff in Tehran.","479","null","The New York Times","World","News","article","Britain Suspends Activities of Cultural Office in Iran, Saying Officials Harassed Its Staff","Britain Suspends Activities of Cultural Office in Iran, Saying Officials Harassed Its Staff"
"https://www.nytimes.com/2009/02/06/business/worldbusiness/06mcdonalds.html","Bettina Wassener","2009-02-05","When McDonald’s lowers the price of the Double Cheeseburger in China, it is clear that the global slowdown has arrived there.","462","null","The New York Times","Business Day","News","article","McDonald’s Scales Back Prices in China","McDonald’s Scales Back Prices in China"
"https://www.nytimes.com/2009/02/06/business/06euro.html","Julia Werdigier","2009-02-05","The European Central Bank left its key rate unchanged on Thursday even as the Bank of England cut its benchmark interest rate for a fourth month to 1 percent.","817","null","The New York Times","Business Day","News","article","2 Central Banks, 2 Different Paths","2 Central Banks, 2 Different Paths"
"https://www.nytimes.com/2009/02/06/world/europe/06britain.html","Raymond Bonner","2009-02-05","The British government on Thursday defended a court’s decision not to release information about a terrorism suspect who says he was tortured in American custody.","855","null","The New York Times","World","News","article","Britain Defends Court Ruling in Secrecy Case","Britain Defends Court Ruling in Secrecy Case"
"https://www.nytimes.com/2009/02/06/world/middleeast/06iraq.html","Alissa Rubin","2009-02-05","The results lifted Prime Minister Nuri Kamal al-Maliki’s party from a minor player among Shiite parties to one on the road to being the most powerful.","1266","null","The New York Times","World","News","article","Prime Minister’s Party Wins in Iraqi Vote but Will Need to Form Coalitions","Prime Minister’s Party Wins in Iraqi Vote but Will Need to Form Coalitions"
"https://www.nytimes.com/2009/08/15/world/asia/15kandahar.html","null","2009-08-14","A suicide car bomber attacked an Afghan army base on Friday, killing one soldier and wounding five other people, an Afghan official said.","124","null","The New York Times","World","News","article","Suicide Bomber Attacks Afghan Army Base","Suicide Bomber Kills Afghan Soldier"
"https://www.nytimes.com/2009/08/17/business/media/17adnewsletter2.html","null","2009-08-17","Q & A with Stuart Elliott.","480","null","The New York Times","Business Day","News","article","Q & A with Stuart Elliott","null"
"https://www.nytimes.com/2009/08/16/jobs/16search.html","Phyllis Korkki","2009-08-15","Desperation, hopelessness, depression, anger — these are not useful feelings to bring to a job search. Yet after a layoff, it is normal to experience some or all of them.","907","null","The New York Times","Job Market","News","article","Accentuating the Positive After a Layoff","Accentuating the Positive After a Layoff"
"https://www.nytimes.com/2009/08/15/your-money/student-loans/15money.html","Ron Lieber","2009-08-14","SafeStart aims to reduce the fear of debt that might keep 18-year-olds from borrowing for school in the first place.","1277","null","The New York Times","Your Money","News","article","A Hand Up for Students Facing a Mountain of Debt","Aid for Students Facing Mountain of Debt"
"https://www.nytimes.com/2009/08/16/business/16novelties.html","Anne Eisenberg","2009-08-15","An off-the-shelf plug inserted into the damaged area can guide formation of new bone and cartilage before dissolving in about six months.","805","null","The New York Times","Business Day","News","article","Mimicking Human Cartilage to Repair a Knee","Mimicking Human Cartilage to Repair a Knee"
"https://www.nytimes.com/2009/08/16/business/16unboxed.html","Steve Lohr","2009-08-15","Big research and development laboratories are reaching out to smaller, more varied groups of researchers.","893","null","The New York Times","Business Day","News","article","The Corporate Lab as Ringmaster","The Corporate Lab As Ringmaster"
"https://www.nytimes.com/2009/08/15/technology/companies/15nortel.html","Ian Austen","2009-08-14","The sale of research and patents to Ericsson of Sweden could endanger Canada’s national security, opponents of the deal argue.","1196","null","The New York Times","Technology","News","article","Nortel Sale to Ericsson Stirs Protest in Canada","Nortel Sale To Ericsson Stirs Protest In Canada"
"https://www.nytimes.com/2009/08/15/technology/internet/15bet.html","Bloomberg News","2009-08-14","Gary S. Kaplan and his company were accused of violating federal laws banning the interstate transmission of wagers by wire.","368","null","The New York Times","Technology","News","article","BetOnSports Founder Pleads Guilty in Racketeering Case","BetOnSports Founder Pleads Guilty in Racketeering Case"
"https://www.nytimes.com/2009/08/15/business/global/15asiaecon.html","Bettina Wassener","2009-08-14","Hong Kong’s economy grew by a seasonally adjusted 3.3 percent in the second quarter from the first quarter, more than analysts had expected.","470","null","The New York Times","Business Day","News","article","Hong Kong Joins Asia’s Rapid Climb Out of Recession","Hong Kong Joins Asia’s Rapid Climb Out of Recession"
"https://www.nytimes.com/2009/08/15/world/asia/15pstan.html","Salman Masood","2009-08-15","Rights groups have long denounced the rules as draconian and Pakistan’s political parties have urged the government to do away with them, calling them a dark legacy of British colonial rule.","626","null","The New York Times","World","News","article","Pakistan Lifts Longtime Ban on Political Activities in Restive Tribal Areas","Pakistan Lifts Longtime Ban on Political Activities in Restive Tribal Areas"
