"|","|__writer_name","|__pub_date","|__snippet","|__word_count","|__score","|__source","|__section_name","|__type_of_material","|__document_type","|__main_headline","|__print_headline"
"https://www.nytimes.com/2013/01/29/business/how-facebook-taught-its-search-tool-to-understand-people.html","Somini Sengupta","2013-01-29","Before Facebook introduced a search tool this month, it assembled a varied team to study what users were searching for and to teach computers how to communicate better with people.","1234","null","The New York Times","Business Day","News","article","For Search, Facebook Had to Go Beyond ‘Robospeak’","For Search, Facebook Had to Go Beyond ‘Robospeak’"
"https://www.nytimes.com/2013/01/30/world/europe/murdoch-apologizes-for-grotesque-netanyahu-cartoon.html","Alan Cowell","2013-01-29","The Sunday Times of London, one of Rupert Murdoch’s titles, printed a cartoon depicting Prime Minister Benjamin Netanyahu of Israel building a bloody wall trapping the bodies of Palestinians.","713","null","The New York Times","World","News","article","Murdoch Apologizes for ‘Grotesque’ Netanyahu Cartoon in British Paper","Murdoch Apologizes for ‘Grotesque’ Netanyahu Cartoon in British Paper"
"https://www.nytimes.com/2013/01/30/world/asia/kazakhstan-plane-crash.html","Andrew Roth","2013-01-29","The crash, which left no survivors, was the second aviation disaster in the country in a month.","331","null","The New York Times","World","News","article","Plane Crashes in Fog in Kazakhstan, Killing All 21 on Board","Plane Crashes in Fog in Kazakhstan, Killing All 21 on Board"
"https://www.nytimes.com/2013/01/30/world/africa/mali-timbuktu-france-britain.html","Peter Tinti","2013-01-29","Some residents in Gao expressed concern that the northern Mali town was unsafe and short of food and fuel, while in Timbuktu there were reports of looting.","675","null","The New York Times","World","News","article","Relief and Anxiety Meld in Malian Towns Freed of Islamists","Relief and Anxiety Meld in Malian Towns Freed of Islamists"
"https://www.nytimes.com/2013/01/30/business/global/30iht-peugeot30.html","David Jolly","2013-01-29","Panel orders struggling French automaker to temporarily halt to shed workers a parts maker, but company says it will continue negotiations.","493","null","International Herald Tribune","Business Day","News","article","Appeals Court Suspends Peugeot's Job-Cut Plan","Appeals Court Suspends Peugeot's Job-Cut Plan"
"https://www.nytimes.com/2013/01/30/world/europe/ukrainian-general-pukach-given-life-sentence-in-killing-of-journalist.html","Ellen Barry","2013-01-29","Gen. Olexey Pukach testified that he had not intended to kill the journalist, Georgy Gongadze, but strangled him accidentally during an interrogation.","621","null","The New York Times","World","News","article","Ukrainian General Sentenced to Life in Journalist’s Killing","Ukrainian General Sentenced to Life in Journalist’s Killing"
"https://www.nytimes.com/2013/01/30/world/americas/deadly-fire-has-brazilians-debating-why-bad-things-happen.html","Simon Romero","2013-01-30","The nightclub fire in Santa Maria, Brazil, that killed more than 230 people Sunday has set off a debate about how — or even if — the country can prevent such disasters.","885","null","The New York Times","World","News","article","After Fire, Some Brazilians Fault a Nation’s Sense of Fatalism","After Fire, Some Brazilians Fault a Nation’s Sense of Fatalism"
"https://www.nytimes.com/2013/01/30/world/europe/welcome-to-britain-our-weather-is-appalling.html","Sarah Lyall","2013-01-30","A new guidebook for immigrants reflects the Conservative view that too many people are trying to move to Britain, and that once they arrive they are failing to appreciate the country properly.","992","null","The New York Times","World","News","article","Welcome to Britain. Our Weather Is Appalling.","Welcome to Britain. Our Weather Is Appalling."
"https://www.nytimes.com/2013/01/30/business/media/vegetables-in-winter-served-family-style.html","Jane Levere","2013-01-30","A campaign shows how mothers — in this case, mothers of dolphin, wolf and bear families, brought to life through the use of voice-overs — complete meals by serving Birds Eye side dishes.","883","null","The New York Times","Business Day","News","article","Vegetables in Winter, Served Family Style","Vegetables in Winter, Served Family Style"
"https://www.nytimes.com/2013/01/30/business/fda-approves-genetic-drug-to-treat-rare-disease.html","Andrew Pollack","2013-01-30","The Food and Drug Administration approved Kynamro, a new drug that not only treats a rare inherited disorder, but does so using a technology that can shut off specific genes that cause disease.","823","null","The New York Times","Business Day","News","article","F.D.A. Approves Genetic Drug to Treat Rare Disease","Approval for Genetic Drug To Treat a Rare Disease"
"https://www.nytimes.com/2013/01/30/business/boeing-aware-of-battery-ills-before-the-fires.html","Christopher Drew","2013-01-30","Even before battery failures led to the grounding of all Boeing 787 jets, there were problems that raised questions about their reliability.","1298","null","The New York Times","Business Day","News","article","Boeing 787 Battery Was a Concern Before Failure","Boeing Battery Was a Concern Before Failure "
"https://www.nytimes.com/2013/01/31/world/middleeast/egypt-protests.html","Kareem Fahim","2013-01-30","A prominent opposition leader called on President Mohamed Morsi to hold a national dialogue one day after the nation’s top general warned that Egypt was in danger of collapse.","984","null","The New York Times","World","News","article","Opposition in Egypt Urges Unity Government","Egyptian Opposition Groups Overlook Quarrels in Call for Unity Government"
"https://www.nytimes.com/2013/01/31/technology/blackberry-maker-unveils-its-new-line.html","Ian Austen","2013-01-30","The company introduced a new operating system and a new generation of phones, along with a new corporate name, with the hope of restoring its products’ status as a symbol of executive cool.","837","null","The New York Times","Technology","News","article","Amid Long Odds, BlackBerry Maker Unveils New Line and New Name","Amid Long Odds, BlackBerry Maker Unveils New Line and New Name"
"https://www.nytimes.com/2013/01/31/world/middleeast/egypts-big-businesses-feel-neglected-amid-turmoil.html","Farah Halime","2013-01-31","Some of Egypt's biggest employers have criticized the government for undermining the economy and the role of larger multinational companies in the country's political stability.","1048","null","International Herald Tribune","World","News","article","Egypt's Big Businesses Feel Neglected Amid Turmoil","Egypt's Big Businesses Feel Neglected Amid Turmoil"
"https://www.nytimes.com/2013/01/31/world/asia/beijing-takes-emergency-steps-to-fight-smog.html","Edward Wong","2013-01-30","The measures include shutting down more than 100 factories and ordering one-third of government vehicles off the streets, official news reports said.","954","null","The New York Times","World","News","article","Beijing Takes Steps to Fight Pollution as Problem Worsens","Beijing Takes Steps To Fight Pollution As Problem Worsens"
"https://www.nytimes.com/2013/01/31/technology/personaltech/raspberry-pi-a-computer-tinkerers-dream.html","John Biggs","2013-01-30","Raspberry Pi, a tiny computer that sells for $35, was created to teach students how computers work.","969","null","The New York Times","Technology","News","article","A Tiny Computer Attracts a Million Tinkerers","A Tiny Computer Attracts a Million Tinkerers"
"https://www.nytimes.com/2013/01/31/technology/personaltech/using-a-smartphone-to-look-after-the-pennies.html","Kit Eaton","2013-01-30","Keeping track of your expenses can be time-consuming, but there are several tools to make the job easier.","821","null","The New York Times","Technology","News","article","Using a Smartphone to Keep Track of the Pennies ","Using a Smartphone to Keep Track of the Pennies"
"https://www.nytimes.com/2013/01/31/world/europe/paris-lights-to-be-dimmed-to-save-energy.html","Maïa de la Baume","2013-01-30","Major attractions like the Eiffel Tower will remain lighted, and there will be exceptions for celebrations, but France is directing shops and offices to turn their lights off at night.","281","null","The New York Times","World","News","article","France Will Dim Its Lights to Conserve Energy","France Will Dim Its Lights To Conserve Energy"
"https://www.nytimes.com/2013/01/31/technology/facebook-earnings.html","Somini Sengupta","2013-01-30","Even with a strong earnings report, the company’s stock dropped after hours before recovering.","1071","null","The New York Times","Technology","News","article","Facebook’s Solid Results Are Greeted Cautiously","Facebook’s Solid Results Are Greeted Cautiously"
"https://www.nytimes.com/2013/01/31/world/drone-strike-lawsuit-raises-concerns-on-intelligence-sharing.html","Ravi Somaiya","2013-01-31","The United States often uses intelligence from its allies to target drone strikes, and now British officials are the subject of a lawsuit over the issue.","1110","null","The New York Times","World","News","article","Drone Strike Prompts Suit, Raising Fears for U.S. Allies","Drone Strike Prompts Suit, Raising Fears For U.S. Allies"
"https://www.nytimes.com/2013/02/01/world/middleeast/turn-to-violence-across-middle-east-raises-questions.html","Anne Barnard","2013-02-01","The transformation of the region’s political systems has taken a violent turn in many corners.","1161","null","The New York Times","World","News","article","As Arab Spring’s Glow Fades and Turmoil Rises, Unsettling Questions","As Arab Spring’s Glow Fades and Turmoil Rises, Unsettling Questions"
"https://www.nytimes.com/2013/02/01/business/labor-union-agrees-to-stop-picketing-walmart.html","Steven Greenhouse","2013-02-01","The United Food and Commercial Workers pledged not to try to unionize Walmart workers to avert charges that it engaged in illegal picketing.","767","null","The New York Times","Business Day","News","article","Labor Union to Ease Walmart Picketing","Labor Union To Ease Walmart Picketing"
"https://www.nytimes.com/2013/02/01/world/americas/explosion-in-mexico-city-at-oil-company-headquarters.html","Damien Cave","2013-02-01","The explosion at the headquarters of Mexico’s state-owned oil company on Thursday injured dozens, as windows shattered and the ground shook.","753","null","The New York Times","World","News","article","Explosion in Mexico City Kills at Least 25","Explosion in Mexico City Kills at Least 25"
"https://www.nytimes.com/2013/02/02/business/global/google-submits-proposals-to-resolve-european-antitrust-concerns.html","James Kanter","2013-02-01","The company had until Thursday night to submit the proposals to end a three-year investigation focused on the dominance of its search service.","696","null","The New York Times","Business Day","News","article","Google Makes Offer in 3-Year European Antitrust Case","Google Makes Offer in 3-Year European Antitrust Case"
"https://www.nytimes.com/2013/02/02/world/europe/scotland-yard-official-april-casburn-sentenced-to-jail-in-murdoch-hacking-scandal.html","John Burns","2013-02-01","April Casburn, a senior police officer, was sentenced for seeking cash payments from Rupert Murdoch’s News of the World tabloid.","316","null","The New York Times","World","News","article","British Antiterrorism Official Sentenced in Hacking Scandal","British Antiterrorism Official Sentenced in Hacking Scandal"
"https://www.nytimes.com/2013/02/02/world/americas/mexico-city-explosion-at-pemex-killed-at-least-32.html","Damien Cave","2013-02-01","The explosion at the headquarters of Mexico’s state-owned oil company on Thursday injured at least 121 people, officials said, but they gave no information about the cause.","661","null","The New York Times","World","News","article","Mexico’s Toll Rises in Blast as Hunt Ends for Survivors","Mexico’s Toll Rises in Blast As Hunt Ends For Survivors"
"https://www.nytimes.com/2013/02/03/jobs/amber-alerts-chief-on-early-lessons-in-self-reliance.html","Carol Colombo","2013-02-02","A chief executive learned as a girl that no job was beneath her — and that no job was above her, either.","650","null","The New York Times","Job Market","News","article","Self-Reliance, Learned Early","Self-Reliance, Learned Early"
"https://www.nytimes.com/2013/02/03/business/knomes-new-machine-to-aid-labs-in-genomic-analysis.html","Anne Eisenberg","2013-02-02","A new computer, made by a company called Knome, is the size of a file cabinet and can filter a person’s genetic information, possibly yielding insights into cancer or other diseases.","801","null","The New York Times","Business Day","News","article","Genomic Analysis, the Office Edition","Genomic Analysis, The Office Edition"
"https://www.nytimes.com/2013/02/03/business/budget-sequestration-how-to-do-it-right.html","Tyler Cowen","2013-02-02","An economist suggests that so-called budget sequestration — government spending cuts — could actually help the nation’s economy, if the right kind of cuts are made.","840","null","The New York Times","Business Day","News","article","Nips and Tucks and Big Budget Cuts","Nips, Tucks And Big Budget Cuts"
"https://www.nytimes.com/2013/03/03/business/alaska-airlines-flying-above-an-industrys-troubles.html","Jad Mouawad","2013-03-02","Born in rugged terrain, Alaska Airlines fortified itself — and has resisted the cycle of bankruptcy and mergers buffeting its industry.","3043","null","The New York Times","Business Day","News","article","Alaska Airlines, Flying Above an Industry’s Troubles","Flying Solo"
"https://www.nytimes.com/2013/03/02/your-money/fighting-the-insurer-over-hurricane-sandy-damage.html","Tara Bernard","2013-03-02","A Brooklyn couple say their insurance company will pay $49,000 for home repairs, while an adjuster they hired put the figure needed at $200,000.","1391","null","The New York Times","Your Money","News","article","Fighting the Insurer Over Hurricane Sandy Damage","Fighting the Insurer Over Hurricane Sandy Damage"
"https://www.nytimes.com/2013/03/02/business/concern-and-canceled-flights-as-airlines-wait-for-787.html","Jad Mouawad","2013-03-02","The grounding of Boeing’s 787 jetliner because of battery trouble has meant delayed new services and scheduling headaches for airlines.","637","null","The New York Times","Business Day","News","article","Concern and Canceled Flights as Airlines Wait for 787","More Flight Cancellations As Airlines Wait for 787"
"https://www.nytimes.com/2013/03/02/world/americas/venezuelan-official-confirms-chavez-receiving-cancer-treatments.html","William Neuman","2013-03-02","President Hugo Chávez is receiving chemotherapy or radiation treatments, a government official said Friday. Mr. Chávez has not been seen in public since his Dec. 11 surgery in Havana.","445","null","The New York Times","World","News","article","Venezuelan Official Confirms Chávez Receiving Cancer Treatments","Chávez Back\r\nOn Treatment\r\nFor Cancer"
"https://www.nytimes.com/2013/03/03/world/africa/on-eve-of-vote-fragile-valley-in-kenya-faces-new-divisions.html","Jeffrey Gettleman","2013-03-03","Kenya is about to hold another major election on Monday, the first since the tumult of 2007 and 2008, but the Rift Valley is still polarized.","1374","null","The New York Times","World","News","article","On Eve of Vote, Fragile Valley in Kenya Faces New Divisions","On Eve of Vote, Fragile Valley In Kenya Faces New Divisions"
"https://www.nytimes.com/2013/03/03/world/asia/spill-in-china-lays-bare-environmental-concerns.html","Edward Wong","2013-03-02","A conflict over a recent chemical spill at a factory has drawn attention to growing problems with environmental degradation and officials’ reluctance to take on polluters.","1081","null","The New York Times","World","News","article","Spill in China Underlines Environmental Concerns","Spill in China Underlines Environmental Concerns"
"https://www.nytimes.com/2013/03/03/world/middleeast/kerry-hoping-to-nudge-egypt-toward-reforms.html","Michael Gordon","2013-03-02","John Kerry made his first trip to an Arab capital as secretary of state on Saturday, hoping to prod Egyptian politicians to show a measure of political peace and a commitment to economic change.","888","null","The New York Times","World","News","article","Kerry Is Hoping to Nudge Egypt Toward Reforms","Kerry Is Hoping to Nudge Egypt Toward Reforms"
"https://www.nytimes.com/2013/03/03/business/in-filing-casino-operator-admits-likely-violation-of-an-antibribery-law.html","Michael Schwirtz","2013-03-03","The violation is believed to involve former executives with Las Vegas Sands, which is controlled by Sheldon Adelson, and their efforts to expand in China.","631","null","The New York Times","Business Day","News","article","In Filing, Casino Operator Admits Likely Violation of an Antibribery Law","In Filing, Casino Operator Admits Likely Violation of an Antibribery Law"
"https://www.nytimes.com/2013/03/04/world/asia/04iht-malaysia04.html","Floyd Whaley","2013-03-03","On the island of Borneo, seven people were reported killed, and four hostages taken, as fighting continued Sunday in the Malaysian state of Sabah over a historic claim by a Philippine religious group.","574","null","International Herald Tribune","World","News","article","Tensions Escalating on Borneo as Malaysia Doubles Military Forces","Tensions Escalating on Borneo as Malaysia Doubles Military Forces"
"https://www.nytimes.com/2013/03/04/world/middleeast/kerry-announces-millions-in-us-aid-for-egypt.html","Michael Gordon","2013-03-03","Secretary of State John Kerry said the United States would provide $250 million in aid after Egypt’s president promised to move ahead with talks over economic reforms.","526","null","The New York Times","World","News","article","Kerry Announces $250 Million in U.S. Aid for Egypt","Kerry Announces $250 Million in U.S. Aid for Egypt"
"https://www.nytimes.com/2013/03/04/technology/amid-do-not-track-effort-web-companies-race-to-look-privacy-friendly.html","Somini Sengupta","2013-03-03","Increasingly, Internet companies like Microsoft, Facebook and Mozilla are pushing each other to prove to consumers that their data is safe and in their control.","1216","null","The New York Times","Technology","News","article","Web Privacy Becomes a Business Imperative","Web Privacy Becomes A Business Imperative"
"https://www.nytimes.com/2013/03/04/business/global/swiss-voters-tighten-countrys-limits-on-executive-pay.html","Raphael Minder","2013-03-03","Ignoring a warning from the business lobby, Swiss citizens voted to give shareholders a binding say on the overall pay packages for executives and directors.","737","null","The New York Times","Business Day","News","article","Swiss Voters Approve a Plan to Severely Limit Executive Compensation","Swiss Voters Approve a Plan to Severely Limit Executive Compensation"
"https://www.nytimes.com/2013/03/04/business/media/photojournalists-in-oakland-face-epidemic-of-camera-robberies.html","Carol Pogash","2013-03-04","In less than a year, journalists at every major television news station in the Bay Area have been robbed of expensive cameras, sometimes at gunpoint, and it is changing the way they report.","1058","null","The New York Times","Business Day","News","article","In Oakland, Photojournalists Covering Crimes Become the Victims","In Oakland, Photojournalists Covering Crimes Become the Victims"
"https://www.nytimes.com/2013/03/04/business/media/news-from-the-advertising-industry.html","Stuart Elliott","2013-03-04","Account assignments, executive appointments and miscellaneous news from advertising agencies.","539","null","The New York Times","Business Day","News","article","News From the Advertising Industry","News From the Advertising Industry"
"https://www.nytimes.com/2013/03/04/business/economic-reports-for-the-week-of-march-4.html","null","2013-03-04","Data to be released will include employment figures for February and the trade deficit for January, and Staples and Kroger are among the companies scheduled to report earnings.","352","null","The New York Times","Business Day","News","article","Economic Reports for the Week Ahead","Looking Ahead"
"https://www.nytimes.com/2013/03/04/world/asia/bangladesh-sees-deadly-day-as-protests-persist.html","Julfikar Manik","2013-03-03","Angry skirmishes over convictions by a war crimes tribunal entered another day, with several deaths.","525","null","The New York Times","World","News","article","At Least 19 Killed as Unrest Persists in Bangladesh","At Least 19 Are Killed as Unrest Persists in Bangladesh"
"https://www.nytimes.com/2013/03/04/business/media/walking-dead-helps-solidify-amcs-ratings-success.html","David Carr","2013-03-03","Being a cable network is less of a disadvantage than it used to be, as broadcast networks become just one more click on a seemingly infinite dial.","1176","null","The New York Times","Business Day","News","article","At AMC, Zombies Topple Network TV","At AMC, Zombies Topple Network TV"
"https://www.nytimes.com/2013/03/04/business/media/disney-gambles-on-box-office-wizardry-of-oz.html","Brooks Barnes","2013-03-04","Disney’s movie studio, which has stumbled recently, takes a bold risk with a prequel to the beloved 1939 musical, “The Wizard of Oz.”","1224","null","The New York Times","Business Day","News","article","One More Trip to Land of Oz","One More Trip to Land of Oz"
"https://www.nytimes.com/2013/03/04/world/europe/austrian-protest-party-wins-in-two-state-elections.html","Nicholas Kulish","2013-03-04","Team Stronach, a pro-business and anti-euro party, won seats in Carinthia and Lower Austria on Sunday, building momentum for national elections in the fall.","912","null","The New York Times","World","News","article","Austrian Protest Party Wins in Two States ","Austrian Protest Party Gains Footholds"
"https://www.nytimes.com/2013/03/04/technology/it-managers-struggle-to-contain-corporate-data-in-the-mobile-age.html","Quentin Hardy","2013-03-04","Employees who put company information online with their smartphones create a tricky problem for I.T. departments: how to protect corporate data without hindering employees’ work.","991","null","The New York Times","Technology","News","article","Where Apps Meet Work, Secret Data Is at Risk","Where Apps Meet Work, Secret Data Is at Risk"
"https://www.nytimes.com/2013/03/04/world/africa/general-says-killing-of-militant-in-mali-is-not-confirmed.html","Adam Nossiter","2013-03-04","The commander of Chad’s troops in an operation with the French says that the fate of the Islamist leader Mokhtar Belmokhtar was still unknown.","883","null","The New York Times","World","News","article","General Says Killing of Militant in Mali Is Not Confirmed","General Says Killing of Militant in Mali Is Not Confirmed"
"https://www.nytimes.com/2013/02/15/world/americas/in-brazil-growing-threats-to-catholicisms-sway.html","Simon Romero","2013-02-14","Some quarters of the Catholic Church in Brazil are confronting threats from evangelicalism and secularism by enlivening worship with charismatic practices.","1222","null","The New York Times","World","News","article","A Laboratory for Revitalizing Catholicism","A Laboratory for Revitalizing Catholicism"
"https://www.nytimes.com/2013/02/16/your-money/modern-safeguards-for-a-family-owned-business.html","Paul Sullivan","2013-02-15","The Phelan Brothers, owners of Taconic Farms, which breeds rodents for lab use, created a holding company as a way to maintain some family control over the business.","1419","null","The New York Times","Your Money","News","article","Modern Safeguards for a Family-Owned Business","Modern Safeguards for a Family-Owned Business"
"https://www.nytimes.com/2013/02/15/business/airline-consolidation-may-be-costly-to-travelers.html","Jad Mouawad","2013-02-14","Some consumer advocates are warning that the merger of American Airlines and US Airways, if approved, could bring rising fees and fares as well as service cuts to smaller cities.","1328","null","The New York Times","Business Day","News","article","Service Cuts May Follow Merger of Airlines","Service Cuts May Arise With Merger Of Airlines"
"https://www.nytimes.com/2013/02/15/world/middleeast/afghan-withdrawals-main-hurdle-getting-gear-out.html","Thom Shanker","2013-02-15","After 11-plus years of war, the American military faces a huge task in getting more than 600,000 pieces of equipment out of a landlocked country with bad roads.","1141","null","The New York Times","World","News","article","Main Hurdle in Afghan Withdrawal: Getting the Gear Out","Main Hurdle in Afghan Withdrawal: Getting the Gear Out"
"https://www.nytimes.com/2013/02/16/business/global/g20-forum-moscow.html","Andrew Kramer","2013-02-15","The debate over a currency war arrived in Moscow as finance officials from the Group of 20 sparred over Japan’s proposed expansive policies.","626","null","The New York Times","Business Day","News","article","U.S. Signals Support for Japan’s Yen Policy","U.S. Signals Support for Japan’s Expansionary Policy"
"https://www.nytimes.com/2013/02/17/business/costs-vs-benefits-in-the-quest-for-romance.html","Robert Frank","2013-02-16","In “Dollars and Sex,” the economist Maria Adshade posits that the forces of supply and demand loom large in the implicit market for romantic partners.","860","null","The New York Times","Business Day","News","article","In the Quest for Love, Costs vs. Benefits","Costs vs. Benefits In a Quest for Romance"
