"|","|__writer_name","|__pub_date","|__snippet","|__word_count","|__score","|__source","|__section_name","|__type_of_material","|__document_type","|__main_headline","|__print_headline"
"https://www.nytimes.com/2001/11/15/world/tuberculosis-group-tries-to-spur-research-for-new-antibiotics.html","Donald McNeil","2001-11-15","Global Alliance for TB Drug Development, new group, hopes to entice major drug companies into plunging into tuberculosis market; will release study that estimates that market will be worth $700 million a year by 2010; study may not provide much in...","571","null","The New York Times","World","News","article","Tuberculosis Group Tries to Spur Research for New Antibiotics","Tuberculosis Group Tries to Spur Research for New Antibiotics"
"https://www.nytimes.com/2001/10/12/world/a-nation-challenged-the-envoy-architect-to-a-nation-post-taliban.html","Serge Schmemann","2001-10-12","United Nations Sec Gen Kofi Annan has reportedly named Lakhdar Brahimi his envoy to Afghanistan; Brahimi, who served in role, 1997-99, will play key role in shaping future government out of squabbling factions of Afghan resistance; United States a...","426","null","The New York Times","World","News","article","Architect To a Nation, Post-Taliban","A NATION CHALLENGED: THE ENVOY; Architect To a Nation, Post-Taliban"
"https://www.nytimes.com/2001/02/17/business/inflation-at-wholesale-level-up-a-steep-1.1-in-january.html","Michael Brick","2001-02-17","Prices paid to manufacturers and other producers for their goods climb 1.1 percent in January, steepest monthly gain in more than decade; some economists fear inflation; core rate is up 0.7 percent (M)","518","null","The New York Times","Business Day","News","article","Inflation at Wholesale Level Up a Steep 1.1% in January","Inflation at Wholesale Level Up a Steep 1.1% in January"
"https://www.nytimes.com/2001/10/24/business/daimler-says-chrysler-lost-less-than-expected.html","Edmund Andrews","2001-10-24","DaimlerChrysler AG report Chrysler group lost $243 million in third quarter, less than half what many analysts predicted; company's operating profit climbed to $606 million from $491 million; net income dropped 70 percent, to $821 million from $2....","536","null","The New York Times","Business Day","News","article","Daimler Says Chrysler Lost Less Than Expected","Daimler Says Chrysler Lost Less Than Expected"
"https://www.nytimes.com/2001/01/02/business/2000-highlights-have-money-will-buy.html","null","2001-01-02","Warren E Buffett's Berkshire Hathaway shares rise 27 percent in 2000, to $71,000; photo (S)","75","null","The New York Times","Business Day","News","article","Have Money, Will Buy","2000 HIGHLIGHTS; Have Money, Will Buy"
"https://www.nytimes.com/2001/05/02/technology/technology-briefing.html","null","2001-05-02","TELECOMMUNICATIONS","631","null","The New York Times","Technology","News","article","Technology Briefing","Technology Briefing"
"https://www.nytimes.com/2001/06/05/business/worldbusiness/IHT-tech-briefmicrosoft-is-warned-on-xp.html","James Connell","2001-06-05","An Internet security expert is warning Microsoft Corp. that the planned introduction of its Windows XP operating system could make the Internet more vulnerable. .The software, which Microsoft plans to begin selling in the autumn, adds some powerfu...","679","null","International Herald Tribune","Business Day","null","article","Tech Brief:MICROSOFT IS WARNED ON XP","Tech Brief:MICROSOFT IS WARNED ON XP"
"https://www.nytimes.com/2001/03/28/business/technology-iridium-satellite-system-is-about-to-be-revived.html","Barnaby Feder","2001-03-28","Iridium Satellite will seek to attract commercial customers to its 72-satellite network by offering new data and messaging services in addition to voice communications featured by original Iridium; analysts say survivial of the formerly bankrupt s...","410","null","The New York Times","Business Day","News","article","Iridium Satellite System Is About to Be Revived","TECHNOLOGY; Iridium Satellite System Is About to Be Revived"
"https://www.nytimes.com/2001/05/24/business/worldbusiness/IHT-tech-briefonline-shopping-record.html","James Connell","2001-05-24","AOL Time Warner Inc.'s America Online Inc. subsidiary said members spent a record $6.7 billion shopping online in the first quarter. The sales beat the previous high of $6.4 million spent in the fourth quarter of last year, particularly on furnitu...","337","null","International Herald Tribune","Business Day","null","article","Tech Brief:ONLINE SHOPPING RECORD","Tech Brief:ONLINE SHOPPING RECORD"
"https://www.nytimes.com/2001/02/28/world/no-2-admiral-meets-with-families-of-sub-victims.html","Howard French","2001-02-28","TOKYO, Feb. 28 -- The United States Navy's second highest ranking officer met today with the relatives of nine missing victims of a submarine accident earlier this month that sunk a Japanese fishery school ship off Hawaii.","601","null","The New York Times","World","News","article","No. 2 Admiral Meets With Families of Sub Victims","No. 2 Admiral Meets With Families of Sub Victims"
"https://www.nytimes.com/2001/09/25/business/worldbusiness/IHT-tech-brief-court-backs-investors.html","Victoria Shannon","2001-09-25","Siding with thousands of small investors burned by the high-tech stock bust, a German court ordered directors of a bankrupt software firm to pay damages to a shareholder who charged he was misled by the company's ""sensational"" financial reports","632","null","International Herald Tribune","Business Day","null","article","Tech Brief :COURT BACKS INVESTORS:","Tech Brief :COURT BACKS INVESTORS:"
"https://www.nytimes.com/2001/09/02/world/brazilian-mayor-in-marital-mess-is-it-the-office.html","Larry Rohter","2001-09-02","Residents of Sao Paulo, Brazil, are distressed that second mayor in a row is involved in messy marital breakup; Marta Suplicy, in short time since she took office, has abandoned her husband, taken up with shadowy Argentine-born campaign adviser an...","1099","null","The New York Times","World","News","article","Brazilian Mayor in Marital Mess: Is It the Office?","Brazilian Mayor in Marital Mess: Is It the Office?"
"https://www.nytimes.com/2001/12/28/technology/technology-briefing.html","null","2001-12-28","Technology Briefing","1419","null","The New York Times","Technology","News","article","Technology Briefing","Technology Briefing"
"https://www.nytimes.com/2001/08/15/business/worldbusiness/IHT-tech-briefadelphia-deepens-loss.html","James Connell","2001-08-15","Adelphia Communications Corp., a cable-television provider in the U.S. Northeast and West, said its second-quarter loss widened as it upgraded lines for digital television and Internet service. .The sixth-largest U.S. cable-television operator's l...","355","null","International Herald Tribune","Business Day","null","article","Tech Brief:ADELPHIA DEEPENS LOSS","Tech Brief:ADELPHIA DEEPENS LOSS"
"https://www.nytimes.com/2001/03/07/business/world-business-briefing-europe-turkey-seeking-imf-s-support.html","Bloomberg News","2001-03-07","Turkey's new economy minister, Kemal Dervis, says he will fly to Washington to meet with IMF and World Bank to try to win backing for new package to strengthen economy (S)","70","null","The New York Times","Business Day","News","article","TURKEY SEEKING I.M.F.'S SUPPORT","WORLD BUSINESS BRIEFING: EUROPE; TURKEY SEEKING I.M.F.'S SUPPORT"
"https://www.nytimes.com/2001/04/24/business/the-markets-key-rates.html","null","2001-04-24","","118","null","The New York Times","Business Day","Statistics","article","Key Rates","THE MARKETS; Key Rates"
"https://www.nytimes.com/2001/05/21/world/fear-of-ethnic-attacks-grips-macedonia-s-cities.html","Carlotta Gall","2001-05-21","Fear grips Macedonia's cities, notably capital of Skopje, that three-month-old conflict between Macedonian security forces and ethnic Albanian rebels in mountainous border areas could spill over into urban areas and develop into ethnic violence; b...","945","null","The New York Times","World","News","article","Fear of Ethnic Attacks Grips Macedonia's Cities","Fear of Ethnic Attacks Grips Macedonia's Cities"
"https://www.nytimes.com/2001/06/14/business/backing-sought-for-offshore-tax-initiative.html","Bloomberg News","2001-06-14","Tax officials from US and other countries end meeting in Paris and return home to seek political agreement for proposals under which US and Organization for Economic Cooperation and Development would cooperate on reducing tax revenue lost to offsh...","211","null","The New York Times","Business Day","News","article","Backing Sought for Offshore Tax Initiative","Backing Sought for Offshore Tax Initiative"
"https://www.nytimes.com/2001/12/17/business/international-business-small-scale-financing-takes-hold-in-africa.html","Henri Cauvin","2001-12-17","Niche firms find profit in financing small to mid-sized businesses in Africa; lenders combine first-world business advice with needed funding at multiple locations around continent; photo (M)","1152","null","The New York Times","Business Day","News","article","International Business; Small-Scale Financing Takes Hold in Africa","International Business; Small-Scale Financing Takes Hold in Africa"
"https://www.nytimes.com/2001/11/19/business/business-digest-263699.html","null","2001-11-19","","500","null","The New York Times","Business Day","Summary","article","BUSINESS DIGEST","BUSINESS DIGEST"
"https://www.nytimes.com/2001/04/20/world/muhammad-rabbani-advocate-of-some-moderation-in-taliban.html","Celia Dugger","2001-04-20","","374","null","The New York Times","World","Obituary; Biography","article","Muhammad Rabbani, Advocate Of Some Moderation in Taliban","Muhammad Rabbani, Advocate Of Some Moderation in Taliban"
"https://www.nytimes.com/2001/09/28/business/company-news-citing-debt-load-moody-s-cuts-disney-s-credit-rating.html","Bloomberg News","2001-09-28","Walt Disney Co's credit ratings are cut by Moody's Investors Service, which cites increased debt load company will assume after it completes its $5.3 billion purchase of Fox Family Worldwide (S)","95","null","The New York Times","Business Day","News","article","CITING DEBT LOAD, MOODY'S CUTS DISNEY'S CREDIT RATING","COMPANY NEWS; CITING DEBT LOAD, MOODY'S CUTS DISNEY'S CREDIT RATING"
"https://www.nytimes.com/2001/07/26/world/six-are-dead-many-missing-as-boat-sinks-off-bahamas.html","David Gonzalez","2001-07-26","American and Bahamian authorities say sailboat packed with as many as 156 Haitians trying to get to United States ran aground on reefs surrounding Great Inagua Island in Bahamas during past week, leaving six dead and possibly dozens more missing; ...","447","null","The New York Times","World","News","article","Six Are Dead, Many Missing, As Boat Sinks Off Bahamas","Six Are Dead, Many Missing, As Boat Sinks Off Bahamas"
"https://www.nytimes.com/2001/04/25/business/worldbusiness/IHT-tech-briefibms-big-nano-investment.html","Victoria Shannon","2001-04-25","IBM will invest more than $100 million to help create a state Center of Excellence in Nanoelectronics at the State University of New York's Albany campus. SUNY would contribute $50 million for the center, which is expected to initially employ 100 ...","283","null","International Herald Tribune","Business Day","null","article","Tech Brief:IBM'S BIG NANO INVESTMENT","Tech Brief:IBM'S BIG NANO INVESTMENT"
"https://www.nytimes.com/2001/04/15/business/market-insight-seeing-blue-skies-again-for-chips.html","Kenneth Gilpin","2001-04-15","","777","null","The New York Times","Business Day","Interview","article","Seeing Blue Skies, Again, For Chips","MARKET INSIGHT; Seeing Blue Skies, Again, For Chips"
"https://www.nytimes.com/2001/01/18/business/lawyers-say-aetna-trying-to-settle-suit.html","Milt Freudenheim","2001-01-18","Aetna Inc is in preliminary talks to try to settle its share of host of lawsuits that attack core marketing and operating practices of health maintenance organization industry; talks have intensified in last 10 days as two sides await ruling by fe...","691","null","The New York Times","Business Day","News","article","Lawyers Say Aetna Trying To Settle Suit","Lawyers Say Aetna Trying To Settle Suit"
"https://www.nytimes.com/2001/07/12/business/company-news-judge-sharply-cuts-jury-award-in-diet-drug-suit.html","Bloomberg News","2001-07-12","Judge Terry Canales cuts $47.3 million, or 84 percent, from $56.5 million award to Gloria Lopez, who claimed her heart had been damaged by pen-phen diet-drug combination; judgment was against American Home Products Corp (S)","121","null","The New York Times","Business Day","News","article","JUDGE SHARPLY CUTS JURY AWARD IN DIET-DRUG SUIT","COMPANY NEWS; JUDGE SHARPLY CUTS JURY AWARD IN DIET-DRUG SUIT"
"https://www.nytimes.com/2001/03/29/business/technology-briefing-internet-house-committee-acts-on-spam.html","null","2001-03-29","House committee, acting to curb unsolicited e-mail, known as spam, approves Rep Heather A Wilson's bill to require such commercial electronic messages to include valid return addresses so that recipients can easily request they be droped from mail...","123","null","The New York Times","Business Day","News","article","HOUSE COMMITTEE ACTS ON SPAM","TECHNOLOGY BRIEFING: INTERNET; HOUSE COMMITTEE ACTS ON SPAM"
"https://www.nytimes.com/2001/09/07/world/north-and-south-korea-to-restart-high-level-talks.html","James Brooke","2001-09-07","High-level talks between North and South Korea will resume after six-month freeze that began when North took offense at comments by Pres Bush and refused to continue meeting with South; Bush said at that time he was skeptical that North Korea's Co...","420","null","The New York Times","World","News","article","North and South Korea to Restart High-Level Talks","North and South Korea to Restart High-Level Talks"
"https://www.nytimes.com/2001/03/13/business/worldbusiness/IHT-swedish-phone-giant-warns-of-heavy-firstquarter.html","Barbara Staszewski","2001-03-13","LM Ericsson AB, the Swedish telecoms giant, warned Monday that it would slump into a heavy loss in the first quarter of the year, mainly because of the economic slowdown in the United States. .Ericsson, which had earlier forecast it would break ev...","1166","null","International Herald Tribune","Business Day","null","article","Swedish Phone Giant Warns Of Heavy First-Quarter Loss : Tech Brief:Gloom at Ericsson","Swedish Phone Giant Warns Of Heavy First-Quarter Loss : Tech Brief:Gloom at Ericsson"
"https://www.nytimes.com/2001/02/10/your-money/IHT-uncertainty-weighs-on-analysts-energy-picks-varied-outlook-for.html","Holly Preston","2001-02-10","SHARES IN ENERGY companies are currently being recommended by many a brokerage firm, but the folks who analyze these stocks on a regular basis readily admit that there is much uncertainty about what the coming year will hold. As a result, their op...","9078","null","International Herald Tribune","Your Money","null","article","Uncertainty Weighs on Analysts' Energy Picks : Varied Outlook for Stocks","Uncertainty Weighs on Analysts' Energy Picks : Varied Outlook for Stocks"
"https://www.nytimes.com/2001/09/21/business/world-business-briefing-europe-the-netherlands-chip-sales-slump.html","Bloomberg News","2001-09-21","Royal Philips Electronics says chip sales might fall more than forecast in third quarter because of slumping demand; expects sales to drop as much as 18 percent from second quarter, after predicting single-digit decline in July (S)","71","null","The New York Times","Business Day","News","article","World Business Briefing | Europe: The Netherlands: Chip Sales Slump","World Business Briefing | Europe: The Netherlands: Chip Sales Slump"
"https://www.nytimes.com/2001/12/31/world/nation-challenged-sanctuary-tribal-area-pakistan-gives-refuge-qaeda-fighters.html","Barry Bearak","2001-12-31","Hundreds of Al Qaeda fighters, chased from Tora Bora caves, have crossed mountains into Pakistan's untamed tribal areas; Pashtuns of remote Tirah Valley offer sanctuary to anyone who seeks it; photos (M)","1375","null","The New York Times","World","News","article","Tribal Area of Pakistan Gives Refuge to Qaeda Fighters Fleeing Caves","A NATION CHALLENGED: SANCTUARY; Tribal Area of Pakistan Gives Refuge to Qaeda Fighters Fleeing Caves"
"https://www.nytimes.com/2001/02/22/business/technology-briefing-software-market-frowns-on-sybase-deal.html","Andrew Zipern","2001-02-22","Shares of Sybase Inc tumble one day after company announces it will acquire New Era of Networks Inc in $373 million stock transaction; photo (S)","116","null","The New York Times","Business Day","News","article","MARKET FROWNS ON SYBASE DEAL","TECHNOLOGY BRIEFING: SOFTWARE; MARKET FROWNS ON SYBASE DEAL"
"https://www.nytimes.com/2001/07/12/business/world-business-briefing.html","null","2001-07-12","ASIA SOUTH KOREA: PROFIT AT DAEWOO The South Korean automaker Daewoo Motor reported an operating profit of $17 million in the second quarter after losing $35 million in the first quarter. The company reported a pretax profit of $1.3 million in Jun...","1371","null","The New York Times","Business Day","News","article","World Business Briefing","World Business Briefing"
"https://www.nytimes.com/2001/02/21/business/worldbusiness/IHT-tech-briefchips-for-america.html","James Connell","2001-02-21","Transmeta Corp. said its chips, which it promotes as energy-saving alternatives to processors built by rivals such as Intel Corp., had found a place in servers soon to be introduced in North America. Transmeta's Crusoe chips have thus far been use...","620","null","International Herald Tribune","Business Day","null","article","Tech Brief:CHIPS FOR AMERICA","Tech Brief:CHIPS FOR AMERICA"
"https://www.nytimes.com/2001/08/17/world/world-briefing-asia-india-campaign-for-sainthood.html","Celia Dugger","2001-08-17","Roman Catholic diocese in Calcutta sends Vatican 35,000-page report promoting sainthood for late Mother Teresa (S)","70","null","The New York Times","World","News","article","World Briefing | Asia: India: Campaign For Sainthood","World Briefing | Asia: India: Campaign For Sainthood"
"https://www.nytimes.com/2001/01/16/business/world-business-briefing.html","null","2001-01-16","EUROPE","460","null","The New York Times","Business Day","News","article","World Business Briefing","World Business Briefing"
"https://www.nytimes.com/2001/06/13/business/on-a-shoestring-keeping-their-day-jobs-dabbling-in-dot-com-dreams.html","Amy Zuckerman","2001-06-13","Profiles of Kevin Broderick, Katherine Walsh-Burke and Andrew Starr, people who are developing Internet businesses in their free time while keeping day jobs; none are seeking venture capital; photo (M)","1037","null","The New York Times","Business Day","News","article","Keeping Their Day Jobs, Dabbling in Dot-Com Dreams","ON A SHOESTRING; Keeping Their Day Jobs, Dabbling in Dot-Com Dreams"
"https://www.nytimes.com/2001/12/13/business/company-briefs-651419.html","null","2001-12-13","","167","null","The New York Times","Business Day","News","article","COMPANY BRIEFS","COMPANY BRIEFS"
"https://www.nytimes.com/2001/07/16/business/in-cable-tv-programmers-provide-a-power-balance.html","Seth Schiesel","2001-07-16","Analysis of intense consolidation of cable television industry in light of possible sale of AT&T's cable assets; top seven cable operators now control over 80 percent of nation's subscribers, up from under 65 percent in 1996 and 44 percent in 1991...","1267","null","The New York Times","Business Day","An Analysis; News Analysis","article","In Cable TV, Programmers Provide a Power Balance","In Cable TV, Programmers Provide a Power Balance"
"https://www.nytimes.com/2001/09/27/world/terrorists-are-sought-in-latin-smugglers-haven.html","Larry Rohter","2001-09-27","FBI agents and police officers from Paraguay, Brazil and Argentina are scouring Ciudad del Este, Paraguay, and other parts of three countries' common border for evidence that region, long notorious as contraband capital of South America, may also ...","1127","null","The New York Times","World","News","article","Terrorists Are Sought in Latin Smugglers' Haven","Terrorists Are Sought in Latin Smugglers' Haven"
"https://www.nytimes.com/2001/01/01/business/from-wallflower-to-most-popular.html","Jayson Blair","2001-01-01","Fashionmall.com, online seller of designer clothing, becomes target of takeover offers from two companies in the space of a few months, Sitestar and Narax; Michael M Savage, president of Narax, and Frederick T Manlunas, chairman of Sitestar, are b...","1259","null","The New York Times","Business Day","News","article","From Wallflower to Most Popular","From Wallflower to Most Popular"
"https://www.nytimes.com/2001/09/06/business/worldbusiness/IHT-tech-briefcyberworks-invests.html","Victoria Shannon","2001-09-06","Pacific Century CyberWorks Ltd. plans to spend $300 million of its dwindling cash on the $2 billion CyberPort project, an analyst said, citing company management.. Edison Lee, a CLSA Ltd. analyst, told Bloomberg News that CyberWorks said it would ...","760","null","International Herald Tribune","Business Day","null","article","Tech Brief:CYBERWORKS INVESTS","Tech Brief:CYBERWORKS INVESTS"
"https://www.nytimes.com/2001/10/31/international/world-briefing.html","null","2001-10-31","EUROPE.","934","null","The New York Times","World","News","article","World Briefing","World Briefing"
"https://www.nytimes.com/2001/04/25/business/world-business-briefing.html","null","2001-04-25","ASIA","620","null","The New York Times","Business Day","News","article","World Business Briefing","World Business Briefing"
"https://www.nytimes.com/2001/02/20/world/a-woman-emerges-to-offer-peru-an-alternative.html","Clifford Krauss","2001-02-20","Lourdes Flores is running for president in Peru; she has been in Congress for 10 years, making career of sponsoring measures important to women; she is now running close second in crowded field of candidates, seven weeks before balloting on April ...","1010","null","The New York Times","World","News","article","A Woman Emerges to Offer Peru an Alternative","A Woman Emerges to Offer Peru an Alternative"
"https://www.nytimes.com/2001/12/23/business/personal-business-diary-new-year-s-resolutions-for-financial-health.html","Vivian Marino","2001-12-23","Experts suggest six ways people can improve their financial health in 2002 (M)","390","null","The New York Times","Business Day","News","article","New Year's Resolutions For Financial Health","PERSONAL BUSINESS: DIARY; New Year's Resolutions For Financial Health"
"https://www.nytimes.com/2001/06/23/business/the-markets-key-rates.html","null","2001-06-23","","118","null","The New York Times","Business Day","Statistics","article","Key Rates","THE MARKETS; Key Rates"
"https://www.nytimes.com/2001/03/04/technology/circuits/article-2001030492805993519-no-title.html","null","2001-03-04","Privacy's Guarded Prognosis","753","null","The New York Times","Technology","News","article","Article 2001030492805993519 -- No Title","Article 2001030492805993519 -- No Title"
"https://www.nytimes.com/2001/04/17/business/more-manufacturers-cut-workers-as-slowdown-hits-profit-growth.html","From STAFF","2001-04-17","Two major consumer technology companies announced large layoffs on Tuesday amid dwindling profit growth in the face of a slowdown in the world economy, and a third was reported to be readying a similar move.","888","null","The New York Times","Business Day","News","article","More Manufacturers Cut Workers as Slowdown Hits Profit Growth","More Manufacturers Cut Workers as Slowdown Hits Profit Growth"
"https://www.nytimes.com/2001/03/11/world/execution-in-china-through-a-brother-s-eyes.html","Craig Smith","2001-03-11","Hundreds, perhaps thousands, of condemned people in China have their organs 'harvested' minutes after their death by gunshot to back of head; China executes more people each year than rest of world combined, although exact number is tightly guarde...","2079","null","The New York Times","World","News","article","Execution in China, Through a Brother's Eyes","Execution in China, Through a Brother's Eyes"
"https://www.nytimes.com/2001/02/15/world/journal-in-exile-man-who-would-be-shah-seeks-job-ruling-iran.html","Elaine Sciolino","2001-02-15","Riza Pahlevi, son of deposed shah of Iran, lives in exile in Maryland but wants to return home as ruler; he has announced 'new phase' in campaign to peacefully remove Islamic Republic and replace it with 'democratic and secular government' that mi...","948","null","The New York Times","World","News","article","Journal in Exile; Man Who Would Be Shah Seeks Job Ruling Iran","Journal in Exile; Man Who Would Be Shah Seeks Job Ruling Iran"
"https://www.nytimes.com/2001/09/27/business/coca-cola-and-procter-call-off-joint-venture.html","Julian Barnes","2001-09-27","Coca-Cola Co and Procter & Gamble call off plans for joint venture that companies announced in February to distribute Pringles chips; analysts believe Procter will seek out new partners to help distribute chips more widely and consider offers to s...","498","null","The New York Times","Business Day","News","article","Coca-Cola and Procter Call Off Joint Venture","Coca-Cola and Procter Call Off Joint Venture"
"https://www.nytimes.com/2001/01/31/business/technology-briefing-hardware-intel-cuts-chip-prices.html","Chris Gaither","2001-01-31","Intel slashes prices on its Pentium III processor, trying to clear out older product lines to speed transition to its new Pentium 4 chip (S)","121","null","The New York Times","Business Day","News","article","INTEL CUTS CHIP PRICES","TECHNOLOGY BRIEFING: HARDWARE; INTEL CUTS CHIP PRICES"
"https://www.nytimes.com/2001/08/11/business/company-briefs-661619.html","null","2001-08-11","","65","null","The New York Times","Business Day","News","article","COMPANY BRIEFS","COMPANY BRIEFS"
