"|","|__writer_name","|__pub_date","|__snippet","|__word_count","|__score","|__source","|__section_name","|__type_of_material","|__document_type","|__main_headline","|__print_headline"
"https://www.nytimes.com/2003/02/18/world/world-briefing-asia-hong-kong-bishop-criticizes-china.html","Keith NYT","2003-02-18","Bishop Joseph Zen, leader of Roman Catholic Church in Hong Kong, says mainland China is stepping up repression of church; photo (S)","80","null","The New York Times","World","News","article","World Briefing | Asia: Hong Kong: Bishop Criticizes China","World Briefing | Asia: Hong Kong: Bishop Criticizes China"
"https://www.nytimes.com/2003/07/21/international/europe/the-wrath-of-the-conquered.html","Gerhard SPÖRL","2003-07-21","America's GIs feel like living targets on Baghdad's streets, while the subjects of the accursed dictator Saddam Hussein complain more and more vocally about the arrogance and incompetence of their conquerors. The star of Gulf war champion George W...","3757","null","The New York Times","World","News","article","The wrath of the conquered","The wrath of the conquered"
"https://www.nytimes.com/2003/01/08/business/the-markets-stocks-bonds-shares-are-mixed-as-excitement-over-tax-plan-subsides.html","Kenneth Gilpin","2003-01-08","Dow Jones industrial average is down 32.98 points, or 0.4 percent, to 8,740.59; Standard & Poor's 500-stock index drops 6.08 points, or 0.7 percent, to 922.93; Nasdaq composite index gains 10.25 points, or 0.7 percent, to 1,431.57; price of benchm...","650","null","The New York Times","Business Day","News","article","Shares Are Mixed as Excitement Over Tax Plan Subsides","THE MARKETS: STOCKS & BONDS; Shares Are Mixed as Excitement Over Tax Plan Subsides"
"https://www.nytimes.com/2003/06/02/business/media-unlikely-pop-idol-sells-like-real-thing.html","Jennifer Bayot","2003-06-02","","733","null","The New York Times","Business Day","News","article","Unlikely Pop Idol Sells Like Real Thing","MEDIA; Unlikely Pop Idol Sells Like Real Thing"
"https://www.nytimes.com/2003/04/08/world/nation-war-third-infantry-division-iraqi-missile-strike-kills-four-tactical.html","Steven Myers","2003-04-08","Iraqi rocket explodes in headquarters of Army's Third Infantry Division south of Baghdad, killing at least two soldiers and two journalists and wounding 15 others, one gravely; strike also destroys 17 military vehicles; Lt Col Peter C Bayer says m...","323","null","The New York Times","World","News","article","Iraqi Missile Strike Kills Four At Tactical Operations Center","A NATION AT WAR: THIRD INFANTRY DIVISION; Iraqi Missile Strike Kills Four At Tactical Operations Center"
"https://www.nytimes.com/2003/09/04/business/company-news-health-insurer-agrees-to-settle-lawsuit-by-doctors.html","Bloomberg News","2003-09-04","Health insurer Cigna Corp agrees to pay $85 million to settle accusations that it routinely underpaid doctors; also agrees to to make changes to its billing processes and business practices that may bring value of settlement to more than $700 mill...","98","null","The New York Times","Business Day","News","article","HEALTH INSURER AGREES TO SETTLE LAWSUIT BY DOCTORS","COMPANY NEWS; HEALTH INSURER AGREES TO SETTLE LAWSUIT BY DOCTORS"
"https://www.nytimes.com/2003/06/19/business/worldbusiness/bertelsmanns-exchief-becomes-partner-at-investment.html","Mark Landler","2003-06-19","Thomas Middelhoff was named a partner with Investcorp, a global investment firm known for buying and selling brand names like Tiffany, Gucci and Saks Fifth Avenue.","1819","null","The New York Times","Business Day","News","article","Bertelsmann's Ex-Chief Becomes Partner at Investment Firm","Bertelsmann's Ex-Chief Becomes Partner at Investment Firm"
"https://www.nytimes.com/2003/06/02/business/worldbusiness/IHT-ahead-of-the-markets-deflation-fears-might-spur.html","Eric Pfanner","2003-06-02","Worries over the threat of deflation in several pockets of the global economy are not officially on the agenda as world leaders meet in Evian, France, for the Group of 8 summit meeting..But this week, policymakers will get a series of readings on ...","3585","null","International Herald Tribune","Business Day","null","article","AHEAD OF THE MARKETS : Deflation fears might spur ECB","AHEAD OF THE MARKETS : Deflation fears might spur ECB"
"https://www.nytimes.com/2003/01/21/world/world-briefing-africa-sierra-leone-police-seek-ex-ruler.html","Somini NYT","2003-01-21","Johnny Paul Koroma, former military leader of Sierra Leone after 1997 coup that overthrew President Ahmad Tejan Kabbah, is wanted by police in Freetown for attack on military installation (S)","50","null","The New York Times","World","News","article","World Briefing | Africa: Sierra Leone: Police Seek Ex-Ruler","World Briefing | Africa: Sierra Leone: Police Seek Ex-Ruler"
"https://www.nytimes.com/2003/09/01/business/business-digest-123994.html","null","2003-09-01","","486","null","The New York Times","Business Day","Summary","article","BUSINESS DIGEST","BUSINESS DIGEST"
"https://www.nytimes.com/2003/11/13/world/for-albanians-it-s-come-to-this-a-son-for-a-tv.html","Nicholas Wood","2003-11-13","Child trafficking has established itself in Albania, Europe's most improverished and long most isolated country; government estimates that 6,000 children have been sent abroad for use in begging and prostitution rackets, or in some cases sold to W...","1086","null","The New York Times","World","News","article","For Albanians, It's Come to This: A Son for a TV","For Albanians, It's Come to This: A Son for a TV"
"https://www.nytimes.com/2003/10/27/world/israelis-blow-up-buildings-in-gaza-strip.html","James Bennet","2003-10-27","Israeli Army blows up three vacant apartment buildings in Gaza Strip after evacuating more than 2,000 Palestinians from surrounding buildings; army claims Palestinians used structures to spy on nearby Netzarim settlement where Palestinian gunmen k...","736","null","The New York Times","World","News","article","Israelis Blow Up Buildings in Gaza Strip","Israelis Blow Up Buildings in Gaza Strip"
"https://www.nytimes.com/2003/10/24/business/world-business-briefing-europe-britain-bid-for-retailer-raised.html","Alan NYT","2003-10-24","World Business Briefing: Britain: Bid fï","78","null","The New York Times","Business Day","News","article","World Business Briefing | Europe: Britain: Bid For Retailer Raised","World Business Briefing | Europe: Britain: Bid For Retailer Raised"
"https://www.nytimes.com/2003/10/15/business/philips-electronics-reports-best-profit-in-three-years.html","Gregory Crouch","2003-10-15","Dutch technology giant Royal Philips Electronics reports its best quarterly profit in nearly three years, with its joint venture in liquid crystal display monitors, LG Philips LCD Co, helping bottom line significantly; reports third-quarter net pr...","479","null","The New York Times","Business Day","News","article","Philips Electronics Reports Best Profit in Three Years","Philips Electronics Reports Best Profit in Three Years"
"https://www.nytimes.com/2003/04/20/business/the-travel-industry-changes-its-vacation-plans-undercrowding-in-china.html","Joseph Kahn","2003-04-20","SARS is walloping Chinese tourist industry despite China's efforts to present nation as safe; visitor drought is expected to last for weeks, reducing overseas arrivals through much of peak travel season (M)","391","null","The New York Times","Business Day","News","article","The Travel Industry Changes Its Vacation Plans; Undercrowding in China","The Travel Industry Changes Its Vacation Plans; Undercrowding in China"
"https://www.nytimes.com/2003/10/26/business/generous-medicare-payments-spur-specialty-hospital-boom.html","Reed Abelson","2003-10-26","Article in series Re-examining Medicare says hospitals across country, most notably in Indianapolis, are creating special cardiac care facilities, driven in large pay by Medicare payment system, with its emphasis on procedures and its weak ties to...","2110","null","The New York Times","Business Day","Series","article","Generous Medicare Payments Spur Specialty Hospital Boom","Generous Medicare Payments Spur Specialty Hospital Boom"
"https://www.nytimes.com/2003/10/31/business/company-news-aetna-lowers-its-profit-outlook-for-2004.html","Bloomberg News","2003-10-31","Aetna says profit will rise 15 percent next year, less than expected, after net income more than doubled in third quarter and company added customers for first time in three years (S)","121","null","The New York Times","Business Day","News","article","AETNA LOWERS ITS PROFIT OUTLOOK FOR 2004","COMPANY NEWS; AETNA LOWERS ITS PROFIT OUTLOOK FOR 2004"
"https://www.nytimes.com/2003/01/31/business/schwab-to-give-up-post-of-chief-executive-at-brokerage-firm.html","Patrick McGeehan","2003-01-31","Charles Schwab Corporation said today that its founder and chairman, Charles R. Schwab, would relinquish the title of co-chief executive in May.","873","null","The New York Times","Business Day","News","article","Schwab to Give Up Post of Chief Executive at Brokerage Firm","Schwab to Give Up Post of Chief Executive at Brokerage Firm"
"https://www.nytimes.com/2003/10/23/world/world-briefing-africa-somalia-un-curfew-after-killings.html","Marc NYT","2003-10-23","Maxwell Gaylard, United Nations relief coordinator for Somalia, expresses concern for safety of relief personnel in Somaliland region after recent murders of four international aid workers; agency orders workers to stay in capital Hargeisa and kee...","136","null","The New York Times","World","News","article","World Briefing | Africa: Somalia: U.N. Curfew After Killings","World Briefing | Africa: Somalia: U.N. Curfew After Killings"
"https://www.nytimes.com/2003/03/31/world/nation-war-approach-capital-infantry-attacks-baghdad-defense-with-first-probes.html","Patrick Tyler","2003-03-31","American Marine and Army infantry units arrayed along broad front south of Baghdad make first probing attacks against Republican Guard division at Karbala, 65 miles from capital; this follows week of heavy aerial bombardment on Iraqi forces that g...","1303","null","The New York Times","World","News","article","INFANTRY ATTACKS BAGHDAD DEFENSE WITH FIRST PROBES","A NATION AT WAR: APPROACH TO CAPITAL; INFANTRY ATTACKS BAGHDAD DEFENSE WITH FIRST PROBES"
"https://www.nytimes.com/2003/03/22/world/nation-war-baghdad-staggering-blow-strikes-heart-iraqi-capital.html","John Burns","2003-03-22","American air war on Iraq explodes in ferocious display of precision bombing and cruise missile strikes that blast heart of Hussein's power with spectacular opening bulls-eye on his most forbidding palace and continues with at least 100 more devast...","1396","null","The New York Times","World","News","article","A Staggering Blow Strikes at the Heart Of the Iraqi Capital","A NATION AT WAR: BAGHDAD; A Staggering Blow Strikes at the Heart Of the Iraqi Capital"
"https://www.nytimes.com/2003/12/15/business/new-economy-computerized-voting-machines-are-secure-efficient-their-makers-say.html","John Schwartz","2003-12-15","National Institute of Standards and Technology holds symposium on touch-screen electronic voting machines; critics complain that manufacturers are putting democracy in mystery box and that computer code for systems was not written to standards tha...","1115","null","The New York Times","Business Day","News","article","New Economy; Computerized voting machines are secure and efficient, their makers say. Skeptics are demanding a paper trail.","New Economy; Computerized voting machines are secure and efficient, their makers say. Skeptics are demanding a paper trail."
"https://www.nytimes.com/2003/03/08/world/bosnian-serbs-told-to-pay-2-million-for-srebrenica-massacre.html","Daniel Simpson","2003-03-08","Human Rights Chamber of Bosnia and Herzegovina orders Bosnia's Serb Republic to pay more than $2 million in compensation for 1995 massacre of 7,500 Muslims in Srebrenica; funds will be used to build memorial at graveyard where families of victims ...","578","null","The New York Times","World","News","article","Bosnian Serbs Told to Pay $2 Million for Srebrenica Massacre","Bosnian Serbs Told to Pay $2 Million for Srebrenica Massacre"
"https://www.nytimes.com/2003/09/25/business/economic-scene-california-s-long-term-economic-problems-need-long-term-solutions.html","Hal Varian","2003-09-25","Hal R Varian Economic Scene column says California's long-term economic problems need long-term solutions as residents prepare to go to polls to decide whether to recall Gov Gray Davis and elect new governor; says long-term reforms require long-te...","1036","null","The New York Times","Business Day","News","article","Economic Scene; California's long-term economic problems need long-term solutions.","Economic Scene; California's long-term economic problems need long-term solutions."
"https://www.nytimes.com/2003/12/09/world/jobs-here-and-in-china-a-white-house-topic.html","Jim Yardley","2003-12-09","China's economic growth rates remain envy of the world, but many economists say continuing boom is still not providing enough new jobs to curb unemployment; country has serious jobs problem; economic restructuring has caused huge layoffs at old, u...","836","null","The New York Times","World","News","article","Jobs Here and in China a White House Topic","Jobs Here and in China a White House Topic"
"https://www.nytimes.com/2003/07/27/business/business-a-specialty-food-store-with-a-discount-attitude.html","Amy Wu","2003-07-27","Article on Trader Joe's, which started as Pronto Markets in Los Angeles in 1958 and is now unique national chain with changing array of specialty items, many private-label, at low prices; photos; company is privately held by German billionaires Ka...","1174","null","The New York Times","Business Day","News","article","Business; A Specialty Food Store With a Discount Attitude","Business; A Specialty Food Store With a Discount Attitude"
"https://www.nytimes.com/2003/03/27/technology/l-soul-baring-in-absentia-984205.html","null","2003-03-27","Douglas A Learner letter comments on similarities among instant messaging 'away-from-my computer' announcements, telephone answering machine greetings and handwritten musings on dorm room doors (Mar 20 article)","98","null","The New York Times","Technology","Letter","article","Soul-Baring in Absentia","Soul-Baring in Absentia"
"https://www.nytimes.com/2003/03/26/business/the-media-business-gq-magazine-names-editor-to-succeed-art-cooper.html","David Carr","2003-03-26","GQ executive editor Jim Nelson is named editor in chief of magazine, succeeding Art Cooper, who retired on Feb 25; photo (M)","467","null","The New York Times","Business Day","News","article","GQ Magazine Names Editor To Succeed Art Cooper","THE MEDIA BUSINESS; GQ Magazine Names Editor To Succeed Art Cooper"
"https://www.nytimes.com/2003/02/08/world/un-warns-of-mideast-conflict-s-harm-to-the-environment.html","Marc Lacey","2003-02-08","Delegates to United Nations environmental conference, Nairobi, Kenya, agree Mideast conflict is having grave effects on environment of West Bank and Gaza Strip; urge Israelis and Palestinians to work jointly to reduce damage; endorse 136 recommend...","589","null","The New York Times","World","News","article","U.N. Warns of Mideast Conflict's Harm to the Environment","U.N. Warns of Mideast Conflict's Harm to the Environment"
"https://www.nytimes.com/2003/10/14/business/iraqi-official-urges-caution-on-imposing-free-market.html","Thomas Crampton","2003-10-14","IrØ","451","null","The New York Times","Business Day","News","article","Iraqi Official Urges Caution On Imposing Free Market","Iraqi Official Urges Caution On Imposing Free Market"
"https://www.nytimes.com/2003/12/05/business/intel-shares-fall-on-news-of-unexpected-write-off.html","Laurie Flynn","2003-12-05","Intel Corp raises low end of its fourth-quarter revenue forecast because of strong holiday sales of its microprocessors for personal computers, but surprises investors with $600 million charge related to acquisition in 1999 of DSP Communications f...","447","null","The New York Times","Business Day","News","article","Intel Shares Fall on News Of Unexpected Write-Off","Intel Shares Fall on News Of Unexpected Write-Off"
"https://www.nytimes.com/2003/10/12/world/in-their-ruined-capital-chechens-rebuild-lives-one-window-at-a-time.html","Seth Mydans","2003-10-12","Some of hundreds of bombed-out, looted buildings in Grozny show signs of life where some Chechens have remained throughout war, and others return to rebuild ruined homes; Roza Khazuyeva says she is tired of being afraid for her family, and wants t...","1026","null","The New York Times","World","News","article","In Their Ruined Capital, Chechens Rebuild Lives One Window at a Time","In Their Ruined Capital, Chechens Rebuild Lives One Window at a Time"
"https://www.nytimes.com/2003/10/02/technology/q-a-from-maven-to-outlaw-evolution-of-hacker.html","null","2003-10-02","","633","null","The New York Times","Technology","Question","article","From Maven to Outlaw: Evolution of 'Hacker'","Q&A; From Maven to Outlaw: Evolution of 'Hacker'"
"https://www.nytimes.com/2003/09/26/business/company-briefs-442305.html","null","2003-09-26","","106","null","The New York Times","Business Day","News","article","COMPANY BRIEFS","COMPANY BRIEFS"
"https://www.nytimes.com/2003/11/04/business/media/people-and-accounts-of-note.html","null","2003-11-04","The Absolut Company, Stockholm, part of Vin & Sprit A.B., has put up a Web site that plays music meant to offer interpretations of the Absolut vodka bottle. The effort is an extension of the longtime print campaign that shows the bottle rendered b...","1065","null","The New York Times","Business Day","News","article","People and Accounts of Note","People and Accounts of Note"
"https://www.nytimes.com/2003/04/29/world/the-sars-epidemic-fear-sars-is-the-spark-for-a-riot-in-china.html","Erik Eckholm","2003-04-29","Thousands of people riot in rural Chinese town of Chagugang after word spreads that four-story school building would be turned into ward for patients suffering from SARS; it takes hundreds of police officers and two busloads of paramilitary troops...","885","null","The New York Times","World","News","article","SARS IS THE SPARK FOR A RIOT IN CHINA","THE SARS EPIDEMIC: FEAR; SARS IS THE SPARK FOR A RIOT IN CHINA"
"https://www.nytimes.com/2003/09/03/business/mutual-funds-allowed-fraudulent-trading-spitzer-says.html","Landon Thomas","2003-09-03","The attorney general of New York made his claim while announcing a $40 million settlement with a hedge fund investor.","575","null","The New York Times","Business Day","News","article","Mutual Funds Allowed Fraudulent Trading, Spitzer Says","Mutual Funds Allowed Fraudulent Trading, Spitzer Says"
"https://www.nytimes.com/2003/04/11/world/a-nation-at-war-bush-s-words-to-iraqis-we-will-help-you-build.html","null","2003-04-11","Transcript of statements by Pres Bush and Prime Min Blair that were broadcast on Iraqi television","901","null","The New York Times","World","Text","article","Bush's Words to Iraqis: 'We Will Help You Build'","A NATION AT WAR; Bush's Words to Iraqis: 'We Will Help You Build'"
"https://www.nytimes.com/2003/01/23/business/the-media-business-advertising-addenda-accounts-986305.html","Nat Ives","2003-01-23","Roundup of recent advertising account changes (S)","71","null","The New York Times","Business Day","News","article","Accounts","THE MEDIA BUSINESS: ADVERTISING -- ADDENDA; Accounts"
"https://www.nytimes.com/2003/07/30/business/currencies-snow-says-us-will-encourage-china-to-widen-currency-range.html","Bloomberg News","2003-07-30","Treasury Sec John W Snow says Bush administration will use quiet diplomacy to encourage China to let its currency strengthen by widening its trading band against dollar, speech to factory workers, Milwaukee; is on two-state tour with Labor Sec Ela...","203","null","The New York Times","Business Day","News","article","Snow Says U.S. Will Encourage China to Widen Currency Range","CURRENCIES; Snow Says U.S. Will Encourage China to Widen Currency Range"
"https://www.nytimes.com/2003/05/30/business/the-markets-commodities.html","null","2003-05-30","Heating oil rises after government reports unexpected drop in distillate fuel inventories; heating oil for June delivery rises 1.69 cents, or 2.3 percent, to 74.65 cents per gallon; graph; chart (S)","36","null","The New York Times","Business Day","News","article","THE MARKETS: COMMODITIES","THE MARKETS: COMMODITIES"
"https://www.nytimes.com/2003/02/07/business/world-business-briefing-asia-japan-lagging-phone-sales.html","Ken NYT","2003-02-07","NTT DoCoMo says it might not reach its full-year sales target for its high-speed third-generation phones; expects to sign up 320,000 customers by end of March; president Keiji Tachikawa says delays in rollout of new handsets might have kept consum...","56","null","The New York Times","Business Day","News","article","World Business Briefing | Asia: Japan: Lagging Phone Sales","World Business Briefing | Asia: Japan: Lagging Phone Sales"
"https://www.nytimes.com/2003/03/02/business/personal-business-questions-to-ask-before-you-sign-on.html","Beth Kobliner","2003-03-02","Advice for employees on questions to ask before switching to consumer-driven health plan (M)","394","null","The New York Times","Business Day","News","article","Personal Business; Questions to Ask Before You Sign On","Personal Business; Questions to Ask Before You Sign On"
"https://www.nytimes.com/2003/10/28/jobs/the-new-generation-class-of-2003-what-they-wanted-what-they-got.html","Interviews Randall","2003-10-28","Interview with recent college graduate Chanda J Davis on her job search, type of job she wanted and what she got; photo (special section, Working) (M)","427","null","The New York Times","Job Market","Interview","article","Class of 2003: What They Wanted, What They Got","THE NEW GENERATION; Class of 2003: What They Wanted, What They Got"
"https://www.nytimes.com/2003/12/25/technology/game-theory-amid-the-fighters-a-few-winners.html","Charles Herold","2003-12-25","Charles Herold Game Theory column reviews his favorite computer and video games of 2003; photos (M)","1325","null","The New York Times","Technology","News","article","Amid the Fighters, a Few Winners","GAME THEORY; Amid the Fighters, a Few Winners"
"https://www.nytimes.com/2003/02/16/business/preludes-mix-and-match-for-many-reasons.html","Abby Ellin","2003-02-16","Abby Ellin column on parties arranged by event planners at which people -- generally single professionals in their 20's or 30's -- can get together to advance their careers and love lives at same time; photo (M)","1026","null","The New York Times","Business Day","News","article","Mix and Match, for Many Reasons","PRELUDES; Mix and Match, for Many Reasons"
"https://www.nytimes.com/2003/03/02/business/business-brokers-to-bankers-no-trespassing.html","Carl Hulse","2003-03-02","Republican Congressional leaders have given real estate brokers key symbolic victory in their push to keep banks out of brokerage business by appproving 11th-hour add-on to Treasury appropriations bill; extraneous provision is example of how Washi...","1431","null","The New York Times","Business Day","News","article","Business; Brokers to Bankers: 'No Trespassing'","Business; Brokers to Bankers: 'No Trespassing'"
"https://www.nytimes.com/2003/02/13/business/media-business-advertising-media-companies-are-raising-their-first-amendment.html","Nat Ives","2003-02-13","Lawsuit filed by IDT Corp against Cable New Network, asserting that CNN unfairly declined to run IDT commercial, is latest pressure tactic from advertisers and regulators seeking greater control over how media outlets handle advertising; suit asse...","959","null","The New York Times","Business Day","News","article","Media companies are raising their First Amendment flags.","THE MEDIA BUSINESS: ADVERTISING; Media companies are raising their First Amendment flags."
"https://www.nytimes.com/2003/03/17/business/a-buffett-warning-on-executive-pay.html","Bloomberg News","2003-03-17","Warren E Buffett, billionaire investor, says companies will not regain investors' trust as long as compensation for chief executives, including stock options, keeps rising while share prices of their companies fall; addresses chief executives at c...","221","null","The New York Times","Business Day","News","article","A Buffett Warning on Executive Pay","A Buffett Warning on Executive Pay"
"https://www.nytimes.com/2003/06/15/business/private-sector-a-good-week-for-a-hip-hop-impresario.html","Lynette Holloway","2003-06-15","Russell Simmons will receive Montblanc Arts Patronage Award (S)","176","null","The New York Times","Business Day","News","article","Private Sector; A Good Week for a Hip-Hop Impresario","Private Sector; A Good Week for a Hip-Hop Impresario"
"https://www.nytimes.com/2003/10/25/your-money/IHT-balance-sheet-cold-comfort-for-fund-investors.html","Jim Peterson","2003-10-25","Having as a trophy the $1.4 billion settlement with the investment banks, the New York State attorney general, Eliot Spitzer, has turned his sights on the mutual fund business. The first prey in his bag, Canary Capital Partners, settled without ad...","5292","null","International Herald Tribune","Your Money","null","article","Balance Sheet : Cold comfort for fund investors","Balance Sheet : Cold comfort for fund investors"
