"|","|__writer_name","|__pub_date","|__snippet","|__word_count","|__score","|__source","|__section_name","|__type_of_material","|__document_type","|__main_headline","|__print_headline"
"https://www.nytimes.com/2006/11/20/business/media/20bank.html","Maria Aspan","2006-11-20","Universal Music is accusing the Bank of America of copyright violations after a video of two of the bank’s employees singing a version of U2’s “One” hit the Internet.","416","null","The New York Times","Business Day","News","article","Lyrics Celebrating Bank Merger Impress Only Copyright Lawyer","Lyrics Celebrating Bank Merger Impress Only Copyright Lawyer"
"https://www.nytimes.com/2006/11/20/business/media/20housekeeping.html","Katharine Seelye","2006-11-20","Good Housekeeping, owned by the Hearst Corporation, is gently updating its century-old brand in hopes of appealing to younger women.","1303","null","The New York Times","Business Day","News","article","Polishing the Good Housekeeping Seal","Polishing the Good Housekeeping Seal"
"https://www.nytimes.com/2006/11/20/business/worldbusiness/20garage.html","Jethro Mullen","2006-11-20","A service starting next month in Paris will allow a cellphone or GPS navigation device to search a parking lot database for nearby parking spots.","707","null","The New York Times","Business Day","News","article","For Those in Paris About to Park, a Service That Tells Them Where","For Those in Paris About to Park, A Service That Tells Them Where"
"https://www.nytimes.com/2006/11/20/business/media/20fox.html","Bill Carter","2006-11-20","Ratings are down about 9 percent from already depressed levels of 2005, and not one new Fox series ranks among the top 55 shows in television.","1087","null","The New York Times","Business Day","News","article","For Fox TV, an Unusually Grim Autumn","For Fox TV, An Unusually Grim Autumn"
"https://www.nytimes.com/2006/11/19/world/europe/20poisoncnd.html","Alan Cowell","2006-11-19","Alexander V. Litvinenko, a Russian former K.G.B. operative living in exile in Britain, had been inquiring into the killing of a journalist in Moscow.","846","null","The New York Times","World","News","article","British Look Into Suspected Poisoning of Ex-K.G.B. Agent","British Look Into Suspected Poisoning of Ex-K.G.B. Agent"
"https://www.nytimes.com/2006/11/19/business/20dealcnd.html","Andrew Sorkin","2006-11-19","Phelps Dodge will be acquired by Freeport-McMoRan Copper and Gold, a smaller rival, in a transaction that would create the world’s largest copper miner.","725","null","The New York Times","Business Day","News","article","Rival to Buy Copper Giant in $25.9 Billion Deal","Rival to Buy Copper Giant in $25.9 Billion Deal"
"https://www.nytimes.com/2006/11/20/business/20office.html","Andrew Sorkin","2006-11-20","The Blackstone Group plans a $36 billion takeover of the country’s largest owner of office buildings.","880","null","The New York Times","Business Day","News","article","Blackstone Acquiring Trust in Richest Buyout","Blackstone Acquiring Trust in Richest Buyout"
"https://www.nytimes.com/2006/11/21/world/asia/21prexycnd.html","David Sanger","2006-11-21","In a six-hour, carefully orchestrated visit to Indonesia, the president praised the country’s first directly elected president.","949","null","The New York Times","World","News","article","Bush Tries to Defuse Indonesian Anger Over Iraq","null"
"https://www.nytimes.com/iht/2006/11/21/world/IHT-21politicus.html","John Vinocur","2006-11-21","After years of rage and murder, the Netherlands has reached what is pretty much a consensus about the integration of Muslim immigrants.","1073","null","International Herald Tribune","World","News","article","Nudging to Consensus Over Dutch Muslims","Politicus: Nudging to consensus over Dutch Muslims"
"https://www.nytimes.com/2006/11/20/business/21exchangecnd.html","Heather Timmons","2006-11-20","The London Stock Exchange, the largest in Europe, quickly rejected Nasdaq’s $5 billion cash offer.","1073","null","The New York Times","Business Day","News","article","Nasdaq Steps Up Bid to Buy London Exchange","null"
"https://www.nytimes.com/2006/11/27/business/28stoxcnd.html","Jeremy Peters","2006-11-27","Wal-Mart helped lead the drop, as Wall Street showed concerns about the slowing economy.","511","null","The New York Times","Business Day","News","article","Stocks Fall Sharply on Concerns About Slowdown","Stocks Fall Sharply on Concerns About Slowdown"
"https://www.nytimes.com/2006/11/27/world/asia/28chinacnd.html","Joseph Kahn","2006-11-27","A Chinese legal expert who exposed abuses in the country’s population control policies got a rare second trial today, but his lawyers accused local authorities of preventing them from mounting a vigorous defense.","588","null","The New York Times","World","News","article","Second Trial for Chinese Rights Advocate Ends in Acrimony","Second Trial for Chinese Rights Advocate Ends in Acrimony"
"https://www.nytimes.com/2006/11/28/business/28flier.html","Phil Otterson","2006-11-28","Few business travelers have two close calls in a day and live to tell the story.","472","null","The New York Times","Business Day","News","article","Under the Ground or Far Above, It’s Dangerous Out There","Under the Ground or Far Above, It’s Dangerous Out There"
"https://www.nytimes.com/2006/11/28/technology/28patent.html","Bloomberg News","2006-11-28","EchoStar Communications lost a bid for a new trial in a patent-infringement lawsuit over digital video recorders that it lost to TiVo.","184","null","The New York Times","Technology","News","article","EchoStar Loses Bid for New Trial","EchoStar Loses Bid for New Trial"
"https://www.nytimes.com/2006/11/28/business/28road.html","Joe Sharkey","2006-11-28","Reflecting on the current air travel environment might present a challenge for those whose livelihood depends on the ability to make the occasional inappropriate remark.","816","null","The New York Times","Business Day","News","article","It’s Not Easy Being a Comic on the Airport Security Line","It&#8217;s Not Easy Being a Comic In the Airport Security Line"
"https://www.nytimes.com/2006/11/28/world/middleeast/28mideast.html","Steven Erlanger","2006-11-28","Prime Minister Ehud Olmert offered negotiations and a prisoner release if Palestinians turned away from violence.","975","null","The New York Times","World","News","article","Israeli Premier Makes an Offer to Palestinians","Israeli Premier Makes an Offer to Palestinians"
"https://www.nytimes.com/2006/11/28/business/media/28adco.html","Stuart Elliott","2006-11-28","Madison Avenue is playing matchmaker, bringing together an advertiser and a network for an elaborate sponsorship deal.","1012","null","The New York Times","Business Day","News","article","Old-School Sponsorship From a Digital-Era Company","Old-School Sponsorship From a Digital-Era Company"
"https://www.nytimes.com/2006/11/28/world/middleeast/28zelikow.html","Helene Cooper","2006-11-28","Philip D. Zelikow served as Secretary of State Condoleezza Rice’s in-house contrarian and advocate for realpolitik in American diplomacy.","611","null","The New York Times","World","News","article","Senior Aide to Rice Resigns From Post","Philip Zelikow, Senior Aide To Rice, Resigns From Post"
"https://www.nytimes.com/2006/11/28/technology/28tube.html","Matt Richtel","2006-11-28","The phone-based version will require a $15-a-month subscription to a Verizon Wireless service called VCast.","408","null","The New York Times","Technology","News","article","YouTube Coming Soon to Cellphones","YouTube Coming Soon To Cellphones"
"https://www.nytimes.com/2006/11/28/business/worldbusiness/28asiaplanes.html","Wayne Arnold","2006-11-28","Asian countries are clamoring for planes to meet surging air travel demands, giving Boeing an edge in the region.","1273","null","The New York Times","Business Day","News","article","Where the Appetite for Aircraft Is Big","Where the Appetite for Aircraft Is Big"
"https://www.nytimes.com/2006/11/28/world/europe/28petersburg.html","Steven Myers","2006-11-28","A plan by Russia’s state energy company for towers along the Neva River has drawn protests from critics who say the project will overshadow the old city.","1056","null","The New York Times","World","News","article","Russian Window on the West Reaches for the Sky","Russian Window on the West Reaches for the Sky"
"https://www.nytimes.com/2006/11/28/business/28legal.html","Cindy Chang","2006-11-28","Milberg Weiss Bershad & Schulman and two of its named partners, accused of making secret payments to entice people to be plaintiffs in lawsuits, will be tried in January 2008.","445","null","The New York Times","Business Day","News","article","Trial of Class-Action Law Firm Is Set for 2008","Trial of Class-Action Law Firm Is Set for 2008"
"https://www.nytimes.com/2006/11/28/business/28stox.html","Jeremy Peters","2006-11-28","Stocks tumbled after a weak sales estimate by Wal-Mart spurred concerns about the holiday shopping season.","1037","null","The New York Times","Business Day","News","article","Stocks Drop Steeply After a Bull Run","Stocks Drop Steeply After A Bull Run"
"https://www.nytimes.com/2006/11/28/business/28boeing.html","Leslie Wayne","2006-11-28","Boeing is adopting a new strategy as it faces a new wave of orders that, if not managed right, could swamp the company again.","1765","null","The New York Times","Business Day","News","article","Boeing Not Afraid to Say ‘Sold Out’","Boeing Not Afraid to Say ‘Sold Out’"
"https://www.nytimes.com/2006/11/28/world/europe/28turkey.html","Sabrina Tavernise","2006-11-28","Turkey is navigating between the forces pulling it closer to Islam and the institutions that safeguard its secularism.","1500","null","The New York Times","World","News","article","Allure of Islam Signals a Shift Within Turkey","Allure of Islam Signals a Shift Within Turkey"
"https://www.nytimes.com/2006/11/28/world/europe/28cnd-pope.html","Ian Fisher","2006-11-28","In a gesture of goodwill, Pope Benedict XVI reversed his position on Turkey’s European Union membership.","1586","null","The New York Times","World","News","article","Pope Backs Turkey’s Bid to Join Europe","null"
"https://www.nytimes.com/2006/11/29/world/europe/29spy.html","Alan Cowell","2006-11-29","An exiled Russian billionaire confirmed that the police found radioactive traces in his office after the death last week of his close associate.","922","null","The New York Times","World","News","article","Billionaire Ally of Dead Spy Issues Statement","Billionaire Ally of Dead Spy Issues Statement"
"https://www.nytimes.com/2006/11/29/business/29airport.html","null","2006-11-29","Federal authorities cleared the way for a program giving travelers who volunteer for background checks an easier passage through airport security to begin next month.","208","null","The New York Times","Business Day","News","article","U.S. Clears Faster Airport Security Checks","U.S. Clears Faster Airport Security Checks"
"https://www.nytimes.com/2006/11/29/world/europe/29detain.html","Brian Knowlton","2006-11-29","A report by the European Parliament offered new confirmation of the United States’ practice of so-called extraordinary renditions.","520","null","The New York Times","World","News","article","Report Rejects European Denial of C.I.A. Activity","Report Rejects European Denial Of C.I.A. Prisons"
"https://www.nytimes.com/2006/11/29/business/29wind.html","Matthew Wald","2006-11-29","A Massachusetts company that makes electronic parts for wind turbines said that it would acquire one of its largest customers, an Austrian company.","302","null","The New York Times","Business Day","News","article","Parts Supplier in Wind Power to Acquire a Customer","Parts Supplier In Wind Power To Acquire A Customer"
"https://www.nytimes.com/2006/11/29/business/29secure.html","Stephen Labaton","2006-11-29","The New York Stock Exchange and NASD announced plans  to merge their regulatory organizations and eliminate duplicative and inconsistent rules.","861","null","The New York Times","Business Day","News","article","Regulators to Merge on Wall St.","Regulators To Merge On Wall St."
"https://www.nytimes.com/2006/11/29/world/middleeast/29arab.html","null","2006-11-29","When President Bush arrives to meet with Prime Minister Nuri Kamal al-Maliki of Iraq, there will be no shortage of people seeking to make him feel unwelcome.","795","null","The New York Times","World","News","article","In Amman Enemies, and Allies, Await Bush","In Amman Enemies, And Allies, Await Bush"
"https://www.nytimes.com/2006/11/25/world/middleeast/25iraq.html","Edward Wong","2006-11-25","Shiite militiamen stormed Sunni mosques, shot guards and burned down buildings in apparent retaliation for a set of devastating bombings that killed more than 200.","1476","null","The New York Times","World","News","article","Militants Attack Sunnis’ Mosques in 2 Iraqi Cities","Militants attack Sunnis’ Mosques In 2 Iraqi Cities"
"https://www.nytimes.com/2006/11/26/world/asia/26lanka.html","Somini Sengupta","2006-11-26","The rebel Tamil Tigers are said to be eliminating dissent within the ranks of ethnic Tamils, the Sri Lankan minority on whose behalf they fight.","837","null","The New York Times","World","News","article","Sri Lanka Rebels’ Critic Silenced by Bullet","Sri Lanka Rebels’ Critic Silenced by Bullet"
"https://www.nytimes.com/2006/11/26/world/europe/26ireland.html","Eamon Quinn","2006-11-26","The man attempted to attack two leaders of Ireland’s main Roman Catholic party, Sinn Fein, while they and other legislators worked toward a power-sharing agreement.","355","null","The New York Times","World","News","article","Protestant Militant Charged in Belfast Attack","Protestant Militant Charged in Belfast Attack"
"https://www.nytimes.com/2006/11/26/world/europe/26crevice.html","Elaine Sciolino","2006-11-26","The evidence, investigators say, reveals the workings of the most feared  kind of cell — young Muslims planning an attack at home with help from outside terrorists.","2762","null","The New York Times","World","News","article","British Terror Trial Traces a Path to Militant Islam","British Terror Trial Traces a Path to Militant Islam"
"https://www.nytimes.com/2006/11/26/world/middleeast/26mideast.html","Greg Myre","2006-11-26","The agreement is the most serious effort to end the fighting in Gaza, but it is not clear whether it will take effect and hold.","597","null","The New York Times","World","News","article","Israel and Palestinians Reach Truce After Months of Fighting in Gaza","Israel and Palestinians Reach Truce After Months of Fighting in Gaza"
"https://www.nytimes.com/2006/11/26/world/middleeast/26cnd-maliki.html","Christine Hauser","2006-11-26","Prime Minister Nuri Kamal al-Maliki said today that his country was in a crisis as political pressure builds on his government.","777","null","The New York Times","World","News","article","Iraqi Leader Sees Crisis Ahead of Meeting With Bush","Iraqi Leader Sees Crisis Ahead of Meeting With Bush"
"https://www.nytimes.com/2006/11/26/world/middleeast/26cnd-iraq.html","Edward Wong","2006-11-26","Days ahead of his meeting with President Bush, Prime Minister Nuri Kamal al-Maliki said that Iraq’s leaders would work to resolve their political conflicts. ","753","null","The New York Times","World","News","article","Iraqi Leader Says Politicians Are Causing Violence","Iraqi Leader Says Political Conflicts Caused Violence"
"https://www.nytimes.com/2006/11/27/world/europe/27spy.html","Alan Cowell","2006-11-27","The British police sought to retrace the movements of Alexander V. Litvinenko before he fell ill from radiation poisoning last week.","736","null","The New York Times","World","News","article","British Police Retrace Steps of Poison Victim","British Police Retrace Steps of Poison Victim"
"https://www.nytimes.com/2006/11/27/world/middleeast/27region.html","Michael Slackman","2006-11-27","Lebanon, which is seemingly sliding toward a new civil conflict, serves as a barometer of tensions and rivalries in the Middle East.","1461","null","The New York Times","World","News","article","Chilling Echo for Lebanon, Mirror of Regional Tension","Chilling Echo For Lebanon"
"https://www.nytimes.com/2006/11/27/business/media/27asktheeditor.html","null","2006-11-27","Steven Reddicliffe, television editor for The Times, answers reader questions. ","1840","null","The New York Times","Business Day","News","article","Talk to the Newsroom:<br />Steven Reddicliffe, Television Editor","null"
"https://www.nytimes.com/2006/11/27/business/worldbusiness/27cnd-walmart.html","Anand Giridharadas","2006-11-27","Wal-Mart moved closer to cracking open one of the last lucrative frontiers for Western retailers today when it announced a joint venture to open stores in India.","1262","null","The New York Times","Business Day","News","article","Wal-Mart to Open Hundreds of Stores in India","null"
"https://www.nytimes.com/2006/11/27/world/europe/27russiansumm_.html","Compiled Schwirtz","2006-11-27","A summary of the top stories in Russian newspapers on Monday.","784","null","The New York Times","World","News","article","Poisoning Mystery on Everyone’s Tongue","Poisoning Mystery on Everyone’s Tongue"
"https://www.nytimes.com/2006/11/27/world/middleeast/28irancnd.html","Nazila Fathi","2006-11-27","A Iranian military aircraft crashed today at Mehrabad Airport in Tehran immediately after takeoff, killing 39 people.","262","null","The New York Times","World","News","article","Iranian Military Plane Crashes, Killing 39","Iranian Military Plane Crashes, Killing 39"
"https://www.nytimes.com/2006/11/27/world/middleeast/28mideastcnd.html","Steven Erlanger","2006-11-27","Ehud Olmert promised to cut checkpoints, release funds and free prisoners if the Palestinians returned to talks.","974","null","The New York Times","World","News","article","Israeli Leader Offers Palestinians Incentives","Israeli Premier Makes an Offer to Palestinians"
"https://www.nytimes.com/2006/11/27/world/middleeast/28troopscnd.html","Brian Knowlton","2006-11-27","As the United States considers its critical next steps in Iraq, three key allies in the American-led war moved closer today to winding down or ending their involvement there.","485","null","The New York Times","World","News","article","3 U.S. Allies Move to Cut Troops in Iraq","3 U.S. Allies Move to Cut Troops in Iraq"
"https://www.nytimes.com/2006/11/13/business/13cnd-mccurry.html","Micheline Maynard","2006-11-13","Robert B. McCurry invented the concept of cash rebates for consumer car-buyers while at the Chrysler Corporation.","401","null","The New York Times","Business Day","News","article","Robert B. McCurry, Auto Executive, Dies at 83","null"
"https://www.nytimes.com/2006/11/15/business/smallbusiness/15qvc.html","Corey Kilgannon","2006-11-15","Hordes of entrepreneurs descended upon Manhattan, each with hopes of grabbing the brass ring of retail.","1223","null","The New York Times","Business Day","News","article","Oh, to Be Discovered by the Folks at QVC","Oh, to Be Discovered By the Folks at QVC"
"https://www.nytimes.com/2006/11/13/world/middleeast/14iraqcnd.html","Sabrina Tavernise","2006-11-13","Prime Minister Nuri Kamal al-Maliki of Iraq met in Baghdad with Gen. John P. Abizaid, the top American commander in the Middle East.","948","null","The New York Times","World","News","article","Iraqi Leader and Top U.S. General Discuss Security","Iraqi Leader and Top U.S. General Discuss Security"
"https://www.nytimes.com/2006/11/14/business/14flier.html","Karen Neuberger","2006-11-14","Comfort is something I’ve been striving for all my life. That’s particularly true when I travel.","502","null","The New York Times","Business Day","News","article","If You Can Shoot an Elephant in Your PJ’s, You Can Fly in Them","If You Can Shoot an Elephant In Your PJ’s, You Can Fly in Them"
"https://www.nytimes.com/2006/11/13/world/asia/14afghancnd.html","Carlotta Gall","2006-11-13","The trail of organizing the bombers who have carried out a rising number of suicide attacks in Afghanistan traces back to Pakistan, officials say.","1704","null","The New York Times","World","News","article","Pakistan Link Seen in Afghan Suicide Attacks","Threat of Suicide Bombers in Afghanistan Is Growing"
"https://www.nytimes.com/2006/11/14/world/asia/14korea.html","Norimitsu Onishi","2006-11-14","South Korea said it saw no need for any additional actions to punish the North for its nuclear test beyond old trade restrictions and the recent suspension of aid.","574","null","The New York Times","World","News","article","South Korea Won’t Intercept Cargo Ships From the North","South Korea Won’t Intercept Cargo Ships From the North"
"https://www.nytimes.com/2006/11/14/business/14options.html","Bloomberg News","2006-11-14","Several companies, including the UnitedHealth Group, reported yesterday that they would delay filing quarterly financial reports while they sorted out issues related to the dating of stock options.","301","null","The New York Times","Business Day","News","article","Filings Delayed Over Problems With Options","Filings Delayed Over Problems With Options"
"https://www.nytimes.com/2006/11/14/technology/14tivo.html","Saul Hansell","2006-11-14","TiVo plans to allow people to use its digital video recorders to watch some video programming from the Internet on their televisions.","564","null","The New York Times","Technology","News","article","Coming Soon via Your TiVo: Internet Video on Television","Coming Soon via Your TiVo: Internet Video on Television"
"https://www.nytimes.com/2006/11/14/business/14boarding.html","Paul Finney","2006-11-14","Spurred by financial pressures and packed planes — often 80 to 90 percent full — airlines have come up with a wide variation of passenger boarding techniques.","1433","null","The New York Times","Business Day","News","article","Loading an Airliner Is Rocket Science","Loading an Airliner Is Rocket Science"
"https://www.nytimes.com/2006/11/14/technology/14gene.html","Andrew Pollack","2006-11-14","The acquisition of Solexa by Illumina will put under one roof most of the main tools now used for genetic studies.","692","null","The New York Times","Technology","News","article","A DNA Chip Maker Acquires Gene-Sequencing Company","A DNA Chip Maker Acquires Gene-Sequencing Company"
"https://www.nytimes.com/2006/11/14/world/asia/14kandahar.html","David Rohde","2006-11-14","An investigation has found that a nighttime NATO air attack last month killed 31 civilians in southern Afghanistan.","731","null","The New York Times","World","News","article","Toll of Civilians NATO Killed Was Worst Since It Took Over","Toll of Civilians NATO Killed Was Worst Since It Took Over"
"https://www.nytimes.com/2006/11/14/business/14hedge.html","Bloomberg News","2006-11-14","The Securities and Exchange Commission expects to file more lawsuits aimed at hedge funds accused of illegal trading and violating their clients’ trust.","320","null","The New York Times","Business Day","News","article","Hedge Funds and Wall St. Are Warned to Be Vigilant on Misdeeds","Hedge Funds and Wall St. Are Warned to Be Vigilant on Misdeeds"
"https://www.nytimes.com/2006/11/14/business/14tyson.html","Bloomberg News","2006-11-14","The world’s biggest meat processor, reported its third straight quarterly loss because of lower chicken and beef prices.","382","null","The New York Times","Business Day","News","article","Chicken and Beef Pricing Cited as Tyson Posts Another Loss","Chicken and Beef Pricing Cited As Tyson Posts Another Loss"
"https://www.nytimes.com/2006/11/14/technology/14satellite.html","Ken Belson","2006-11-14","Companies providing Internet access using satellites are filling one of the biggest gaps in the country’s digital infrastructure.","1389","null","The New York Times","Technology","News","article","With a Dish, Broadband Goes Rural","With a Dish, Broadband Goes Rural"
"https://www.nytimes.com/2006/11/14/world/middleeast/14cnd-iraq.html","John Burns","2006-11-14","The move suggested that the abduction of dozens today in Baghdad may have been the work of death squads operating under interior ministry cover.","1773","null","The New York Times","World","News","article","Arrest of Iraqi Police Officials Ordered After Kidnapping","null"
"https://www.nytimes.com/2006/11/15/business/smallbusiness/15radio.html","Robert Strauss","2006-11-15","Jerry Lee, a successful radio entrepreneur, believes that radio can be more effective than television both for advertisers and listeners.","881","null","The New York Times","Business Day","News","article","For Radio Man, a Hit Ad Is as Good as a Hit Song","For Radio Man, a Hit Ad Is as Good as a Hit Song"
"https://www.nytimes.com/2006/11/14/world/europe/14cnd-emit.html","null","2006-11-14","The proposed policy is Europe’s boldest move yet to stamp its environmental policies on the rest of the world.","1079","null","The New York Times","World","News","article","Europe Seeks to Impose Airline Emission Controls","Europe Seeks to Impose Airline Emission Controls"
"https://www.nytimes.com/iht/2006/11/15/world/IHT-15globalist.html","Roger Cohen","2006-11-15","At a time when Islamists are a force at the ballot box, does Egypt, a peaceful, moderate oasis amid regional turmoil, really need more democracy?","1033","null","International Herald Tribune","World","News","article","Confronting Democracy as an Era Ends in Egypt","Globalist: Confronting democracy as an era ends in Egypt"
