"|","|__writer_name","|__pub_date","|__snippet","|__word_count","|__score","|__source","|__section_name","|__type_of_material","|__document_type","|__main_headline","|__print_headline"
"https://www.nytimes.com/2006/09/10/business/yourmoney/10goods.html","Brendan Koerner","2006-09-10","Nothing says “look at me” like playing video clips on your belt.","633","null","The New York Times","Business Day","News","article","If You Buckle Up, They Will Watch","If You Buckle Up, They Will Watch"
"https://www.nytimes.com/2006/09/09/world/africa/09sudan.html","Lydia Polgreen","2006-09-09","Paul Salopek, who has won two Pulitzer Prizes, had been detained by a militant group allied to the Sudanese government on Aug. 6.","494","null","The New York Times","World","News","article","Sudan Agrees to Free U.S. Reporter Accused of Spying","Sudan Agrees to Free U.S. Reporter Accused of Spying"
"https://www.nytimes.com/2006/09/09/world/europe/09drnovsek.html","Nicholas Wood","2006-09-09","After surviving cancer, Janez Drnovsek said he was suddenly emboldened to speak his mind on all sorts of topics.","1230","null","The New York Times","World","News","article","Slovenian President Finds Peace and Wants to Share It","Slovenian President Finds Peace and Wants to Share It"
"https://www.nytimes.com/2006/09/09/world/europe/09britain.html","Alan Cowell","2006-09-09","Gordon Brown pledged that Britain would remain “shoulder to shoulder” with the United States against terrorism.","800","null","The New York Times","World","News","article","Criticism Follows Blair’s Likely Successor Even as He Begins Discussing Policy Plans","Criticism Follows Blair&#8217;s Likely Successor Even as He Begins Discussing Policy Plans"
"https://www.nytimes.com/2006/09/09/technology/09broadcom.html","Bloomberg News","2006-09-09","Under investigation for stock options backdating, the computer chip maker discovered more irregularities that will double its expenses.","222","null","The New York Times","Technology","News","article","More Irregularities Are Found at Broadcom","More Irregularities Are Found at Broadcom"
"https://www.nytimes.com/2006/09/07/world/asia/07kyrgyz.html","C. Chivers","2006-09-07","The officer stationed in Kyrgyzstan was reported missing on Wednesday after disappearing during a shopping trip.","806","null","The New York Times","World","News","article","U.S. Air Force Major Missing in Kyrgyzstan","U.S. Air Force Major Missing in Kyrgyzstan"
"https://www.nytimes.com/2006/09/07/business/07depot.html","Bloomberg News","2006-09-07","Home Depot said that federal prosecutors had requested information regarding its stock options practices.","199","null","The New York Times","Business Day","News","article","Options Data Sought From Home Depot","Options Data Sought From Home Depot"
"https://www.nytimes.com/2006/09/07/business/07auto.html","Nick Bunkley","2006-09-07","Ford and General Motors have announced plans to offer extended warranties to battle the perception of poor quality that have plagued American vehicles.","524","null","The New York Times","Business Day","News","article","Ford and G.M. Talk of Quality as They Try to Court Buyers","Ford and G.M. Talk of Quality As They Try to Court Buyers"
"https://www.nytimes.com/2006/09/07/business/07place.html","Barnaby Feder","2006-09-07","The F.D.A. approved the first implantable, self-sufficient artificial heart but it is too large to fit into more than half of male patients and 80 percent of women.","927","null","The New York Times","Business Day","News","article","An Innovative Heart Device Is Still Short of Lucrative","An Innovative Heart Device Is Still Short of Lucrative"
"https://www.nytimes.com/2006/09/07/world/europe/08blaircnd.html","Alan Cowell","2006-09-07","The British prime minister’s announcement comes a day after an extraordinary procession of eight junior aides resigned.","912","null","The New York Times","World","News","article","Blair Says He Plans to Resign in Next Year\n","null"
"https://www.nytimes.com/2006/09/07/business/07cnd-econ.html","Jeremy Peters","2006-09-07","A real estate group issued a pessimistic outlook and two builders said their profits will not meet expectations.","368","null","The New York Times","Business Day","News","article","Brokers and Builders Warn of Housing Slump","Outlook Dims in Housing Market, Brokers and Builders Say"
"https://www.nytimes.com/2006/09/08/business/media/08paper.html","null","2006-09-08","Richard H. Gilman will be succeeded by P. Steven Ainsley, president and chief operating officer of The Boston Globe’s Regional Media Group.","269","null","The New York Times","Business Day","News","article","Publisher Retires at Boston Globe","Publisher Retires At Boston Globe"
"https://www.nytimes.com/2006/09/08/world/08react.html","Brian Knowlton","2006-09-08","Reaction in Europe and Afghanistan to the United States’ transfer of 14 top terror suspects from secret C.I.A. camps to Guantánamo Bay, Cuba, for trial has been sharply mixed.","611","null","The New York Times","World","News","article","Europeans’ Views Mixed on News of C.I.A. Camps","Europeans’ Views Mixed On News of C.I.A. Camps"
"https://www.nytimes.com/2006/09/08/business/08proxy.html","Floyd Norris","2006-09-08","A federal court has temporarily cleared the way for shareholders to force companies to hold contested elections for directors.","691","null","The New York Times","Business Day","News","article","Court Decision Prompts S.E.C. to Revisit a Rule on Shareholder Proposals","Court Decision Prompts S.E.C. to Revisit a Rule on Shareholder Proposals"
"https://www.nytimes.com/2006/09/08/business/08wall.html","Landon Thomas","2006-09-08","Does former Treasury Secretary Robert E. Rubin still matter? Many would probably say yes.  But just don’t ask the man himself. ","1474","null","The New York Times","Business Day","News","article","New Role for Rubin: Policy Guru","New Role For Rubin: Policy Guru"
"https://www.nytimes.com/2006/10/28/business/28offline.html","null","2006-10-28","Maybe it is workers who are from Mars and bosses who are from Venus.","681","null","The New York Times","Business Day","News","article","The Workplace as Solar System","The Workplace as Solar System"
"https://www.nytimes.com/2006/10/28/world/americas/28brownfield.html","Simon Romero","2006-10-28","William Brownfield, the United States ambassador to Venezuela, has one of the most challenging jobs of any American ambassador.","1236","null","The New York Times","World","News","article","Good-Will Ambassador? Venezuela Is Leery of U.S. Envoy","Good-Will Ambassador? Venezuela Is Leery of U.S. Envoy"
"https://www.nytimes.com/2006/10/29/business/yourmoney/29suits.html","Jeremy Peters","2006-10-29","Some professional athletes seem to have limited options for work once they retire. The Boston Red Sox pitcher Curt Schilling has a different idea. ","827","null","The New York Times","Business Day","News","article","A Better Pitchman May Be Hard to Find","A Better Pitchman May Be Hard to Find"
"https://www.nytimes.com/2006/10/28/world/americas/28brazil.html","Paulo Prada","2006-10-28","On Sept. 29, an American corporate jet apparently collided with a Brazilian airliner, which crashed, killing all 154 people on board.","461","null","The New York Times","World","News","article","American Pilots Were at Correct Altitude Over Brazil, Lawyer Says","American Pilots Were at Correct Altitude Over Brazil, Lawyer Says"
"https://www.nytimes.com/2006/10/28/business/28shortcuts.html","Alina Tugend","2006-10-28","Figuring out charges for financing and for late payments can be a mystery for consumers.","1380","null","The New York Times","Business Day","News","article","In Credit Card Rates, Trust but Verify","In Credit Card Rates, Trust but Verify"
"https://www.nytimes.com/2006/10/28/business/worldbusiness/28ipo.html","David Barboza","2006-10-28","Shares of Industrial and Commercial Bank of China soared 15 percent on their first day, in the biggest initial offering in history. ","763","null","The New York Times","Business Day","News","article","Price Surges on Debut Day for Shares in China Bank","Price Surges On Debut Day For Shares In China Bank"
"https://www.nytimes.com/2006/10/29/world/middleeast/29iraqwomen.html","Sabrina Tavernise","2006-10-29","For Iraqi women, the daily violence has torn the fabric of society, breaking communities and their long-established social networks.","1267","null","The New York Times","World","News","article","Iraqis See the Little Things Fade Away in War’s Gloom","Iraqis See the Little Things Fade Away in War’s Gloom"
"https://www.nytimes.com/2006/10/29/world/europe/29chirac.html","Elaine Sciolino","2006-10-29","French President Jacques Chirac has been under unrelenting attack at home, as old allies criticize his leadership and question his legacy.","1283","null","The New York Times","World","News","article","Chirac’s Last Act: Lion in Winter, Wolves All Around","Chirac’s Last Act: Lion in Winter, Wolves All Around"
"https://www.nytimes.com/2006/10/29/world/americas/29venezuela.html","Simon Romero","2006-10-29","President Hugo Chavez has halted mining in a Venezuelan town, setting off protests and threatening the livelihoods of miners.","881","null","The New York Times","World","News","article","Boomtown in Venezuela Confronts Mining Ban","Mining Ban Riles Venezuela Boomtown"
"https://www.nytimes.com/2006/10/30/technology/30adco.html","Louise Story","2006-10-30","In an effort to combat click fraud, companies are demanding that online publishers hire auditors to check their ad and viewer counts by the middle of 2007.","1241","null","The New York Times","Technology","News","article","Marketers Demanding Better Count of the Clicks","Marketers Demanding Better Count Of the Clicks"
"https://www.nytimes.com/2006/10/22/world/europe/22rice.html","Thom Shanker","2006-10-22","The secretary of state’s remarks raised the possibility of a testy atmosphere for the discussions on North Korea.","705","null","The New York Times","World","News","article","Rice Criticizes Russia’s Limits on News Media","In Russia, Rice Criticizes Limits on the Press"
"https://www.nytimes.com/2006/10/23/business/media/23drill.html","Alex Mindlin","2006-10-23","Movie audiences prefer sequels with names to those with numbered titles, and they expect more divergent plots from numbered sequels than from those with new names.","193","null","The New York Times","Business Day","News","article","In Movie Sequel Titles, Names Are Best","In Movie Sequel Titles, Names Are Best"
"https://www.nytimes.com/2006/10/23/business/media/23carr.html","David Carr","2006-10-23","People are working longer and harder, allowing a woman who finds succor in store-bought pasta and canned broth to hit a sweet spot.","1045","null","The New York Times","Business Day","News","article","Rachael Ray Gives the Gift of Time","Rachael Ray Gives the Gift Of Time"
"https://www.nytimes.com/2006/10/23/business/23card.html","John Schwartz","2006-10-23","The security of the cards, which can be read through a wallet or an item of clothing, is startlingly weak, researchers say.","1406","null","The New York Times","Business Day","News","article","Researchers See Privacy Pitfalls in No-Swipe Credit Cards","Researchers See Privacy Pitfalls in No-Swipe Credit Cards"
"https://www.nytimes.com/2006/10/23/business/23law.html","Julie Creswell","2006-10-23","Milberg Weiss announced Sunday that Matthew Gluck, 63, a partner with Fried, Frank, Harris, Shriver & Jacobson, is joining the firm as a senior partner.","306","null","The New York Times","Business Day","News","article","Against Tide, Lawyer Joins Milberg Weiss","Against Tide, Lawyer Joins Milberg Weiss"
"https://www.nytimes.com/2006/10/23/world/asia/23afghan.html","Abdul Wafa","2006-10-23","An Afghan factional commander is said to have died in the fighting between the followers of two Pashtun clans. ","379","null","The New York Times","World","News","article","32 Killed in Factional Fighting in Western Afghanistan","32 Killed in Factional Fighting in Western Afghanistan"
"https://www.nytimes.com/2006/10/22/world/africa/23nationscnd.html","Warren Hoge","2006-10-22","The blunt-spoken envoy has been outspoken in reporting on killings, rapes and other atrocities in Darfur.","1058","null","The New York Times","World","News","article","Sudan Orders U.N. Envoy to Leave Country","Sudan Orders U.N. Envoy to Leave Country"
"https://www.nytimes.com/2006/10/23/world/asia/23india.html","Somini Sengupta","2006-10-23","A senior Indian official said the evidence of Pakistan’s role in the serial bombings on the commuter train line in Mumbai was short of “clinching.”","558","null","The New York Times","World","News","article","Indian Officials Split on Pakistan Role in Bombings","Indian Officials Split on Pakistan Role in Bombings"
"https://www.nytimes.com/2006/10/23/world/americas/23panama.html","Marc Lacey","2006-10-23","The $5.25 billion overhaul, set to begin next year, will double the capacity of the aging canal.","833","null","The New York Times","World","News","article","Panamanians Vote Overwhelmingly to Expand Canal","Panamanians Vote Overwhelmingly to Expand Canal"
"https://www.nytimes.com/2006/10/23/world/middleeast/23iraq.html","Michael Luo","2006-10-23","The U.S. military also reported five more combat deaths, bringing the month’s total of lost American lives to at least 83.","759","null","The New York Times","World","News","article","13 Police Recruits Among 18 Iraqis Killed in Violence","13 Police Recruits Among 18 Iraqis Killed in Violence"
"https://www.nytimes.com/2006/10/23/world/middleeast/23baghdad.html","Michael Gordon","2006-10-23","The Iraqi capital, American generals like to say, is the center of gravity for the larger U.S. mission in Iraq.","1424","null","The New York Times","World","News","article","To Stand or Fall in Baghdad: Capital Is Key to Mission","To Stand or Fall in Baghdad For American Commanders, This Is It: Securing Capital Is the Key to Their Mission"
"https://www.nytimes.com/2006/10/23/business/worldbusiness/23cnd-trade.html","Choe Sang-Hun","2006-10-23","North Korea's nuclear test has undermined Seoul’s demand that goods produced by South Korean factories in the North be included in the deal.","699","null","The New York Times","Business Day","News","article","South Korea and U.S. Resume Trade Talks","null"
"https://www.nytimes.com/2006/10/24/business/retirement/24inherit.html","null","2006-10-24","There are an increasing number of “senior move management” businesses offering services to retirees who are moving and must sift through the detritus of a lifetime.","1033","null","The New York Times","Business Day","News","article","This Is a Job for ‘Senior Move’ Managers","This Is a Job for ‘Senior Move’ Managers"
"https://www.nytimes.com/2006/10/30/technology/30youtube.html","Noam Cohen","2006-10-30","Last week YouTube began removing clips of Comedy Central shows. The week before, nearly 30,000 clips were removed because of copyright concerns.","292","null","The New York Times","Technology","News","article","YouTube Is Purging Copyrighted Clips","YouTube Is Purging Copyrighted Clips"
"https://www.nytimes.com/2006/10/30/technology/30bbc.html","Heather Timmons","2006-10-30","Critics inside the BBC’s Web site are condemning plans to advertise on the site, saying the ads could damage the BBC’s reputation and lead to less serious journalism.","411","null","The New York Times","Technology","News","article","BBC Plan for Web Ads Draws Fire","BBC Plan for Web Ads Draws Fire"
"https://www.nytimes.com/2006/10/30/technology/30aarp.html","null","2006-10-30","Nintendo’s booth at this year’s AARP Life@50+ event was part of its attempts to sell Wii, its new video game console, to older adults.","286","null","The New York Times","Technology","News","article","Nintendo at AARP Event to Court the Grayer Gamer","Nintendo at AARP Event To Court the Grayer Gamer"
"https://www.nytimes.com/2006/10/30/world/asia/30lanka.html","null","2006-10-30","Peace talks between Sri Lanka and the Tamil Tigers stalled after negotiators failed to agree on a date to continue discussions.","210","null","The New York Times","World","News","article","Sri Lanka Sees Peace Talks Stall","Sri Lanka Sees Peace Talks Stall"
"https://www.nytimes.com/2006/10/30/world/americas/30mexico.html","Marc Lacey","2006-10-30","Federal forces bashed through barricades and pushed back activists who had seized the downtown five months ago.","1031","null","The New York Times","World","News","article","Mexican Forces Move to Retake Oaxaca","Mexican Federal Police and Army Move to Retake Oaxaca"
"https://www.nytimes.com/2006/10/30/world/europe/30russiasumm.html","Michael Schwirtz","2006-10-30","A summary of the top stories in Russian newspapers on Monday.","677","null","The New York Times","World","News","article","Leftist Parties Combine, But Some Members Split Away","Leftist Parties Combine, But Some Members Split Away"
"https://www.nytimes.com/2006/10/30/business/media/30asktheeditors.html","null","2006-10-30","","5692","null","The New York Times","Business Day","News","article","Talk to the Newsroom:<br />Lawrie Mifflin, Editor, Television and Video","null"
"https://www.nytimes.com/2006/11/01/technology/circuits/01sett.html","Eric Taub","2006-11-01","With DirecTV and Dish Network offering all-digital channel lineups and central customer service, satellite has traditionally been the service to beat. But cable is changing.","1426","null","The New York Times","Technology","News","article","Cable or Satellite? That Depends","Cable or Satellite? That Depends"
"https://www.nytimes.com/2006/10/30/world/americas/31mexicocnd.html","Marc Lacey","2006-10-30","As federal riot police hunkered down in Oaxaca, protesters sought to protect the pilfered radio transmitter they use to mobilize the population.","754","null","The New York Times","World","News","article","Mexican Protesters Try to Protect Their Rallying Cry","Mexican Protesters Try to Protect Their Rallying Cry"
"https://www.nytimes.com/2006/10/31/business/31memo.html","Joe Sharkey","2006-10-31","BUSINESS TRAVEL IN 2007 Get ready to hear more from your corporate travel manager next year. As airlines fill more seats and raise fares and hotels in business centers continue raising already high rates, companies are being advised by American Ex...","395","null","The New York Times","Business Day","News","article","Memo Pad","null"
"https://www.nytimes.com/2006/10/31/world/middleeast/31mideast.html","Greg Myre","2006-10-31","Israel’s prime minister said the military operation would be intended to halt Palestinian rocket fire, not to reoccupy the territory.","504","null","The New York Times","World","News","article","Olmert Says Israel May Widen Military Role in Gaza","Olmert Says Israel May Widen Military Role in Gaza"
"https://www.nytimes.com/2006/10/31/world/asia/31korea.html","Joseph Kahn","2006-10-31","Chinese trade statistics show that China cut off oil exports to North Korea in September during heightened tension over North Korea’s nuclear and missile programs.","919","null","The New York Times","World","News","article","China May Be Using Oil to Press North Korea","China May Be Using Oil to Press North Korea"
"https://www.nytimes.com/2006/10/31/business/31auto.html","Bloomberg News","2006-10-31","The Ford Motor Company expects to cut North American production as much as 12 percent in the first half of 2007 as the company’s truck sales decline.","172","null","The New York Times","Business Day","News","article","Ford to Reduce Output in 2007","Ford to Reduce Output in 2007"
"https://www.nytimes.com/2006/10/31/business/31econ.html","Jeremy Peters","2006-10-31","Americans saw their incomes rise last month, but they did not respond by rushing out to spend that extra money.","648","null","The New York Times","Business Day","News","article","Incomes Rose Last Month; Spending Was Restrained","Incomes Rose Last Month; Spending Was Restrained"
"https://www.nytimes.com/2006/10/31/business/31hedge.html","Landon Thomas","2006-10-31","The closing of the fund highlights how sensitive hedge fund investors have become to weak performance after last month’s blow-up of Amaranth Advisors.","576","null","The New York Times","Business Day","News","article","A $700 Million Hedge Fund, Down From $3 Billion, Says It Will Close","A $700 Million Hedge Fund, Down From $3 Billion, Says It Will Close"
"https://www.nytimes.com/2006/10/31/business/31delphi.html","Nick Bunkley","2006-10-31","The civil fraud charges were filed against nine former executives, but the Delphi Corporation itself will not be fined because of a settlement reached with the S.E.C.","900","null","The New York Times","Business Day","News","article","S.E.C. Sues Ex-Officials of Delphi","S.E.C. Sues Ex-Officials Of Delphi"
"https://www.nytimes.com/2006/10/31/business/31fraud.html","Bloomberg News","2006-10-31","The Amerigroup Corporation must pay at least $144 million in damages for wrongfully denying coverage to pregnant women eligible for Medicaid.","86","null","The New York Times","Business Day","News","article","Health Care Verdict","Health Care Verdict"
"https://www.nytimes.com/2006/10/31/business/media/31paper.html","Katharine Seelye","2006-10-31","The decline, one of the steepest on record, adds to the woes of a mature industry beset by layoffs and the possible sale of some of its flagships.","1168","null","The New York Times","Business Day","News","article","Newspaper Circulation Falls Sharply","Newspaper Circulation Falls Sharply"
"https://www.nytimes.com/2006/10/25/world/middleeast/25assess.html","Michael Gordon","2006-10-25","The U.S. goal to have the Iraqi military take over primary responsibility for security seems far removed from the violence-plagued streets of Baghdad.","1100","null","The New York Times","World","News","article","Iraqi Realities Undermine the Pentagon’s Predictions","Searching for the Exit: Stark Iraqi Realities Undermine the Pentagon’s Hopeful Predictions"
"https://www.nytimes.com/2006/10/25/technology/25amazon.html","Laurie Flynn","2006-10-25","Amazon.com said Tuesday it would slow its investment in new technology in a bid to start reaping the rewards of its continuing growth.","672","null","The New York Times","Technology","News","article","Amazon to Curtail Its Spending","Amazon To Curtail Its Spending"
"https://www.nytimes.com/2006/10/25/world/middleeast/26baghdadcnd.html","John Burns","2006-10-25","The statement came in the form of a “clarification” issued to news organizations in Baghdad of remarks made by Gen. George W. Casey Jr.","2196","null","The New York Times","World","News","article","General Says Troop Increase Not Part of Baghdad Plans","null"
"https://www.nytimes.com/2006/10/25/world/europe/25russiansumm.html","Michael Schwirtz","2006-10-25","Investigators in the case of Anna Politkovskaya have identified two former police officers from Nizhevartovsk as possible suspects.","708","null","The New York Times","World","News","article","Suspects Identified in Killing of Journalist","Suspects Identified in Killing of Journalist"
"https://www.nytimes.com/2006/10/25/business/26cnd-econ.html","Jeremy Peters","2006-10-25","But the number of such homes sold continues to fall, the National Association of Realtors reported today.","583","null","The New York Times","Business Day","News","article","Prices of Previously Owned Homes Fall","null"
"https://www.nytimes.com/2006/10/25/world/europe/25cnd-russia.html","Andrew Kramer","2006-10-25","President Vladimir V. Putin of Russia said his influence would continue after 2008 but that he would not run for president again.","801","null","The New York Times","World","News","article","Putin Pledges Influence After He Leaves Office","Putin Pledges Influence After He Leaves Office"
"https://www.nytimes.com/2006/10/26/world/middleeast/26diplo.html","Helene Cooper","2006-10-26","The five permanent members of the U.N. Security Council and Germany are scheduled to meet Thursday to debate the resolution.","737","null","The New York Times","World","News","article","Draft Iran Resolution Would Restrict Students","Draft Iran Resolution Would Restrict Students"
"https://www.nytimes.com/2006/10/26/business/26diller.html","Geraldine Fabrikant","2006-10-26","The highest-paid executive last year was Barry Diller, chairman and chief executive of IAC/Interactive.","1936","null","The New York Times","Business Day","News","article","Diller Takes the Prize for Highest Paid","Diller, a Late Entry, Takes the Prize For Highest Paid"
"https://www.nytimes.com/2006/10/26/world/americas/26pavon.html","Marc Lacey","2006-10-26","A Guatemalan prison known as the Independent Republic of Pavón, taken over by its inmates a decade ago, has been raided and recaptured by the government.","873","null","The New York Times","World","News","article","Eulogy for an Outlaw Prison (It Was a Jungle in There)","Eulogy for an Outlaw Prison (It Was a Jungle in There)"
"https://www.nytimes.com/2006/10/26/business/26fine.html","Bloomberg News","2006-10-26","The chief of the James River Capital Corporation was fined $2.25 million over accusations he used deception to engage in timed trading.","207","null","The New York Times","Business Day","News","article","Chief of Fund Fined by NASD","Chief of Fund Fined by NASD"
"https://www.nytimes.com/2006/10/26/business/media/26adco.html","Stuart Elliott","2006-10-26","Wal-Mart has cut ties with its ad agency in an effort replace its familiar down-home image with a more polished approach.","1713","null","The New York Times","Business Day","News","article","Wal-Mart Makes It a Clean Break","Wal-Mart Makes It a Clean Break"
