"|","|__writer_name","|__pub_date","|__snippet","|__word_count","|__score","|__source","|__section_name","|__type_of_material","|__document_type","|__main_headline","|__print_headline"
"https://www.nytimes.com/2001/07/19/world/nepal-s-royal-deaths-give-life-to-swirl-of-theories.html","John Burns","2001-07-19","Many Nepalese visit Katmandu's most revered Hindu temple and stare down at cremation site of kingdom's murdered king, queen and seven other members of royal family; eyewitnesses say they were killed by drunken and drugged Crown Prince Dipendra, wh...","1376","null","The New York Times","World","News","article","Nepal's Royal Deaths Give Life to Swirl of Theories","Nepal's Royal Deaths Give Life to Swirl of Theories"
"https://www.nytimes.com/2001/09/24/business/a-nation-challenged-the-web-sites-shaken-public-tracks-flights-from-home-pc-s.html","Laurie Flynn","2001-09-24","RLM Software's FlightView service, which lets consumers track progress of nearly any commercial airline flight originating or landing in United States, has suddenly become one of most popular sites on Web in wake of terrorist attacks; photo (M)","271","null","The New York Times","Business Day","News","article","Shaken Public Tracks Flights From Home PC's","A NATION CHALLENGED: THE WEB SITES; Shaken Public Tracks Flights From Home PC's"
"https://www.nytimes.com/2001/10/31/business/company-news-cargill-says-it-will-buy-control-of-cerestar.html","Bloomberg News","2001-10-31","Cargill Inc will acquire Cerestar, manufacturer of starches and sweeteners, from Montedison for approximately $1.13 billion (S)","125","null","The New York Times","Business Day","News","article","CARGILL SAYS IT WILL BUY CONTROL OF CERESTAR","COMPANY NEWS; CARGILL SAYS IT WILL BUY CONTROL OF CERESTAR"
"https://www.nytimes.com/2001/01/21/business/company-in-trouble-theyacutere-waiting.html","null","2001-01-21","Chiquita. Fruit of the Loom. Friendly Ice Cream. Xerox.","2676","null","The New York Times","Business Day","News","article","Company in Trouble? They´re Waiting","Company in Trouble? They´re Waiting"
"https://www.nytimes.com/2001/01/22/business/the-media-business-advertising-addenda-people-558877.html","Jane Levere","2001-01-22","D'Arcy Masius Benton & Bowles names Cory Basso executive vice president and general manager of its New York office, new post (S)","63","null","The New York Times","Business Day","News","article","People","THE MEDIA BUSINESS: ADVERTISING -- ADDENDA; People"
"https://www.nytimes.com/2001/03/26/business/worldbusiness/IHT-tech-briefdsl-blackout.html","Victoria Shannon","2001-03-26","More than 100,000 subscribers to high-speed digital subscriber line Internet access will have their service turned off this week because of AT&T Corp.'s deal to buy a bankrupt DSL provider's assets.. Microsoft's MSN is among the several hundred DS...","702","null","International Herald Tribune","Business Day","null","article","Tech Brief:DSL BLACKOUT","Tech Brief:DSL BLACKOUT"
"https://www.nytimes.com/2001/07/09/world/army-and-police-keep-order-at-protestant-march-in-ulster.html","Warren Hoge","2001-07-09","British troops and police officers in riot gear mount huge security presence in Portadown, Northern Ireland, most volatile of all Ulster towns, and marching Orangemen limit their procession from Drumcree Church to token protest; extreme efforts by...","913","null","The New York Times","World","News","article","Army and Police Keep Order at Protestant March in Ulster","Army and Police Keep Order at Protestant March in Ulster"
"https://www.nytimes.com/2001/02/27/business/company-news-qwest-to-seek-right-to-expand-long-distance-service.html","Bloomberg News","2001-02-27","Qwest Communications International will ask Federal Communications Commission for permission to sell long-distance service in Colorado or Arizona this summer; after getting permission from FCC to sell in one state, Qwest will seek permission later...","115","null","The New York Times","Business Day","News","article","QWEST TO SEEK RIGHT TO EXPAND LONG-DISTANCE SERVICE","COMPANY NEWS; QWEST TO SEEK RIGHT TO EXPAND LONG-DISTANCE SERVICE"
"https://www.nytimes.com/2001/10/18/technology/technology-briefing.html","null","2001-10-18","Technology Briefing","1517","null","The New York Times","Technology","News","article","Technology Briefing","Technology Briefing"
"https://www.nytimes.com/2001/05/13/business/backslash-survivor-the-new-economy.html","Matt Richtel","2001-05-13","Matt Richtel column suggests several reality television shows about Silicon Valley people watching their stocks tank; drawing (M)","787","null","The New York Times","Business Day","News","article","Survivor: The New Economy","BACKSLASH; Survivor: The New Economy"
"https://www.nytimes.com/2001/06/05/world/world-briefing-asia-afghanistan-the-price-of-misery.html","Barry NYT","2001-06-05","Drought conditions in Afghanistan leave some families so short of cash that they have begun giving away their daughters so they do not have to feed them (S)","61","null","The New York Times","World","News","article","World Briefing | Asia: Afghanistan: The Price Of Misery","World Briefing | Asia: Afghanistan: The Price Of Misery"
"https://www.nytimes.com/2001/07/16/business/microsoft-adversary-to-become-ftc-official.html","Steve Lohr","2001-07-16","Susan A Creighton, lawyer who has long dogged Microsoft Corp on antitrust issues on behalf of its competitors, will join Federal Trade Commission as competition bureau deputy director; will be unable to comment on case and will not be involved in ...","333","null","The New York Times","Business Day","News","article","Microsoft Adversary to Become F.T.C. Official","Microsoft Adversary to Become F.T.C. Official"
"https://www.nytimes.com/2001/03/25/business/portfolios-etc-waiting-for-the-other-shoe-to-drop-on-a-sagging-economy.html","Jonathan Fuerbringer","2001-03-25","Jonathan Fuerbringer column on view of some economists, still a minority, that economic slump in US will turn into recession and dim prospects for stock market because there may soon be layoffs and declines in worker income, which would slow consu...","696","null","The New York Times","Business Day","News","article","Waiting for the Other Shoe to Drop on a Sagging Economy","PORTFOLIOS, ETC.; Waiting for the Other Shoe to Drop on a Sagging Economy"
"https://www.nytimes.com/2001/10/31/world/world-briefing-europe-ukraine-stock-market-monitor-slain.html","Michael NYT","2001-10-31","Olexy Romashko, Ukrainian official who policed legality of stock market transactions, is found murdered in his apartment building elevator, apparent victim of mafia-connected clans that dominate nation's business and financial sectors (S)","77","null","The New York Times","World","News","article","World Briefing | Europe: Ukraine: Stock Market Monitor Slain","World Briefing | Europe: Ukraine: Stock Market Monitor Slain"
"https://www.nytimes.com/2001/12/03/business/media-vanity-fairs-depiction-upsets-capitol-hill-women.html","Allison Jones","2001-12-03","More than 30 women from 20 Congressional offices sign protest letter to Vanity Fair magazine defending their collective image, which they feel was tarnished by December article about three flirtatious young women on Capitol Hill; photo (M)","685","null","The New York Times","Business Day","News","article","MEDIA; Vanity Fair's Depiction Upsets Capitol Hill Women","MEDIA; Vanity Fair's Depiction Upsets Capitol Hill Women"
"https://www.nytimes.com/2001/06/11/business/equifax-to-buy-stake-in-a-software-vendor.html","null","2001-06-11","Equifax will invest $5 million in Seisint, start-up vendor of computer software tailored to high-speed analysis of larger databases and deploy Seisint's technology to eliminate much of computer coding work involved in producing lists of potential ...","175","null","The New York Times","Business Day","News","article","Equifax to Buy Stake in a Software Vendor","Equifax to Buy Stake in a Software Vendor"
"https://www.nytimes.com/2001/08/30/world/herbert-haag-86-priest-who-challenged-vatican.html","Eric Pace","2001-08-30","Herbert Haag, Swiss liberal Roman Catholic theologian who sought reform and liberalization of church, dies at age 86 (M)","367","null","The New York Times","World","Obituary; Biography","article","Herbert Haag, 86, Priest Who Challenged Vatican","Herbert Haag, 86, Priest Who Challenged Vatican"
"https://www.nytimes.com/2001/05/11/business/world-business-briefing-americas-canada-thomson-posts-profit.html","Bloomberg News","2001-05-11","Thomson Corp posts first-quarter profit of $167 million (S)","70","null","The New York Times","Business Day","News","article","World Business Briefing | Americas: Canada: Thomson Posts Profit","World Business Briefing | Americas: Canada: Thomson Posts Profit"
"https://www.nytimes.com/2001/12/13/news/greeks-drop-spy-count-on-planespotters.html","Barry James","2001-12-13","","1130","null","The New York Times","World","News","article","Greeks Drop Spy Count on Plane-Spotters","Greeks Drop Spy Count on Plane-Spotters"
"https://www.nytimes.com/2001/04/28/business/world-business-briefing-europe-britain-vote-of-confidence.html","Alan Cowell","2001-04-28","Sir Christopher Bland, new chairman of British Telecommunications PLC, will invest about $1.4 million of his own money buying stock in company (S)","111","null","The New York Times","Business Day","News","article","BRITAIN: VOTE OF CONFIDENCE","WORLD BUSINESS BRIEFING: EUROPE; BRITAIN: VOTE OF CONFIDENCE"
"https://www.nytimes.com/2001/10/05/news/terror-attacks-put-the-future-of-skyscrapers-in-question-as-insurance.html","Eric Pfanner","2001-10-05","","1351","null","The New York Times","World","News","article","Terror Attacks Put the Future of Skyscrapers In Question as Insurance Costs Begin to Rise : Tall Dreams and Premiums","Terror Attacks Put the Future of Skyscrapers In Question as Insurance Costs Begin to Rise : Tall Dreams and Premiums"
"https://www.nytimes.com/2001/03/29/business/company-briefs-618667.html","null","2001-03-29","","129","null","The New York Times","Business Day","News","article","COMPANY BRIEFS","COMPANY BRIEFS"
"https://www.nytimes.com/2001/08/07/world/shenzhen-journal-golf-obsesses-a-boom-town-s-elite.html","Mark Landler","2001-08-07","Golf catches on in China's southern boom city of Shenzhen, where it has become obsession among elite; city is ringed by golf courses of varying size and quality, most built to cater mainly to Hong Kong residents; clubs like Mission Hills Golf Club...","1136","null","The New York Times","World","News","article","Shenzhen Journal; Golf Obsesses a Boom Town's Elite","Shenzhen Journal; Golf Obsesses a Boom Town's Elite"
"https://www.nytimes.com/2001/02/05/business/e-commerce-report-comparison-shopping-sites-have-felt-shakeout-but-hope-that.html","Bob Tedeschi","2001-02-05","Comparison-shopping Internet sites have undergone same shakeout as e-retailing companies; companies that remain insist they havebetter chance at surviving than many e-tailers, given continuing--if slower--growth of online shopping; photo (M)","1192","null","The New York Times","Business Day","News","article","E-Commerce Report; Comparison-shopping sites have felt the shakeout but hope that a diversified source of revenues may serve as a buffer.","E-Commerce Report; Comparison-shopping sites have felt the shakeout but hope that a diversified source of revenues may serve as a buffer."
"https://www.nytimes.com/2001/02/14/business/excerpts-from-greenspans-testimony.html","null","2001-02-14","Alan Greenspan, the chairman of the Federal Reserve, gave his semiannual report on the economy to the Senate Banking Committee today. Following are excerpts from his testimony and from an exchange between Mr. Greenspan and Senator Christopher J. D...","1105","null","The New York Times","Business Day","News","article","Excerpts From Greenspan's Testimony","Excerpts From Greenspan's Testimony"
"https://www.nytimes.com/2001/04/23/world/suicide-bomber-attacks-israeli-bus-killing-a-doctor.html","Deborah Sontag","2001-04-23","Palestinian suicide bomber attacks Israeli bus in Kfar Sava near Tel Aviv, killing himself and Israeli doctor and wounding dozens of people; physician identified as Dr Mario Goldin; Prime Min Ariel Sharon blames Palestinian Authority; bombing foll...","971","null","The New York Times","World","News","article","Suicide Bomber Attacks Israeli Bus, Killing a Doctor","Suicide Bomber Attacks Israeli Bus, Killing a Doctor"
"https://www.nytimes.com/2001/08/14/business/walmart-and-home-depot-report-higher-earnings.html","Sherri Day","2001-08-14","In the face of a sluggish economy, Wal-Mart Stores and Home Depot each managed to report today that earnings rose in the second quarter","1319","null","The New York Times","Business Day","News","article","Wal-Mart and Home Depot Report Higher Earnings","Wal-Mart and Home Depot Report Higher Earnings"
"https://www.nytimes.com/2001/03/26/business/deal-for-use-of-gas-pipeline-stirs-dispute-on-competition.html","Richard Oppel","2001-03-26","Federal complaint by California against El Paso Natural Gas Co for allegedly manipulating price of gas through its control of pipeline capacity opens window on debate about oversight of natural gas industry, which provides fuel for growing share o...","1974","null","The New York Times","Business Day","News","article","Deal for Use of Gas Pipeline Stirs Dispute on Competition","Deal for Use of Gas Pipeline Stirs Dispute on Competition"
"https://www.nytimes.com/2001/02/19/business/a-latecomer-to-web-the-new-yorker-hopes-to-be-a-lasting-site.html","Susan Stellin","2001-02-19","New Yorker magazine opens companion Web site; is a late comer to Web, but publisher Conde Nast hopes to apply lessons learned from other publications' Web exploits; drawing (M)","632","null","The New York Times","Business Day","News","article","A Latecomer to Web, The New Yorker Hopes to Be a Lasting Site","A Latecomer to Web, The New Yorker Hopes to Be a Lasting Site"
"https://www.nytimes.com/2001/06/12/news/the-printhuman-vs-computer.html","Suzy Menkes","2001-06-12","","1294","null","The New York Times","World","News","article","The Print:Human vs. Computer","The Print:Human vs. Computer"
"https://www.nytimes.com/2001/05/21/world/powell-endorses-proposals-for-ending-mideast-violence.html","Jane Perlez","2001-05-21","WASHINGTON, May 21 -- Secretary of State Colin L. Powell openly inserted the Bush administration into the Israeli-Palestinian conflict today, instructing one of his most senior aides to work with both sides to set out a ""time line"" for a series of...","458","null","The New York Times","World","News","article","Powell Endorses Proposals for Ending Mideast Violence","Powell Endorses Proposals for Ending Mideast Violence"
"https://www.nytimes.com/2001/04/22/business/l-executive-pay-and-priorities-970867.html","null","2001-04-22","Mark Cassell letter comments on April 1 article on compensation of executives of major corporations","51","null","The New York Times","Business Day","Letter","article","Executive Pay and Priorities","Executive Pay and Priorities"
"https://www.nytimes.com/2001/04/11/world/mexico-seeks-closer-law-enforcement-ties-with-wary-us.html","Tim Weiner","2001-04-11","Mexico asks wary US to share more intelligence and ideas for fighting criminal organizations on both sides of border; Adolfo Aguilar Zinser, security adviser to Pres Vicente Fox, will meet with Atty Gen John Ashcroft, security adviser Condoleezza ...","535","null","The New York Times","World","News","article","Mexico Seeks Closer Law Enforcement Ties With Wary U.S.","Mexico Seeks Closer Law Enforcement Ties With Wary U.S."
"https://www.nytimes.com/2001/07/30/business/the-media-business-advertising-addenda-people-472867.html","Bernard Stamler","2001-07-30","","32","null","The New York Times","Business Day","News","article","People","THE MEDIA BUSINESS: ADVERTISING -- ADDENDA; People"
"https://www.nytimes.com/2001/07/13/world/rights-group-says-taliban-aren-t-solely-to-blame-for-the-afghan-disaster.html","Barbara Crossette","2001-07-13","Human Rights Watch, breaking ranks with most human rights groups and United States government, issues report saying that Taliban leaders are not solely responsible for deepening disaster in Afghanistan; report calls for sanctions against armed opp...","642","null","The New York Times","World","News","article","Rights Group Says Taliban Aren't Solely to Blame for the Afghan Disaster","Rights Group Says Taliban Aren't Solely to Blame for the Afghan Disaster"
"https://www.nytimes.com/2001/01/17/business/the-boss-one-bull-run-i-skipped.html","null","2001-01-17","My father and my younger brother suffered from asthma. In 1956, after I graduated, we left the Bronx and moved to Miami. Whatever they were allergic to didn't exist there. I was hanging out with the guys. I could have gone left; I could have gone ...","622","null","The New York Times","Business Day","News","article","The Boss: One Bull Run I Skipped","The Boss: One Bull Run I Skipped"
"https://www.nytimes.com/2001/06/10/business/vicarious-consumption-where-shoes-start-at-2900-tax-included.html","Alan Cowell","2001-06-10","London's bespoke outfitters are masters both of art of crafting custom apparel and shoes and also of discretion regarding their customers; 'royal warrants' do reveal where some senior members of royal family get their suits, shirts, shoes, etc; ph...","1537","null","The New York Times","Business Day","News","article","Where Shoes Start At $2,900, Tax Included","VICARIOUS CONSUMPTION; Where Shoes Start At $2,900, Tax Included"
"https://www.nytimes.com/2001/04/05/business/stocks-soar-in-strong-rally-with-nasdaq-gaining-89.html","Michael Brick","2001-04-05","Stocks staged a stunning rally today, rebounding from their steep losses earlier this week, after Dell Computer and Alcoa offered encouraging words about their profits, in contrast to the seemingly relentless wave of recent corporate earnings warn...","462","null","The New York Times","Business Day","News","article","Stocks Soar in Strong Rally, With Nasdaq Gaining 8.9%","Stocks Soar in Strong Rally, With Nasdaq Gaining 8.9%"
"https://www.nytimes.com/2001/10/09/world/small-plane-collides-with-jet-on-milan-runway-118-die.html","Melinda Henneberger","2001-10-09","At least 118 people are killed at Linate Airport in Milan, Italy, in collision between small Cessna airplane and Scandinavian Airlines MD-87 jetliner; investigator says pilot of Cessna took wrong turn on taxiway and into path of jetliner during ta...","968","null","The New York Times","World","News","article","Small Plane Collides With Jet on Milan Runway; 118 Die","Small Plane Collides With Jet on Milan Runway; 118 Die"
"https://www.nytimes.com/2001/09/17/business/business-digest-213497.html","null","2001-09-17","","703","null","The New York Times","Business Day","Summary","article","BUSINESS DIGEST","BUSINESS DIGEST"
"https://www.nytimes.com/2001/03/01/business/worldbusiness/IHT-tech-briefnamco-lowers-forecast.html","Robert Youngblood","2001-03-01","","244","null","International Herald Tribune","Business Day","null","article","Tech Brief:NAMCO LOWERS FORECAST","Tech Brief:NAMCO LOWERS FORECAST"
"https://www.nytimes.com/2001/05/31/world/last-chapter-berlin-to-pay-slave-workers-held-by-nazis.html","Roger Cohen","2001-05-31","German Parliament approves motion that opens way for payment of $4.5 billion to laborers forced to work by Nazis; agreement comes 56 years after fall of Third Reich and after two years of often bitter negotiations; many Germans hail settlement as ...","733","null","The New York Times","World","News","article","Last Chapter: Berlin to Pay Slave Workers Held by Nazis","Last Chapter: Berlin to Pay Slave Workers Held by Nazis"
"https://www.nytimes.com/2001/11/02/business/in-a-surprise-move-aol-replaces-its-chief-financial-officer.html","Geraldine Fabrikant","2001-11-02","AOL Time Warner replaces J Michael Kelly, its tough-minded chief financial officer, with Wayne Pace; transfers Kelly to company's America Online unit, where he will become chief operating officer (M)","704","null","The New York Times","Business Day","News","article","In a Surprise Move, AOL Replaces Its Chief Financial Officer","In a Surprise Move, AOL Replaces Its Chief Financial Officer"
"https://www.nytimes.com/2001/10/30/world/nightmare-phone-call-gunfire-killing-his-fiancee.html","Joel Greenberg","2001-10-30","Article on murders of four Israeli women and shooting of 30 other people by two Palestinian gunmen in Hadera; gunmen were later shot and killed by police; photo (M)","564","null","The New York Times","World","News","article","Nightmare Phone Call: Gunfire Killing His Fiancée","Nightmare Phone Call: Gunfire Killing His Fiancée"
"https://www.nytimes.com/2001/01/10/business/the-markets-commodities.html","null","2001-01-10","Heating oil falls on forecasts for milder weather in Northeast, which accounts for four-fifths of demand; heating oil for February delivery falls 1.96 cents, or 2.4 percent, to 80.62 cents a gallon in New York trading; graph; chart (S)","39","null","The New York Times","Business Day","News","article","THE MARKETS: COMMODITIES","THE MARKETS: COMMODITIES"
"https://www.nytimes.com/2001/02/02/news/this-time-america-kept-its-hands-out-of-the-crisis-in-philippines.html","Thomas Fuller","2001-02-02","","1832","null","The New York Times","World","News","article","This Time, America Kept Its Hands Out of the Crisis in Philippines","This Time, America Kept Its Hands Out of the Crisis in Philippines"
"https://www.nytimes.com/2001/04/10/business/company-news-sawtek-trims-profit-forecast-and-says-it-will-cut-jobs.html","Bloomberg News","2001-04-10","Sawtek Inc, maker of cellular-phone components, says that profit and sales for rest of 2001 will be lower than in 2000, that it will cut 35 jobs in Costa Rica because of slowdown in wireless and communications markets and that it is reducing work ...","139","null","The New York Times","Business Day","News","article","SAWTEK TRIMS PROFIT FORECAST AND SAYS IT WILL CUT JOBS","COMPANY NEWS; SAWTEK TRIMS PROFIT FORECAST AND SAYS IT WILL CUT JOBS"
"https://www.nytimes.com/2001/02/11/business/following-the-money-but-also-the-mind.html","Louis Uchitelle","2001-02-11","Louis Uchitelle column on rise of behavioral economists, who accept traditional theory that people act on basis of rational self-interest but insist that they are also prey to skewed reasoning, self-indulgence, self-destructive behavior and a host...","3578","null","The New York Times","Business Day","News","article","Following the Money, but Also the Mind","Following the Money, but Also the Mind"
"https://www.nytimes.com/2001/11/14/business/executive-who-promoted-interest-free-car-loans-is-leaving-gm.html","Danny Hakim","2001-11-14","Ronald L Zarrella, architect of General Motors strategy to offer interest-free financing after Sept 11 terrorist attacks, resigns as president of its North American operations to take top job at his former employer, Bausch & Lomb; Robert A Lutz, r...","679","null","The New York Times","Business Day","News","article","Executive Who Promoted Interest-Free Car Loans Is Leaving G.M.","Executive Who Promoted Interest-Free Car Loans Is Leaving G.M."
"https://www.nytimes.com/2001/02/23/business/worldbusiness/IHT-tech-briefsmaller-yahoo-auctions.html","James Connell","2001-02-23","Yahoo Inc. said the number of items for sale in its online auctions had fallen ""considerably"" since it began charging fees for listings last month. Yahoo began charging from 20 cents to $2.25 for each item listed for sale in a quest for new sour","316","null","International Herald Tribune","Business Day","null","article","Tech Brief:SMALLER YAHOO AUCTIONS","Tech Brief:SMALLER YAHOO AUCTIONS"
"https://www.nytimes.com/2001/05/14/business/economic-calendar.html","null","2001-05-14","","60","null","The New York Times","Business Day","Schedule","article","Economic Calendar","Economic Calendar"
"https://www.nytimes.com/2001/07/19/business/europe-moves-to-speed-up-approval-of-new-drugs.html","Alan Cowell","2001-07-19","European Commission proposes acceleration in approval of new drugs that could reduce up to half time it takes for new medication to reach markets and patients; move would bring European drug approval practices neaer those of US; plan calls for red...","691","null","The New York Times","Business Day","News","article","Europe Moves to Speed Up Approval of New Drugs","Europe Moves to Speed Up Approval of New Drugs"
"https://www.nytimes.com/2001/03/06/business/aol-time-warner-forms-new-tv-network-group.html","Jim Rutenberg","2001-03-06","AOL Time Warner Inc. announced today that it was reorganizing its television holdings, putting its vast collection of basic cable television channels and its WB broadcast network under a new division to be headed by Jamie Kellner, the founder and ...","409","null","The New York Times","Business Day","News","article","AOL Time Warner Forms New TV Network Group","AOL Time Warner Forms New TV Network Group"
"https://www.nytimes.com/2001/06/07/business/company-news-priceline-shares-increase-on-word-of-new-investment.html","Bloomberg News","2001-06-07","Priceline.com Inc shares rise 30 percent after companies controlled by Li Ka-shing say they will increase stake in company; Hutchison Whampoa Ltd and Cheung Kong (Holdings) Ltd to buy 25 million shares for $4.40 each from company founder Jay Walke...","140","null","The New York Times","Business Day","News","article","PRICELINE SHARES INCREASE ON WORD OF NEW INVESTMENT","COMPANY NEWS; PRICELINE SHARES INCREASE ON WORD OF NEW INVESTMENT"
