"|","|__writer_name","|__pub_date","|__snippet","|__word_count","|__score","|__source","|__section_name","|__type_of_material","|__document_type","|__main_headline","|__print_headline"
"https://www.nytimes.com/2001/02/15/news/peoples-publisher-marcos-foe-returns-to-fray-wily-media-maverick-who.html","Thomas Fuller","2001-02-15","","2103","null","The New York Times","World","News","article","People's Publisher / Marcos Foe Returns to Fray : Wily Media Maverick Who Helped Topple Estrada","People's Publisher / Marcos Foe Returns to Fray : Wily Media Maverick Who Helped Topple Estrada"
"https://www.nytimes.com/2001/02/20/business/worldbusiness/IHT-tech-briefpatent-approved.html","James Connell","2001-02-20","Brokat Infosystems AG, a Stuttgart-based financial-software maker, said it had won a patent for a German digital signature process to be used via mobile phones. The company said it had a similar patent pending in the United States and several othe...","259","null","International Herald Tribune","Business Day","null","article","Tech Brief:PATENT APPROVED","Tech Brief:PATENT APPROVED"
"https://www.nytimes.com/2001/10/29/world/nation-challenged-overview-oct-28-2000-military-reassurances-unexplained-attacks.html","Serge Schmemann","2001-10-29","Overview of day's events in war in Afghanistan, anthrax scare and memorial held for those killed in World Trade Center attack (M)","748","null","The New York Times","World","News","article","Military Reassurances, Unexplained Attacks, a Mideast Pullout","A NATION CHALLENGED: AN OVERVIEW: OCT. 28, 2000; Military Reassurances, Unexplained Attacks, a Mideast Pullout"
"https://www.nytimes.com/2001/07/15/business/investing-diary-doing-reverse-splits-to-avoid-delisting.html","Michael Brick","2001-07-15","Comment on companies tø","300","null","The New York Times","Business Day","News","article","Doing (Reverse) Splits To Avoid Delisting","INVESTING: DIARY; Doing (Reverse) Splits To Avoid Delisting"
"https://www.nytimes.com/2001/07/08/business/mutual-funds-report-76-buy-hold-manager-learning-let-go-bit-bit.html","Abby Schultz","2001-07-08","Martin J Whitman lays groundwork for succession at Third Avenue Value Funds, group of three value funds with impressive records; has stepped down as co-manager of Third Avenue Small-Cap Value and Third Avenue Real Estate Value, but will still mana...","1224","null","The New York Times","Business Day","News","article","At 76, a Buy-and-Hold Manager Is Learning to Let Go, Bit by Bit","MUTUAL FUNDS REPORT; At 76, a Buy-and-Hold Manager Is Learning to Let Go, Bit by Bit"
"https://www.nytimes.com/2001/03/29/business/worldbusiness/IHT-tech-briefamazon-nemesis.html","Victoria Shannon","2001-03-29","Ravi Suria, 30, the bond analyst at Lehman Brothers Inc. who shot to fame on his rigorous and skeptical research reports on Amazon.com Inc. and other stock-market darlings, has left Lehman to join Duquesne Capital Management, a hedge fund in New Y...","285","null","International Herald Tribune","Business Day","null","article","Tech Brief:AMAZON NEMESIS","Tech Brief:AMAZON NEMESIS"
"https://www.nytimes.com/2001/10/10/business/business-travel-faa-has-spoken-carry-items-now-let-s-hope-airport-screeners-get.html","Joe Sharkey","2001-10-10","Business Travel column on Federal Aviation Administration guidelines on what may be carried on board airplane under new security procedures (M)","801","null","The New York Times","Business Day","News","article","Business Travel; The F.A.A. has spoken on carry-on items. Now let's hope airport screeners get the message.","Business Travel; The F.A.A. has spoken on carry-on items. Now let's hope airport screeners get the message."
"https://www.nytimes.com/2001/10/16/world/world-briefing-europe-scotland-netherlands-lockerbie-appeal-set.html","Donald McNeil","2001-10-16","Scottish court sets Jan 23 hearing on appeal by Libyan, Abdelbaset Ali Mohmed al-Megrahi, who was sentenced to life in prison for 1988 bombing of Pan Am jet over Lockerbie (S)","96","null","The New York Times","World","News","article","World Briefing | Europe: Scotland, Netherlands: Lockerbie Appeal Set","World Briefing | Europe: Scotland, Netherlands: Lockerbie Appeal Set"
"https://www.nytimes.com/2001/11/28/world/envoy-forges-bonds-and-reaps-benefits.html","Eric Schmitt","2001-11-28","Career sketch of retired Gen Antÿ","973","null","The New York Times","World","News","article","Envoy Forges Bonds and Reaps Benefits","Envoy Forges Bonds and Reaps Benefits"
"https://www.nytimes.com/2001/04/12/business/worldbusiness/IHT-tech-briefcar-dealing.html","James Connell","2001-04-12","","131","null","International Herald Tribune","Business Day","null","article","Tech Brief:CAR DEALING","Tech Brief:CAR DEALING"
"https://www.nytimes.com/2001/01/19/business/worldbusiness/IHT-tech-brieffinnish-phones.html","Victoria Shannon","2001-01-19","","218","null","International Herald Tribune","Business Day","null","article","Tech Brief:FINNISH PHONES","Tech Brief:FINNISH PHONES"
"https://www.nytimes.com/2001/09/20/business/nation-challenged-automakers-detroit-with-its-sales-falling-urged-help-spur.html","Danny Hakim","2001-09-20","Commerce Sec Donald L Evans and Labor Sec Elaine L Chao make unscheduled visit to Detroit to urge auto industry to do what it can to help economy on brink of recession; Bush administration would prefer that automakers, instead of making fewer vehi...","818","null","The New York Times","Business Day","News","article","Detroit, With Its Sales Falling, Is Urged to Help Spur Economy","A NATION CHALLENGED: THE AUTOMAKERS; Detroit, With Its Sales Falling, Is Urged to Help Spur Economy"
"https://www.nytimes.com/2001/05/16/business/the-boss-speaking-up-about-dyslexia.html","John Chambers","2001-05-16","When my parents went to medical school, I went back and forth to my grandparents and was spoiled by everybody.","581","null","The New York Times","Business Day","News","article","The Boss: Speaking Up About Dyslexia","The Boss: Speaking Up About Dyslexia"
"https://www.nytimes.com/2001/08/16/business/as-midway-airlines-retrenches-the-competition-intensifies.html","Jane Levere","2001-08-16","Midway Airlines, regional airline that operates out of Raleigh-Durham International Airport in North Carolina, files for Chapter 11 bankruptcy protection; Midway is droppging service to 9 of 28 cities on its system; is also cutting its work force ...","575","null","The New York Times","Business Day","News","article","As Midway Airlines Retrenches, the Competition Intensifies","As Midway Airlines Retrenches, the Competition Intensifies"
"https://www.nytimes.com/2001/06/26/business/swiss-watch-exports-fell-2.2-in-may.html","Bloomberg News","2001-06-26","Federation of Swiss Watch Makers says Swiss watch exports fell 2.2 percent by value in May because of slower economic growth in US and two fewer working days in May year earlier; sales rose 7.1 percent in first five months of year, while volume of...","180","null","The New York Times","Business Day","News","article","Swiss Watch Exports Fell 2.2% in May","Swiss Watch Exports Fell 2.2% in May"
"https://www.nytimes.com/2001/04/30/business/compressed-data-panel-on-encryption-turns-into-pessimistic-assessment-of-privacy.html","Susan Stellin","2001-04-30","Researchers and policy makers taking part in recent Columbia University panel discussion are pessimistic about whether encryption can safeguard Internet; say broader security issue on Internet involves privacy, with technology alone unable to brin...","378","null","The New York Times","Business Day","News","article","Compressed Data; Panel on Encryption Turns Into Pessimistic Assessment of Privacy","Compressed Data; Panel on Encryption Turns Into Pessimistic Assessment of Privacy"
"https://www.nytimes.com/2001/07/13/business/worldbusiness/IHT-tech-briefcourt-victory-for-att.html","Victoria Shannon","2001-07-13","AT&T Corp., which owns the No. 1 U.S. cable-television company, has the right to decide which Internet companies may access its fast Web connections in Virginia, a federal appeals court ruled.. The 4th U.S. Circuit Court of Appeals let stand a low...","699","null","International Herald Tribune","Business Day","null","article","Tech Brief:COURT VICTORY FOR AT&T","Tech Brief:COURT VICTORY FOR AT&T"
"https://www.nytimes.com/2001/10/21/world/a-nation-challenged-military-analysis-first-of-the-stinging-jabs.html","Michael Gordon","2001-10-21","Military analysis of nighttime commando raid in Afghanistan as opening new fast-paced stage of war against terrorism, first of series of stinging jabs intended to unhinge enemy; photo; Pentagon has warned that this phase may be drawn out and will ...","1162","null","The New York Times","World","An Analysis; Military Analysis","article","First of the Stinging Jabs","A NATION CHALLENGED: MILITARY ANALYSIS; First of the Stinging Jabs"
"https://www.nytimes.com/2001/06/13/world/pushing-his-missile-plan-in-spain-bush-calls-arms-treaty-a-relic.html","Frank Bruni","2001-06-13","Pres Bush begins first overseas trip since taking office with fervent pitch for new missile defense shield; remarks in Madrid dismiss 1972 ABM treaty as relic of past; Bush is equally emphatic in opposition to Kyoto global warming accord he calls ...","1216","null","The New York Times","World","News","article","Pushing His Missile Plan in Spain, Bush Calls Arms Treaty a 'Relic'","Pushing His Missile Plan in Spain, Bush Calls Arms Treaty a 'Relic'"
"https://www.nytimes.com/2001/05/01/world/world-briefing.html","null","2001-05-01","AFRICA","839","null","The New York Times","World","News","article","World Briefing","World Briefing"
"https://www.nytimes.com/2001/07/17/business/worldbusiness/IHT-firm-files-for-bankruptcy-and-sells-tech-unit-to.html","Victoria Shannon","2001-07-17","Comdisco Inc., still hurting from the technology-stock crash of last year, said Monday it would sell its technology services business to Hewlett-Packard Co. for $610 million, cut 200 more jobs and file for federal bankruptcy protection.. The compa...","876","null","International Herald Tribune","Business Day","null","article","FIRM FILES FOR BANKRUPTCY AND SELLS TECH UNIT TO H-P : Tech Brief:COMDISCO WOES","FIRM FILES FOR BANKRUPTCY AND SELLS TECH UNIT TO H-P : Tech Brief:COMDISCO WOES"
"https://www.nytimes.com/2001/03/21/business/worldbusiness/IHT-techbrieforacle-cutback.html","Robert Youngblood","2001-03-21","","181","null","International Herald Tribune","Business Day","null","article","TechBrief:ORACLE CUTBACK","TechBrief:ORACLE CUTBACK"
"https://www.nytimes.com/2001/10/10/business/the-media-business-advertising-addenda-fallon-worldwide-to-expand-operations.html","Stuart Elliott","2001-10-10","Fallon Worldwide will expand operations by opening offices in Hong Kong, Sao Paulo, Brazil, and Singapore (S)","88","null","The New York Times","Business Day","News","article","Fallon Worldwide To Expand Operations","THE MEDIA BUSINESS: ADVERTISING -- ADDENDA; Fallon Worldwide To Expand Operations"
"https://www.nytimes.com/2001/09/24/business/nation-challenged-commentators-pronouncements-irony-draw-line-sand.html","null","2001-09-24","Media industry pundits seek to guess at future mood of New York City in wake of terrorist attacks; Graydon Carter, Vanity Fair editor, is most prominent of early prognosticators, predicting end to age of irony; photos (M)","1190","null","The New York Times","Business Day","News","article","Pronouncements on Irony Draw a Line in the Sand","A NATION CHALLENGED: THE COMMENTATORS; Pronouncements on Irony Draw a Line in the Sand"
"https://www.nytimes.com/2001/02/06/business/prudential-adds-a-bank-analyst.html","null","2001-02-06","Nancy Bush is dismissed as bank analyst at Prudential Securities and believes Michael Mayo, prominent banking stock analyst, will be her replacement (M)","302","null","The New York Times","Business Day","News","article","Prudential Adds a Bank Analyst","Prudential Adds a Bank Analyst"
"https://www.nytimes.com/2001/11/01/world/a-nation-challenged-saudis-freeze-funds-of-66-on-us-list.html","null","2001-11-01","Saudi Arabia orders freeze on assets of people and organizations that United States has identified as sponsors of terrorism (M)","196","null","The New York Times","World","News","article","Saudis Freeze Funds Of 66 on U.S. List","A NATION CHALLENGED; Saudis Freeze Funds Of 66 on U.S. List"
"https://www.nytimes.com/2001/05/18/business/technology-briefing-internet-paper-putting-archives-online.html","Bloomberg News","2001-05-18","Washington Post Co, publisher of Washington Post, and Bell & Howell plan to post newspaper's archives on Internet; financial terms undisclosed (S)","78","null","The New York Times","Business Day","News","article","Technology Briefing | Internet: Paper Putting Archives Online","Technology Briefing | Internet: Paper Putting Archives Online"
"https://www.nytimes.com/2001/03/16/world/blasts-in-china-leave-at-least-18-dead.html","Craig Smith","2001-03-16","SHANGHAI, March 16 — A series of apparently coordinated blasts killed at least 18 people in an industrial city 120 miles south of Beijing early Friday, sending riot police into the streets and sparking rumors that laid-off factory workers were wre...","880","null","The New York Times","World","News","article","Blasts in China Leave at Least 18 Dead","Blasts in China Leave at Least 18 Dead"
"https://www.nytimes.com/2001/04/10/business/technology-math-error-may-mean-mp.3-owes-more-in-lawsuit.html","null","2001-04-10","Verdict in copyright lawsuit against MP3.com that resulted in award of $296,873 for independent record label Tee Vee Toons may have included mathematical error representing difference of millions of dollars; eight-person jury intended amount to be...","593","null","The New York Times","Business Day","News","article","Math Error May Mean MP.3 Owes More in Lawsuit","TECHNOLOGY; Math Error May Mean MP.3 Owes More in Lawsuit"
"https://www.nytimes.com/2001/11/28/business/world-business-briefing-europe-danube-river-shipping-revival.html","Peter Green","2001-11-28","Danube Commission says that shipping on Danube River should return by spring to levels that were normal before 1999 Kosovo war; commission, which groups 11 countries through which river flows, says work would begin soon on removing ruined bridges ...","110","null","The New York Times","Business Day","News","article","World Business Briefing | Europe: Danube River: Shipping Revival","World Business Briefing | Europe: Danube River: Shipping Revival"
"https://www.nytimes.com/2001/08/03/business/technology-briefing-internet-coming-soon-dot-name-addresses.html","Susan NYT","2001-08-03","Internet Corporation for Assigned Names and Numbers, or Icann, signs contract with Global Name Registry Ltd to distribute addresses with .name extension, available to individuals (S)","115","null","The New York Times","Business Day","News","article","Technology Briefing | Internet: Coming Soon: 'Dot-Name' Addresses","Technology Briefing | Internet: Coming Soon: 'Dot-Name' Addresses"
"https://www.nytimes.com/2001/07/10/business/world-business-briefing-europe-britain-producer-prices-flat.html","Bloomberg News","2001-07-10","British producer prices rose 0.1 percent in June after revised 0.4 percent gain in May; growth from June 2000 slowed to 0.4 percent from revised 0.7 percent (S)","71","null","The New York Times","Business Day","News","article","World Business Briefing | Europe: Britain: Producer Prices Flat","World Business Briefing | Europe: Britain: Producer Prices Flat"
"https://www.nytimes.com/2001/05/21/business/business-digest-413658.html","null","2001-05-21","","577","null","The New York Times","Business Day","Summary","article","BUSINESS DIGEST","BUSINESS DIGEST"
"https://www.nytimes.com/2001/12/17/business/frances-e-holberton-84-early-computer-programmer.html","Steve Lohr","2001-12-17","Frances Elizabeth Holberton, one of first computer programmers, dies at age 84; photo (M)","700","null","The New York Times","Business Day","Obituary; Biography","article","Frances E. Holberton, 84, Early Computer Programmer","Frances E. Holberton, 84, Early Computer Programmer"
"https://www.nytimes.com/2001/02/15/technology/l-retailer-s-lament-928658.html","null","2001-02-15","Brad Miles letter laments retailing trends","123","null","The New York Times","Technology","Letter","article","Retailer's Lament","Retailer's Lament"
"https://www.nytimes.com/2001/09/19/business/worldbusiness/IHT-tech-brief-altavista-cuts-jobs.html","Victoria Shannon","2001-09-19","","232","null","International Herald Tribune","Business Day","null","article","Tech Brief :ALTAVISTA CUTS JOBS","Tech Brief :ALTAVISTA CUTS JOBS"
"https://www.nytimes.com/2001/03/14/business/world-business-briefing-americas-brazil-s-industrial-output-is-up.html","Bloomberg News","2001-03-14","Brazil's industrial output grew at fastest pace in 11 months in January (S)","51","null","The New York Times","Business Day","News","article","BRAZIL'S INDUSTRIAL OUTPUT IS UP","WORLD BUSINESS BRIEFING: AMERICAS; BRAZIL'S INDUSTRIAL OUTPUT IS UP"
"https://www.nytimes.com/2001/03/22/technology/news-watch-cordless-and-no-longer-blind-see-how-the-mouse-runs.html","Stephen Miller","2001-03-22","Logitech to offer first cordless optical computer mouse; mouse has no tracking ball to control on-screen cursor and does not need special surface like mouse pad; uses radio frequency to transmit movements to computer (M)","191","null","The New York Times","Technology","News","article","Cordless and No Longer Blind: See How the Mouse Runs","NEWS WATCH; Cordless and No Longer Blind: See How the Mouse Runs"
"https://www.nytimes.com/2001/09/06/technology/l-laptop-learning-050938.html","null","2001-09-06","James A Ferguson letter on Aug 23 article hails educational value of laptop computers for high school students","160","null","The New York Times","Technology","Letter","article","Laptop Learning","Laptop Learning"
"https://www.nytimes.com/2001/05/04/business/company-news-macromedia-s-share-price-drops-23-percent.html","Bloomberg News","2001-05-04","Macromedia Inc lost $22 million in its fiscal fourth quarter; revenue rose to $89.1 million; shares fall 23 percent (S)","99","null","The New York Times","Business Day","News","article","MACROMEDIA'S SHARE PRICE DROPS 23 PERCENT","COMPANY NEWS; MACROMEDIA'S SHARE PRICE DROPS 23 PERCENT"
"https://www.nytimes.com/2001/05/01/world/zambian-leader-is-nominated-for-3rd-term-despite-dissent.html","Henri Cauvin","2001-05-01","Zambia's Pres Frederick Chiluba wins his party's nomination for his contentious campaign for third term in office, even as outrage mounts among some party's leaders; Zambia's Constitution bars third presidential term; Parliament would have to amen...","473","null","The New York Times","World","News","article","Zambian Leader Is Nominated For 3rd Term Despite Dissent","Zambian Leader Is Nominated For 3rd Term Despite Dissent"
"https://www.nytimes.com/2001/12/20/business/hawaii-s-2-airlines-to-merge-via-stock-swap.html","Laurence Zuckerman","2001-12-20","Hawaii's two airlines, battered by steep drop in tourism after Sept 1, agree to merger in deal that would place former president of Continental Airlines in charge of new combination; Hawaiian Airlines and Aloha Airlines, which have competed for 55...","527","null","The New York Times","Business Day","News","article","Hawaii's 2 Airlines to Merge via Stock Swap","Hawaii's 2 Airlines to Merge via Stock Swap"
"https://www.nytimes.com/2001/02/25/world/ninian-smart-73-author-and-scholar-of-comparative-religion.html","Wolfgang Saxon","2001-02-25","Roderick Ninian Smart, scholar of comparative religion, dies at age 73 (M)","349","null","The New York Times","World","Obituary; Biography","article","Ninian Smart, 73, Author and Scholar of Comparative Religion","Ninian Smart, 73, Author and Scholar of Comparative Religion"
"https://www.nytimes.com/2001/07/06/business/technology-companies-in-us-profiting-from-surge-in-internet-gambling.html","Matt Richtel","2001-07-06","American companies profit from boom in online gambling and from business relationships with virtual casinos based overseas whose games can be played in United States, where most states ban wagering over Internet; some state attorneys general say s...","1688","null","The New York Times","Business Day","News","article","Companies in U.S. Profiting From Surge In Internet Gambling","TECHNOLOGY; Companies in U.S. Profiting From Surge In Internet Gambling"
"https://www.nytimes.com/2001/01/26/business/argentina-off-to-fast-start-this-year.html","Clifford Krauss","2001-01-26","Buenos Aires stock market has begun year by soaring 26 percent, easily beating every other stock exchanges in world; impressive rise has led some investors to say that Argentina might be poised to return to days of early 1990's when, with governme...","708","null","The New York Times","Business Day","News","article","Argentina Off to Fast Start This Year","Argentina Off to Fast Start This Year"
"https://www.nytimes.com/2001/02/02/business/higher-ad-sales-help-primedia-narrow-losses.html","Bloomberg News","2001-02-02","Primedia Inc says fourth-quarter loss narrowed to $18.4 million from $19 million year ago; sales rose 0.8 percent, to $459.4 million from $455.6 million (M)","322","null","The New York Times","Business Day","News","article","Higher Ad Sales Help Primedia Narrow Losses","Higher Ad Sales Help Primedia Narrow Losses"
"https://www.nytimes.com/2001/09/06/technology/piracy-and-privacy-dear-user-this-bootleg-copy-will-self-destruct-in-30-days.html","null","2001-09-06","Microsoft has built anticopying mechanism into its new Windows XP computer operating system to curb software piracy; software, which can be activated only once, will self-destruct if not activated within 30 days (M)","735","null","The New York Times","Technology","News","article","Dear User: This Bootleg Copy Will Self-Destruct in 30 Days","PIRACY AND PRIVACY; Dear User: This Bootleg Copy Will Self-Destruct in 30 Days"
"https://www.nytimes.com/2001/11/14/business/us-move-to-extend-scope-of-payroll-tax.html","Bloomberg News","2001-11-14","Internal Revenue Service issues regulations requiring companies and employees to pay 15.3 percent payroll tax on exercise of incentive stock options and proceeds from employee stock purchase plans; it is first time in 30 years that payroll taxes w...","197","null","The New York Times","Business Day","News","article","U.S. Move to Extend Scope of Payroll Tax","U.S. Move to Extend Scope of Payroll Tax"
"https://www.nytimes.com/2001/07/17/business/worldbusiness/IHT-tech-briefhughes-shortfall.html","Victoria Shannon","2001-07-17","The satellite service provider Hughes Electronics Corp. cut its full-year revenue outlook to about $8.3 billion from about $8.76 billion. The company also cut full-year cash flow projections to a range of $450 million to $500 million from a previo...","849","null","International Herald Tribune","Business Day","null","article","Tech Brief:HUGHES SHORTFALL","Tech Brief:HUGHES SHORTFALL"
"https://www.nytimes.com/2001/08/23/business/the-media-business-advertising-addenda-agency-alliance-seeks-new-business.html","Stuart Elliott","2001-08-23","More than 35 independent public relations agencies that specialize in technology clients are forming alliance named Global Fluency to gain new business regionally and worldwide (S)","174","null","The New York Times","Business Day","News","article","Agency Alliance Seeks New Business","THE MEDIA BUSINESS: ADVERTISING -- ADDENDA; Agency Alliance Seeks New Business"
"https://www.nytimes.com/2001/10/23/business/soybean-processor-exceeds-forecasts.html","Bloomberg News","2001-10-23","Bunge Ltd reports third-quarter net income more than tripled, to $57 million, up from $17 million in 2000 period (M)","265","null","The New York Times","Business Day","News","article","Soybean Processor Exceeds Forecasts","Soybean Processor Exceeds Forecasts"
"https://www.nytimes.com/2001/04/01/business/personal-business-diary-an-11th-hour-checklist-for-saving-on-taxes.html","null","2001-04-01","Laurence I Foster, partner in accounting firm Richard A Eisner & Company, offers list of money-saving items taxpayers often overlook when filing their returns (M)","376","null","The New York Times","Business Day","News","article","An 11th-Hour Checklist For Saving on Taxes","PERSONAL BUSINESS: DIARY; An 11th-Hour Checklist For Saving on Taxes"
"https://www.nytimes.com/2001/04/14/world/collision-with-china-intelligence-gathering-listening-looking-old-methods-still.html","Christopher Drew","2001-04-14","American spy plane that was damaged in collision with Chinese fighter jet is still in China; as diplomats discuss its fate, issue arises whether this facet of spy game has outlived its usefulness; Chinese officials have clearly been aggravated by ...","669","null","The New York Times","World","News","article","Listening, Looking: Old Methods Still Work","COLLISION WITH CHINA: INTELLIGENCE-GATHERING; Listening, Looking: Old Methods Still Work"
"https://www.nytimes.com/2001/12/13/business/worldbusiness/world-business-briefing.html","null","2001-12-13","AUSTRALIA MORE FALLOUT FROM ONE.TEL Repercussions continue from the failure earlier this year of the start-up telecommunications company, One.Tel, backed by Rupert Murdoch and Kerry Packer. Australia's securities regulator accused several former d...","1041","null","The New York Times","Business Day","News","article","World Business Briefing","World Business Briefing"
