"|","|__writer_name","|__pub_date","|__snippet","|__word_count","|__score","|__source","|__section_name","|__type_of_material","|__document_type","|__main_headline","|__print_headline"
"https://www.nytimes.com/2013/01/15/world/americas/cubans-take-advantage-of-day-1-of-new-travel-rules.html","Victoria Burnett","2013-01-15","With costly travel fees and bureaucratic hurdles finally eliminated, many islanders who have long wished to go overseas flocked to get plane tickets and passports.","926","null","The New York Times","World","News","article","In First Day of New Rules, Cubans Make Travel Plans","In First Day of New Rules, Cubans Make Travel Plans"
"https://www.nytimes.com/2013/01/15/business/roche-hires-dr-john-reed-to-lead-research-operations.html","Andrew Pollack","2013-01-15","Dr. John C. Reed, the chief executive of the Sanford-Burnham Medical Research Institute, will become head of Roche’s pharmaceutical research and early development group in April.","715","null","The New York Times","Business Day","News","article","Roche Hires Academic to Take Lead on Research","Roches Hires Academic To Take Lead On Research"
"https://www.nytimes.com/2013/01/16/world/africa/italy-closes-benghazi-consulate-after-ambush-attempt.html","Elisabetta Povoledo","2013-01-15","An attempted attack on the Italian consul over the weekend raised concerns about the tenuous security situation in Libya, and in Benghazi in particular.","350","null","The New York Times","World","News","article","Italy Closes Consulate in Benghazi After New Attack","Italy Closes Consulate in Benghazi After New Attack"
"https://www.nytimes.com/2013/01/16/world/africa/panetta-says-us-will-offer-france-aid-but-not-troops-in-mali.html","Elisabeth Bumiller","2013-01-15","Defense Secretary Leon E. Panetta reiterated that the United States would offer France air and logistical support, but would not send any ground troops to Mali.","290","null","The New York Times","World","News","article","Panetta Says U.S. Still in Talks With French Over Mali Aid","Panetta Says U.S. Still in Talks With French Over Mali Aid"
"https://www.nytimes.com/2013/01/16/business/media/google-seen-as-prints-nemesis-is-honored-by-usa-today-for-creativity.html","Stuart Elliott","2013-01-16","The search giant will receive $1 million in full-page advertising space in USA Today after its submission won a contest.","924","null","The New York Times","Business Day","News","article","On Print’s Turf, Google Wins for Creativity","On Print’s Turf, Google Wins For Creativity"
"https://www.nytimes.com/2013/01/16/business/global-economy-is-looking-brighter-world-bank-says.html","Annie Lowrey","2013-01-15","After growing 2.3 percent in 2012, the world economy should pick up modestly in the coming years, from 2.4 percent this year to 3.3 percent in 2015.","820","null","The New York Times","Business Day","News","article","Global Economy Brightens With Modest Growth Ahead, World Bank Says","Global Economy Brightens With Modest Growth Ahead, World Bank Says"
"https://www.nytimes.com/2013/01/16/world/middleeast/consulate-said-to-support-claim-of-syrian-gas-attack.html","Michael Gordon","2013-01-16","A State Department cable said forces loyal to President Bashar al-Assad of Syria may have used chemical weapons in the city of Homs on Dec. 23, according to a report.","379","null","The New York Times","World","News","article","Consulate Supported Claim of Syria Gas Attack, Report Says","Consulate Supported Claim of Syria Gas Attack, Report Says"
"https://www.nytimes.com/2013/01/12/world/middleeast/un-expresses-dismay-over-saudi-execution-of-sri-lankan-maid.html","Nick Cumming-Bruce","2013-01-11","The woman, Rizana Nafeek, was beheaded on Wednesday for the death of a 4-month-old infant in her care in 2005, when she was 17.","253","null","The New York Times","World","News","article","U.N. Expresses Dismay Over Saudi Execution of Sri Lankan Maid","U.N. Expresses Dismay Over Saudi Execution of Sri Lankan Maid"
"https://www.nytimes.com/2013/01/13/your-money/the-auto-loan-that-went-haywire.html","David Segal","2013-01-12","After setting up automatic payments on her loan, a car owner started receiving mysterious refunds, and then a troublesome call from a bill collector.","950","null","The New York Times","Your Money","News","article","The Auto Loan That Went Haywire","The Auto Loan That Went Haywire"
"https://www.nytimes.com/2013/01/12/world/asia/us-can-speed-afghan-exit-obama-says.html","Mark Landler","2013-01-11","After meeting with President Hamid Karzai of Afghanistan, President Obama said American troops would play a supporting role to Afghans beginning this spring.","1013","null","The New York Times","World","News","article","Obama Accelerates Transition of Security to Afghans","Meeting With Karzai, Obama Accelerates Transition of Security to Afghans"
"https://www.nytimes.com/2013/01/12/world/africa/a-trail-of-bullet-casings-leads-from-africas-wars-to-iran.html","C. Chivers","2013-01-11","Researchers worked for years to locate the source of rifle and machine-gun ammunition in war-torn regions. The manufacturer was not one of Africa’s usual suspects.","1556","null","The New York Times","World","News","article","A Trail of Bullet Casings Leads From Africa’s Wars Back to Iran","A Trail of Bullet Casings Leads From Africa’s Wars Back to Iran"
"https://www.nytimes.com/2013/02/19/world/asia/for-his-second-act-japanese-premier-plays-it-safe-with-early-results.html","Martin Fackler","2013-02-19","Analysts say Prime Minister Shinzo Abe’s success hinges on whether he can lead his Liberal Democratic Party to victory in upper house elections in July.","1153","null","The New York Times","World","News","article","For His Second Act, Japanese Premier Plays It Safe, With Early Results","For His Second Act, Japanese Premier Plays It Safe, With Early Results"
"https://www.nytimes.com/2013/02/19/world/asia/un-reports-decline-in-killings-of-afghan-civilians.html","Alissa Rubin","2013-02-19","The annual United Nations report on civilian casualties found that the number killed in 2012 dropped last year, though the number of injured rose.","759","null","The New York Times","World","News","article","U.N. Report Shows Fewer Killings of Afghan Civilians, Suggesting Shift in War","U.N. Report Shows Fewer Killings of Afghan Civilians, Suggesting Shift in War"
"https://www.nytimes.com/2013/02/19/technology/chinas-army-is-seen-as-tied-to-hacking-against-us.html","David Sanger","2013-02-19","An overwhelming percentage of the attacks on American companies and government agencies start in a building on the edge of Shanghai, say cybersecurity experts and American intelligence officials.","2979","null","The New York Times","Technology","News","article","Chinese Army Unit Is Seen as Tied to Hacking Against U.S.","China’s Army Seen as Tied To Hacking Against U.S."
"https://www.nytimes.com/2013/02/20/world/europe/president-sargsyan-wins-easy-victory-in-armenia-election.html","null","2013-02-19","Armenians returned President Serzh Sargsyan to office for a second five-year term, with preliminary results showing him with about 59 percent of the vote.","763","null","The New York Times","World","News","article","Incumbent Wins Easy Victory in Armenia","Incumbent Wins Easy Victory in Armenia"
"https://www.nytimes.com/2013/02/20/world/europe/nestle-pulls-2-products-in-horse-meat-scandal.html","Stephen Castle","2013-02-19","Nestlé, one of the world’s best-known food companies, said it was removing pasta meals from store shelves in Italy and Spain.","772","null","The New York Times","World","News","article","Nestlé Removes  2 Products in Horse Meat Scandal","Meat Tests Cause Nestlé To Remove 2 Products"
"https://www.nytimes.com/2013/02/18/world/europe/18iht-educbriefs18.html","Calvin Yang","2013-02-19","The Alfred Denny Museum, at the University of Sheffield, has decided to open to the public on a regular basis after an event drew huge public interest.","408","null","International Herald Tribune","World","News","article","Natural History Museum Opens Doors to Public","Natural History Museum Opens Doors to Public"
"https://www.nytimes.com/2013/02/20/technology/nanotubes-seen-as-an-alternative-to-silicon-circuits.html","John Markoff","2013-02-19","Carbon nanotubes may prove to be the material of the future when today’s silicon-based chips reach their fundamental physical limits.","779","null","The New York Times","Technology","News","article","Nanotubes Seen as Alternative When Silicon Chips Hit Their Limits","Nanotubes Seen as Alternative When Silicon Chips Hit Their Limits"
"https://www.nytimes.com/2013/02/20/business/media/world-wildlife-fund-anti-poaching-campaign-avoids-violent-images.html","Andrew Newman","2013-02-20","Rather than showing violent imagery, the World Wildlife Fund’s advertising campaign presents animals in their most majestic of states.","904","null","The New York Times","Business Day","News","article","Avoiding Violent Images for an Anti-Poaching Campaign","Avoiding Violent Images for an Anti-Poaching Campaign"
"https://www.nytimes.com/2013/02/20/world/africa/seven-members-of-french-family-kidnapped-in-cameroon.html","Adam Nossiter","2013-02-20","The family, including four children, was seized in the north, the second hostage-taking in the region in four days.","627","null","The New York Times","World","News","article","French Family Kidnapped in Cameroon","French Family Kidnapped in Cameroon"
"https://www.nytimes.com/2013/02/20/business/battle-lines-drawn-for-bps-day-in-court.html","Clifford Krauss","2013-02-20","A collection of cases on the Deepwater Horizon spill are headed for federal court, where they are expected to have a broad effect on environmental law.","1306","null","The New York Times","Business Day","News","article","Battle Lines Drawn for BP’s Day in Court","Battle Lines for the BP Spill"
"https://www.nytimes.com/2013/02/12/business/lessons-from-a-talkative-airplane-seatmate-frequent-flier.html","Elana Drell-Szyfer","2013-02-11","Elana Drell-Szyfer, chief executive of Ahava North America, found herself sitting next to an 80-year-old Catholic nun on a flight to Israel.","613","null","The New York Times","Business Day","News","article","Something Wise From a Talkative Seatmate","Something Wise From a Talkative Seatmate"
"https://www.nytimes.com/2013/02/12/world/asia/zen-buddhists-roiled-by-accusations-against-teacher.html","Mark Oppenheimer","2013-02-11","An independent council of Zen leaders has said that the Buddhist teacher Joshu Sasaki sexually harassed female students.","1527","null","The New York Times","World","News","article","Zen Groups Distressed by Accusations Against Teacher","Zen Groups Distressed by Accusations Against Teacher"
"https://www.nytimes.com/2013/02/12/world/middleeast/syrian-insurgents-claim-to-control-large-hydropower-dam.html","Hwaida Saad","2013-02-12","The Tabqa Dam, Syria’s biggest, is considered a potent weapon in the battle for allegiances in the nearly two-year-old conflict.","717","null","The New York Times","World","News","article","Syrian Insurgents Claim to Control Large Hydropower Dam","Syrian Insurgents Claim to Control Large Hydropower Dam"
"https://www.nytimes.com/2013/02/12/business/shells-move-to-fix-drill-vessels-imperils-arctic-plans.html","Clifford Krauss","2013-02-12","The company’s ambitious oil exploration program in the Arctic has been hindered by delays for the last seven years.","799","null","The New York Times","Business Day","News","article","Shell Vessels Sidelined, Imperiling Arctic Plans","Shell Vessels Sidelined, Imperiling Arctic Plans"
"https://www.nytimes.com/2013/02/12/world/asia/north-korea-draws-new-china-scrutiny.html","Jane Perlez","2013-02-12","Pyongyang’s plans for a new nuclear test could force a showdown on the issue with a close ally.","1042","null","The New York Times","World","News","article","North Korea Draws New China Scrutiny","North Korea Draws New China Scrutiny "
"https://www.nytimes.com/2013/02/12/business/2012-was-the-safest-year-for-airlines-globally-since-1945.html","Jad Mouawad","2013-02-12","It will be four years on Tuesday since the last fatal crash in the United States, a record unmatched since propeller planes gave way to the jet.","1248","null","The New York Times","Business Day","News","article","Airline Industry at Its Safest Since the Dawn of the Jet Age","Airline Industry at Its Safest Since the Dawn of the Jet Age"
"https://www.nytimes.com/2013/02/12/business/tv-show-mirrors-a-japanese-battery-makers-bind.html","Hiroko Tabuchi","2013-02-12","The plot of the Japanese television series “Made in Japan” underscores the hopes the country has pinned on technologies like lithium-ion batteries.","1344","null","The New York Times","Business Day","News","article","TV Show Mirrors a Japanese Battery Maker’s Bind","TV Show Mirrors a Japanese Battery Maker’s Bind"
"https://www.nytimes.com/2013/02/12/world/asia/north-korea-nuclear-test.html","David Sanger","2013-02-12","North Korea set off a nuclear test on Tuesday, its official news service said, and preliminary estimates suggested it was far larger than the previous two conducted by the North.","1223","null","The New York Times","World","News","article","North Korea Confirms It Conducted 3rd Nuclear Test","Evidence Points to Nuclear Test  by North Korea"
"https://www.nytimes.com/2013/02/13/world/middleeast/syrian-rebels-claim-to-have-seized-military-airfield-and-warplanes.html","Hwaida Saad","2013-02-12","The development, if confirmed, represents the second strategic setback for President Bashar al-Assad’s government this week.","853","null","The New York Times","World","News","article","Syrian Rebels Say They Have Seized a Military Airfield and Its Warplanes","Syrian Rebels Say They Have Seized a Military Airfield and Its Warplanes"
"https://www.nytimes.com/2013/02/13/world/middleeast/hundreds-on-police-force-protest-egypts-government.html","Mayy Sheikh","2013-02-13","Officials of a police union that called for a strike charged that President Mohamed Morsi and his Islamist allies had used the police to beat back demonstrations by his political opponents.","416","null","The New York Times","World","News","article","Hundreds on Police Force Protest Egypt’s Government","Hundreds on Police Force Protest Egypt’s Government"
"https://www.nytimes.com/2013/02/13/world/asia/despite-claims-of-third-blast-north-korean-nuclear-program-remains-a-mystery.html","William Broad","2013-02-13","Experts don’t yet know if the latest detonation used plutonium or uranium, or if it was nuclear at all.","979","null","The New York Times","World","News","article","A Secretive Country Gives Experts Few Clues to Judge Its Nuclear Program","A Secretive Country Gives Experts Few Clues to Judge Its Nuclear Program"
"https://www.nytimes.com/2013/02/14/world/middleeast/israel-australia-prisoner-x.html","Jodi Rudoren","2013-02-13","Australia’s foreign minister on Wednesday ordered an investigation into his government’s handling of the 2010 detention and death of an Australian immigrant to Israel.","995","null","The New York Times","World","News","article","More Details Emerging About Israel’s Prisoner X","More Details Emerging About Israel’s Prisoner X"
"https://www.nytimes.com/2013/02/18/technology/18iht-rawdata18.html","Kevin O'Brien","2013-02-17","With economic growth near the top of the agenda, a balkanized industry is coming under new scrutiny that could dismantle some of the structural obstacles to a single market.","687","null","International Herald Tribune","Technology","News","article","A New Chance to Organize Europe’s Telecommunications Industry","A New Chance to Organize the E.U. Telecommunications Industry"
"https://www.nytimes.com/2013/02/18/business/fast-furious-6-focuses-on-its-online-following-for-promotion.html","Brooks Barnes","2013-02-18","Universal’s “Fast & Furious” series is a second-class citizen in Hollywood, but not online, where it has more Facebook “likes” than any active film series except “Avatar.”","1107","null","The New York Times","Business Day","News","article","‘Fast & Furious’ Stresses Social Side of Fandom","‘Fast & Furious’ Stresses Social Side of Fandom"
"https://www.nytimes.com/2013/02/18/world/asia/kabuls-car-guantanamo-where-vehicles-rot-and-trust-goes-to-die.html","Azam Ahmed","2013-02-18","Behind high stone walls are thousands of cars, trucks, vans, motorcycles and even bicycles, lined up in vehicular purgatory after falling afoul of the Kabul traffic police.","1280","null","The New York Times","World","News","article","In Kabul’s ‘Car Guantánamo,’ Autos Languish and Trust Dies","In Kabul’s ‘Car Guantánamo,’ Autos Languish and Trust Dies"
"https://www.nytimes.com/2013/02/18/technology/tech-industry-sets-its-sights-on-gambling.html","David Streitfeld","2013-02-18","With some states poised to clear the way for legal gambling on the Internet, Silicon Valley’s traditional gaming companies are expanding to meet the expected deluge of players.","1401","null","The New York Times","Technology","News","article","Tech Industry Sets Its Sights on Gambling","Tech Industry Sets Its Sights On Gambling"
"https://www.nytimes.com/2013/02/18/world/americas/rafael-correa-wins-re-election-in-ecuador.html","William Neuman","2013-02-18","The vote showed the broad popularity of President Rafael Correa’s government’s social programs and support for the poor.","665","null","The New York Times","World","News","article","President Correa Handily Wins Re-election in Ecuador","President Correa Easily Wins Re-election in Ecuador"
"https://www.nytimes.com/2013/02/19/world/europe/russian-scientists-say-they-found-meteorite-fragments.html","Andrew Kramer","2013-02-18","On Friday, terror rained from the skies in Siberia, but by Monday, what fell from the sky had turned to gold for people who rushed to retrieve meteorite fragments.","1282","null","The New York Times","World","News","article","Russians Wade Into the Snow to Seek Treasure From the Sky","Russians Wade Into the Snow To Seek Treasure From the Sky"
"https://www.nytimes.com/2013/02/19/business/global/possible-challenge-to-macau-gambling-takes-shape-in-hainan.html","null","2013-02-18","A casino bar is the Chinese government's first approval, albeit tacit, of a gambling concept outside Macau and apart from two state-run lotteries.","995","null","International Herald Tribune","Business Day","News","article","Possible Challenge to Macau Gambling Takes Shape in Hainan","Possible Challenge to Macau Gambling Takes Shape in Hainan"
"https://www.nytimes.com/2013/02/19/world/americas/chavez-returns-to-venezuela-after-cancer-surgery-in-cuba.html","William Neuman","2013-02-18","The predawn homecoming of President Hugo Chávez more than two months after having cancer surgery did little to dispel the uncertainty over who was running the country.","1231","null","The New York Times","World","News","article","Chávez Returns to Venezuela, Trailing Doubts","Chávez Returns To Venezuela, Trailing Doubts"
"https://www.nytimes.com/2013/02/19/world/europe/19iht-letter19.html","Judy Dempsey","2013-02-18","In a bid to prevent European companies from selling electronic eavesdropping gear to Bahrain, several groups have filed a complaint with the Organization for Economic Cooperation and Development.","748","null","International Herald Tribune","World","News","article","An Attempt to Take Tools From Tyrants","An Attempt to Take Tools From Tyrants"
"https://www.nytimes.com/2013/02/19/business/global/draghi-seeks-to-quiet-talk-about-global-currency-war.html","James Kanter","2013-02-18","Mario Draghi, the president of the European Central Bank, urged financial officials not to say anything that would contribute to fears of a global currency war.","954","null","The New York Times","Business Day","News","article","Draghi Seeks to Ease Talk of Global Currency War","Draghi Seeks to Ease Talk of Global Currency War"
"https://www.nytimes.com/2013/02/19/business/strangers-on-a-flight-just-taking-a-fling-frequent-flier.html","Brian Balthazar","2013-02-19","Brian Balthazar, director of programming at HGTV, likes business travel. He says when you fly a lot, almost anything can happen.","618","null","The New York Times","Business Day","News","article","Strangers on a Flight, Just Taking a Fling","Strangers on a Flight, Just Taking a Fling"
"https://www.nytimes.com/2013/02/14/business/global/obama-pledges-trade-pact-talks-with-eu.html","James Kanter","2013-02-13","Officials from Washington and Brussels say they have already resolved some of the stickiest issues, but concede that the details could hit snags.","1502","null","International Herald Tribune","Business Day","News","article","A Running Start for a U.S.-Europe Trade Pact","A Running Start for a U.S.-Europe Trade Pact"
"https://www.nytimes.com/2013/02/14/business/health-officials-urge-fda-action-on-soft-drinks.html","Stephanie Strom","2013-02-13","Led by the Center for Science in the Public Interest, the group says the scientific consensus is that the level of added sugars in soft drinks is unsafe.","942","null","The New York Times","Business Day","News","article","Health Officials Urge F.D.A. to Limit Sweeteners in Sodas","Health Officials Urge F.D.A. to Limit Sweeteners in Sodas"
"https://www.nytimes.com/2013/02/14/technology/personaltech/apps-let-you-take-karaoke-with-you.html","Kit Eaton","2013-02-13","Mobile apps give singers access to song lyrics and backing tracks, and at least one provides voice coaching.","824","null","The New York Times","Technology","News","article","Practice for ‘The Voice’ by Using Yours With Mobile Karaoke","Practice for ‘The Voice’ by Using Yours With Mobile Karaoke"
"https://www.nytimes.com/2013/02/14/world/asia/in-japan-the-fax-machine-is-anything-but-a-relic.html","Martin Fackler","2013-02-14","The reluctance to give up fax machines offers a revealing glimpse into an aging nation that can often seem quietly determined to stick to its tried-and-true ways.","1208","null","The New York Times","World","News","article","In High-Tech Japan, the Fax Machines Roll On","In High-Tech Japan, the Fax Machines Roll On"
"https://www.nytimes.com/2013/02/14/world/middleeast/israel-museums-herod-show-draws-anger-over-use-of-west-bank-objects.html","Jodi Rudoren","2013-02-14","The Palestinian Authority says the exhibition is a violation of international law because much of its material was taken from the Israeli-occupied West Bank.","832","null","The New York Times","World","News","article","Anger That a Herod Show Uses West Bank Objects","Anger That a Herod Show Uses West Bank Objects"
"https://www.nytimes.com/2013/02/14/world/asia/in-india-kisses-are-on-rise-even-in-public.html","Gardiner Harris","2013-02-14","Indian couples have not always embraced kissing in front of others. Recent studies, backed by interviews with sociologists and psychiatrists, suggest that is changing.","1231","null","The New York Times","World","News","article","In India, Kisses Are on Rise, Even in Public","In India, Kisses Are on Rise, Even in Public"
"https://www.nytimes.com/2013/02/15/business/global/chinese-plan-to-invest-in-cambodia-is-big-but-vague.html","Andrew C","2013-02-14","The $11 billion proposal calls for construction of a steel plant and seaport to be linked by a new 400-kilometer railroad.","1254","null","International Herald Tribune","Business Day","News","article","Chinese Plan to Invest in Cambodia Is Big, but Vague","Cambodia Plan Is Big, but Vague"
"https://www.nytimes.com/2013/02/15/business/global/japanese-central-bank-defends-yen-policies.html","Hiroko Tabuchi","2013-02-14","The recent monetary push by Japan seeks to stabilize the economy, not influence currencies, the central bank said.","505","null","The New York Times","Business Day","News","article","Japan’s Central Bank Defends Policy on the Yen","Japanese Central Bank Defends Yen Policies"
"https://www.nytimes.com/2013/02/20/business/a-digital-shift-on-health-data-swells-profits.html","Julie Creswell","2013-02-20","As doctors and hospitals struggle to make new records systems work, the winners are big companies that lobbied for the legislation that allowed their sales to soar.","1347","null","The New York Times","Business Day","News","article","A Digital Shift on Health Data Swells Profits in an Industry","A Digital Shift On Health Data Swells Profits"
"https://www.nytimes.com/2013/02/21/business/economy/fed-meeting-shows-divisions-on-policy-course.html","Binyamin Appelbaum","2013-02-20","A vocal minority of Federal Reserve officials has questioned moves to reduce joblessness, but supporters of those efforts remain firmly in control.","920","null","The New York Times","Business Day","News","article","Fed Meeting Shows Dissent on Measures to Lift Job Growth","Fed Meeting Shows Growing Dissent on Measures to Lift Job Growth"
"https://www.nytimes.com/2013/02/21/business/boeing-to-propose-battery-fixes-to-faa.html","Christopher Drew","2013-02-20","A top executive will meet with agency officials on Friday to outline efforts to get the Boeing 787 back in the air.","850","null","The New York Times","Business Day","News","article","Boeing to Propose Redesign of 787 Battery to F.A.A.","Boeing to Propose Redesign of 787 Battery to F.A.A."
"https://www.nytimes.com/2013/02/21/technology/sony-unveils-playstation-4-aiming-for-return-to-glory.html","Brian Chen","2013-02-21","Sony held a gathering in New York City to introduce its new PlayStation, but it did not unveil the console and did not say when it would go on sale.","929","null","The New York Times","Technology","News","article","With PlayStation 4, Sony Aims for Return to Glory","With PlayStation 4, Sony Hopes to Regain Past Glory"
