"|","|__writer_name","|__pub_date","|__snippet","|__word_count","|__score","|__source","|__section_name","|__type_of_material","|__document_type","|__main_headline","|__print_headline"
"https://www.nytimes.com/2003/03/25/business/company-news-computer-consultant-names-chief-financial-officer.html","Bloomberg News","2003-03-25","BearingPoint Inc names Robert Falcone chief financial officer, succeeding Robert Lamb, who resigned (S)","85","null","The New York Times","Business Day","News","article","COMPUTER CONSULTANT NAMES CHIEF FINANCIAL OFFICER","COMPANY NEWS; COMPUTER CONSULTANT NAMES CHIEF FINANCIAL OFFICER"
"https://www.nytimes.com/2003/04/01/business/company-news-general-motors-extends-no-interest-loans-to-5-years.html","Bloomberg News","2003-04-01","General Motors will extend no-interest loans to five years on most of its models in April because of slower-than-expected March (S)","104","null","The New York Times","Business Day","News","article","GENERAL MOTORS EXTENDS NO-INTEREST LOANS TO 5 YEARS","COMPANY NEWS; GENERAL MOTORS EXTENDS NO-INTEREST LOANS TO 5 YEARS"
"https://www.nytimes.com/2003/01/22/business/company-news-teva-says-british-court-invalidates-2-merck-patents.html","Bloomberg News","2003-01-22","Teva Pharmaceutical Industries, leading maker of generic drugs, says British court invalidated two Merck & Co patents for osteoporosis drug Fosamax; Merck will appeal; Teva says it will not introduce generic version of Fosamax in Britain until 200...","81","null","The New York Times","Business Day","News","article","TEVA SAYS BRITISH COURT INVALIDATES 2 MERCK PATENTS","COMPANY NEWS; TEVA SAYS BRITISH COURT INVALIDATES 2 MERCK PATENTS"
"https://www.nytimes.com/2003/11/02/jobs/home-front-helping-the-economy-one-snip-at-a-time.html","Joseph Fried","2003-11-02","Home Front interview with Santa Cruz on her hair salon business, which has gone from small shop two decades ago to three locations in Manhattan, employing 15 people; photo (S)","692","null","The New York Times","Job Market","News","article","Helping the Economy, One Snip at a Time","HOME FRONT; Helping the Economy, One Snip at a Time"
"https://www.nytimes.com/2003/07/22/world/after-the-war-official-tour-wolfowitz-sees-challenges-and-vindication-in-iraq.html","Eric Schmitt","2003-07-22","Deputy Sec Paul Wolfowitz visits Mosul and sees newly elected, multi-ethnic local council as fruit of long personal mission to oust Saddam Hussein; roadside bomb explodes near US convoy, killing soldier and Iraqi interpreter; Wolfowitz's five-day ...","1468","null","The New York Times","World","News","article","Wolfowitz Sees Challenges, And Vindication, in Iraq","AFTER THE WAR: OFFICIAL TOUR; Wolfowitz Sees Challenges, And Vindication, in Iraq"
"https://www.nytimes.com/2003/05/16/world/aftereffects-riyadh-attacks-us-agents-arrive-to-join-saudi-bombing-investigation.html","Steven Weisman","2003-05-16","Team of agents from Federal Bureau of Investigation lands in Riyadh, Saudi Arabia, hoping to track down those involved in bombing attack on housing compounds in Riyadh; say they hope to get full cooperation from Saudi authorities, noting widesprea...","1085","null","The New York Times","World","News","article","U.S. Agents Arrive to Join Saudi Bombing Investigation","AFTEREFFECTS: RIYADH ATTACKS; U.S. Agents Arrive to Join Saudi Bombing Investigation"
"https://www.nytimes.com/2003/07/06/business/market-insight-temporary-workers-a-barometer-of-recovery.html","Kenneth Gilpin","2003-07-06","Excerpts from interview with Greg Cappelli, business and professional services analyst at Credit Suisse First Boston, on prospects for companies that place temporary employees; photo (M)","768","null","The New York Times","Business Day","Interview","article","Temporary Workers: A Barometer Of Recovery","MARKET INSIGHT; Temporary Workers: A Barometer Of Recovery"
"https://www.nytimes.com/2003/04/04/business/worldbusiness/world-business-briefing-americas.html","null","2003-04-04","BRAZIL: Financial Revision Advances; CANADA: Bank Has Write-Down;.","445","null","The New York Times","Business Day","News","article","World Business Briefing: Americas","World Business Briefing: Americas"
"https://www.nytimes.com/2003/01/27/world/china-court-rejects-appeal-of-tibetan-monk-sentenced-to-death-for-separatism.html","Erik Eckholm","2003-01-27","Chinese court rejects appeal of prominent Tibetan monk whose death sentence for bombing and separatist activities touched off world outcry; monk, Tenzin Deleg Rimpoche, is religious leader in remote ethnic Tibetan region of Sichuan Province; Chine...","270","null","The New York Times","World","News","article","China Court Rejects Appeal of Tibetan Monk Sentenced to Death for Separatism","China Court Rejects Appeal of Tibetan Monk Sentenced to Death for Separatism"
"https://www.nytimes.com/2003/07/08/world/workers-in-argentina-take-over-abandoned-factories.html","Larry Rohter","2003-07-08","Across Argentina, at least 160 factories employing estimated 10,000 people are being run as cooperatives by their employees; this is result of economy collapse 18 months ago, which prompted owners of many factories to shut their doors and walk awa...","1000","null","The New York Times","World","News","article","Workers in Argentina Take Over Abandoned Factories","Workers in Argentina Take Over Abandoned Factories"
"https://www.nytimes.com/2003/06/03/business/russia-japan-natural-gas-project-advances.html","James Brooke","2003-06-03","Oil and gas alliance led by Royal Dutch/Shell Group signs contract for more than $2 billion with Russian-Japanese alliance, clearing way for construction to begin on Russia's first liquified natural gas plant; plant is part of project that will su...","490","null","The New York Times","Business Day","News","article","Russia-Japan Natural Gas Project Advances","Russia-Japan Natural Gas Project Advances"
"https://www.nytimes.com/2003/06/11/business/company-news-brunswick-buys-game-maker-for-34.5-million.html","Bloomberg News","2003-06-11","Brunswick Corp acquires Valley-Dynamo LP, maker of commercial and consumer pool, foosball and table hockey products, for $34.5 million; will add Valley-Dynamo to its Brunwick Billiards division (S)","60","null","The New York Times","Business Day","News","article","BRUNSWICK BUYS GAME MAKER FOR $34.5 MILLION","COMPANY NEWS; BRUNSWICK BUYS GAME MAKER FOR $34.5 MILLION"
"https://www.nytimes.com/2003/09/03/business/at-t-suit-says-worldcom-used-fraud-in-routing-calls.html","Bloomberg News","2003-09-03","AT&T Corp files federal racketeering lawsuit against WorldCom Inc, accusing it of fraudulently routing calls; also accuses WorldCom of mail and wire fraud; suit seeks unspecified damages and also names phone company Onvoy; competitors, including V...","294","null","The New York Times","Business Day","News","article","AT&T Suit Says WorldCom Used Fraud in Routing Calls","AT&T Suit Says WorldCom Used Fraud in Routing Calls"
"https://www.nytimes.com/2003/07/01/business/world-business-briefing-europe-britain-toy-store-bidding.html","Bloomberg News","2003-07-01","Hamleys, British toy retailer thap","123","null","The New York Times","Business Day","News","article","World Business Briefing | Europe: Britain: Toy Store Bidding","World Business Briefing | Europe: Britain: Toy Store Bidding"
"https://www.nytimes.com/2003/11/20/business/pbhg-founders-could-face-suit.html","null","2003-11-20","Securities and Exchange Commission and New York State Atty Gen Eliot L Spitze5r could take action against PBHG Funds' founders Gary L Pilgrim and Harry J Baxter, as well as firm itself, as early as Nov 20 (S)","125","null","The New York Times","Business Day","News","article","PBHG Founders Could Face Suit","PBHG Founders Could Face Suit"
"https://www.nytimes.com/2003/01/15/international/us-urges-hussein-to-abdicate-as-inspectors-check-palace.html","Brian Knowlton","2003-01-15","As inspectors pressed their search for illegal weapons, the U.S. suggested today that Saddam Hussein leave his country.","922","null","The New York Times","World","News","article","U.S. Urges Hussein to Abdicate, as Inspectors Check Palace","U.S. Urges Hussein to Abdicate, as Inspectors Check Palace"
"https://www.nytimes.com/2003/06/04/business/indonesia-is-asian-exception-shrugging-off-dollar-s-fall.html","Wayne Arnold","2003-06-04","Indonesia, unlike its neighbors, benefits from falling United States dollar and rise in value of its rupiah; strong rupiah is making foreign debts easier to repay, attracting investors and holding down inflation (M)","710","null","The New York Times","Business Day","News","article","Indonesia Is Asian Exception, Shrugging Off Dollar's Fall","Indonesia Is Asian Exception, Shrugging Off Dollar's Fall"
"https://www.nytimes.com/2003/07/30/business/business-digest-712604.html","null","2003-07-30","","544","null","The New York Times","Business Day","Summary","article","BUSINESS DIGEST","BUSINESS DIGEST"
"https://www.nytimes.com/2003/06/06/business/technology-briefing-hardware-national-semiconductor-posts-net-loss.html","Bloomberg News","2003-06-06","National Semiconductor Corp posts second consecutive quarterly loss as sales increase at slowest pace in more than year; net loss put at $4.4 million, or 2 cents a share, in fourth quarter ended May 25 (S)","135","null","The New York Times","Business Day","News","article","Technology Briefing | Hardware: National Semiconductor Posts Net Loss","Technology Briefing | Hardware: National Semiconductor Posts Net Loss"
"https://www.nytimes.com/2003/06/24/business/the-media-business-advertising-addenda-miami-agency-wins-international-prize.html","Stuart Elliott","2003-06-24","Crispin, Porter & Bogusky takes top honors in commercials category at annual International Advertising Festival in Cannes, France; other winners noted (S)","307","null","The New York Times","Business Day","News","article","Miami Agency Wins International Prize","THE MEDIA BUSINESS: ADVERTISING -- ADDENDA; Miami Agency Wins International Prize"
"https://www.nytimes.com/2003/12/19/business/world-business-briefing-asia-malaysia-rail-plan-shelved.html","Wayne NYT","2003-12-19","Government of Malaysia's","79","null","The New York Times","Business Day","News","article","World Business Briefing | Asia: Malaysia: Rail Plan Shelved","World Business Briefing | Asia: Malaysia: Rail Plan Shelved"
"https://www.nytimes.com/2003/03/11/business/worldbusiness/opec-agrees-to-keep-oil-output-quotas.html","null","2003-03-11","The accord to keep its output limit at 24.5 million barrels a day signals OPEC will wait until a war starts with Iraq before boosting supplies.","945","null","The New York Times","Business Day","News","article","OPEC Agrees to Keep Oil Output Quotas","OPEC Agrees to Keep Oil Output Quotas"
"https://www.nytimes.com/2003/01/19/world/threats-responses-evidence-us-accelerates-its-efforts-build-case-against-iraq.html","Steven Weisman","2003-01-19","Bush administration is concerned that 'smoking gun' may never be found in Iraq; it is urgently assembling argument that Baghdad's withholding of weapons information, and its refusal to make scientists freely available, should persuade American all...","1101","null","The New York Times","World","News","article","U.S. Accelerates Its Efforts To Build a Case Against Iraq","THREATS AND RESPONSES: THE EVIDENCE; U.S. Accelerates Its Efforts To Build a Case Against Iraq"
"https://www.nytimes.com/2003/09/19/business/ray-h-jordan-innovator-at-jc-penney-dies-at-98.html","Barnaby Feder","2003-09-19","Ray H Jordan, who led J C Penney's move into catalog sales in 1962 and then became president of company during period of rapid expansion, dies at age of 98; photo (M)","423","null","The New York Times","Business Day","Biography","article","Ray H. Jordan, Innovator At J.C. Penney, Dies at 98","Ray H. Jordan, Innovator At J.C. Penney, Dies at 98"
"https://www.nytimes.com/2003/05/20/world/anti-tobacco-pact-gains-despite-firms-lobbying.html","Alison Langley","2003-05-20","World Health Orgn is expected to adopt tobacco control treaty at its annual assembly in Geneva, despite lobbying efforts of major tobacco companies; if approved, it will have to go to 92 member nations for ratification; Tommy G Thompson, secretary...","895","null","The New York Times","World","News","article","Anti-Tobacco Pact Gains Despite Firms' Lobbying","Anti-Tobacco Pact Gains Despite Firms' Lobbying"
"https://www.nytimes.com/2003/10/17/business/interim-chief-details-exchange-overhaul.html","null","2003-10-17","","82","null","The New York Times","Business Day","Summary","article","Interim Chief Details Exchange Overhaul","Interim Chief Details Exchange Overhaul"
"https://www.nytimes.com/2003/02/05/business/technology-cisco-sees-no-upturn-soon-for-technology-spending.html","Matt Richtel","2003-02-05","Cisco Systems Inc reports that its sales held steady last quarter amid continued technology downturn; chief executive John T Chambers suggests upturn is not imminent; company reports sales were $4.71 billion in its second quarter, down from $4.8 b...","663","null","The New York Times","Business Day","News","article","Cisco Sees No Upturn Soon for Technology Spending","TECHNOLOGY; Cisco Sees No Upturn Soon for Technology Spending"
"https://www.nytimes.com/2003/12/26/business/technology-to-fool-auditors-from-colored-pens-to-computer-scanners.html","Floyd Norris","2003-12-26","Floyd Norris column deplores credulity of auditors who swallowed Parmalat's claim to have had 3.95 billion euros in bank account in Cayman Islands; says they should have wondered why company with such an unheard-of amount of cash in the bank would...","594","null","The New York Times","Business Day","News","article","Technology to Fool Auditors: From Colored Pens to Computer Scanners","Technology to Fool Auditors: From Colored Pens to Computer Scanners"
"https://www.nytimes.com/2003/07/13/world/armed-with-pencils-army-of-census-workers-fans-out-into-afghan-outback.html","Carlotta Gall","2003-07-13","Census takers from Afghanistan's Central Statistics Office fan out in effort to take nation's first census in 23 years; census is occurring simultaneously with consultations on new constitution; Ghulam Hazrat, controller of project, say no one rea...","922","null","The New York Times","World","News","article","Armed With Pencils, Army of Census Workers Fans Out Into Afghan Outback","Armed With Pencils, Army of Census Workers Fans Out Into Afghan Outback"
"https://www.nytimes.com/2003/03/21/international/worldspecial/urgent-mystery-at-outset-was-hussein-hit.html","Elisabeth Bumiller","2003-03-21","U.S. officials said that they were not sure which, if any, top Iraqi officials where killed in the first airstrike on Baghdad.","1069","null","The New York Times","World","News","article","Urgent Mystery at Outset: Was Hussein Hit?","Urgent Mystery at Outset: Was Hussein Hit?"
"https://www.nytimes.com/2003/07/20/business/c-corrections-575704.html","null","2003-07-20","Correction of July 13 article on science underlying new skin care treatments: main ingredient in some products sold by dermatologists is human growth factor, not human growth hormone","31","null","The New York Times","Business Day","Correction","article","Corrections","Corrections"
"https://www.nytimes.com/2003/12/06/world/rumsfeld-visits-georgia-to-bind-a-partnership-with-an-ally.html","Thom Shanker","2003-12-06","Defense Sec Donald Rumsfeld visits Georgia, first senior administration official to do so since peaceful revolt forced out government of Eduard Shevardnadze; expresses strong support for nation in face of rising secessionist sentiment; is greeted ...","554","null","The New York Times","World","News","article","Rumsfeld Visits Georgia to Bind A Partnership With an Ally","Rumsfeld Visits Georgia to Bind A Partnership With an Ally"
"https://www.nytimes.com/2003/11/27/business/worldbusiness/IHT-eu-deficit-deal-could-shake-confidence.html","Eric Pfanner","2003-11-27","The apparent demise of the strict fiscal rules underpinning the euro could help European governments spend their way out of future recessions, but it comes too late to provide much of a lift to their economies in the short term, analysts say.. Wha...","4271","null","International Herald Tribune","Business Day","null","article","EU deficit deal could shake confidence","EU deficit deal could shake confidence"
"https://www.nytimes.com/2003/05/08/business/earnings-decline-at-pixar.html","Bloomberg News","2003-05-08","Pixar Animation Studios says first-quarter profit declined 48 percent; net income fell to $8.18 million from $15.6 million year earlier; sales declined 50 percent, to $18.7 million (S)","87","null","The New York Times","Business Day","News","article","Earnings Decline at Pixar","Earnings Decline at Pixar"
"https://www.nytimes.com/2003/07/10/technology/game-theory-in-the-tamest-of-starts-the-seeds-of-enchantment.html","Charles Herold","2003-07-10","Charles Herold Game Theory column reviews The Legend of Zelda: The Wind Walker and Kung Fu Chaos; photos (M)","1152","null","The New York Times","Technology","News","article","In the Tamest of Starts, the Seeds of Enchantment","GAME THEORY; In the Tamest of Starts, the Seeds of Enchantment"
"https://www.nytimes.com/2003/03/07/business/technology-briefing-software-microsoft-to-invest-2-billion-in-programs.html","Bloomberg News","2003-03-07","Microsoft Corp will invest $2 billion in next fiscal year to sell programs to companies with fewer than 500 workers; names top sales executive Orlando Ayala to lead new group selling software (S)","145","null","The New York Times","Business Day","News","article","Technology Briefing | Software: Microsoft To Invest $2 Billion In Programs","Technology Briefing | Software: Microsoft To Invest $2 Billion In Programs"
"https://www.nytimes.com/2003/02/12/business/world-business-briefing-europe-switzerland-insurer-reverses-loss.html","Alison NYT","2003-02-12","World Business Briefing: Switzerla8","65","null","The New York Times","Business Day","News","article","World Business Briefing | Europe: Switzerland: Insurer Reverses Loss","World Business Briefing | Europe: Switzerland: Insurer Reverses Loss"
"https://www.nytimes.com/2003/08/13/international/worldspecial/uneasy-calm-in-basra-as-british-stand-ready-for.html","Robert Worth","2003-08-13","Some officials said today there could be more unrest if the supply of fuel and electricity does not improve quickly.","842","null","The New York Times","World","News","article","Uneasy Calm in Basra as British Stand Ready for New Unrest","Uneasy Calm in Basra as British Stand Ready for New Unrest"
"https://www.nytimes.com/2003/10/03/world/korean-claim-leaves-us-concerned-but-skeptical.html","James Brooke","2003-10-03","Secretary of State Colin L Powell says North Korea's claim that it is making atomic bombs from plutonium reprocessed from spent fuel rods is matter of great concern, but one United States has not verified; notes that North Korea makes these statem...","737","null","The New York Times","World","News","article","Korean Claim Leaves U.S. Concerned, But Skeptical","Korean Claim Leaves U.S. Concerned, But Skeptical"
"https://www.nytimes.com/2003/04/18/international/middleeast/israel-indicates-willingness-ease-policy-on.html","Greg Myre","2003-04-18","If an emerging Palestinian government makes an effort to halt violence, Israel is willing to pull back troops and release Palestinian prisoners and ease travel restrictions.","936","null","The New York Times","World","News","article","Israel Indicates Willingness Ease Policy on Palestinians","Israel Indicates Willingness Ease Policy on Palestinians"
"https://www.nytimes.com/2003/11/30/business/business-people-spending-his-money-on-something-that-matters.html","Jane Levere","2003-11-30","Robert F X Sillerman, who will invest $50 million to $75 million in new $250 million Anguilla resort, comments on his plans to golf there; photo (M)","242","null","The New York Times","Business Day","News","article","Business People; Spending His Money On Something That Matters","Business People; Spending His Money On Something That Matters"
"https://www.nytimes.com/2003/10/11/world/world-briefing-europe-russia-newspaper-editor-killed.html","Steven Myers","2003-10-11","Aleksei Sidorov, editor of Togliatti Review, Russian daily newspaper, is killed and investigators believe murder is linked to work at paper; last April, Valery Ivanov, then editor of same newpaper, was shot and killed after articles were published...","106","null","The New York Times","World","News","article","World Briefing | Europe: Russia: Newspaper Editor Killed","World Briefing | Europe: Russia: Newspaper Editor Killed"
"https://www.nytimes.com/2003/10/30/world/struggle-for-iraq-paramilitary-forces-videotape-said-show-torture-under-hussein.html","null","2003-10-30","Fox News broadcasts portions of videotape showing what it says are graphic examples of man being tortured by Iraqi soldiers during Saddam Hussein's rule; Fox spokesman declines to say how Fox obtained tape; photo (S)","157","null","The New York Times","World","News","article","Videotape Is Said to Show Torture Under Hussein Rule","THE STRUGGLE FOR IRAQ: PARAMILITARY FORCES; Videotape Is Said to Show Torture Under Hussein Rule"
"https://www.nytimes.com/2003/07/29/world/annan-is-said-to-want-new-prosecutor-for-rwanda-war-crimes.html","Felicity Barringer","2003-07-29","Secretary Gen Kofi Annan has reportedly decided to recommend that Carla Del Ponte, chief prosecutor for war crimes tribunals for Yugoslavia and Rwanda, be relieved of her Rwanda responsibilities when Security Council votes on renewing her contract...","571","null","The New York Times","World","News","article","Annan Is Said to Want New Prosecutor for Rwanda War Crimes","Annan Is Said to Want New Prosecutor for Rwanda War Crimes"
"https://www.nytimes.com/2003/10/15/business/commercial-real-estate-regional-market-white-plains-downtown-project-adds-big.html","Elsa Brenner","2003-10-15","Target has opened 153,000-square-foot store in White Plains, becoming first retailer to ring up sales in new $320 million retail-residential complex called City Center at White Plains that will also include Circuit City, 15-screen National Amuseme...","731","null","The New York Times","Business Day","News","article","COMMERCIAL REAL ESTATE: REGIONAL MARKET -- White Plains; Downtown Project Adds Big Retailer","COMMERCIAL REAL ESTATE: REGIONAL MARKET -- White Plains; Downtown Project Adds Big Retailer"
"https://www.nytimes.com/2003/01/13/news/gene-tools-root-out-truffle-fraud.html","Barry James","2003-01-13","","554","null","The New York Times","World","News","article","Gene tools root out truffle fraud","Gene tools root out truffle fraud"
"https://www.nytimes.com/2003/12/31/business/technology-briefing-hardware-chip-sales-to-rise-18-in-2004.html","Bloomberg News","2003-12-31","International Data Corp forecasts global semiconductor sales will rise 18 percent in 2004, to $188.8 billion; sees semiconductor market growing at 12.5 percent annual rate, 2003-8 (S)","173","null","The New York Times","Business Day","News","article","Technology Briefing | Hardware: Chip Sales To Rise 18% In 2004","Technology Briefing | Hardware: Chip Sales To Rise 18% In 2004"
"https://www.nytimes.com/2003/12/23/business/supervalus-profit-dropped-15-in-quarter.html","null","2003-12-23","By Bloomberg News.","185","null","The New York Times","Business Day","News","article","Supervalus Profit Dropped 15% in Quarter","Supervalus Profit Dropped 15% in Quarter"
"https://www.nytimes.com/2003/05/03/world/aftereffects-postwar-plans-iraq-s-us-overseer-is-praised-by-rumsfeld.html","Douglas Jehl","2003-05-03","Structure of American administration of postwar Iraq remains unresolved, as Defense Sec Donald Rumsfeld issues strong endorsement of Jay Garner, retired lieutenant general whose job seemed about to be eclipsed by L Paul Bremer (M)","880","null","The New York Times","World","News","article","Iraq's U.S. Overseer Is Praised by Rumsfeld","AFTEREFFECTS: POSTWAR PLANS; Iraq's U.S. Overseer Is Praised by Rumsfeld"
"https://www.nytimes.com/2003/05/13/world/thieves-take-cellini-sculpture-from-art-museum-in-vienna.html","Mark Landler","2003-05-13","Thieves steal 16th-century gold-plated sculpture by Florentine master Benvenuto Cellini from Kunsthistorisches Museum in Vienna, Austria; alarm is set off when piece is lifted from its case, but it is switched off by guard, believing it to be fals...","673","null","The New York Times","World","News","article","Thieves Take Cellini Sculpture From Art Museum in Vienna","Thieves Take Cellini Sculpture From Art Museum in Vienna"
"https://www.nytimes.com/2003/02/19/world/threats-responses-world-germany-skepticism-about-us-its-motives.html","Mark Landler","2003-02-19","Joshua B Kalish, consultant from New Jersey who has lived in Frankfurt for year, discusses Germans' resentment of US, although most make distinction between government and individuals; interview; photo; says he tells them he does not know what is ...","342","null","The New York Times","World","News","article","THREATS AND RESPONSES: OUT IN THE WORLD -- Germany; Skepticism About U.S. And Its Motives","THREATS AND RESPONSES: OUT IN THE WORLD -- Germany; Skepticism About U.S. And Its Motives"
"https://www.nytimes.com/2003/08/16/news/new-yorkers-meet-the-neighbors-in-impromptu-block-parties-no-lights-big.html","Thomas Fuller","2003-08-16","","1335","null","The New York Times","World","News","article","New Yorkers meet the neighbors in impromptu block parties : No lights, big city:the next day","New Yorkers meet the neighbors in impromptu block parties : No lights, big city:the next day"
