"|","|__writer_name","|__pub_date","|__snippet","|__word_count","|__score","|__source","|__section_name","|__type_of_material","|__document_type","|__main_headline","|__print_headline"
"https://www.nytimes.com/2006/10/21/business/21charts.html","Floyd Norris","2006-10-21","When adjusted for inflation, the Dow lags behind those of many other countries, and appears to be going nowhere fast.","475","null","The New York Times","Business Day","News","article","Viewed From Abroad, the Dow at 12,000 Isn’t So Impressive","Viewed From Abroad, the Dow at 12,000 Isn’t So Impressive"
"https://www.nytimes.com/2006/10/21/world/europe/21food.html","James Kanter","2006-10-21","The French oil company defended its chief who is being investigated for possible kickbacks in the U.N.-supervised oil-for-food campaign.","355","null","The New York Times","World","News","article","Total Says Executive Questioned Over Iraq Oil Deals Is Innocent","Total Says Executive Questioned Over Iraq Oil Deals Is Innocent"
"https://www.nytimes.com/2006/10/21/business/21online.html","null","2006-10-21","Not since the days of khaki colonialism has buying Africa been so sexy.","676","null","The New York Times","Business Day","News","article","Seeing Red in Product Red","Seeing Red in Product Red"
"https://www.nytimes.com/2006/10/21/business/21offline.html","null","2006-10-21","When the Tesla Roadster goes into production next year, it will go from zero to 60 m.p.h. in four seconds and have a $100,000 price tag.","682","null","The New York Times","Business Day","News","article","What a Difference Money Makes","What a Difference Money Makes"
"https://www.nytimes.com/2006/10/21/business/21stent.html","Barnaby Feder","2006-10-21","New evidence indicates that some stents can cause fatal blood clots months or even years after they are implanted.","1803","null","The New York Times","Business Day","News","article","Doctors Rethink Widespread Use of Heart Stents","Doctors Rethink Widespread Use Of Heart Stents"
"https://www.nytimes.com/2006/10/21/world/middleeast/21militias.html","Sabrina Tavernise","2006-10-21","Despite its new rogue fringe, Iraqi Shiites see the Mahdi militia as the most effective protector against hostile Sunni groups.","1705","null","The New York Times","World","News","article","Many Iraqis Look to Gunmen as Protectors","As Trust Vanishes, Many Iraqis Look to Gunmen as Protectors"
"https://www.nytimes.com/2006/10/21/business/21insure.html","null","2006-10-21","Warren E. Buffett will pay up to $7 billion in insurance claims that threatened to ruin many Lloyd’s investors. ","1160","null","The New York Times","Business Day","News","article","Buffett Acts to Extricate Lloyd’s","Buffett Acts To Extricate Lloyd’s"
"https://www.nytimes.com/2006/11/02/world/asia/02cnd-china.html","Joseph Kahn","2006-11-02","Leaders of 48 of the 53 African countries are scheduled to arrive this weekend for a huge diplomatic event.","1373","null","The New York Times","World","News","article","China Opens Summit for African Leaders","null"
"https://www.nytimes.com/2006/11/03/business/03trader.html","Michael Schmidt","2006-11-03","As trading becomes more electronic, women traders on Wall Street are finding a slightly more level playing field.","773","null","The New York Times","Business Day","News","article","No Longer the 1980s","No Longer the 1980s"
"https://www.nytimes.com/2006/11/03/business/03home.html","Vikas Bajaj","2006-11-03","A new $40 million ad campaign by the National Association of Realtors will promote that now is an ideal time to buy a home.","532","null","The New York Times","Business Day","News","article","Realtors Say the Stars Are Aligned for Housing","Realtors Say the Stars Are Aligned for Housing"
"https://www.nytimes.com/2006/11/03/business/03cyber.html","Tom Zeller","2006-11-03","The arrests follow a two-year operation by the F.B.I. to identify suspects using stolen consumer information.","254","null","The New York Times","Business Day","News","article","3 Americans Arrested by F.B.I. in Identity Thefts","3 Americans Arrested by F.B.I. in Identity Thefts"
"https://www.nytimes.com/2006/11/03/business/03econ.html","Jeremy Peters","2006-11-03","The results suggest that lower- and middle-class Americans are holding on to their wallets even as energy prices fall and wages rise.","1043","null","The New York Times","Business Day","News","article","October Sales Were Weak at Wal-Mart","October Sales Were Weak At Wal-Mart"
"https://www.nytimes.com/2006/11/03/business/04econ.html","Jeremy Peters","2006-11-03","Businesses added just 92,000 workers in October, even as the unemployment rate fell to a five-year low.","497","null","The New York Times","Business Day","News","article","Jobs Statistics Report Offers Fuel for Both Sides","null"
"https://www.nytimes.com/2006/11/04/world/asia/04zhao.html","Jim Yardley","2006-11-04","Instead, Guan Anping, the defense lawyer, said that prosecutors and the defense team would be limited to arguing the case through written filings.","433","null","The New York Times","World","News","article","Chinese Court Denies Public Hearing for Times Researcher","Chinese Court Denies Hearing In Appeal by Times Researcher"
"https://www.nytimes.com/2006/11/05/jobs/05boss.html","null","2006-11-05","""Everyone has a crossroads in his or her life. You can take two roads,"" said Michael L. Barrera, president of the United States Hispanic Chamber of Commerce. ","737","null","The New York Times","Job Market","News","article","Skipping the Pity Party","Skipping the Pity Party"
"https://www.nytimes.com/2006/11/05/business/yourmoney/05strat.html","null","2006-11-05","Pay to prosper: How political donations help businesses.","1024","null","The New York Times","Business Day","News","article","The Share-Price-to-Campaign-Contribution Ratio","The Share-Price-to-Campaign-Contribution Ratio"
"https://www.nytimes.com/2006/11/05/business/yourmoney/05view.html","Daniel Gross","2006-11-05","They weren't kidding about location, location, location.","938","null","The New York Times","Business Day","News","article","All Housing Markets Are Local, Except When They’re Not","All Housing Markets Are Local, Except When They’re Not"
"https://www.nytimes.com/iht/2006/11/04/world/IHT-04globalist.html","Roger Cohen","2006-11-04","What’s left of U.S. politics is this: wolves howling in the dark that the world will come to an end if the other side wins.","1004","null","International Herald Tribune","World","News","article","Right-Wing Nut Jobs vs. Pinko Commies - Take 2","Globalist: Right-wing nut jobs vs. pinko Commies - Take 2"
"https://www.nytimes.com/2006/11/05/business/yourmoney/05goods.html","Brendan Koerner","2006-11-05","At last, outerwear for the discriminating piper.","632","null","The New York Times","Business Day","News","article","Mist, Moors and a Better Rain Cape","Mist, Moors and a Better Rain Cape"
"https://www.nytimes.com/2006/10/01/world/middleeast/01iraq.html","Michael Luo","2006-10-01","While uncertainty remained about the cause of the curfew, an Iraqi official appeared to allude to a specific threat involving car bombs.","814","null","The New York Times","World","News","article","Baghdad Is Quiet With Strict Curfew in Place","Baghdad Quiet as Curfew Bars Cars and Pedestrians"
"https://www.nytimes.com/2006/10/02/technology/02ecom.html","Bob Tedeschi","2006-10-02","Web sites that list classified ads have proliferated, but so far they have mostly made life easier for buyers rather than sellers.","979","null","The New York Times","Technology","News","article","Wanted: A Way to Profit by Simplifying Web Classifieds","Wanted: A Way to Profit by Simplifying Web Classifieds"
"https://www.nytimes.com/2006/10/02/technology/02onyx.html","Richard Siklos","2006-10-02","Using a new software program called NAV, the film “The Onyx Project” presents viewers with links to click that serve as departure points from one scene to the next.","490","null","The New York Times","Technology","News","article","In This Movie, the Audience Picks the Scene","In This Movie, The Audience Picks the Scene"
"https://www.nytimes.com/2006/10/02/business/media/02addes.html","null","2006-10-02","General Motors.","424","null","The New York Times","Business Day","News","article","Addenda","null"
"https://www.nytimes.com/2006/10/02/business/02hedge.html","Bloomberg News","2006-10-02","By Bloomberg News.","250","null","The New York Times","Business Day","News","article","Distressed Hedge Fund Hires Sale Adviser","Distressed Hedge Fund Hires Sale Adviser"
"https://www.nytimes.com/2006/10/02/technology/02adcol.html","Ken Belson","2006-10-02","Instead of trumpeting low prices and new phones in ads, cellphone companies are pointing out their rivals’ shortcomings.","820","null","The New York Times","Technology","News","article","Cellphone Carriers Focus Ads on Each Other","Cellphone Carriers Focus Ads on Each Other"
"https://www.nytimes.com/2006/10/02/world/middleeast/02mideast.html","Steven Erlanger","2006-10-02","Six Palestinians were killed in clashes between Hamas and Fatah in some of their fiercest battles since the elections in January.","978","null","The New York Times","World","News","article","Fatal Clashes in Gaza Over Unpaid Salaries","Fatal Clashes in Gaza Over Unpaid Salaries"
"https://www.nytimes.com/2006/10/02/world/europe/02austria.html","Mark Landler","2006-10-02","Austrian voters rebuked the governing People’s Party, leaving two extreme right parties as players on an uncertain political landscape.","712","null","The New York Times","World","News","article","Social Democrats Defeat Governing Party in Austria","Social Democrats Defeat Governing Party in Austria"
"https://www.nytimes.com/2006/10/02/world/europe/03hungarycnd.html","Judy Dempsey","2006-10-02","The move was a bid to regain the initiative after weeks of mounting political crisis in the country.","722","null","The New York Times","World","News","article","Hungary’s Leader Calls for Confidence Vote","null"
"https://www.nytimes.com/2006/10/03/world/middleeast/03mideast.html","Greg Myre","2006-10-03","Palestinian leaders appealed for calm, and the clashes were not as intense or as widespread as on Sunday.","848","null","The New York Times","World","News","article","2 Killed as Palestinian Factions Clash for 2nd Day","2 Killed in Second Day of Clashes Between Palestinian Factions"
"https://www.nytimes.com/2006/10/03/business/03memo.html","Joe Sharkey","2006-10-03","","199","null","The New York Times","Business Day","News","article","Memo Pad","null"
"https://www.nytimes.com/2006/10/03/business/03aig.html","Bloomberg News","2006-10-03","By Bloomberg News.","199","null","The New York Times","Business Day","News","article","Ex-A.I.G. Chief Wins Right to See Memos","Ex-A.I.G. Chief Wins Right to See Memos"
"https://www.nytimes.com/2006/10/03/business/worldbusiness/03fugitive.html","John Grobler","2006-10-03","Jacob Alexander, wanted in the United States on stock option fraud charges, showed every sign he would fight extradition.","318","null","The New York Times","Business Day","News","article","In Namibia Court, Arguments Over Bail for Options Fugitive","In Namibia Court, Arguments Over Bail for Options Fugitive"
"https://www.nytimes.com/2006/10/03/world/asia/03afghan.html","Carlotta Gall","2006-10-03","After NATO forces flushed out Taliban insurgents in Pashmul, Afghanistan, a new and more difficult battle began - for the support of the local people.","1665","null","The New York Times","World","News","article","After Afghan Battle, a Harder Fight for Peace","After Afghan Battle, a Harder Fight for Peace"
"https://www.nytimes.com/2006/10/16/business/media/16adco-column.html","Stuart Elliott","2006-10-16","","1365","null","The New York Times","Business Day","News","article","Maybe They Can Call It Nontraditional Home","null"
"https://www.nytimes.com/2006/10/17/business/17flier.html","John Hamlin","2006-10-17","Much has changed in how music stars travel. For more and more acts, fancy tour buses are out and leased private jets are in.","555","null","The New York Times","Business Day","News","article","Bordeaux Will Never Taste the Same","Bordeaux Will Never Taste the Same"
"https://www.nytimes.com/2006/10/17/world/europe/17russia.html","Steven Myers","2006-10-17","Andrei A. Kozlov had led efforts to clean up Russia’s notoriously corrupt banking system, a task that earned him many enemies.","508","null","The New York Times","World","News","article","Russians Arrest 3 in Murder of a Banker Who Fought Corruption","Russians Arrest 3 in Murder of a Banker Who Fought Corruption"
"https://www.nytimes.com/2006/10/17/business/worldbusiness/17oil.html","Andrew Kramer","2006-10-17","In a sign of continuing turmoil in the Russian oil industry, the government threatened to revoke oil field licenses held by Lukoil.","612","null","The New York Times","Business Day","News","article","Russia Threatening to Revoke Lukoil Licenses","Russia Threatening to Revoke Lukoil Licenses"
"https://www.nytimes.com/2006/10/17/world/middleeast/17christians.html","Michael Luo","2006-10-17","Muslim fury over Pope Benedict XVI’s remarks on Islam has brought a new level of threat to an already shrinking Christian population.","1317","null","The New York Times","World","News","article","Iraq’s Christians Flee as Extremist Threat Worsens","Iraq’s Christian Minority Flees As Extremist Threat Worsens"
"https://www.nytimes.com/2006/10/17/business/17protest.html","Steven Greenhouse","2006-10-17","In a rare demonstration, more than 100 Wal-Mart employees rallied at a store in Hialeah Gardens, Fla., a Miami suburb.","595","null","The New York Times","Business Day","News","article","Florida Wal-Mart Workers Stage Protest","Florida Wal-Mart Workers Stage Protest"
"https://www.nytimes.com/2006/10/17/world/americas/17ecuador.html","Simon Romero","2006-10-17","Rafael Correa, a candidate for president, found himself defending his ties to President Hugo Chávez of Venezuela.","713","null","The New York Times","World","News","article","Link to Chávez May Have Hurt Ecuadorean Candidate","Link to Ch&#225;vez May Have Hurt Ecuadorean Candidate"
"https://www.nytimes.com/2006/10/17/business/17megajets.html","Joe Sharkey","2006-10-17","In a market in which many owners progressively upgrade, the next big thing is the Boeing 787 Dreamliner, which lists for about $150 million and up.","1131","null","The New York Times","Business Day","News","article","For the Super-Rich, It’s Time to Upgrade the Old Jumbo Jet","For the Super-Rich, It’s Time to Upgrade the Old Jumbo Jet"
"https://www.nytimes.com/2006/10/17/world/asia/17expats.html","Somini Sengupta","2006-10-17","Where once the brains of India left for more lucrative pastures in the United States, today a handful of fresh American college graduates are sampling the fruits of the Indian economic boom.","706","null","The New York Times","World","News","article","In a Twist, Americans Appear in Ranks of Indian Firms","In a Twist, Americans Appear in Ranks of Indian Firms"
"https://www.nytimes.com/2006/10/17/world/asia/18lankacnd.html","Shimali Senanayake","2006-10-17","Air force jets today hit Tiger camps in Mullaittivu and Mankulam, according to The Associated Press.","511","null","The New York Times","World","News","article","Sri Lankan Rebels Attacked After Truck Blast","null"
"https://www.nytimes.com/2006/10/17/world/middleeast/18iraqcnd.html","Michael Luo","2006-10-17","The situation in Balad starkly highlights the dilemma for U.S. commanders as they transfer wide areas of the country to Iraqi forces.","1446","null","The New York Times","World","News","article","Fighting in Iraqi Town Killed Over 60, U.S. Says","null"
"https://www.nytimes.com/2006/10/17/business/18econcnd.html","Jeremy Peters","2006-10-17","A sharp drop in the price of gasoline helped push wholesale prices down in September at the fastest pace in three years.","624","null","The New York Times","Business Day","News","article","Inflation Index Hints Upward, but Fuel Cost Drops","null"
"https://www.nytimes.com/2006/10/17/world/europe/17russiansumm.html","Michael Schwirtz","2006-10-17","A summary of the top stories in Russian newspapers on Tuesday.","766","null","The New York Times","World","News","article","Violence in Chechnya Rises after Celebration","Violence in Chechnya Rises after Celebration"
"https://www.nytimes.com/2006/10/17/world/middleeast/17cnd-mideast.html","Greg Myre","2006-10-17","The Palestinian Authority’s president warned today that the current Palestinian political crisis was intolerable.","467","null","The New York Times","World","News","article","Abbas Says He May Dismiss Hamas Government","Abbas Suggests He May Dismiss Hamas Government"
"https://www.nytimes.com/2006/10/18/world/europe/18britain.html","Alan Cowell","2006-10-18","The British prime minister joined the increasingly corrosive debate over the use of the Islamic veil.","782","null","The New York Times","World","News","article","Blair Criticizes Full Islamic Veils as ‘Mark of Separation’","Blair Criticizes Full Islamic Veils as ‘Mark of Separation’"
"https://www.nytimes.com/2006/10/18/world/europe/18lunch.html","Sarah Lyall","2006-10-18","British schools are learning that you can lead a child to a healthy lunch, but you can’t make him eat. ","1076","null","The New York Times","World","News","article","Glorious Food? English Schoolchildren Think Not","Glorious Food? English Schoolchildren Think Not"
"https://www.nytimes.com/2006/10/18/business/18wall.html","Jenny Anderson","2006-10-18","Fueled by its debt and equity markets business, Merrill Lynch's quarterly earnings were up 23 percent.","539","null","The New York Times","Business Day","News","article","Equities Business Fuels a Surge in Profit at Merrill Lynch","Equities Business Fuels a Surge in Profit at Merrill Lynch"
"https://www.nytimes.com/2006/10/18/world/americas/18nations.html","Warren Hoge","2006-10-18","Guatemala was unable to win enough votes to secure Latin America’s open seat on the Security Council next year.","614","null","The New York Times","World","News","article","Council Seat Still Undecided After 22 Ballots","Council Seat Still Undecided After 22 Ballots"
"https://www.nytimes.com/2006/10/18/business/worldbusiness/18steel.html","Anand Giridharadas","2006-10-18","The Tata Group tries to build a brand like G.E. with a bid to acquire a company seven times its size, the Corus Group of Britain.","775","null","The New York Times","Business Day","News","article","An Indian Company Wants to Be Everywhere","An Indian Company Wants to Be Everywhere"
"https://www.nytimes.com/2006/10/18/business/18enron.html","Kate Murphy","2006-10-18","The decision prevents the government from seizing more than $43.5 million from his estate that prosecutors claimed he stole from Enron.","503","null","The New York Times","Business Day","News","article","Judge Throws Out Kenneth Lay’s Conviction","Judge Throws Out Kenneth Lay’s Conviction"
"https://www.nytimes.com/2006/10/18/business/18leonhardt.html","David Leonhardt","2006-10-18","Strangely, we talk about medical spending as if it were nothing more than a drag on the economy, rather than an investment in the most important thing of all.","1234","null","The New York Times","Business Day","News","article","A Lesson From Europe on Health Care","A Lesson From Europe On Health Care"
"https://www.nytimes.com/2006/10/18/business/18pellicano.html","null","2006-10-18","Prosecutors are investigating Bertram H. Fields, the Hollywood superlawyer, for ties to the sprawling case against his favorite private eye, Anthony Pellicano.","625","null","The New York Times","Business Day","News","article","Lawyers Called to Grand Jury in Pellicano Wiretap Case","Lawyers Called to Grand Jury In Pellicano Wiretap Case"
"https://www.nytimes.com/2006/10/18/technology/18blue.html","Jeremy Peters","2006-10-18","Income soared on robust software sales, a business helped by nearly $4 billion in acquisitions this year.","403","null","The New York Times","Technology","News","article","Acquisitions Lift Earnings 47% at I.B.M.","Acquisitions Lift Earnings 47% at I.B.M."
"https://www.nytimes.com/2006/10/18/business/media/18yahoo.html","Saul Hansell","2006-10-18","Yahoo posted a 37 percent drop in quarterly profits, amid weak sales of online corporate advertising.","765","null","The New York Times","Business Day","News","article","Yahoo Profit Falls Sharply on Weakness in Advertising","Yahoo Profit Falls Sharply On Weakness In Advertising"
"https://www.nytimes.com/2006/10/18/technology/18game.html","John Markoff","2006-10-18","With the arrival of its PlayStation 3 nearing, Sony is aiming at its rival's sweet spot: Internet-based gaming.","1268","null","The New York Times","Technology","News","article","Battleground for Consoles Moves Online","Battleground For Consoles Moves Online"
"https://www.nytimes.com/2006/10/03/business/03harrahs.html","Peter Edmonston","2006-10-03","Private equity firms have found a new business where they can place their multibillion-dollar bets: gambling.","1056","null","The New York Times","Business Day","News","article","$15 Billion Deal for Harrah’s May Put Other Casinos Into Play","$15 Billion Deal for Harrah’s May Put Other Casinos Into Play"
"https://www.nytimes.com/2006/10/03/business/03auto.html","Micheline Maynard","2006-10-03","When the board of General Motors meets Tuesday it must try to answer the question: Is the company’s turnaround real?","1681","null","The New York Times","Business Day","News","article","G.M. Applying Its Sales Skills to Its Comeback Story","G.M. Applying Its Sales Skills to Its Comeback Story"
"https://www.nytimes.com/2006/10/03/world/asia/04denguecnd.html","null","2006-10-03","The government called an emergency meeting of health officials to try to control an outbreak that has left 14 dead.","599","null","The New York Times","World","News","article","Dengue Fever Overwhelms New Delhi Hospitals","Dengue Fever Outbreak Overwhelms New Delhi Hospitals"
"https://www.nytimes.com/2006/10/03/world/middleeast/04iraqcnd.html","Michael Luo","2006-10-03","The report brought the total number of American troops killed on Monday to at least eight.","620","null","The New York Times","World","News","article","U.S. Reports 4 More Soldiers Were Killed Monday","null"
"https://www.nytimes.com/2006/10/03/business/03cnd-airbus.html","Nicola Clark","2006-10-03","The first deliveries of Airbus’ troubled A380 super jumbo jet were delayed again today, this time by as much as another year, pushing the program off by a full two years.","998","null","The New York Times","Business Day","News","article","Airbus Delays New Jumbo Jet a Second Time","Airbus Delays New Jumbo Jet a Second Time"
"https://www.nytimes.com/2006/10/04/world/asia/04japan.html","Martin Fackler","2006-10-04","The newly installed administration of Prime Minister Shinzo Abe is moving rapidly to improve estranged relations with China and South Korea.","702","null","The New York Times","World","News","article","Japan Leader’s First Diplomatic Bow Is to Asian Neighbors","Japan Leader’s First Diplomatic Bow Is to Asian Neighbors"
"https://www.nytimes.com/2006/10/04/business/worldbusiness/04car.html","Keith Bradsher","2006-10-04","The joint venture has drawn concern that the imports could lead to job losses at Detroit-based manufacturers.","729","null","The New York Times","Business Day","News","article","Daimler and Chery of China Planning Subcompact for U.S.","Daimler and Chery of China Planning Subcompact for U.S."
"https://www.nytimes.com/2006/10/04/technology/04chip.html","null","2006-10-04","The Marvell Technology Group said that third-quarter sales will miss analysts’ estimates and that its expenses will increase because of a review of stock option grants.","286","null","The New York Times","Technology","News","article","Marvell’s News Sends Shares Down 12%","Marvell’s News Sends Shares Down 12%"
"https://www.nytimes.com/2006/10/04/business/04leonhardt.html","David Leonhardt","2006-10-04","Baseball teams part ways with a manager who asks for too much money, but it’s hard to think of a company that has let a chief executive walk over pay.","1066","null","The New York Times","Business Day","News","article","Why C.E.O.'s Aren't Sitting in the Dugout","Why C.E.O.&#8217;s Aren&#8217;t Sitting In the Dugout"
"https://www.nytimes.com/2006/10/04/world/middleeast/04diplo.html","Philip Shenon","2006-10-04","At least 10 were killed and more than 100 were wounded in fighting on Sunday and Monday between Hamas and Fatah.","630","null","The New York Times","World","News","article","Rice Urges 2 Palestinian Groups to Halt Violence","Rice Urges 2 Palestinian Groups to Halt Violence"
"https://www.nytimes.com/2006/10/04/world/asia/04corrupt.html","Joseph Kahn","2006-10-04","Analysts say China’s rulers are trying to shake up the leadership and wipe out resistance to their policy agenda.","1701","null","The New York Times","World","News","article","In Graft Inquiry, Chinese See a Shake-Up Coming","In Graft Inquiry, Chinese See a Shake-Up Coming"
"https://www.nytimes.com/2006/10/04/world/europe/04hijack.html","Ian Fisher","2006-10-04","Officials said the hijacker was apparently a convert to Christianity who wanted to communicate with Pope Benedict XVI.","423","null","The New York Times","World","News","article","Hijacker of Turkish Plane Wanted to Contact Pope, Officials Say","Hijacker of Turkish Plane Wanted to Contact Pope, Officials Say"
