"|","|__writer_name","|__pub_date","|__snippet","|__word_count","|__score","|__source","|__section_name","|__type_of_material","|__document_type","|__main_headline","|__print_headline"
"https://www.nytimes.com/2009/01/31/world/middleeast/31mideast.html","Isabel Kershner","2009-01-30","An Israeli leftist group is helping Palestinians sue the state of Israel for its use of their privately owned lands for Jewish settlement in the West Bank.","935","null","The New York Times","World","News","article","Israeli Advocacy Group Begins Campaign to Help Palestinians Sue Over Settlements","Israeli Advocacy Group Begins Campaign to Help Palestinians Sue Over Settlements"
"https://www.nytimes.com/2009/01/31/world/middleeast/31sadr.html","Alissa Rubin","2009-01-30","One voice largely missing in this election is that of Moktada al-Sadr, the anti-American cleric who came to symbolize the Shiite insurgency in Iraq.","591","null","The New York Times","World","News","article","Sadr Is Silent, but Backers Work Behind Scenes","Sadr, Insurgency Icon, Is Silent, But Backers Work Behind Scenes"
"https://www.nytimes.com/2009/02/01/business/01fisher.html","Geraldine Fabrikant","2009-01-31","About a quarter of the condos in one of the country’s wealthiest communities are for sale, and few are finding buyers.","2035","null","The New York Times","Business Day","News","article","Fisher Island: Still a Refuge, but Not From the Downturn","Paradise Lost?"
"https://www.nytimes.com/2009/01/22/business/worldbusiness/22rupiah.html","Keith Bradsher","2009-01-22","The global economic slump is spreading across Asia, where countries depend on manufacturing for a far greater share of economic output than Western countries do.","932","null","The New York Times","Business Day","News","article","Jobs Vanish as Exports Fall in Asia","Jobs Vanish As Exports Fall in Asia"
"https://www.nytimes.com/2009/01/22/world/middleeast/22phosphorus.html","Ethan Bronner","2009-01-22","Militaries use white phosphorus widely to obscure the battlefield but it is also limited under an international convention that bans targeting civilians with it.","1073","null","The New York Times","World","News","article","Outcry Erupts Over Reports That Israel Used Phosphorus Arms on Gazans","Outcry Erupts Over Reports That Israel Used Phosphorus Arms on Gazans"
"https://www.nytimes.com/2009/01/22/business/economy/22treasury.html","Jackie Calmes","2009-01-22","Senators grilled Timothy F. Geithner about his personal tax delinquencies but predicted he would be confirmed.","1073","null","The New York Times","Business Day","News","article","Geithner Grilled Over Tax Issue","Obama Convenes Financial Team Minus His Chief Economic Spokesman"
"https://www.nytimes.com/2009/01/22/business/22pepsi.html","Andrew Martin","2009-01-22","PepsiCo calculated that the equivalent of 3.75 pounds of carbon dioxide is emitted to the atmosphere for each half-gallon carton of orange juice.","962","null","The New York Times","Business Day","News","article","How Green Is My Orange?","How Green Is My Orange?"
"https://www.nytimes.com/2009/01/23/business/23norris.html","Floyd Norris","2009-01-22","Pay in the financial industry was excessively high around 1930 and from the mid-1990s until 2006, according to two economists, but may be set to fall.","1144","null","The New York Times","Business Day","News","article","Wall Street Paychecks May Wither","Wall Street Paychecks May Wither"
"https://www.nytimes.com/2009/01/23/technology/companies/23google.html","Miguel Helft","2009-01-22","Strong sales and cost-cutting pushed the company’s profitability above Wall Street’s recently lowered forecasts.","817","null","The New York Times","Technology","News","article","Google Beats Forecast Even as Its Profit Tapers","Google Beats Forecast Even as Its Profit Tapers"
"https://www.nytimes.com/2009/01/25/world/asia/25beijing.html","Edward Wong","2009-01-24","The central bank of China rejected an accusation by President Obama’s nominee for Treasury secretary that China was trying to gain an unfair advantage on exports.","349","null","The New York Times","World","News","article","China Rejects Currency Manipulation Charge","China Rejects Accusations Of Currency Manipulation"
"https://www.nytimes.com/2009/01/25/business/worldbusiness/25brazil.html","Andrew Downie","2009-01-24","Brazil’s state-controlled oil company announced a plan to spend more than $174 billion for deep-water oil and gas exploration.","340","null","The New York Times","Business Day","News","article","Brazil Expands Investment in Offshore Drilling Projects","Brazil Expands Investment In Oil Drilling"
"https://www.nytimes.com/2009/01/26/world/asia/26lanka.html","Somini Sengupta","2009-01-25","The government said that its troops had captured the last major town controlled by the ethnic Tamil army.","394","null","The New York Times","World","News","article","Sri Lanka Captures Rebel Stronghold","Troops Take A Town Held By Rebels In Sri Lanka"
"https://www.nytimes.com/2009/01/26/world/africa/26congo.html","Jeffrey Gettleman","2009-01-25","There is a growing concern that Rwanda may not hand over Gen. Laurent Nkunda, the captured rebel leader.","817","null","The New York Times","World","News","article","Congo Presses for Extradition of Warlord","Congo Presses for Extradition of Warlord"
"https://www.nytimes.com/2009/01/26/business/worldbusiness/26music.html","Eric Pfanner","2009-01-26","Promoting an offbeat remedy for digital piracy, the rainy outpost in the Irish Sea is suggesting a fee on Internet service to pay for downloaded music.","936","null","The New York Times","Business Day","News","article","Isle of Man Plans Unlimited Music Downloads","A Fix for Music Piracy: Tack a Fee on Broadband"
"https://www.nytimes.com/2009/01/26/world/europe/26storm.html","null","2009-01-26","Powerful gales swept across both countries on Saturday, leaving at least 15 people dead, including 4 children.","218","null","The New York Times","World","News","article","Spain and France Clean Up From Storm","Spain and France Clean Up From Storm"
"https://www.nytimes.com/2009/01/26/technology/26spend.html","Brad Stone","2009-01-26","As consumers are finding ways to buy computers at a lower cost, high-margin businesses are hurting.","1244","null","The New York Times","Technology","News","article","$200 Laptops Break a Business Model","A Broken Business Model?"
"https://www.nytimes.com/2009/01/26/business/media/26drill.html","Alex Mindlin","2009-01-26","By letting Internet buyers name their price for its 2007 album, Radiohead introduced many people to the retailing strategy called “pay what you want.”","201","null","The New York Times","Business Day","News","article","Smart Move in Letting You Pick Price?","You Picked the Price, but Who Gained?"
"https://www.nytimes.com/2009/01/26/business/media/26cigar.html","Stephanie Clifford","2009-01-26","The latest issue of Cigar Aficionado magazine advises President Obama on relations with Cuba and argues for abolishing preconditions if the United States should re-engage the Caribbean nation.","402","null","The New York Times","Business Day","News","article","Sometimes, a Political Position Is Just About Wanting a Cigar","Sometimes, a Political Position Is Just About Wanting a Cigar"
"https://www.nytimes.com/2009/01/26/business/media/26addes.html","Stuart Elliott","2009-01-26","Accounts.","925","null","The New York Times","Business Day","News","article","Accounts, People, Miscellany","Accounts, People, Miscellany"
"https://www.nytimes.com/2009/01/26/world/asia/26afghan.html","Carlotta Gall","2009-01-26","Conflicting accounts of a raid on suspected insurgents underscore a rift between Afghans and American forces.","1584","null","The New York Times","World","News","article","From Hospital, Afghans Rebut U.S. Account","From Hospital, Afghans Rebut U.S. Account"
"https://www.nytimes.com/2009/01/26/business/26fuld.html","Louise Story","2009-01-26","The transaction between Richard S. Fuld Jr. and his wife, Kathleen, is likely to raise eyebrows for reasons other than the price.","752","null","The New York Times","Business Day","News","article","For $10, Fuld Sold Florida Mansion to His Wife","Fuld Sold Mansion To His Wife For $10"
"https://www.nytimes.com/2009/01/28/business/28medical.html","Alison Gregor","2009-01-27","With real estate generally in turmoil, medical office buildings are still viewed favorably by lenders, who appreciate the growth prospects of health care.","1041","null","The New York Times","Business Day","News","article","A Nice, Staid Corner of Real Estate: Medical Offices","A Nice, Staid Real Estate Corner"
"https://www.nytimes.com/2009/01/28/world/middleeast/28journalists.html","Campbell Robertson","2009-01-27","Iraq’s land-for-journalists program illustrates the challenges democratic principles face when they clash with entitlements that were never before questioned.","1077","null","The New York Times","World","News","article","For Iraqi Journalists, Free Press vs. Free Land","Iraqi Journalists Face Clash of Principles and Entitlements: Free Press vs. Free Land"
"https://www.nytimes.com/2009/01/28/business/economy/28views.html","null","2009-01-28","The world’s financial crisis should not turn into a crisis of capitalism in which government intervention and protectionism swamp the creative potential of free markets.","710","null","The New York Times","Business Day","News","article","Message to Davos: Keep Capitalism","null"
"https://www.nytimes.com/2009/01/28/business/media/28movie.html","Michael Cieply","2009-01-28","The revenues yielded by New York’s tax incentives for film and television production more than cover their costs, a study found.","492","null","The New York Times","Business Day","News","article","Movie Production Incentives Are Said to Help New York","Movie Production Incentives Are Said to Help New York"
"https://www.nytimes.com/2009/01/28/world/europe/28vatican.html","Rachel Donadio","2009-01-28","The St. Pius X Society, a schismatic Catholic society that Pope Benedict XVI recently rehabilitated, distanced itself from the comments of one of its members, who has denied the Holocaust.","814","null","The New York Times","World","News","article","Group Says It Doesn’t Share Views of Holocaust Denier","Group Says It Doesn’t Share Views of Holocaust Denier"
"https://www.nytimes.com/2009/01/28/business/28drug.html","Natasha Singer","2009-01-28","Bristol-Myers Squibb’s current strategy is to move away from mass-market drugs into more expensive drugs for rarer diseases. But more than half its sales depend on three drugs alone.","788","null","The New York Times","Business Day","News","article","Bristol-Myers’s Reliance on Three Drugs Casts Doubt on Strategy","Bristol-Myers’s Heavy Reliance on 3 Drugs Puts Its Prospects for Growth in Doubt"
"https://www.nytimes.com/2009/01/29/world/africa/29pirates.html","Norimitsu Onishi","2009-01-28","Japan said it would deploy its Maritime Self-Defense Force to protect Japanese commercial ships off the coast of Somalia, possibly as early as March.","489","null","The New York Times","World","News","article","Japan Says It Will Send Anti-Piracy Force to Somalia’s Coast","Japan Says It Will Send Anti-Piracy Force to Somalia’s Coast"
"https://www.nytimes.com/2009/01/20/business/economy/20builders.html","John Rudolf","2009-01-19","Lines of credit for home developers is no longer a matter of payment history, but of risk analysis and management in a shrinking real estate market.","1579","null","The New York Times","Business Day","News","article","Banks Foreclose on Builders With Perfect Records","Banks Foreclose on Builders"
"https://www.nytimes.com/2009/01/20/business/20road.html","Joe Sharkey","2009-01-20","For business travelers on a budget who know where to look, the savings are significant.","797","null","The New York Times","Business Day","News","article","Behind the Wheel, Travel Sans the Glamour","Behind the Wheel, Travel Sans the Glamour"
"https://www.nytimes.com/2009/01/20/world/europe/20italy.html","Rachel Donadio","2009-01-20","Authorities are investigating groups devoted to Mafiosi.","938","null","The New York Times","World","News","article","On Facebook, Sicilian Mafia Is a Hot Topic","Good Guys in Sicilian Mafia? On Facebook, It’s a Hot Topic"
"https://www.nytimes.com/2009/01/20/business/20gem.html","Vikas Bajaj","2009-01-20","A court battle between M&T and Deutsche Bank demonstrates the arguments over who should pay for the collapse of collateralized debt obligations.","2022","null","The New York Times","Business Day","News","article","After Sure-Bet Investment Fails, a Bank Contends It Was Duped","After Sure-Bet Investment Fails, A Bank Contends It Was Duped"
"https://www.nytimes.com/2009/01/20/world/middleeast/20briefs-002.html","Nazila Fathi","2009-01-20","Four Iranians imprisoned on charges of trying to overthrow the government with the backing of the C.I.A. include two prominent AIDS doctors, an Iranian intelligence official said Monday.","92","null","The New York Times","World","News","article","Iran: 2 Prisoners Are AIDS Doctors","IRAN: 2 PRISONERS ARE AIDS DOCTORS"
"https://www.nytimes.com/2009/01/20/world/asia/20briefs-006.html","Seth Mydans","2009-01-20","A United Nations-backed tribunal announced that it would open the first hearing on Feb. 17 in the long-delayed trials of five former leaders of the Khmer Rouge.","129","null","The New York Times","World","News","article","Cambodia: Khmer Rouge Trials to Start","Cambodia: Khmer Rouge Trials To Start"
"https://www.nytimes.com/2009/01/20/world/asia/20briefs-007.html","Sangar Rahimi","2009-01-20","A car bomb detonated outside a military base in the eastern town of Khost on Monday, killing a teenager and wounding at least 16 other civilians, military and police officials said.","52","null","The New York Times","World","News","article","Afghanistan: Car Bomb Kills Teenager","Afghanistan: Car Bomb Kills Teenager"
"https://www.nytimes.com/2009/01/21/world/asia/21china.html","Edward Wong","2009-01-20","China said that it faced threats from several independence movements and that U.S. arms sales to Taiwan jeopardized Asia’s stability.","697","null","The New York Times","World","News","article","China Sees Separatist Threats","China Sees Threats From Separatists and U.S. Arms Sales"
"https://www.nytimes.com/2009/01/21/world/middleeast/21israel.html","Isabel Kershner","2009-01-20","Israel’s deadly offensive against Hamas in Gaza had ended on Sunday, yet there was little sense of triumph here in the days after.","978","null","The New York Times","World","News","article","Few Israelis Near Gaza Feel War Achieved Much","Few Israelis Near Gaza Feel War Achieved Much"
"https://www.nytimes.com/2009/06/08/world/americas/08plane.html","Andrew Downie","2009-06-07","Searchers pulled 15 more bodies from the Atlantic as French officials confirmed that their investigation was focusing on airspeed data.","1074","null","The New York Times","World","News","article","More Bodies Recovered Near Site of Plane Crash","15 More Bodies Recovered Near Site of Plane Crash"
"https://www.nytimes.com/2009/06/08/technology/internet/08link.html","Noam Cohen","2009-06-08","In Wikipedia’s less-traveled corners are obscure entries where the facts, point of view and wording can cause heated editing fights.","938","null","The New York Times","Technology","News","article","The Wars of Words on Wikipedia’s Outskirts","The Wars of Words On Wikipedia’s Outskirts"
"https://www.nytimes.com/2009/06/08/technology/start-ups/08phone.html","Jenna Wortham","2009-06-08","A new way to profit from writing software for smart phones is emerging: Sell the apps, then sell your company.","992","null","The New York Times","Technology","News","article","Apps Are Booming as Companies Seek a Place on Your Phone","Apps Boom as Companies Seek a Place on Your Phone"
"https://www.nytimes.com/2009/06/08/business/media/08warner.html","Brooks Barnes","2009-06-08","A 20 percent weight reduction in DVD packaging is expected to reduce costs and cut carbon emissions by more than 30 percent.","319","null","The New York Times","Business Day","News","article","Making a Case for the Environment and the Bottom Line","Making a Case for the Environment and the Bottom Line"
"https://www.nytimes.com/2009/06/08/business/media/08adco.html","Andrew Newman","2009-06-08","An established buyer of scrap gold adjusts its message to attract women with an excess of jewelry that has lost its sentimental luster.","945","null","The New York Times","Business Day","News","article","Buyers of Old Jewelry in a New Appeal to Women","Buyers of Old Jewelry in a New Appeal to Women"
"https://www.nytimes.com/2009/06/08/world/africa/08somalia.html","Mohamed Ibrahim","2009-06-08","Two gunmen opened fire on two Somali broadcast journalists in the capital’s busy Bakara market on Sunday, killing one and wounding the other.","226","null","The New York Times","World","News","article","Somali Gunmen Kill Journalist in Busy Market","Somali Gunmen Kill Journalist In Busy Market"
"https://www.nytimes.com/2009/06/08/business/media/08consumer.html","Brian Stelter","2009-06-08","Consumer Reports, a zealously independent publication, recently sent out a survey on its automotive issue seeking guidance on its cover and presentation.","342","null","The New York Times","Business Day","News","article","Consumer Reports Seeks Input on Reaching Consumers","Consumer Reports Seeks Input on Reaching Consumers"
"https://www.nytimes.com/2009/06/09/world/asia/09china.html","Andrew Jacobs","2009-06-08","All computers sold in the country must include software to filter out “unhealthy information” from the Internet.","1164","null","The New York Times","World","News","article","China Requires Censorship Software on New PCs","China Requires Software on New Computers to Block ‘Unhealthy Information’"
"https://www.nytimes.com/2009/06/09/world/americas/09plane.html","Andrew Downie","2009-06-08","Brazilian divers have recovered the distinctive red-and blue-striped stabilizer from the tail of the Air France jetliner that crashed in the Atlantic Ocean.","704","null","The New York Times","World","News","article","Recovered Debris From Jet May Ease Data Search","Recovered Debris From Jet May Ease Search for Data"
"https://www.nytimes.com/2009/06/09/business/09audit.html","Floyd Norris","2009-06-08","The new chairman of the Public Company Accounting Oversight Board will face conflicts with European regulators and a suit challenging the board’s existence.","701","null","The New York Times","Business Day","News","article","Chairman to Step Down From an Auditing Board","Chairman to Step Down From an Auditing Board"
"https://www.nytimes.com/2009/06/09/business/09bristol.html","Natasha Singer","2009-06-09","Dr. Andrew G. Bodnar’s sentence to write a book is not the first time the judge in his case has ordered a defendant to write.","461","null","The New York Times","Business Day","News","article","Judge Orders Former Bristol-Myers Executive to Write Book","Judge Orders Former Bristol-Myers Executive to Write Book"
"https://www.nytimes.com/2009/06/09/business/media/09globe.html","Richard Pérez-Peña","2009-06-09","The union at The Boston Globe narrowly rejected cuts despite threats of deeper reductions in pay from The New York Times Company, which owns the paper.","1059","null","The New York Times","Business Day","News","article","Boston Globe Union Rejects Deal on Pay Cuts","Globe Union Rejects Deal On Pay Cuts"
"https://www.nytimes.com/2009/06/09/world/europe/09ireland.html","John Burns","2009-06-09","Relatives of a bombing’s victims won a civil case against an Irish Republican Army splinter group.","540","null","The New York Times","World","News","article","$2.6 Million Awarded in Suit Over Northern Ireland Attack","$2.6 Million Awarded in Suit Over Northern Ireland Attack"
"https://www.nytimes.com/2009/06/10/business/10arcandor.html","Carter Dougherty","2009-06-09","Arcandor made the bankruptcy filing after the government rejected its request for emergency state aid.","800","null","The New York Times","Business Day","News","article","German Retail Group Arcandor Files for Bankruptcy","A Major German Retailer Files for Bankruptcy"
"https://www.nytimes.com/2009/06/10/business/economy/10tarp.html","Eric Dash","2009-06-09","Goldman Sachs, JPMorgan Chase and eight other large banks were deemed strong enough by federal regulators to return more than $68 billion in taxpayer aid.","1135","null","The New York Times","Business Day","News","article","10 Large Banks Allowed to Exit U.S. Aid Program","10 Large Banks Allowed to Exit U.S. Aid Program"
"https://www.nytimes.com/2009/06/09/business/smallbusiness/09toolkit.html","null","2009-06-09","In this economy, entrepreneurs need to know what their customers are thinking. One tip: Go out and ask them.","630","null","The New York Times","Business Day","News","article","What Do Customers Really Want? Here’s How to Find Out","null"
"https://www.nytimes.com/2009/06/10/business/economy/10michigan.html","Bill Vlasic","2009-06-09","As the state hemorrhages jobs, lawmakers and executives are seeking alternative industries — like filmmaking and solar panel production — to take up the slack.","1116","null","The New York Times","Business Day","News","article","Michigan Works to Remake Itself Without King Auto","Life Without King Auto"
"https://www.nytimes.com/2009/06/10/world/europe/10iht-plane.html","Nicola Clark","2009-06-09","The Brazilian military, meanwhile, began bringing ashore recovered bodies from the Air France crash, while vessels picked up another four corpses.","567","null","International Herald Tribune","World","News","article","Air France to Replace Airspeed Sensors","Air France to Replace Airspeed Sensors"
"https://www.nytimes.com/2009/06/07/business/media/07newline.html","Michael Cieply","2009-06-06","Now folded into Warner Brothers, New Line Cinema is surprising some as it manages to hang on to its indie flair.","2372","null","The New York Times","Business Day","News","article","Will Warner Grow Tired of New Line, Its Pet Indie?","Will Warner Grow Tired of Its Pet Indie?"
"https://www.nytimes.com/2009/06/06/world/americas/06peru.html","Simon Romero","2009-06-06","More than two dozen deaths raised tensions over indigenous protests of plans to open vast tracts of rain forest to oil drilling, logging and hydroelectric dams.","966","null","The New York Times","World","News","article","Fatal Clashes Erupt in Peru at Roadblock","Fatal Clashes Erupt in Peru At Roadblock"
"https://www.nytimes.com/2009/06/06/business/06nocera.html","Joe Nocera","2009-06-06","The efficient market hypothesis, which argues that the stock market is essentially rational, is taking serious hits, and one analyst says it is at the root of the financial crisis.","1652","null","The New York Times","Business Day","News","article","Poking Holes in a Theory on Markets","Poking Holes In a Theory On Markets"
"https://www.nytimes.com/2009/06/06/business/economy/06walmart.html","Stephanie Rosenbloom","2009-06-06","At an annual shareholder meeting, the retailer’s leaders indicated they would not become complacent with their relative success.","772","null","The New York Times","Business Day","News","article","Wal-Mart Outlines Plans to Keep Its Momentum","Wal-Mart Outlines Plans to Keep Its Momentum"
"https://www.nytimes.com/2009/06/06/technology/06digital.html","Stephen Labaton","2009-06-06","Despite government efforts to promote the switch to digital signals and a delay of four months in the schedule, three million homes are unprepared.","1143","null","The New York Times","Technology","News","article","Millions Face Blank Screens in TV Switch","Millions Face Blank Screens In TV Switch"
"https://www.nytimes.com/2009/06/06/business/economy/06bank.html","Edmund Andrews","2009-06-06","With Bank of America and Citigroup due to report on their progress under the bailout, it’s uncertain whether their top leaders can keep their jobs.","922","null","The New York Times","Business Day","News","article","Regulators Push for Change at Two Troubled Big Banks","Regulators Push for Change At Two Troubled Big Banks"
"https://www.nytimes.com/2009/06/06/world/middleeast/06diplo.html","Helene Cooper","2009-06-06","President Obama’s new formulation on the Israeli-Palestinian conflict has rekindled fears that he may be fundamentally less pro-Israeli than his predecessors.","780","null","The New York Times","World","News","article","Among Israel’s U.S. Backers, Anxiety and Some Support Greet Obama’s Words","Among Israel’s U.S. Backers, Anxiety And Some Support Greet Obama’s Words"
"https://www.nytimes.com/2009/06/07/world/europe/07prexy.html","Jeff Zeleny","2009-06-06","President Obama and the leaders of France, Great Britain and Canada reflected upon the 65th anniversary of D-Day.","1103","null","The New York Times","World","News","article","Obama Hails D-Day Heroes at Normandy","In Reflecting on D-Day Heroics, Obama Sees Lessons for Facing Today’s Trials"
"https://www.nytimes.com/2009/06/07/world/asia/07viet.html","Dan Bilefsky","2009-06-06","In the Czech Republic and other countries of Eastern Europe, Asian migrants now face competition even for low-paying jobs.","1026","null","The New York Times","World","News","article","Czechs Cool to Presence of Workers From Asia","Czechs Cool To Presence Of Workers From Asia"
"https://www.nytimes.com/2009/06/07/world/asia/07pstan.html","Sabrina Tavernise","2009-06-06","The prisoners, captured during the Pakistan Army’s campaign in the Swat Valley, were an important part of the leadership of the area, military officials said.","585","null","The New York Times","World","News","article","Militants Attack Army Convoy, Killing 2 of Their Own","Militants Attack Army Convoy, Killing 2 of Their Own"
