"|","|__writer_name","|__pub_date","|__snippet","|__word_count","|__score","|__source","|__section_name","|__type_of_material","|__document_type","|__main_headline","|__print_headline"
"https://www.nytimes.com/2013/05/09/business/global/09iht-asiaecon09.html","Bettina Wassener","2013-05-08","Policy makers across the region have deployed a range of tools to try to dampen the adverse effects that can come when too much money flows into an economy.","541","null","International Herald Tribune","Business Day","News","article","Asia-Pacific Nations Push to Rein In Rising Currencies","Asia-Pacific Nations Push to Rein in Rising Currencies"
"https://www.nytimes.com/2013/05/11/world/asia/feng-shui-grows-in-china-as-officials-seek-success.html","Dan Levin","2013-05-11","China’s ambitious civil servants are increasingly — if discreetly — seeking supernatural shortcuts to wealth and power, much to the dismay of the Communist Party.","1102","null","The New York Times","World","News","article","China Officials Seek Career Shortcut With Feng Shui","China Officials Find Comrade In Feng Shui"
"https://www.nytimes.com/2013/05/11/world/asia/zhu-ling-case-re-emerges-unleashing-chinese-fury.html","Andrew Jacobs","2013-05-10","Nearly two decades after Zhu Ling was poisoned, her case has electrified the nation with questions about the power of China’s political elite in a society where justice remains elusive.","1291","null","The New York Times","World","News","article","Poison Attack Revives Fury in China Over ’95 Case","Poison Attack Revives Fury In China Over ’95 Case"
"https://www.nytimes.com/2013/05/09/world/asia/patronages-roots-run-deep-as-pakistan-faces-vote.html","Declan Walsh","2013-05-08","Amid the talk of change in Saturday’s elections, Pakistan remains a place where handouts can decide votes and lawmakers are sought out for protection.","1117","null","The New York Times","World","News","article","Political Handouts Thrive in Pakistan","The Power of Patronage in Pakistan"
"https://www.nytimes.com/2013/05/09/world/former-top-lawyer-in-state-dept-criticizes-drone-secrecy.html","Scott Shane","2013-05-08","Harold H. Koh, a former legal adviser to the State Department, said the lack of transparency was unnecessary and had backfired.","616","null","The New York Times","World","News","article","Ex-Lawyer in State Department Criticizes Drone Secrecy","Ex-Lawyer in State Department Criticizes Drone Secrecy"
"https://www.nytimes.com/2013/05/09/world/middleeast/09iht-m09-jordan-syria.html","Rana Sweis","2013-05-09","As refugees continue to flow across the border, Jordanians are suffering economically.","1233","null","International Herald Tribune","World","News","article","Resentment Grows Against Syrian Refugees in Jordan","Resentment Grows Against Syrian Refugees in Jordan"
"https://www.nytimes.com/2013/05/09/world/asia/rally-turns-deadly-in-southern-afghanistan.html","Rod Nordland","2013-05-08","Local officials greatly differed in their accounts of how violence started at an event that was said to have begun as a peaceful pro-government rally.","704","null","The New York Times","World","News","article","Rally Turns Deadly in Southern Afghanistan","null"
"https://www.nytimes.com/2013/05/09/world/europe/09iht-rome09.html","Gaia Pianigiani","2013-05-09","An appeals court in Milan sentenced former Prime Minister Silvio Berlusconi to four years in prison and imposed a five-year ban on his holding public office.","310","null","The New York Times","World","News","article","Court Upholds Berlusconi Tax Fraud Verdict","Court Upholds Berlusconi Tax Fraud Verdict"
"https://www.nytimes.com/2013/05/09/business/global/after-a-strong-recovery-chinas-economy-unexpectedly-stumbles-again.html","Keith Bradsher","2013-05-08","A combination of weak exports and slowly rising consumer spending prompted concerns among economists about sustaining even modest growth.","1038","null","The New York Times","Business Day","News","article","China’s Economy Unexpectedly Stumbles Again on Weak Export Results","China’s Economy Unexpectedly Stumbles Again on Weak Export Results"
"https://www.nytimes.com/2013/05/10/world/europe/in-russia-marathon-bombing-suspect-talked-jihad.html","Ellen Barry","2013-05-10","Acquaintances of Tamerlan Tsarnaev in Russia said he was already interested in waging jihad when he arrived there last year, but they discouraged him from joining a militant group.","1161","null","The New York Times","World","News","article","Suspect in Boston Bombing Talked Jihad in Russia","Marathon Bomb Suspect Talked Jihad in Russia"
"https://www.nytimes.com/2013/05/10/world/middleeast/us-imposes-sanctions-on-those-aiding-iran.html","Rick Gladstone","2013-05-10","The actions appeared to signal an accelerated effort by the United States to squeeze Iran economically over the lack of progress in negotiations on its disputed nuclear program.","598","null","The New York Times","World","News","article","U.S. Imposes Sanctions on Those Aiding Iran","U.S. Imposes Sanctions On Those Aiding Iran"
"https://www.nytimes.com/2013/05/10/world/americas/efrain-rios-montt-denies-role-in-guatemalan-massacres.html","Elisabeth Malkin","2013-05-10","In a rambling statement on Thursday lasting almost an hour, Gen. Efraín Ríos Montt said he had never authorized or proposed attacks on any ethnic groups.","627","null","The New York Times","World","News","article","Ex-Dictator Denies Role in Guatemalan Massacres","Ex-Dictator Denies Role In Guatemalan Massacres"
"https://www.nytimes.com/2013/05/11/world/europe/british-police-deny-protecting-jimmy-savile.html","Alan Cowell","2013-05-10","A report by the West Yorkshire police covered 68 of hundreds of sexual abuse allegations that have surfaced against the former television presenter Jimmy Savile.","991","null","The New York Times","World","News","article","British Police Force Denies Protecting Savile From Abuse Allegations","Police in BBC Host’s Town Say They Did Not Shield Him"
"https://www.nytimes.com/2013/05/11/business/global/pro-inflation-policies-show-signs-of-helping-japan-economy.html","Hiroko Tabuchi","2013-05-10","The Bank of Japan's efforts to reinvigorate the nation's economy are showing results, at least in the sinking value of the yen, which hit 100 to the dollar on Friday for the first time in four years.","1302","null","International Herald Tribune","Business Day","News","article","Pro-Inflation Policies Show Signs of Helping Japanese Economy","Pro-Inflation Policies Show Signs of Helping Japanese Economy"
"https://www.nytimes.com/2013/05/11/world/middleeast/syria-human-rights.html","Nick Cumming-Bruce","2013-05-10","Navi Pillay, the high commissioner for human rights, said she feared that international outrage had been numbed by two years of conflict.","690","null","The New York Times","World","News","article","U.N. Rights Chief Urges Faster Action to End Fighting in Syria","U.N. Official Urges Haste In Ending Syria Crisis"
"https://www.nytimes.com/2013/05/11/business/media/nbc-to-name-new-head-of-news-division.html","Brian Stelter","2013-05-10","Deborah Turness, who worked at ITV News in Britain, would become the first woman to lead the news division at a major network.","495","null","The New York Times","Business Day","News","article","NBC News Is Said to Pick a Woman as Its Chief","NBC News Said to Pick A Woman As Its Chief"
"https://www.nytimes.com/2013/05/11/business/economy/student-loan-debt-weighing-down-younger-us-workers.html","Annie Lowrey","2013-05-10","The anemic economy has left millions struggling to get ahead. Student debt is making it even harder for many of them, as they delay purchases of things like homes and cars.","1072","null","The New York Times","Business Day","News","article","Student Debt Slows Growth as Young Spend Less","Heavy Load of Student Loan Debt Is Weighing on the Economy, Too"
"https://www.nytimes.com/2013/05/15/business/retirementspecial/international-retirement-plans-offer-insight-to-aid-americas-system.html","Steven Greenhouse","2013-05-15","Scores of other countries have elaborate retirement schemes and policies that Americans could learn from to address some of the biggest pitfalls of their system.","2514","null","The New York Times","Business Day","News","article","How They Do It Elsewhere","How They Do It Elsewhere"
"https://www.nytimes.com/2013/05/13/business/media/q-and-a-with-stuart-elliott.html","null","2013-05-13","A viewer is confused by the comings and goings in a Jetta commercial.","854","null","The New York Times","Business Day","News","article","Q. and A. With Stuart Elliott","Q. and A. With Stuart Elliott"
"https://www.nytimes.com/2013/05/14/world/europe/britains-conservatives-split-over-europe.html","Stephen Castle","2013-05-13","A clamor for Britain to exit the European Union appeared to be spreading even as Prime Minister David Cameron met with President Obama in Washington.","915","null","The New York Times","World","News","article","As British Prime Minister Visits Washington, His Party Splits Over European Union","As British Prime Minister Visits Washington, His Party Splits Over European Union"
"https://www.nytimes.com/2013/05/14/world/asia/pakistan-vote-inspires-measured-optimism-in-india.html","Gardiner Harris","2013-05-13","Some Indians believe that the man poised to become Pakistan’s next prime minister will seek economic cooperation despite the bitter rivalry between the two neighbors.","622","null","The New York Times","World","News","article","After Vote in Pakistan, Some Hope in India","After Vote In Pakistan, Some Hope In India"
"https://www.nytimes.com/2013/05/15/world/europe/as-crime-rises-spains-farmers-patrol-their-land.html","Suzanne Daley","2013-05-14","Many of Spain’s small, isolated farming communities seemed immune from the economic crisis. But now many believe the problem is at their doorstep.","954","null","The New York Times","World","News","article","As Thieves Troll Spanish Farmland, Villagers Begin Patrols","As Thieves Start Trolling Spanish Farmland, Villagers Begin Patrols"
"https://www.nytimes.com/2013/05/14/world/middleeast/obama-and-cameron-press-putin-on-syria.html","Michael Gordon","2013-05-13","President Obama and Prime Minister David Cameron of Britain have taken generally cautious and deliberate approaches to the Syrian conflict.","863","null","The New York Times","World","News","article","A Focus on Syria for Obama and Cameron","A Focus on Syria for Obama and Cameron"
"https://www.nytimes.com/2013/05/14/world/africa/car-bomb-in-libya.html","null","2013-05-13","A car explosion on a busy street in Benghazi stirred new anger at the failure of the transitional government to fill the security vacuum left by the ouster of Col. Muammar el-Qaddafi.","454","null","The New York Times","World","News","article","Car Bomb Kills at Least 4 in Libya","Libya: Deadly Car Bombing in Benghazi"
"https://www.nytimes.com/2013/05/14/world/middleeast/israel-approval-near-for-austerity-budget.html","Isabel Kershner","2013-05-13","A plan for higher taxes has prompted demonstrations reminiscent of those that rocked the country in 2011, when crowds protested the high cost of living.","1101","null","The New York Times","World","News","article","Israel’s Austerity Budget Draws Citizen Protests","Approaching Approval, Israeli Austerity Budget Draws Citizen Protests"
"https://www.nytimes.com/2013/05/14/world/europe/germany-accuses-refugee-of-being-somali-pirates-accountant.html","Nicholas Kulish","2013-05-13","The suspect was the bookkeeper for a group that hijacked the German tanker the Marida Marguerite and its crew  three years ago, the authorities said.","449","null","The New York Times","World","News","article","Germany Accuses Man of Being Somali Pirates’ Accountant","A Suspect In Tallying Pirate Spoils"
"https://www.nytimes.com/2013/05/14/business/hotels-aim-to-attract-foodies-traveling-on-business.html","Martha White","2013-05-13","A push for local foods helps hotels differentiate themselves in a crowded marketplace, where catering to business travelers is a priority.","1024","null","The New York Times","Business Day","News","article","Farm-to-Hotel Dining","Farm-to-Hotel Dining"
"https://www.nytimes.com/2013/05/14/business/fast-wi-fi-on-flights-may-serve-the-airlines-too.html","Joe Sharkey","2013-05-13","Faster Internet access is being sold as a boon for airline passengers, but it may be a lucrative sales tool for airlines as well.","788","null","The New York Times","Business Day","News","article","The Commercial Side of Fast Wi-Fi on Flights","The Commercial Side Of Fast Wi-Fi on Flights"
"https://www.nytimes.com/2013/05/14/business/media/ironman-3-cant-cut-angst-in-china-over-us-films.html","Michael Cieply","2013-05-13","Approaching $100 million at the box office there, the film was the target of an editorial in China Daily, which said Chinese elements were added to trick the audience.","282","null","The New York Times","Business Day","News","article","Success of ‘Iron Man 3’ Hasn’t Reduced Tension Over U.S. Films in China","null"
"https://www.nytimes.com/2013/05/15/business/retirementspecial/covering-the-rising-cost-of-long-term-care.html","Caitlin Kelly","2013-05-15","After the stock market crash of 2008 and a collapsing housing bubble diminished the value of many nest eggs, the cost of long-term care is now a concern for many aging Americans.","1390","null","The New York Times","Business Day","News","article","Covering the Rising Cost of Long-Term Care","Covering the Rising Cost of Long-Term Care"
"https://www.nytimes.com/2013/05/14/world/americas/2-are-arrested-in-killing-of-malcolm-xs-grandson.html","Randal Archibold","2013-05-14","The men taken into custody worked at a bar in Mexico City where Malcolm Shabazz was beaten during what a prosecutor called a dispute over an excessive bill.","599","null","The New York Times","World","News","article","2 Waiters Arrested in Killing of Malcolm X’s Grandson","2 Waiters Arrested in Killing of Malcolm X’s Grandson"
"https://www.nytimes.com/2013/05/11/business/media/nbc-adds-3-more-shows-including-an-updated-ironside.html","Bill Carter","2013-05-10","The other shows are a comedy, “Undateable,” and a spinoff of “Chicago Fire.”","264","null","The New York Times","Business Day","News","article","NBC Adds 3 More Shows, Including an Updated ‘Ironside’","null"
"https://www.nytimes.com/2013/05/11/business/dannon-cuts-sugar-carefully-in-childrens-yogurt.html","Stephanie Strom","2013-05-10","Dannon cut the sugar in its Danimals Smoothies for children, but it did so with the utmost care to make sure children couldn’t taste the difference.","1053","null","The New York Times","Business Day","News","article","The Trek to a Yogurt Less Sweet","The Trek to a Yogurt Less Sweet"
"https://www.nytimes.com/2013/05/15/business/retirementspecial/the-4-rule-for-retirement-withdrawals-may-be-outdated.html","Eilene Zimmerman","2013-05-15","A rule stated that if retirees withdrew 4.5 percent of their savings every year — adjusted for inflation — their nest eggs would last 30 years. Not anymore.","983","null","The New York Times","Business Day","News","article","4% Rule for Retirement Withdrawals Is Golden No More","4% Rule for Retirement Withdrawals Is Golden No More"
"https://www.nytimes.com/2013/05/15/business/retirementspecial/retired-and-back-in-school-for-the-degree-not-just-the-fun.html","Geraldine Fabrikant","2013-05-15","Some people who have retired from their jobs go for advanced degrees, either for a new career or for the thrill of learning for themselves.","928","null","The New York Times","Business Day","News","article","Back to School, but for the Degree, Not Just the Fun","Back to School, but for the Degree, Not Just the Fun"
"https://www.nytimes.com/2013/05/11/business/energy-environment/environmental-review-to-delay-two-engineered-crops.html","Andrew Pollack","2013-05-11","The Agriculture Department said approval of the crops might affect the environment and human health.","685","null","The New York Times","Business Day","News","article","Environmental Review to Delay Two Engineered Crops","Environmental Review to Delay Two Engineered Crops"
"https://www.nytimes.com/2013/05/07/world/europe/07iht-letter07.html","Alan Cowell","2013-05-06","Once a year, the curators of Hampstead Heath, a park in London, hold the Dawn Chorus Walk to identify by their warbles and chirrups the species of birds calling out for a mate.","818","null","International Herald Tribune","World","News","article","Tweeting, of the More Natural Kind","Tweeting, of the More Natural Kind"
"https://www.nytimes.com/2013/05/07/world/middleeast/iran-warns-syrian-rebels-after-report-of-shrine-desecration.html","Thomas Erdbrink","2013-05-06","Iran’s leaders warned of sectarian conflict after reports that Syrian rebels had raided a shrine outside Damascus and made off with the remains of the figure buried there.","676","null","The New York Times","World","News","article","Iran Warns Syrian Rebels After Report of Shrine Desecration","Iran Warns Syrian Rebels After Report of Shrine Desecration"
"https://www.nytimes.com/2013/05/07/world/asia/07iht-malaysia07.html","Joe Cochrane","2013-05-06","Though it held on to power in Sunday’s election, the governing National Front coalition failed to win over 50 percent of the popular vote, leaving Prime Minister Najib Razak’s position shaky.","531","null","The New York Times","World","News","article","Close Election Leaves the Fate of Malaysia’s Premier Uncertain","Close Election Leaves the Fate of Malaysia’s Premier Uncertain"
"https://www.nytimes.com/2013/05/06/business/ads-proclaim-hail-finlandia.html","Stuart Elliott","2013-05-06","Finlandia adopts a broad, tongue-in-cheek approach to selling cheese in a new campaign.","1558","null","The New York Times","Business Day","News","article","Ads Proclaim, ‘Hail, Finlandia’","Ads Proclaim, &#8216;Hail, Finlandia&#8217;"
"https://www.nytimes.com/2013/05/07/business/media/mountain-dew-drops-lil-wayne-over-emmett-till-lyric.html","Tanzina Vega","2013-05-06","How Mountain Dew backed away from Lil Wayne’s “offensive” reference to Emmett Till.","784","null","The New York Times","Business Day","News","article","Lil Wayne Puts Mountain Dew in Crisis Mode","Lil Wayne Puts Mountain Dew In Crisis Mode"
"https://www.nytimes.com/2013/05/07/business/global/foxconn-tries-to-move-beyond-apples-shadow.html","Lin Yang","2013-05-07","Foxconn, an electronics contractor in China that was criticized for poor conditions in factories making Apple products, is moving to develop its own goods, like televisions.","1434","null","The New York Times","Business Day","News","article","Foxconn Tries to Move Past the iPhone","New Direction for Foxconn"
"https://www.nytimes.com/2013/05/07/business/effort-to-ease-global-entry-works-most-of-the-time.html","Joe Sharkey","2013-05-07","Most travelers report quick re-entry, but some complain of problems with fingerprint scanners.","899","null","The New York Times","Business Day","News","article","Speedy Customs Program Works, at Least Usually","Speedy Customs Program Works, at Least Usually"
"https://www.nytimes.com/2013/05/13/business/global/for-britain-better-to-stay-put-in-eu.html","null","2013-05-12","The idea that Britain can have its cake and eat it too is naïve. The rest of the Union might allow it access to the market, but only if Britain abided by E.U. rules. And it would not have a vote on those rules.","948","null","International Herald Tribune","Business Day","News","article","For Britain, Better to Stay Put in E.U.","For Britain, Better to Stay Put in E.U."
"https://www.nytimes.com/2013/05/13/world/asia/china-eyes-liu-tienan-an-official-challenged-by-a-journalist.html","Chris Buckley","2013-05-12","Investigators said a senior economic policy maker, Liu Tienan, was “suspected of grave violations of discipline,” accusations first raised by a magazine editor.","516","null","The New York Times","World","News","article","After a Journalist’s Prodding, China Investigates a Top Official","After a Journalist’s Prodding, China Investigates a Top Official"
"https://www.nytimes.com/2013/05/13/world/europe/bulgaria-elections.html","Matthew Brunwasser","2013-05-12","Despite earlier protests forcing the government to resign, the election has aroused little interest or discussion. Still, accusations of corruption have popped up.","640","null","The New York Times","World","News","article","Few Vote in Bulgaria as Apathy Prevails","Few Vote In Bulgaria As Apathy Prevails"
"https://www.nytimes.com/2013/05/14/world/europe/in-bavaria-family-values-that-merkel-could-do-without.html","Melissa Eddy","2013-05-13","Germany’s Christian Social Union, the sister party of Chancellor Angela Merkel’s Christian Democratic Union, is embroiled in a scandal that threatens her re-election chances.","958","null","The New York Times","World","News","article","Nepotism in Bavarian Politics Creates a Scandal Merkel Could Do Without","Nepotism in Bavarian Politics Creates a Scandal Merkel Could Do Without"
"https://www.nytimes.com/2013/05/13/business/media/news-from-the-advertising-industry.html","Stuart Elliott","2013-05-12","Account assignments, executive appointments and miscellaneous news from advertising agencies.","193","null","The New York Times","Business Day","News","article","News From the Advertising Industry","News From the Advertising Industry"
"https://www.nytimes.com/2013/05/13/business/media/barbara-walters-to-announce-2014-retirement-on-the-view.html","Bill Carter","2013-05-13","Network television’s first anchorwoman plans to announce Monday that next year she will leave the business where she broke barriers and rules for more than 50 years.","1253","null","The New York Times","Business Day","News","article","Walters to Announce 2014 Retirement on ‘The View’","Walters Set to Announce 2014 Retirement on ‘The View’"
"https://www.nytimes.com/2013/05/13/business/global/greek-tax-crackdown-yields-little-revenue.html","Landon Thomas","2013-05-12","Tax evasion lies at the heart of the Greek financial collapse, yet efforts to collect billions of euros in taxes from deadbeat residents have yielded little additional revenue.","1256","null","The New York Times","Business Day","News","article","Greek Crackdown on Tax Evasion Yields Little Revenue","Greek Crackdown on Tax Evasion Yields Little Revenue in Tackling the Deficit"
"https://www.nytimes.com/2013/05/13/business/media/sophomore-slump-afflicts-once-promising-tv-showsdarren-michaels-warner-brothers-television.html","Bill Carter","2013-05-13","Some of the most popular new series from a year ago declined in the ratings in their second seasons.","1176","null","The New York Times","Business Day","News","article","Sophomore Slump Afflicts Once-Promising TV Shows","Sophomore Slump Afflicts Once-Promising TV Shows"
"https://www.nytimes.com/2013/05/13/business/media/tv-networks-face-falling-ratings-and-new-rivals.html","Brian Stelter","2013-05-13","The broadcast networks are preparing to unveil new fall lineups for an audience that is shrinking rapidly, lured away by new rivals on all sides.","1281","null","The New York Times","Business Day","News","article","As TV Ratings and Profits Fall, Networks Face a Cliffhanger","As TV Ratings and Profits Fall, Networks Face a Cliffhanger"
"https://www.nytimes.com/2013/05/07/world/asia/us-accuses-chinas-military-in-cyberattacks.html","David Sanger","2013-05-07","The Pentagon explicitly accused China of attacking government systems and defense contractors, possibly to map “military capabilities that could be exploited during a crisis.”","1226","null","The New York Times","World","News","article","U.S. Blames China’s Military Directly for Cyberattacks","China’s Military Is Accused by U.S. In Cyberattacks"
"https://www.nytimes.com/2013/05/08/world/asia/china-cuts-ties-with-north-korean-bank.html","Keith Bradsher","2013-05-07","The United States has pressed China to rein in the North’s nuclear program, and the decision appeared to be its strongest move yet.","922","null","The New York Times","World","News","article","China Cuts Ties With Key North Korean Bank","China Cuts Ties With Key North Korean Bank"
"https://www.nytimes.com/2013/05/08/business/baxter-says-its-new-alzheimers-treatment-has-failed.html","Andrew Pollack","2013-05-07","Baxter International said that the immunoglobulin therapy did not significantly arrest the decline in either cognition or daily functioning when compared with a placebo.","560","null","The New York Times","Business Day","News","article","Alzheimer’s Treatment Failed Trial, Maker Says ","Alzheimer’s Treatment Failed Trial, Maker Says"
"https://www.nytimes.com/2013/05/08/world/europe/spanish-court-drops-subpoena-against-princess-cristina.html","Raphael Minder","2013-05-07","Princess Cristina will not have to appear in court in an embezzlement case in which her husband is under investigation.","537","null","The New York Times","World","News","article","Spanish Court Drops Subpoena Against Princess","Spain: Princess Is No Longer a Suspect"
"https://www.nytimes.com/2013/05/08/world/europe/germany-extends-its-success-to-the-soccer-field.html","Nicholas Kulish","2013-05-07","The Continent’s championship soccer game will be between two German teams, and many observers see a link to the country’s economic approach.","1147","null","The New York Times","World","News","article","One More Field Where the Continent Trails Germany","One More Field Where the Continent Trails Germany"
