"|","|__writer_name","|__pub_date","|__snippet","|__word_count","|__score","|__source","|__section_name","|__type_of_material","|__document_type","|__main_headline","|__print_headline"
"https://www.nytimes.com/2002/06/06/business/media/people-and-accounts-of-note.html","Allison Fass","2002-06-06","Business Marketing Association, Chicago, named Bob Goranson as national chairman. Mr. Goranson is a partner at Mobium Creative Group, Chicago.","1031","null","The New York Times","Business Day","News","article","People and Accounts of Note","People and Accounts of Note"
"https://www.nytimes.com/2002/02/10/business/backslash-mayhem-and-far-from-the-nicest-kind.html","Matt Richtel","2002-02-10","Matt Richtel's Backslash column on whether violent video games have any redeeming content focuses on Grand Theft Auto III, popular new video game from Take Two Interactive Software that has been banned in Australia because of its violent nature, d...","846","null","The New York Times","Business Day","News","article","Mayhem, and Far From the Nicest Kind","BACKSLASH; Mayhem, and Far From the Nicest Kind"
"https://www.nytimes.com/2002/06/21/business/technology-internet-radio-criticizes-rate-on-royalties.html","Amy Harmon","2002-06-21","Federal copyright regulators set critical ground rule for fledgling Internet radio industry, cutting in half proposed royalty rate that Internet companies must pay record labels; adjustment falls short of what many say would be necessary for them ...","674","null","The New York Times","Business Day","News","article","Internet Radio Criticizes Rate On Royalties","TECHNOLOGY; Internet Radio Criticizes Rate On Royalties"
"https://www.nytimes.com/2002/05/17/world/world-briefing-americas-brazil-police-chief-convicted-in-peasants-deaths.html","Larry NYT","2002-05-17","Jury in Brazil finds Col Mario Colares Pantoja guilty of murder in connection with killing of 19 landless peasants during 1996 confrontation in Amazon; sentences him to 228 years in prison (S)","75","null","The New York Times","World","News","article","World Briefing | Americas: Brazil: Police Chief Convicted In Peasants' Deaths","World Briefing | Americas: Brazil: Police Chief Convicted In Peasants' Deaths"
"https://www.nytimes.com/2002/02/08/business/company-news-watchguard-is-buying-rapidstream-for-48-million.html","Bloomberg News","2002-02-08","WatchGuard Technologies, maker of Internet-security software and hardware, plans to buy RapidStream Inc for $48 million (S)","105","null","The New York Times","Business Day","News","article","WATCHGUARD IS BUYING RAPIDSTREAM FOR $48 MILLION","COMPANY NEWS; WATCHGUARD IS BUYING RAPIDSTREAM FOR $48 MILLION"
"https://www.nytimes.com/2002/07/05/business/international-business-japan-s-bad-loan-agency-turns-a-profit.html","Ken Belson","2002-07-05","Resolution and Collection Corp, agency charged with cleaning up Japan's banking problems, turned profit collecting bad loans last year; operation is still far from achieving its goals and lawmakers are weighing whether to speed up process by allow...","584","null","The New York Times","Business Day","News","article","Japan's Bad-Loan Agency Turns a Profit","INTERNATIONAL BUSINESS; Japan's Bad-Loan Agency Turns a Profit"
"https://www.nytimes.com/2002/07/06/your-money/IHT-upstart-airlines-above-the-clouds-the-granddaddy-of-them-all.html","Terry Maxon","2002-07-06","In early 1971, an upstart Texas air carrier hired M. Lamar Muse, a former airline executive then working as a consultant, to get it up and running. By the time he left Southwest Airlines Co. seven years later, Muse had helped create the successful...","4518","null","International Herald Tribune","Your Money","null","article","Upstart airlines / Above the clouds : The granddaddy of them all","Upstart airlines / Above the clouds : The granddaddy of them all"
"https://www.nytimes.com/2002/10/15/business/auriongold-to-accept-placer-dome-offer.html","Bernard Simon","2002-10-15","Australia's AurionGold abandons its opposition to hostile takeover bid from Placer Dome Inc of Canada; AurionGold's directors say that it is no longer in best interests of shareholders to reject Placer's offer of stock and cash, valued at 1.5 bill...","480","null","The New York Times","Business Day","News","article","AurionGold to Accept Placer Dome Offer","AurionGold to Accept Placer Dome Offer"
"https://www.nytimes.com/2002/12/16/technology/e-commerce-report-baby-boomers-grow-older-online-prescription-drug-sales-are.html","Bob Tedeschi","2002-12-16","Online sales of prescription drugs show steady growth as Internet users seek to cut costs and frequency of trips to drugstores; pharmacy-benefit management plans, which help run benefits programs for health insurers, are in strongest position to c...","1104","null","The New York Times","Technology","News","article","E-Commerce Report; As baby boomers grow older, online prescription drug sales are showing steady growth.","E-Commerce Report; As baby boomers grow older, online prescription drug sales are showing steady growth."
"https://www.nytimes.com/2002/01/24/business/text-of-fed-chairmans-testimony-on-the-economy.html","null","2002-01-24","The following text of testimony by Alan Greenspan, the Federal Reserve Board chairman, before the Senate Budget Committee, was taken from the Federal Reserve's web site, federalreserve.gov .","5301","null","The New York Times","Business Day","News","article","Text of Fed Chairman's Testimony on the Economy","Text of Fed Chairman's Testimony on the Economy"
"https://www.nytimes.com/2002/03/27/business/world-business-briefing-europe-cross-border-telecom-merger.html","Suzanne NYT","2002-03-27","Sonera of Finland and Telia of Sweden say they will merge to form Nordic region's largest telecommunications company; Finnish government still owns 53 percent of Sonera, and Swedish government owns 71 percent of Telia (S)","143","null","The New York Times","Business Day","News","article","World Business Briefing | Europe: Cross-Border Telecom Merger","World Business Briefing | Europe: Cross-Border Telecom Merger"
"https://www.nytimes.com/2002/11/26/business/world-business-briefing-asia-japan-isuzu-loss-triples.html","Ken NYT","2002-11-26","Losses at Isuzu Motors, which is 48.5 percent owned by General Motors, more than triple in six months through Sept; company reports 84 billion yen ($683 million) operating deficit and 24 percent sales decrease; anticipates 181 billion yen full-yea...","72","null","The New York Times","Business Day","News","article","World Business Briefing | Asia: Japan: Isuzu Loss Triples","World Business Briefing | Asia: Japan: Isuzu Loss Triples"
"https://www.nytimes.com/2002/02/16/your-money/IHT-singledip-or-doubledip-recession-where-to-put-your-money-91763289911.html","Sharon Reier","2002-02-16","Fasten your seat belts, investors: You may be in for a lot of turbulence if the current nearterm economic recovery is merely setting the stage for a severe second dip in a double-dip scenario. .""The markets are priced for the rare single dip,""","5223","null","International Herald Tribune","Your Money","null","article","Single-dip or double-dip recession?: Where to put your money hinges on whether the rebound will last","Single-dip or double-dip recession?: Where to put your money hinges on whether the rebound will last"
"https://www.nytimes.com/2002/09/14/world/world-briefing-europe-germany-kohl-bows-out.html","Victor NYT","2002-09-14","Former German Chancellor Helmut Kohl, 72, retiring as member of Parliament, skips final session before national election (S)","99","null","The New York Times","World","News","article","World Briefing | Europe: Germany: Kohl Bows Out","World Briefing | Europe: Germany: Kohl Bows Out"
"https://www.nytimes.com/2002/04/03/technology/technology-briefing.html","null","2002-04-03","Technology Briefing","1433","null","The New York Times","Technology","News","article","Technology Briefing","Technology Briefing"
"https://www.nytimes.com/2002/07/27/world/world-briefing-europe-greece-key-arrest-in-terror-killings.html","Anthee NYT","2002-07-27","Greek police arrest ceramics merchant Nikos Papanastasiou, Pavlos Serifis and Alexander Yiotopoulos, alleged members of terror group November 17, for 1975 assassination of CIA station chief Richard S Welch (S)","73","null","The New York Times","World","News","article","World Briefing | Europe: Greece: Key Arrest In Terror Killings","World Briefing | Europe: Greece: Key Arrest In Terror Killings"
"https://www.nytimes.com/2002/02/07/business/commercial-lending-increased-in-2001.html","Bloomberg News","2002-02-07","Mortgage Bankers Association of America says commercial mortgage lending rose 19 percent in 2001 as property owners took advantage of falling interest rates to refinance loans; lending rose to $73.8 billion from $62 million in 2000; American Counc...","203","null","The New York Times","Business Day","News","article","Commercial Lending Increased in 2001","Commercial Lending Increased in 2001"
"https://www.nytimes.com/2002/01/10/world/satellite-maker-fined-20-million-in-china-trade-secrets-case.html","Christopher Marquis","2002-01-10","Loral Space and Communications Corp reaches accord with State Department to pay $14 million in fines and spend $6 million to improve its compliance procedures over seven years to settle federal probe into charges it passed sensitive materials to C...","516","null","The New York Times","World","News","article","Satellite Maker Fined $20 Million in China Trade Secrets Case","Satellite Maker Fined $20 Million in China Trade Secrets Case"
"https://www.nytimes.com/2002/07/02/business/the-markets-stocks-bonds-range-of-fears-pushes-stocks-to-big-losses.html","Kenneth Gilpin","2002-07-02","Stock prices fall sharply, led by technology shares, pushing Nasdaq composite index to its lowest level in more than five years on worries about additional accounting scandals, new terrorist attacks and true health of economy; Nasdaq falls 59.41 p...","927","null","The New York Times","Business Day","News","article","Range of Fears Pushes Stocks To Big Losses","THE MARKETS: STOCKS & BONDS; Range of Fears Pushes Stocks To Big Losses"
"https://www.nytimes.com/2002/11/21/business/world-business-briefing-europe-britain-support-for-rate-cut-ebbs.html","Suzanne NYT","2002-11-21","Notes from Bank of England meeting of policy makers on Nov 6-7 show support for interest rate cut ebbed; two members voted to lower interest rates, compared with three who did so at previous meeting in October; benchmark interest rate was left unc...","128","null","The New York Times","Business Day","News","article","World Business Briefing | Europe: Britain: Support For Rate Cut Ebbs","World Business Briefing | Europe: Britain: Support For Rate Cut Ebbs"
"https://www.nytimes.com/2002/12/30/business/the-weeks-economic-events.html","null","2002-12-30","MONDAYExisting-Home SalesNov.","11","null","The New York Times","Business Day","News","article","The Week's Economic Events","The Week's Economic Events"
"https://www.nytimes.com/2002/07/06/business/the-markets-currencies.html","null","2002-07-06","Dollar rises, settling at 97.34 cents against euro; graph (S)","36","null","The New York Times","Business Day","News","article","THE MARKETS: CURRENCIES","THE MARKETS: CURRENCIES"
"https://www.nytimes.com/2002/05/22/business/the-media-business-advertising-addenda-clio-awards-honor-ddb-worldwide.html","Aaron Donovan","2002-05-22","DDB Worldwide takes top honors at annual Clio Awards ceremonies; DDB is named agency network of year and receives 31 Clios, including 2 Grand Clios; Fallon Worldwide and Harvest Films are other big winners (S)","145","null","The New York Times","Business Day","News","article","Clio Awards Honor DDB Worldwide","THE MEDIA BUSINESS: ADVERTISING -- ADDENDA; Clio Awards Honor DDB Worldwide"
"https://www.nytimes.com/2002/04/17/business/company-news-earnings-at-gannett-jump-40-percent-in-first-quarter.html","Bloomberg News","2002-04-17","Gannett Co's first-quarter profit rose nearly 40 percent; net income rose to $243.6 million from $174.5 million year earlier; sales fell 3.2 percent, to $1.52 billion (S)","105","null","The New York Times","Business Day","News","article","EARNINGS AT GANNETT JUMP 40 PERCENT IN FIRST QUARTER","COMPANY NEWS; EARNINGS AT GANNETT JUMP 40 PERCENT IN FIRST QUARTER"
"https://www.nytimes.com/2002/11/03/business/executive-life-tough-at-the-top-get-your-own-coffee.html","Melinda Ligos","2002-11-03","Budget cutting at many corporations takes aim at executive's privileges, and one of prime targets is their full-time administrative assistants; executive secretary who specializes in catering to needs of individual executive has become almost enda...","967","null","The New York Times","Business Day","News","article","Executive Life; Tough at the Top: Get Your Own Coffee","Executive Life; Tough at the Top: Get Your Own Coffee"
"https://www.nytimes.com/2002/11/07/world/critic-of-kazakh-leader-is-ailing-in-6th-day-of-hunger-strike.html","Michael Wines","2002-11-07","Sergei Duvanov, leading journalist and critic of Pres Nursultan Nazarbayev of Kazakhstan, is reported to be in deteriorating health in sixth day of hunger strike to protest what he calls government effort to frame him on child-rape charges; he was...","482","null","The New York Times","World","News","article","Critic of Kazakh Leader Is Ailing in 6th Day of Hunger Strike","Critic of Kazakh Leader Is Ailing in 6th Day of Hunger Strike"
"https://www.nytimes.com/2002/11/01/business/pinch-piracy-wakes-china-up-copyright-issue-it-s-more-than-trade-dispute-when.html","Joseph Kahn","2002-11-01","Chinese artists have begun to join big foreign interests like Microsoft Corp and AOL Time Warner to protest China's seemingly limitless capacity to make cheap knockoffs; throughout 1990's, intellectual property was mainly seen as trade dispute pit...","1218","null","The New York Times","Business Day","News","article","The Pinch of Piracy Wakes China Up On Copyright Issue; It's More Than a Trade Dispute When the Victims Are Chinese","The Pinch of Piracy Wakes China Up On Copyright Issue; It's More Than a Trade Dispute When the Victims Are Chinese"
"https://www.nytimes.com/2002/10/30/world/world-briefing-europe-russia-head-of-orthodox-church-ailing.html","Steven Myers","2002-10-30","Russian Orthodox Church Patriarch Aleksy II is hospitalized while visiting Russian republic of Astrakhan; photo (S)","89","null","The New York Times","World","News","article","World Briefing | Europe: Russia: Head Of Orthodox Church Ailing","World Briefing | Europe: Russia: Head Of Orthodox Church Ailing"
"https://www.nytimes.com/2002/06/27/news/the-next-europe-an-expanding-union-eu-pays-the-price-for-farm-subsidies.html","Thomas Fuller","2002-06-27","","3279","null","The New York Times","World","News","article","The next Europe / An expanding Union: EU pays the price for farm subsidies","The next Europe / An expanding Union: EU pays the price for farm subsidies"
"https://www.nytimes.com/2002/05/15/business/company-news-two-companies-decide-to-reincorporate-in-bermuda.html","Dow Jones","2002-05-15","Shareholders of Leucadia National Corp and Cooper Industries approve measures to reincorporate in Bermuda; Leucadia says it has no immediate plans to complete move to Bermuda because such transaction would be treated as sale of assets and company ...","137","null","The New York Times","Business Day","News","article","TWO COMPANIES DECIDE TO REINCORPORATE IN BERMUDA","COMPANY NEWS; TWO COMPANIES DECIDE TO REINCORPORATE IN BERMUDA"
"https://www.nytimes.com/2002/02/07/world/brazil-forum-more-local-than-worldly.html","Simon Romero","2002-02-07","Brazilian leftist organizations seize control of World Social Forum, antiglobalization alternative to World Economic Forum, and turn event into campaign stop for coming presidential election; Luiz Inacio Lula da Silva, presidential candidate of so...","775","null","The New York Times","World","News","article","Brazil Forum More Local Than Worldly","Brazil Forum More Local Than Worldly"
"https://www.nytimes.com/2002/06/08/your-money/IHT-they-done-you-wrong.html","Erika Kinetz","2002-06-08","Getting justice from your broker or investment adviser has a lot in common with the real-estate business: The key factors appear to be location, location and location.. The Japan Securities Dealers Association (www.jsda.or.jp), an industry organiz...","2131","null","International Herald Tribune","Your Money","null","article","They done you wrong?","They done you wrong?"
"https://www.nytimes.com/2002/02/21/business/enticements-are-cited-by-bankers-in-enron-case.html","Kurt Eichenwald","2002-02-21","Bankers for Enron Corp told former Enron treasurer Jeffrey McMahon that company that they had been led to believe that they could obtain lucrative businss from Enron if they agreed to invest money in outside partnership LJM controlled by Enron's c...","732","null","The New York Times","Business Day","News","article","Enticements Are Cited By Bankers In Enron Case","Enticements Are Cited By Bankers In Enron Case"
"https://www.nytimes.com/2002/09/30/world/rival-reformers-head-into-runoff-for-serbian-presidency.html","Daniel Simpson","2002-09-30","Yugoslav Pres Vojislav Kostunica, moderate nationalist, will face Miroljub Labus, pro-Western economist in runoff election; won 31.3 percent of vote, compared with 27.8 for Labus; Vojislav Seselj, nationalist firebrand, wins 22.5 percent of vote; ...","592","null","The New York Times","World","News","article","Rival Reformers Head Into Runoff for Serbian Presidency","Rival Reformers Head Into Runoff for Serbian Presidency"
"https://www.nytimes.com/2002/02/22/business/northrop-grumman-bids-about-59-billion-for-trw.html","From STAFF","2002-02-22","Northrop Grumman Corp. offered to acquire TRW Inc. for $47 a share in stock.","767","null","The New York Times","Business Day","News","article","Northrop Grumman Bids About $5.9 Billion for TRW","Northrop Grumman Bids About $5.9 Billion for TRW"
"https://www.nytimes.com/2002/04/29/world/child-traffickers-prey-on-bangladesh.html","Somini Sengupta","2002-04-29","Article on child trafficking in Bangladesh, considered one of most vulnerable spots in global trafficking market because of desperate poverty and demand for cheap labor elsewhere; problem has attracted attention of Bangladesh Government, which has...","1320","null","The New York Times","World","News","article","Child Traffickers Prey on Bangladesh","Child Traffickers Prey on Bangladesh"
"https://www.nytimes.com/2002/02/20/international/milosevic-crossexamines-victim-in-court.html","Ian Fisher","2002-02-20","Slobodan Milosevic faced his first victim of the war in Kosovo today in court.","1032","null","The New York Times","World","News","article","Milosevic Cross-Examines Victim in Court","Milosevic Cross-Examines Victim in Court"
"https://www.nytimes.com/2002/02/11/business/media-business-advertising-interactive-commercials-get-olympic-tryout-with.html","null","2002-02-11","Interactive television commercials make their Olympic debut during opening ceremonies; commercials for AT&T and TD Waterhouse permit interactivity only on television cable or satellite boxes equipped with Wink Communications software; photo (M)","788","null","The New York Times","Business Day","News","article","Interactive commercials get an Olympic tryout with viewers who have the right software.","THE MEDIA BUSINESS: ADVERTISING; Interactive commercials get an Olympic tryout with viewers who have the right software."
"https://www.nytimes.com/2002/11/01/business/the-media-business-advertising-addenda-accounts-690740.html","Constance Hays","2002-11-01","Interactive Advertising Bureau awards its account for online advertising campaign to Euro RSCG MVBMS Partners (S)","37","null","The New York Times","Business Day","News","article","Accounts","THE MEDIA BUSINESS: ADVERTISING -- ADDENDA; Accounts"
"https://www.nytimes.com/2002/11/07/business/gop-victory-sets-stage-for-probusiness-agenda.html","Mary Walsh","2002-11-07","Waking to a new power configuration in Washington, business leaders began to revise their wish lists for action on issues like taxes, health care and labor.","4535","null","The New York Times","Business Day","News","article","G.O.P. Victory Sets Stage for Pro-Business Agenda","G.O.P. Victory Sets Stage for Pro-Business Agenda"
"https://www.nytimes.com/2002/05/25/world/us-review-of-a-deadly-afghanistan-battle-finds-lapses.html","Eric Schmitt","2002-05-25","American officials say military review of battle in eastern Afghanistan in early March that left seven American soldiers dead found intelligence lapses, radio glitches and miscommunication between commanders and commandos; clash came on third day ...","927","null","The New York Times","World","News","article","U.S. Review of a Deadly Afghanistan Battle Finds Lapses","U.S. Review of a Deadly Afghanistan Battle Finds Lapses"
"https://www.nytimes.com/2002/06/07/business/big-board-issues-its-ideas-on-corporate-governance.html","null","2002-06-07","New York Stock Exchange issued recommendations intended to tighten corporate governance rules, including requiring that independent directors constitute majority on corporate boards; about 25 percent of 2,800 companies listed on exchange did not h...","827","null","The New York Times","Business Day","News","article","Big Board Issues Its Ideas on Corporate Governance","Big Board Issues Its Ideas on Corporate Governance"
"https://www.nytimes.com/2002/06/16/business/money-medicine-here-are-your-pills-do-you-want-the-seminar.html","Michelle Andrews","2002-06-16","Small but growing number of drugstores are expanding their services to include broader range of health management services; physicians are guardedly supportive of pharmacists entry into patient care (M)","747","null","The New York Times","Business Day","News","article","Here Are Your Pills. Do You Want the Seminar?","MONEY & MEDICINE; Here Are Your Pills. Do You Want the Seminar?"
"https://www.nytimes.com/2002/07/25/world/embattled-scrutinized-powell-soldiers-on.html","Todd Purdum","2002-07-25","Secretary of State Colin L Powell's string of internal policy differences and defeats sets off speculation that he might resign; associates dismiss that notion, saying Powell is not man easily defeated; veteran diplomats say that while internal te...","1917","null","The New York Times","World","News","article","Embattled, Scrutinized, Powell Soldiers On","Embattled, Scrutinized, Powell Soldiers On"
"https://www.nytimes.com/2002/10/17/technology/circuits/ad-campaign-leaves-pie-on-microsofts-face.html","David Pogue","2002-10-17","People accuse Microsoft of devious tactics all the time. Flanked by the best lawyers that money can buy, Microsoft generally denies the accusations, and that’s that.","1289","null","The New York Times","Technology","News","article","Ad Campaign Leaves Pie on Microsoft’s Face","Ad Campaign Leaves Pie on Microsoft’s Face"
"https://www.nytimes.com/2002/11/06/world/cleaned-up-for-party-beijing-is-swept-of-trouble.html","Elisabeth Rosenthal","2002-11-06","Delegates from all over China flood into Beijing to attend 16th Communist Party Congress; in preparation, tens of thousands of people regarded as potential troublemakers have been detained by authorities--many moved to custody in distant locales--...","1034","null","The New York Times","World","News","article","Cleaned Up for Party, Beijing Is Swept of 'Trouble'","Cleaned Up for Party, Beijing Is Swept of 'Trouble'"
"https://www.nytimes.com/2002/12/17/world/saudi-idlers-attract-radicals-and-worry-royals.html","Craig Smith","2002-12-17","Millions of economically distraught, educated young Saudis form restive core in oil-rich land; their idle presence represents prime recruiting ground for radical Islamists and is growing source of anxiety for ruling royal family; 15 of 19 Sept 11 ...","1280","null","The New York Times","World","News","article","Saudi Idlers Attract Radicals and Worry Royals","Saudi Idlers Attract Radicals and Worry Royals"
"https://www.nytimes.com/2002/06/19/world/us-officials-differ-on-strategy-for-iraq.html","null","2002-06-19","","105","null","The New York Times","World","Summary","article","U.S. Officials Differ On Strategy for Iraq","U.S. Officials Differ On Strategy for Iraq"
"https://www.nytimes.com/2002/12/20/business/the-markets-key-rates.html","null","2002-12-20","","118","null","The New York Times","Business Day","Statistics","article","Key Rates","THE MARKETS; Key Rates"
"https://www.nytimes.com/2002/06/17/business/enron-s-many-strands-the-overview-andersen-trial-yields-evidence-in-enron-s-fall.html","Kurt Eichenwald","2002-06-17","Evidence introduced at criminal trial of Arthur Andersen & Co indicates for first time that improper accounting decision, which set in motion demise of Enron Corp, served mainly to benefit financial interests of single corporate insider, outside p...","1537","null","The New York Times","Business Day","News","article","Andersen Trial Yields Evidence In Enron's Fall","ENRON'S MANY STRANDS: THE OVERVIEW; Andersen Trial Yields Evidence In Enron's Fall"
"https://www.nytimes.com/2002/06/01/business/company-news-hearst-buys-veranda-magazine-for-undisclosed-price.html","David NYT","2002-06-01","Hearst Magazines purchasB","87","null","The New York Times","Business Day","News","article","HEARST BUYS VERANDA MAGAZINE FOR UNDISCLOSED PRICE","COMPANY NEWS; HEARST BUYS VERANDA MAGAZINE FOR UNDISCLOSED PRICE"
