"|","|__writer_name","|__pub_date","|__snippet","|__word_count","|__score","|__source","|__section_name","|__type_of_material","|__document_type","|__main_headline","|__print_headline"
"https://www.nytimes.com/2010/10/22/business/global/22iht-nickel.html","Andrew Kramer","2010-10-21","Shareholders of Norilsk Nickel, a Russian company that produces about a fifth of the world’s nickel, thwarted an effort to oust the management.","484","null","The New York Times","Business Day","News","article","Oligarchs Fight Over Nickel Company","Oligarchs Fight Over Nickel Company"
"https://www.nytimes.com/2010/04/23/business/economy/23views.html","Agnes Crane","2010-04-23","Of the seven offerings on United States stock exchanges on Thursday, all but one initially priced at or below the bottom of the expected range the night before.","679","null","The New York Times","Business Day","News","article","Investors Resist I.P.O. Temptations","Investors Resist I.P.O. Temptations"
"https://www.nytimes.com/2010/09/07/business/07ipo.html","Peter Lattman","2010-09-07","Some 161 companies are seeking to raise more than $56 billion through initial public offerings, the largest volume on record for pent-up I.P.O.’s.","964","null","The New York Times","Business Day","News","article","Many Line Up to Go Public, but Market Mood Is Iffy","Many Line Up to Go Public, but Market Mood Is Iffy"
"https://www.nytimes.com/2010/08/28/business/global/28wheat.html","Andrew Kramer","2010-08-27","Farmers in Russia, many of them public corporations, said that rising prices would more than make up for their yield losses from the drought — and their shares were up, too.","1156","null","The New York Times","Business Day","News","article","Drought in Russia Ripples Beyond the Wheat Fields","Drought Cuts Yields, but Rising Prices Help Russia’s Corporate Farms"
"https://www.nytimes.com/2010/02/03/business/03views.html","Rolfe Winkler","2010-02-03","The sale of PNC Global Investment Servicing, the back-office operations of PNC Financial Services, raises PNC’s capital and is helping it repay $7.6 billion in bailout money.","702","null","The New York Times","Business Day","News","article","A Winning Deal for PNC Investors","A Winning Deal for PNC Investors"
"https://www.nytimes.com/2010/06/04/business/global/04rusoil.html","Andrew Kramer","2010-06-04","A venture to sell Russian natural gas to China was in trouble before the BP spill in the Gulf of Mexico.","555","null","The New York Times","Business Day","News","article","BP’s Natural Gas Joint Venture in Russia Is in Bankruptcy","BP’s Natural Gas Joint Venture in Russia Is in Bankruptcy"
"https://www.nytimes.com/2010/12/31/business/media/31oprah.html","Brian Stelter","2010-12-31","Oprah Winfrey and Discovery Communications are betting that media will become more personalized — beginning with a channel built around one of the biggest personalities on TV.","1125","null","The New York Times","Business Day","News","article","Shaping a Network With Oprah’s View","Shaping a Network With Oprah’s View"
"https://www.nytimes.com/2010/04/02/business/media/02tele.html","Bill Carter","2010-04-01","ABC and CBS had steep declines for their nightly newscasts, but NBC received its best ratings since 2005, in part because of the Olympics.","307","null","The New York Times","Business Day","News","article","Ratings Fall on Newscasts at 2 Networks","Ratings Fall On Newscasts At 2 Networks"
"https://www.nytimes.com/2010/01/13/business/media/13adco.html","Stuart Elliott","2010-01-13","A year after playing down their involvement, companies are promoting their Super Bowl spots.","859","null","The New York Times","Business Day","News","article","Super Bowl Sales as Economic Indicator","Super Bowl Sales as Economic Indicator"
"https://www.nytimes.com/2010/03/01/business/media/01adnewsletter3.html","null","2010-03-01","","1237","null","The New York Times","Business Day","News","article","People and Accounts of Note","null"
"https://www.nytimes.com/2010/06/16/world/asia/16kyrgyz.html","Clifford Levy","2010-06-15","Investigators from the United Nations believed that the conflict may have been touched off by coordinated attacks.","880","null","The New York Times","World","News","article","Evidence of Plans for Kyrgyz Violence","As Violence in Kyrgyzstan Eases, Evidence Suggests the Attacks Were Organized"
"https://www.nytimes.com/2010/03/25/your-money/estate-planning/25ESTATE.html","Paul Sullivan","2010-03-25","Reviewing legal documents regarding your estate will help ensure your wishes are carried out and make settling your affairs easier for your heirs.","1207","null","The New York Times","Your Money","News","article","Assemble a Paper Trail, and Make Sure Your Heirs Can Follow It","Assemble a Paper Trail, And Make Sure Your Heirs Can Follow It"
"https://www.nytimes.com/2010/06/10/technology/personaltech/10basics.html","Stefanie Olsen","2010-06-09","A study found that 75 percent of 12- to 17-year-olds in the United States owned a mobile phone. Parents say they generally buy their child a phone for safety reasons.","1281","null","The New York Times","Technology","News","article","When to Buy Your Child a Cellphone","When to Buy Your Child a Cellphone"
"https://www.nytimes.com/2010/04/05/business/media/05adnewsletter3.html","null","2010-04-05","The latest moves of executives and accounts in the advertising industry.","1172","null","The New York Times","Business Day","News","article","People and Accounts of Note in Advertising","Webdenda"
"https://www.nytimes.com/2010/10/01/business/01bp.html","Clifford Krauss","2010-09-30","Robert Dudley said BP was coming back from a near-death experience but would not shun risk in the future.","867","null","The New York Times","Business Day","News","article","New BP Chief Seeks a ‘Fast Evolution’","New Chief of BP Promises a ‘Fast Evolution’ to Improve Risk Management"
"https://www.nytimes.com/2010/01/21/business/21regulate.html","Sewell Chan","2010-01-21","William C. Dudley joined other Fed officials in warning that Congressional efforts to curb the Federal Reserve could undermine its effectiveness.","618","null","The New York Times","Business Day","News","article","Fed Chief in New York Defends Main Office","Fed Chief In New York Defends Main Office"
"https://www.nytimes.com/2010/06/07/business/media/07adnewsletter1.html","Stuart Elliott","2010-06-07","Tree Top apple juice returns to consumer marketing by pulling out the stops, digitally speaking.","1558","null","The New York Times","Business Day","News","article","Sit Under the Apple Tree With Me, Juice Brand Asks","Sit Under the Apple Tree With Me, Juice Brand Asks"
"https://www.nytimes.com/2010/12/30/technology/personaltech/30pogue.html","David Pogue","2010-12-29","The Sixth Annual Pogie Awards go to the best ideas in products, clever twists that make life just a little better.","1298","null","The New York Times","Technology","News","article","The Pogies: Best Tech Ideas of the Year","The Pogies: Best Ideas Of the Year"
"https://www.nytimes.com/2010/06/09/business/global/09bets.html","Julia Werdigier","2010-06-08","European retailers are betting on the soccer World Cup to help increase sales by promising cash for goals.","650","null","The New York Times","Business Day","News","article","It’s Not Just a Game, It’s a Promotion","World Cup Is Not Just A Game, It’s A Promotion"
"https://www.nytimes.com/2010/06/25/business/25mgm.html","Michael de la Merced","2010-06-25","Lions Gate is fending off a $7-a-share tender offer from Carl C. Icahn, while MGM is seeking to reorganize its $4 billion debt load.","245","null","The New York Times","Business Day","News","article","MGM Said to Be in Merger Talk","MGM Said to Be in Merger Talk"
"https://www.nytimes.com/2010/06/03/technology/03stream.html","Brad Stone","2010-06-03","The founders of the file-sharing site Kazaa will unveil a venture, Rdio, which will allow users to stream and store music on a range of mobile phones.","918","null","The New York Times","Technology","News","article","File-Sharing Pioneers Now Selling Music","Now Selling Music Files, Not Sharing"
"https://www.nytimes.com/2010/04/12/business/media/12adnewsletter3.html","null","2010-04-12","People and accounts of note in the ad industry.","1337","null","The New York Times","Business Day","News","article","People and Accounts of Note in Advertising","Webdenda"
"https://www.nytimes.com/2010/07/23/world/europe/23galileo.html","Rachel Donadio","2010-07-22","A Florence museum, renamed for Galileo, is exhibiting newly recovered bits of his body as if they were the relics of an actual saint.","1094","null","The New York Times","World","News","article","A Museum Display of Galileo Has a Saintly Feel","A Museum Display of Galileo, The Heretic, Has a Saintly Feel"
"https://www.nytimes.com/2010/11/08/business/media/08adnewsletter1.html","Stuart Elliott","2010-11-08","A campaign for the university’s School of Continuing and Professional Studies utilizes word clouds, which express in visual form the contents of Web sites, to promote adult courses.","1073","null","The New York Times","Business Day","News","article","Ads for N.Y.U. Have Their Words in the Clouds","Ads for N.Y.U. Have Their Words in the Clouds"
"https://www.nytimes.com/2010/06/14/technology/internet/14aolcambio.html","Brian Stelter","2010-06-14","The site, Cambio, is being billed as a next-generation video network, where entertainers can connect with their fans.","997","null","The New York Times","Technology","News","article","MTV Serves as Model for AOL Site","MTV Serves As Model For AOL Site"
"https://www.nytimes.com/2010/05/15/your-money/15money.html","Tara Bernard","2010-05-14","One cause of the pay gap between men and women may be how women approach negotiations, researchers say.","1463","null","The New York Times","Your Money","News","article","A Toolkit for Women Seeking a Raise","A Toolkit For Women Seeking A Raise"
"https://www.nytimes.com/2010/04/16/business/16views.html","Jeffrey Goldfarb","2010-04-16","With low interest rates and banks eager to lend, private equity firms may embark on a return to the good old days.","741","null","The New York Times","Business Day","News","article","Big Leveraged Buyouts May Soon Make a Comeback","Another Chance For Buyout Artists"
"https://www.nytimes.com/2010/06/04/business/economy/04shop.html","Christine Hauser","2010-06-03","Shoppers pulled back last month amid concerns about the global economy and stock market volatility.","686","null","The New York Times","Business Day","News","article","U.S. Retailers Report Lackluster Sales Gains ","Lackluster Gains Reported At Retail Stores Last Month"
"https://www.nytimes.com/2010/04/30/world/americas/30canada.html","Ian Austen","2010-04-29","Col. David Russell Williams, who is accused in two murders and two sexual assaults, was charged in Canada on Thursday with 82 additional crimes.","474","null","The New York Times","World","News","article","82 Charges Added On for Officer","Dual Life For Colonel In Canada"
"https://www.nytimes.com/2010/02/25/world/africa/25nigeria.html","Adam Nossiter","2010-02-24","President Umaru Yar’Adua’s return from medical treatment in Saudi Arabia had raised concerns that a power struggle might unfold between him and the vice president.","590","null","The New York Times","World","News","article","President Returns to Nigeria, but Not to Work","President Returns to Nigeria, but Not to Work"
"https://www.nytimes.com/2010/05/26/business/26vending.html","Stephanie Rosenbloom","2010-05-25","Futuristic machines are proliferating at airports, hotels and stores around the world, selling high-end products, and not for small change.","1150","null","The New York Times","Business Day","News","article","The New Touch-Face of Vending Machines","Machines That Accept Credit Cards, and Big Bills"
"https://www.nytimes.com/2010/01/09/business/economy/09earlybird.html","Damien Cave","2010-01-09","In Florida, early-bird specials have expanded beyond frugal retirees as younger diners tighten their budgets.","1135","null","The New York Times","Business Day","News","article","Newly Frugal Generation Revives Discount Dining","A Newly Frugal Generation Revives Discount Dining in Florida"
"https://www.nytimes.com/2010/05/06/business/economy/06dems.html","null","2010-05-06","Sensing the depth of public opinion, some Democratic senators — with the support of some conservative Republicans — are moving to stiffen a bill to regulate Wall Street.","1123","null","The New York Times","Business Day","News","article","Senate Liberals Push for Strict Financial Rules","Senate Liberals Move to Toughen Bill Regulating Wall Street"
"https://www.nytimes.com/2010/08/15/business/media/15archie.html","George Gustines","2010-08-14","A new management team is aggressively trying to transform the Archie family of characters into global brands in comics, film and apparel.","2204","null","The New York Times","Business Day","News","article","Hey, Archie! Want to Build an Empire?","Hey, Archie! Want to Build An Empire?"
"https://www.nytimes.com/2010/06/19/business/economy/19debt.html","Peter Goodman","2010-06-19","The recession has delivered an abundance of debt-saturated customers to settlement companies that take high fees regardless of whether debt is cut.","2410","null","The New York Times","Business Day","News","article","Peddling Relief, Firms Put Debtors in Deeper Hole","Peddling Relief, Firms Put Debtors in a Deeper Hole"
"https://www.nytimes.com/2010/02/19/world/americas/19mexico.html","Elisabeth Malkin","2010-02-19","The man accused of killing Bradley Roland Will in Oaxaca in 2006 was released from jail after a tribunal said there was no evidence against him.","485","null","The New York Times","World","News","article","Mexico Exonerates Suspect in Killing of U.S. Journalist","Mexico Exonerates Suspect In Killing of U.S. Journalist"
"https://www.nytimes.com/2010/03/06/business/economy/06stimulus.html","Louis Uchitelle","2010-03-06","Edward B. Montgomery is helping depressed former assembly towns tap federal money to build new futures.","1119","null","The New York Times","Business Day","News","article","For Auto Towns, Emissary Is Ambassador of Hope","Ambassador of Hope"
"https://www.nytimes.com/2010/07/12/business/media/12adnewsletter3.html","null","2010-07-12","Rob Baird rejoined the New York office of Mother as a global creative.","1062","null","The New York Times","Business Day","News","article","Accounts and People of Note in the Ad Industry","null"
"https://www.nytimes.com/2010/03/02/business/media/02adco.html","Stuart Elliott","2010-03-02","The best, worst and most tone-deaf commercials that ran — and ran — during NBC’s coverage of the Winter Olympics.","1087","null","The New York Times","Business Day","News","article","Medals for Ads During NBC’s Winter Olympics Coverage","One Final Trip to the Podium"
"https://www.nytimes.com/2010/01/10/business/mutfund/10global.html","Tim Gray","2010-01-09","Mutual funds specializing in emerging markets attracted more than $80 billion in new money over the last year, reflecting market gains.","1045","null","The New York Times","Business Day","News","article","How to Gauge the Rush to Emerging Markets","How to Gauge the Rush to Emerging Markets"
"https://www.nytimes.com/2010/05/23/business/23unboxed.html","Steve Lohr","2010-05-22","Innovations in technology are helping to shift the diagnosis, monitoring and treatment of diseases.","994","null","The New York Times","Business Day","News","article","High-Tech Alternatives to High-Cost Care","High-Tech Alternatives to High-Cost Care"
"https://www.nytimes.com/2010/02/17/business/energy-environment/17nukes.html","Matthew Wald","2010-02-16","The president announced approval of an $8.3 billion loan guarantee for two reactors in Georgia, which would be the first nuclear plants built in the United States since the 1970s.","915","null","The New York Times","Business Day","News","article","U.S. Supports New Nuclear Reactors in Georgia","U.S. Backs Construction Of Reactors"
"https://www.nytimes.com/2010/03/08/world/africa/08nigeria.html","Adam Nossiter","2010-03-07","Clashes between Muslims and Christians have been reported near the central Nigerian city of Jos, where sectarian violence flared in January.","428","null","The New York Times","World","News","article","Clashes Kill Dozens in Central Nigeria","Sectarian Clashes Kill Dozens in Central Nigeria"
"https://www.nytimes.com/2010/05/06/business/06regulate.html","Edward Wyatt","2010-05-05","The Senate approved two amendments that both Democrats and Republicans claimed would end the prospect of bailouts for companies deemed “too big to fail.”","502","null","The New York Times","Business Day","News","article","2 Votes Break Logjam on Financial Overhaul Bill","2 Votes Break Logjam on Financial Overhaul Bill"
"https://www.nytimes.com/2010/01/09/your-money/credit-and-debit-cards/09money.html","Ron Lieber","2010-01-08","Fees that merchants build to cover rewards programs lead to higher prices, which are passed on to poorer consumers.","1401","null","The New York Times","Your Money","News","article","The Damage of Card Rewards","The Damage Of Card Rewards"
"https://www.nytimes.com/2010/01/09/your-money/individual-retirement-account-iras/09convert.html","Tara Bernard","2010-01-08","The rules on converting a traditional I.R.A. into a Roth were relaxed this year, but making the change will not help everyone.","1440","null","The New York Times","Your Money","News","article","New Rules Ease Roth Conversions, but Benefits Vary","New Rules Allow Anyone to Convert to a Roth I.R.A., but Should You?"
"https://www.nytimes.com/2010/01/09/business/media/09times.html","Richard Pérez-Peña","2010-01-09","Trish Hall, the Living/Style editor of The New York Times, will become an assistant managing editor coordinating coordinate lifestyle coverage across the paper.","298","null","The New York Times","Business Day","News","article","Times Names Features Editor","Times Names Features Editor"
"https://www.nytimes.com/2010/01/09/business/energy-environment/09solar.html","Keith Bradsher","2010-01-09","The country is taking tentative steps to master an alternative energy industry: using mirrors to capture sunlight, produce steam and generate electricity.","998","null","The New York Times","Business Day","News","article","China Tries a New Tack to Go Solar","China Tries A New Tack To Go Solar"
"https://www.nytimes.com/2010/01/09/business/global/09whistle.html","Bloomberg News","2010-01-09","Birkenfeld was sentenced to a 40-month prison term for his part in the UBS tax evasion case.","206","null","The New York Times","Business Day","News","article","Ex-UBS Banker Reports to Prison","Ex-UBS Banker Reports to Prison"
"https://www.nytimes.com/2010/01/09/business/economy/09baltimore.html","Michael Powell","2010-01-09","Baltimore contends Wells Fargo steered blacks into high-interest subprime mortgages and caused damage to poor neighborhoods.","414","null","The New York Times","Business Day","News","article","Federal Judge Rejects Suit by Baltimore Against Bank","Federal Judge Rejects Suit By Baltimore Against Bank"
"https://www.nytimes.com/2010/01/09/technology/personaltech/09reader.html","Brad Stone","2010-01-09","Dozens of companies, both well known and unknown, brought slender touch-screen tablets and electronic reading devices to the Consumer Electronics Show in Las Vegas.","1204","null","The New York Times","Technology","News","article","A Deluge of Devices for Reading and Surfing","A Deluge of Devices for Reading and Surfing"
"https://www.nytimes.com/2010/01/10/world/middleeast/10balawi.html","Stephen Farrell","2010-01-09","A Jordanian suicide bomber said that his attack on C.I.A. operatives in Afghanistan last month was revenge for the killing of a Pakistani Taliban leader.","1385","null","The New York Times","World","News","article","Video Links Taliban in Pakistan to C.I.A. Attack","Video Bolsters Pakistani Taliban Link to C.I.A. Deaths"
"https://www.nytimes.com/2010/01/11/world/asia/11afghan.html","Rod Nordland","2010-01-10","A reporter and a U.S. Marine were killed when the vehicle they were traveling in struck a roadside bomb.","787","null","The New York Times","World","News","article","British Journalist and American Marine Die in Afghan Bomb Explosion","British Journalist and American Marine Die in Afghan Bomb Explosion"
"https://www.nytimes.com/2010/01/11/world/asia/11yemen.html","Steven Erlanger","2010-01-10","Yemen would talk to any Qaeda follower who “renounces violence and terrorism,” the president of Yemen said.","715","null","The New York Times","World","News","article","Yemen’s President Says Government Is Willing to Talk to Disarmed Qaeda Fighters","Yemen’s President Says Government Is Willing to Talk to Disarmed Qaeda Fighters"
"https://www.nytimes.com/2010/01/11/business/11drone.html","Christopher Drew","2010-01-10","So much video intelligence is coming out of Afghanistan that military analysts are finding it hard to keep up.","1394","null","The New York Times","Business Day","News","article","Military Is Awash in Data From Drones","Drone Flights Leave Military Awash in Data"
"https://www.nytimes.com/2010/01/11/technology/11iht-canal.html","Eric Pfanner","2010-01-11","The French cable television group has defied skeptics, reversed the damage from Vivendi's failed expansion and insulated itself against the advertising recession.","1280","null","International Herald Tribune","Technology","News","article","Under Low-Key Chief, Canal Plus Prospers","Under Low-Key Chief, Canal Plus Prospers"
"https://www.nytimes.com/2010/01/11/business/media/11nygard.html","Ian Austen","2010-01-11","Nygard, a sportswear line based in Canada, is suing for copyright infringement after an uninvited reporter covered its grand opening in Manhattan.","346","null","The New York Times","Business Day","News","article","Nygard Store Tries to Impose a Press Curb","Nygard Sues Over Unwanted Media Coverage of a Store Opening in Manhattan"
"https://www.nytimes.com/2010/01/11/business/economy/11views.html","null","2010-01-11","While regional banks are braced for a damaging impact, mortgage-backed-bond investors are betting that they will escape with just a few scratches.","755","null","The New York Times","Business Day","News","article","Hope of Reprieve for Bond Investors","Hope of Reprieve for Bond Investors"
"https://www.nytimes.com/2010/12/26/world/europe/26hungary.html","Judy Dempsey","2010-12-25","Prime Minister Viktor Orban is fighting back against criticism from European countries over a new law that some fear could curb press freedom.","538","null","The New York Times","World","News","article","Hungary Waves Off Criticism Over Media Law","Hungary Waves Off Criticism Over Media Restrictions"
"https://www.nytimes.com/2010/12/26/business/global/26chinarates.html","Edward Wong","2010-12-25","The move by China’s central bank appears to be part of a long-term campaign to suppress inflation, as ordinary Chinese express discontent with rising prices.","764","null","The New York Times","Business Day","News","article","China Raises Interest Rates Again to Cool Inflation","China Again Raises Interest Rates"
"https://www.nytimes.com/2010/12/27/world/middleeast/27baghdad.html","John Leland","2010-12-26","On a Friday night, dozens of motorcyclists and scooter riders gather on a boulevard in Baghdad, emulating American bikers but with some differences.","834","null","The New York Times","World","News","article","Iraq’s Wild Ones Are Mainly Looking to Impress","Iraq’s Wild Ones Are Mainly Looking to Impress"
"https://www.nytimes.com/2010/12/27/world/europe/27russia.html","Clifford Levy","2010-12-26","The demonstration in Moscow, held in reaction to a wave of disturbances in Russia, was one of the largest in recent memory by liberal groups.","318","null","The New York Times","World","News","article","Protesting Ethnic Strife in Russia","Protesting Ethnic Strife In Russia"
"https://www.nytimes.com/2010/12/27/business/media/27movies.html","Brooks Barnes","2010-12-27","Moviegoers have sent a message that seems obvious but has often been forgotten: make a good product, or we won’t buy.","1087","null","The New York Times","Business Day","News","article","Hollywood Moves Away From Middlebrow","Away From the Middlebrow"
"https://www.nytimes.com/2010/12/28/world/europe/28italy.html","Rachel Donadio","2010-12-27","Police believed the bomb was the work of the anarchist group that sent two similar packages last week.","383","null","The New York Times","World","News","article","Mail Bomb Defused at Rome Embassy","Letter Bomb Defused at Greek Embassy in Rome"
"https://www.nytimes.com/2010/12/28/world/asia/28korea.html","Martin Fackler","2010-12-27","President Lee Myung-bak said that his nation would not shy away from defending itself against the North, even if it meant the possibility of war.","555","null","The New York Times","World","News","article","South Korea Leader Sends North a Message","South Korea Leader Sends North a Message"
"https://www.nytimes.com/2010/12/28/world/asia/28afghan.html","Michael Kamber","2010-12-27","The explosion, which killed one and wounded 26 others, occurred in front of Kabul Bank, according to authorities.","648","null","The New York Times","World","News","article","Car Bomb Kills 1 and Hurts 26 Near Afghan Police Station","Car Bomb Kills 1, Hurts 26 Near Afghan Police Station"
"https://www.nytimes.com/2010/12/28/business/28aig.html","Adrienne Carter","2010-12-27","The insurer is replacing credit from the Federal Reserve of New York with bank lines of credit.","271","null","The New York Times","Business Day","News","article","36 Banks Provide A.I.G. With Credit","36 Banks Provide A.I.G. With Credit"
