"|","|__writer_name","|__pub_date","|__snippet","|__word_count","|__score","|__source","|__section_name","|__type_of_material","|__document_type","|__main_headline","|__print_headline"
"https://www.nytimes.com/2010/03/23/business/global/23cable.html","Ian Austen","2010-03-22","The system will allow owners of conventional television stations to negotiate payment from operators of cable and satellite TV systems.","811","null","The New York Times","Business Day","News","article","In Canada, Local Stations May Negotiate a Cable Fee","In Canada, Local Stations May Negotiate a Cable Fee"
"https://www.nytimes.com/2010/03/23/business/23lend.html","Louise Story","2010-03-22","Deciding which homeowners get federal money to help with mortgages is raising questions of fairness in Arizona.","1483","null","The New York Times","Business Day","News","article","Microcosm of Housing Crisis on an Arizona Street","Housing Crisis on Arizona Street Divides Neighbors"
"https://www.nytimes.com/2010/03/23/business/global/23enron.html","Vikas Bajaj","2010-03-23","A former Enron plant is a monument to India’s corruption, cronyism and weak economic policies, all impediments to the country’s development.","1342","null","The New York Times","Business Day","News","article","India’s Woes Reflected in Bid to Restart Old Plant","India’s Power Struggles"
"https://www.nytimes.com/2010/03/23/business/23pay.html","Eric Dash","2010-03-23","Of the 104 senior executives whose pay was set by the federal pay regulator in the last two years, about 85 percent are still with the companies, data shows.","1126","null","The New York Times","Business Day","News","article","Few Fled Companies Constrained by Pay Limits","Pay Limits Caused Few To Quit Jobs"
"https://www.nytimes.com/2010/03/30/business/30gene.html","John Schwartz","2010-03-29","In a ruling with potentially far-reaching implications for the patenting of human genes, a judge struck down a company’s patents on two genes linked to an increased risk of breast and ovarian cancer.","869","null","The New York Times","Business Day","News","article","Judge Invalidates Human Gene Patent","Cancer Genes Cannot Be Patented, U.S. Judge Rules"
"https://www.nytimes.com/2010/03/30/business/30subsidy.html","Steven Greenhouse","2010-03-30","An association representing 300 large companies said a provision of the health overhaul would hurt profits.","1066","null","The New York Times","Business Day","News","article","Companies Push to Repeal Provision of Health Law","In Tax Move, A Pushback On Reform"
"https://www.nytimes.com/2010/03/30/business/30housing.html","David Streitfeld","2010-03-30","After several disastrous months for home sales, the pace appears to be picking up again.","1270","null","The New York Times","Business Day","News","article","Spurt of Home Buying as End of Tax Credit Looms","Racing Against Time, Act II"
"https://www.nytimes.com/2010/03/30/world/asia/30karzai.html","Dexter Filkins","2010-03-30","The Obama administration is struggling with how to influence an ally they regard as unreliable.","1053","null","The New York Times","World","News","article","Afghan Leader Is Seen to Flout Influence of U.S.","AFGHAN LEADER IS SEEN TO FLOUT INFLUENCE OF U.S."
"https://www.nytimes.com/2010/03/30/business/30lehman.html","Bloomberg News","2010-03-30","Lehman, the investment bank liquidating in bankruptcy, is evaluating 65,000 claims totaling more than $819 billion.","347","null","The New York Times","Business Day","News","article","Lehman Says Debtor Claims May Decline","Lehman Says Debtor Claims May Decline"
"https://www.nytimes.com/2010/03/31/world/asia/31korea.html","Choe Sang-Hun","2010-03-30","President Lee Myung-bak became the first South Korean head of state to visit the disputed waters off the Korean Peninsula, after a navy ship sank there last week.","409","null","The New York Times","World","News","article","S. Korean President Visits Waters Where Ship Sank","South Korean Leader Visits Disputed Waters Where Naval Ship Sank"
"https://www.nytimes.com/2010/03/31/world/asia/31execute.html","Mark McDonald","2010-03-30","China executed “thousands” in 2009, more than the rest of the world combined, Amnesty International said.","548","null","The New York Times","World","News","article","China Said to Execute Thousands in ’09","China Leads in Executions, Report by Amnesty Finds"
"https://www.nytimes.com/2010/03/31/business/global/31ringgit.html","Liz Gooch","2010-03-30","Prime Minister Najib Razak said his government will promote greater private-sector investment and revise a controversial affirmative action policy to focus on need instead of race.","863","null","International Herald Tribune","Business Day","News","article","Malaysia Outlines New Growth Strategy","Malaysia Outlines New Growth Strategy"
"https://www.nytimes.com/2010/03/31/your-money/financial-planners/31iht-nwathletes.html","Conrad De Aenlle","2010-03-30","For anyone, a huge financial loss can be devastating. But a huge and unexpected good fortune may be just as ruinous, financial planners say.","819","null","International Herald Tribune","Your Money","News","article","A Special Peril Off the Playing Field","A Special Peril Off the Playing Field"
"https://www.nytimes.com/2010/03/31/business/global/31punt.html","Matthew Saltmarsh","2010-03-30","The plan includes helping the banks raise $30 billion and a “bad bank” to handle failing loans.","615","null","The New York Times","Business Day","News","article","Ireland Lays Out a Plan to Help Banks","Ireland Lays Out a Broad Plan to Help Rescue Its Banks"
"https://www.nytimes.com/2010/03/31/business/global/31ford.html","Keith Bradsher","2010-03-30","Ford has cut back on luxury models and increased output of smaller, fuel-efficient cars.","1267","null","The New York Times","Business Day","News","article","Ford Shifts and Gains Ground in Asia","In China, Back to Henry’s Way"
"https://www.nytimes.com/2010/03/22/business/global/22euro.html","Jack Ewing","2010-03-21","Chancellor Angela Merkel of Germany said that Greece should solve its own problems, ahead of a summit meeting scheduled for Thursday.","894","null","International Herald Tribune","Business Day","News","article","Rift in E.U. Widens Over Importance of Greek Aid","Merkel Remains at Odds With Rest of E.U. Over Greece"
"https://www.nytimes.com/2010/03/22/world/americas/22haiti.html","Deborah Sontag","2010-03-22","A country club has been transformed into a mucky makeshift city, home to at least 44,000 people displaced by the earthquake.","1004","null","The New York Times","World","News","article","Tent City at a Golf Club Dramatizes Haiti’s Limbo","Sprawling Tent City at a Golf Club Dramatizes Haiti’s Limbo"
"https://www.nytimes.com/2010/03/22/world/middleeast/22egypt.html","Michael Slackman","2010-03-22","The restoration of a synagogue in Egypt illustrates how the government has tried to satisfy foreign critics and domestic political opinion.","1023","null","The New York Times","World","News","article","A Synagogue’s Unveiling Exposes a Conundrum","Policy Contortions Conceal a Shared Religious Heritage Behind a Curtain"
"https://www.nytimes.com/2010/11/21/technology/21brain.html","Matt Richtel","2010-11-21","The constant stream of stimuli offered by new technology poses a profound new challenge to focusing and learning.","4190","null","The New York Times","Technology","News","article","Growing Up Digital, Wired for Distraction","YOUR BRAIN ON COMPUTERS; Growing Up Digital, Wired for Distraction"
"https://www.nytimes.com/2010/11/21/world/asia/21kabul.html","Rod Nordland","2010-11-20","“Eagle Four” is a police show financed largely by American Embassy money.","1130","null","The New York Times","World","News","article","On TV, an Afghan Unit Tackles the Taliban","On TV, an Afghan Unit Challenges Tradition And Tackles the Taliban"
"https://www.nytimes.com/2010/11/21/world/asia/21intel.html","David Sanger","2010-11-21","North Korea showed an American scientist last week a vast new facility it secretly and rapidly built to enrich uranium.","1356","null","The New York Times","World","News","article","North Koreans Unveil New Plant for Nuclear Use","NORTH KOREANS\nUNVEIL NEW PLANT\nFOR NUCLEAR USE"
"https://www.nytimes.com/2010/11/21/world/middleeast/21parcel.html","Scott Shane","2010-11-21","Al Qaeda’s branch in Yemen said that its failed parcel bomb plot last month reflected a strategy of cheap attacks meant to inflict broad economic damage.","822","null","The New York Times","World","News","article","Qaeda Branch Aimed for Broad Damage at Low Cost","Qaeda Branch Says Plot Used Strategy of Broad Damage at Low Cost"
"https://www.nytimes.com/2010/11/22/world/middleeast/22mideast.html","Isabel Kershner","2010-11-21","The Palestinian president, Mahmoud Abbas, said that any American proposal for restarting peace talks must include a complete halt in Israeli settlement building.","773","null","The New York Times","World","News","article","Palestinian Leader Insists on Halt to Settlements","Palestinian Insists on Halt To Settlements In Jerusalem"
"https://www.nytimes.com/2010/11/22/business/media/22potter.html","Brooks Barnes","2010-11-21","The global sales for the seventh Harry Potter movie was a result of a yearlong full-court press by Warner Brothers.","716","null","The New York Times","Business Day","News","article","‘Harry Potter’ Has $330 Million Debut Weekend","Warner’s Edgy ‘Harry Potter’ Campaign Pays Off"
"https://www.nytimes.com/2010/11/22/business/media/22nbc.html","Bill Carter","2010-11-22","Two of NBC’s top cable executives not only kept their jobs but also were given new responsibilities, a sign of Comcast’s respect for the cable operations.","979","null","The New York Times","Business Day","News","article","Comcast’s Plans for Executives Offer Clues to Future of NBC","Comcast’s Plans for Executives Offer Clues to Future of NBC"
"https://www.nytimes.com/2010/11/22/business/22views.html","null","2010-11-22","Motorola will restructure in January, but there’s still a gap between the company’s current and break-up value.","748","null","The New York Times","Business Day","News","article","In Motorola Split, New Chapter","In Motorola Split, New Chapter"
"https://www.nytimes.com/2010/11/22/business/media/22link.html","Noam Cohen","2010-11-22","The Web site iCasualties.org has had a decline in traffic and donations as public interest in the wars has waned.","955","null","The New York Times","Business Day","News","article","Close Watch on Casualties in Afghanistan and Iraq","Close Watch on Casualties in Afghanistan and Iraq"
"https://www.nytimes.com/2010/11/22/world/americas/22assess.html","Jackie Calmes","2010-11-22","President Obama had mixed results on his Asia trip, but he seemed much happier after the NATO summit in Lisbon.","1151","null","The New York Times","World","News","article","For Obama, a Little Help From His Friends","For Obama, a Little Help From His Friends"
"https://www.nytimes.com/2010/11/22/world/asia/22grunts.html","James Dao","2010-11-22","Life on the front lines has two sides: the adrenaline-fueled moments of fighting, and the unglamorous everything else.","2570","null","The New York Times","World","News","article","Between Firefights, Jokes, Sweat and Tedium","Between Firefights, Jokes and Sweat, Tales and Tedium"
"https://www.nytimes.com/2010/11/22/world/americas/22haiti.html","Randal Archibold","2010-11-22","Earthquake devastation and a cholera epidemic have kept Haitians angry and distracted from coming elections.","1307","null","The New York Times","World","News","article","Mired in Crises, Haiti Struggles to Focus on Election","Mired in Crises, Haiti Struggles to Focus on Election"
"https://www.nytimes.com/2010/11/23/world/asia/23nz.html","Jonathan Hutchison","2010-11-22","A New Zealand police official admitted for the first time on Monday the possibility of fatalities from a coal mine explosion that trapped 29 men underground.","330","null","The New York Times","World","News","article","Officials Admit Possible Loss of Life in New Zealand Mine Blast","Officials Admit Possible Loss of Life in New Zealand Mine Blast"
"https://www.nytimes.com/2010/11/23/world/asia/23afghan.html","Rod Nordland","2010-11-22","The senior civilian representative of NATO in Afghanistan provoked critics after saying that Kabul is safer for children than major Western cities.","658","null","The New York Times","World","News","article","Criticism Sharp After NATO Official Portrays Kabul as Safe for Children","Sharp Criticism After a NATO Official Portrays Kabul as Safe for Children"
"https://www.nytimes.com/2010/11/23/business/23views.html","Rob Cox","2010-11-23","A record number of companies, including Harrah’s, look set to abort their market debuts as investors looks skeptically.","755","null","The New York Times","Business Day","News","article","For Harrah’s I.P.O., Investors Are Wary","Investors Get Wise On Offerings"
"https://www.nytimes.com/2010/12/14/world/asia/14india.html","Jim Yardley","2010-12-13","Allegations of bribery, abuse of power and privatization of public wealth have sent the Congress Party into a tailspin.","1205","null","The New York Times","World","News","article","Telecom Scandal Plunges India Into Political Crisis","Phone Scandal In India Shakes Top Politicians"
"https://www.nytimes.com/2010/12/14/business/media/14adco.html","Andrew Newman","2010-12-14","Kissing, shredding paper and riding a bicycle are among the activities linked to the annual celebration in Times Square by marketers like Nivea, Duracell, GetMarried.com and MasterCard.","978","null","The New York Times","Business Day","News","article","For New Year’s Eve, the Tie-Ins Erupt","For New Year’s Eve, The Tie-Ins Erupt"
"https://www.nytimes.com/2010/12/14/business/14amgen.html","Andrew Pollack","2010-12-14","The treatment, denosumab, delayed the spread of prostate cancer to bones in a clinical trial, the company said late Monday.","582","null","The New York Times","Business Day","News","article","Amgen Drug Slows Spread of Cancer but Doesn’t Extend Life","Amgen Drug Slows Spread of Cancer but Doesn’t Improve Survival in Trial"
"https://www.nytimes.com/2010/12/15/world/europe/15sweden.html","John Burns","2010-12-14","The attack could have been devastating, said Swedish police, who also confirmed the bomber’s identity.","1034","null","The New York Times","World","News","article","Police Say Early Detonation of Bomb Averted Disaster in Sweden","Police Say Early Detonation of Bomb Averted Disaster in Sweden"
"https://www.nytimes.com/2010/12/15/world/europe/15assange.html","Ravi Somaiya","2010-12-14","Julian Assange was ordered released on $310,000 bail as he challenges a Swedish prosecutor’s demand for his extradition but remained in custody pending appeal.","1242","null","The New York Times","World","News","article","Release on Bail of WikiLeaks Founder Is Delayed by Appeal","Founder of WikiLeaks Is Ordered Freed on Bail"
"https://www.nytimes.com/2010/12/15/world/europe/15italy.html","Rachel Donadio","2010-12-14","Prime Minister Silvio Berlusconi of Italy escaped the collapse of his government, but political uncertainty remained.","1016","null","The New York Times","World","News","article","Berlusconi Survives Confidence Vote","Berlusconi Survives Confidence Votes, but Protests Erupt in Rome"
"https://www.nytimes.com/2010/12/15/world/europe/15germany.html","Alan Cowell","2010-12-14","Germany staged simultaneous raids in three states against Islamic networks suspected of seeking the imposition of an Islamic state in Germany.","749","null","The New York Times","World","News","article","Raid on Islamic Groups in Germany","German Authorities Raid Islamic Groups in 3 States"
"https://www.nytimes.com/2010/12/15/world/asia/15bangladesh.html","Julfikar Manik","2010-12-14","The fire at a garment factory north of Dhaka, the capital, was the latest blow to the country’s largest industry.","429","null","The New York Times","World","News","article","Bangladesh Factory Fire Kills at Least 20","Fire Breaks Out in Top Floors of Bangladesh Garment Factory, Killing at Least 20"
"https://www.nytimes.com/2010/12/15/business/economy/15leonhardt.html","David Leonhardt","2010-12-15","Resistance to the expansion of the social safety net stems from tension between two competing traditions.","1050","null","The New York Times","Business Day","News","article","Opposition to Health Law Is Steeped in Tradition","In Health Law, Old Arguments Get New Airing"
"https://www.nytimes.com/2010/12/15/world/americas/15mexico.html","Randal Archibold","2010-12-15","The status of a legislator elected 15 months before he vanished from public view comes with a perk: immunity.","1070","null","The New York Times","World","News","article","Politics Enables Mexican Fugitive to Defang a Law","POLITICS ENABLES MEXICAN FUGITIVE TO DEFANG A LAW"
"https://www.nytimes.com/2010/12/15/world/africa/15kenya.html","Jeffrey Gettleman","2010-12-15","A prosecutor wants to charge high-ranking politicians on both sides of the 2007-8 crisis with crimes against humanity.","1273","null","The New York Times","World","News","article","International Court Seeks Indictments in Kenya Vote Violence","Kenyans’ Indictment for Postelection Violence Is Sought"
"https://www.nytimes.com/2010/12/15/business/media/15ebooks.html","Julie Bosman","2010-12-15","Publishers are capitalizing on the iPad and the Nook Color by producing illustrated e-books, particularly for children.","651","null","The New York Times","Business Day","News","article","E-Readers With Color Open Door for Pictures","E-Readers With Color Open Door For Pictures"
"https://www.nytimes.com/2010/12/16/world/europe/16greece.html","Niki Kitsantonis","2010-12-15","Thousands of Greeks took to the streets of Athens for a protest marred by violence as a general strike brought international travel and public services to a standstill.","560","null","The New York Times","World","News","article","Anti-Austerity Protest in Greece Turns Violent","Anti-Austerity Protest in Greece Turns Violent"
"https://www.nytimes.com/2010/12/16/world/asia/16redcross.html","Alissa Rubin","2010-12-15","The International Committee of the Red Cross held a rare news conference to express concern that security is preventing aid groups from reaching victims of conflict.","323","null","The New York Times","World","News","article","For Red Cross, Aid Conditions Hit New Low in Afghanistan","For Red Cross, Aid Conditions In Afghanistan Hit New Low"
"https://www.nytimes.com/2010/12/16/business/16obama.html","Helene Cooper","2010-12-15","Mr. Obama invited 20 executives to join him to discuss trade, tax reform, education and how to encourage companies to stop sitting on their cash reserves.","636","null","The New York Times","Business Day","News","article","Obama Tries Charm Offensive on Group of Top Executives","Obama Tries Charm Offensive on Group of Top Executives"
"https://www.nytimes.com/2010/12/22/business/media/22adco.html","Andrew Newman","2010-12-22","Allstar Products said it had sold 25 million Snuggies, the blanket with arms, and there were no signs that sales were waning.","912","null","The New York Times","Business Day","News","article","Lots of Laughs, and Even More Sales","Lots of Laughs, And Even More Sales"
"https://www.nytimes.com/2010/12/22/world/europe/22pope.html","Rachel Donadio","2010-12-21","The Vatican said that remarks about condoms for disease prevention did not justify using them for birth control.","726","null","The New York Times","World","News","article","Vatican Adds Nuance to Pope’s Condom Remarks","Vatican Further Clarifies Pope’s Remarks on Condoms"
"https://www.nytimes.com/2010/12/22/business/global/22bskyb.html","Bloomberg News","2010-12-22","Vince Cable, who oversaw media and telecommunications policy in Britain, was quoted saying that he had “declared war” on Rupert Murdoch.","254","null","The New York Times","Business Day","News","article","Minister Loses Sway After Remarks","Minister Loses Sway After Remarks"
"https://www.nytimes.com/2010/12/23/world/asia/23korea.html","Mark McDonald","2010-12-22","Despite previous warnings of retaliation, the South Korean military continued to defy North Korea on Wednesday by launching a three-day naval drill in the Sea of Japan.","606","null","The New York Times","World","News","article","South Korea’s Latest Military Exercises Draw Little Reaction From North Korea","South Korea’s Latest Military Exercises Draw Little Reaction From North Korea"
"https://www.nytimes.com/2010/12/26/business/26proto.html","Amy Wallace","2010-12-25","Inventors of the past year had many reasons for their creations — from the need to solve an immediate problem to the need for self-expression.","1031","null","The New York Times","Business Day","News","article","Behind the Many Faces of Innovation, 2010","Behind The Many Faces of Innovation, 2010"
"https://www.nytimes.com/2010/12/23/world/europe/23treaty.html","Peter Baker","2010-12-22","A new treaty with Russia will scale back cold war nuclear arsenals and caps a surprisingly successful lame-duck session for President Obama.","1528","null","The New York Times","World","News","article","Senate Passes Arms Control Treaty With Russia, 71-26","Senate Hammering Out G.O.P. Amendments to Treaty"
"https://www.nytimes.com/2010/12/23/world/asia/23afghan.html","Michael Kamber","2010-12-23","Abdul Karim Barahwe, the governor of Nimroz Province in western Afghanistan, said the Iranian authorities had started halting tankers bound for Afghanistan about 10 days ago.","521","null","The New York Times","World","News","article","Iran Stops Fuel Delivery, Afghanistan Says, and Prices Are Rising","Iran Has Stopped Sending Deliveries of Fuel, Afghanistan Says, and Prices Are Rising"
"https://www.nytimes.com/2010/12/23/business/23prichard.html","Michael Cooper","2010-12-23","As cities and states struggle to pay for pensions, Prichard, Ala., is a worst case. Some retirees have become destitute.","1587","null","The New York Times","Business Day","News","article","Alabama Town’s Failed Pension Is a Warning","In Town That Stopped Checks, A Warning on Public Pensions"
"https://www.nytimes.com/2010/12/23/world/europe/23magnitsky.html","Ellen Barry","2010-12-23","Reports had different conclusions about the death in detention of a lawyer who had accused investigators of fraud.","2482","null","The New York Times","World","News","article","After Russian Death, Inquiry Doors Open and Shut","After Death in Russian Prison, Inquiry Doors Open and Shut"
"https://www.nytimes.com/2010/12/24/business/energy-environment/24fuel.html","Matthew Wald","2010-12-23","With natural gas getting cheaper, a bit of alchemy may be the cheapest way to create a gallon of diesel fuel.","998","null","The New York Times","Business Day","News","article","New Interest in Turning Gas to Diesel","New Interest in Converting Gas to Diesel"
"https://www.nytimes.com/2010/12/10/business/global/10yuan.html","Bettina Wassener","2010-12-10","Exports and imports grew much more firmly than expected last month, fanning expectations that Beijing will soon raise interest rates further to fight inflation.","230","null","The New York Times","Business Day","News","article","Trade Growth Accelerated in China","China’s Trade Growth Stronger Than Expected"
"https://www.nytimes.com/2010/12/11/world/11military.html","Elisabeth Bumiller","2010-12-10","Defense Secretary Robert M. Gates said he had not been optimistic that the Senate would repeal the law.","540","null","The New York Times","World","News","article","Gates Regrets Rejection of ‘Don’t Ask, Don’t Tell’","Gates Regrets Rejection of ‘Don’t Ask, Don’t Tell’"
"https://www.nytimes.com/2010/12/11/world/europe/11anonymous.html","Ravi Somaiya","2010-12-11","Internet security experts said that tens of thousands more supporters had downloaded the attack software since the WikiLeaks founder, Julian Assange, was jailed in Britain.","686","null","The New York Times","World","News","article","Activists Say Web Assault for Assange Is Expanding","Activists Say Web Assault For Assange Is Expanding"
"https://www.nytimes.com/2010/12/11/world/middleeast/11nuke.html","David Sanger","2010-12-10","President Obama’s chief nuclear adviser said that tougher measures would be part of an effort to force Iran into suspending production of nuclear fuel.","598","null","The New York Times","World","News","article","U.S. and Allies Plan More Sanctions Against Iran","Harder Push To Stop Iran From Making Nuclear Fuel"
"https://www.nytimes.com/2010/12/13/business/media/13adnewsletter3.html","null","2010-12-13","Bang Bang Films, Mumbai, India, and Believe Media, Los Angeles, are forming Believe@Bang Bang.","1079","null","The New York Times","Business Day","News","article","Accounts and People of Note in the Ad Industry","Webdenda"
"https://www.nytimes.com/2010/12/11/your-money/11wealth.html","Paul Sullivan","2010-12-10","Nothing brings Ponzi schemes to the surface like a financial crisis. Here are some steps investors can take to keep from being among the victims.","1244","null","The New York Times","Your Money","News","article","How to Avoid Being Taken in by a Ponzi Scheme","Ponzi Schemes Aplenty, And How to Avoid Them"
"https://www.nytimes.com/2010/12/12/your-money/12haggler.html","David Segal","2010-12-11","A trip with Norwegian Cruise Line was terrible, but the company’s reaction to complaints was even worse.","996","null","The New York Times","Your Money","News","article","For This Cruise Line, Better Pack Your Lunch","For This Cruise Line, Better Pack Your Lunch"
