"|","|__writer_name","|__pub_date","|__snippet","|__word_count","|__score","|__source","|__section_name","|__type_of_material","|__document_type","|__main_headline","|__print_headline"
"https://www.nytimes.com/2002/06/16/business/investing-gearing-up-for-lower-expectations.html","Elizabeth Harris","2002-06-16","Investors now expect that stock market's long-term returns will be lower than they anticipated few years ago; article demonstrates how reduction of one or two percentage points annually has large impact on value of long-term holdings; photo; graph...","1285","null","The New York Times","Business Day","News","article","Investing; Gearing Up for Lower Expectations","Investing; Gearing Up for Lower Expectations"
"https://www.nytimes.com/2002/10/17/business/technology-briefing-hardware-sun-microsystems-credit-rating-lowered.html","Bloomberg News","2002-10-17","Sun Microsystems Inc's credit rating is reduced by Standard & Poor's on concern about weak demand for company's products, including server computers that run business networks and Web sites (S)","118","null","The New York Times","Business Day","News","article","Technology Briefing | Hardware: Sun Microsystems' Credit Rating Lowered","Technology Briefing | Hardware: Sun Microsystems' Credit Rating Lowered"
"https://www.nytimes.com/2002/02/08/business/worldbusiness/world-business-briefing.html","null","2002-02-08","World Business Briefing","1247","null","The New York Times","Business Day","News","article","World Business Briefing","World Business Briefing"
"https://www.nytimes.com/2002/01/04/business/technology-briefing-software-in-a-switch-fbi-endorses-xp-patch.html","null","2002-01-04","FBI's National Infrastructure Protection Center reverses course and says free software patch offered by Microsoft Corp does protect against serious flaws in Windows XP, its latest version of Windows software (S)","139","null","The New York Times","Business Day","News","article","Technology Briefing | Software: In A Switch, F.B.I. Endorses XP Patch","Technology Briefing | Software: In A Switch, F.B.I. Endorses XP Patch"
"https://www.nytimes.com/2002/08/06/technology/technology-briefing-ecommerce.html","null","2002-08-06","AVOCENT TO BUY 2C COMPUTING FOR $22.8 MILLION; INVESTMENT IN CORNELL CENTER INCREASED;.","641","null","The New York Times","Technology","News","article","Technology Briefing: E-Commerce","Technology Briefing: E-Commerce"
"https://www.nytimes.com/2002/10/27/business/l-the-role-of-politics-in-a-pension-fund-592528.html","null","2002-10-27","Paul Sheridan letter responds to Oct 13 article about investment vehicles used by California's state employees' pension fund","199","null","The New York Times","Business Day","Letter","article","The Role of Politics In a Pension Fund","The Role of Politics In a Pension Fund"
"https://www.nytimes.com/2002/09/23/business/copyright-hurdles-confront-selling-of-music-on-the-internet.html","Amy Harmon","2002-09-23","Services that want to sell music online are facing administrative and other problems getting permission from recordings companies and composers; record labels withhold rights to some songs to protect CD sales and sometimes favor own services over ...","1937","null","The New York Times","Business Day","News","article","Copyright Hurdles Confront Selling of Music on the Internet","Copyright Hurdles Confront Selling of Music on the Internet"
"https://www.nytimes.com/2002/05/31/business/world-business-briefing-europe-italy-insurer-acquires-rival.html","Bloomberg News","2002-05-31","Societa Assicuratrice Industriale will buy La Fondiaria Assicurazioni, ending 10-month takeover battle, to create Italy's biggest casualty insurer; deal values Fondiaria at 1.86 billion euros (S)","63","null","The New York Times","Business Day","News","article","World Business Briefing | Europe: Italy: Insurer Acquires Rival","World Business Briefing | Europe: Italy: Insurer Acquires Rival"
"https://www.nytimes.com/2002/10/21/business/worldbusiness/IHT-what-it-means-jargon-acronyms-and-other-cryptic.html","Victoria Shannon","2002-10-21","We all know dot-com. That's the bubble that burst. But what about dot-aero, dot-coop and dot-pro?.These are all shorthand expressions for locations on the World Wide Web, and they are called by Internet know-it-alls TLDs — top-level domains, the m","1808","null","International Herald Tribune","Business Day","null","article","what it MEANS / jargon, acronyms and other cryptic terms in the news : Dot-dot-dot-dash-dash-dash","what it MEANS / jargon, acronyms and other cryptic terms in the news : Dot-dot-dot-dash-dash-dash"
"https://www.nytimes.com/2002/09/23/business/the-media-business-advertising-addenda-accounts-021628.html","Stuart Elliott","2002-09-23"," * Advertising account changes noted (S)","217","null","The New York Times","Business Day","News","article","Accounts","THE MEDIA BUSINESS: ADVERTISING -- ADDENDA; Accounts"
"https://www.nytimes.com/2002/03/09/world/mideast-turmoil-the-diplomacy-us-shifts-gears-in-mideast-policy.html","Todd Purdum","2002-03-09","Pres Bush decides to have his special envoy Anthony C Zinni return to Middle East after concluding that in face of rising violence, riskiest thing of all now might be to do nothing, even if there is nothing new to do; administration officials say ...","996","null","The New York Times","World","News","article","U.S. Shifts Gears in Mideast Policy","MIDEAST TURMOIL: THE DIPLOMACY; U.S. Shifts Gears in Mideast Policy"
"https://www.nytimes.com/2002/01/15/international/asia/pakistan-leader-reaffirms-support-for-the-kashmir-cause.html","Erik Eckholm","2002-01-15","General Pervez Musharraf restated Pakistan's unbending support for ""the Kashmir cause and the people of Kashmir"" today as Pakistani and Indian officials awaited the arrival of Secretary of State Colin Powell.","600","null","The New York Times","World","News","article","Pakistan Leader Reaffirms Support for the Kashmir Cause and People","Pakistan Leader Reaffirms Support for the Kashmir Cause and People"
"https://www.nytimes.com/2002/07/23/business/the-markets-key-rates.html","null","2002-07-23","","118","null","The New York Times","Business Day","Statistics","article","Key Rates","THE MARKETS; Key Rates"
"https://www.nytimes.com/2002/04/19/international/finance-ministers-to-discuss-fighting-terrorism-and-poverty.html","Richard Stevenson","2002-04-19","As protesters streamed into Washington, finance ministers gathered today to take up proposals for battling terrorism and poverty.","486","null","The New York Times","World","News","article","Finance Ministers to Discuss Fighting Terrorism and Poverty","Finance Ministers to Discuss Fighting Terrorism and Poverty"
"https://www.nytimes.com/2002/10/01/business/poultry-farm-settles-suit.html","Bloomberg News","2002-10-01","MILWAUKEE, Sept. 30 (Bloomberg News) — DeCoster Farms, a poultry and egg processor in Iowa, has agreed to pay $1.53 million to settle government allegations that migrant employees were raped or harassed by supervisors. Some of the money will go to...","187","null","The New York Times","Business Day","News","article","Poultry Farm Settles Suit","Poultry Farm Settles Suit"
"https://www.nytimes.com/2002/09/10/world/threats-responses-baghdad-s-arsenal-weapons-development-called-iraq-s-priority.html","Warren Hoge","2002-09-10","Report by International Institute for Strategic Studies says Iraq has sizeable stockpiles of chemical and biological weapons and can quickly expand production, but will be unable to build nuclear weapon for years unless it obtains radioactive mate...","712","null","The New York Times","World","News","article","Weapons Development Called Iraq's Priority","THREATS AND RESPONSES: BAGHDAD'S ARSENAL; Weapons Development Called Iraq's Priority"
"https://www.nytimes.com/2002/01/30/business/corvis-to-acquire-dorsal.html","Bloomberg News","2002-01-30","Corvis Corp, maker of fiber optic equipment, agrees to buy Dorsal Networks for $90.4 million in stock to expand in market for equipment used in underwater cables (S)","106","null","The New York Times","Business Day","News","article","Corvis to Acquire Dorsal","Corvis to Acquire Dorsal"
"https://www.nytimes.com/2002/06/27/business/world-business-briefing-asia-hong-kong-bank-posts-loss.html","Bloomberg News","2002-06-27","Bank of China (Hong Kong) reports net income fell 47 percent, 2001, to 2.77 billion Hong Kong dollars ($355 million); photo (S)","100","null","The New York Times","Business Day","News","article","World Business Briefing | Asia: Hong Kong: Bank Posts Loss","World Business Briefing | Asia: Hong Kong: Bank Posts Loss"
"https://www.nytimes.com/2002/03/15/business/company-news-florida-utility-agrees-to-four-year-plan-to-cut-rates.html","Bloomberg News","2002-03-15","Florida Power and Light agrees to reduce rates by $250 million per year through 2005 after reaching accord with state officials and large energy customers; utility will cut its base rate by 7 percent and decrease fuel charges by additional $200 mi...","104","null","The New York Times","Business Day","News","article","FLORIDA UTILITY AGREES TO FOUR-YEAR PLAN TO CUT RATES","COMPANY NEWS; FLORIDA UTILITY AGREES TO FOUR-YEAR PLAN TO CUT RATES"
"https://www.nytimes.com/2002/11/02/world/world-briefing-europe-the-hague-milosevic-ailing-again.html","Marlise NYT","2002-11-02","Hearings in war crimes trial of ailing former Yugoslav Pres Slobodan Milosevic are suspended while he gets medical attention; judges ask prosecutors and legal advisers to recommend ways to curtail lengthy trial (S)","90","null","The New York Times","World","News","article","World Briefing | Europe: The Hague: Milosevic Ailing Again","World Briefing | Europe: The Hague: Milosevic Ailing Again"
"https://www.nytimes.com/2002/01/22/business/foreign-shares-mostly-lower-with-nokia-and-nortel-in-lead.html","Bloomberg News","2002-01-22","European and Canadian stocks are lower; US markets are closed in observance of Martin Luther King's Birthday (M)","452","null","The New York Times","Business Day","News","article","Foreign Shares Mostly Lower, With Nokia and Nortel in Lead","Foreign Shares Mostly Lower, With Nokia and Nortel in Lead"
"https://www.nytimes.com/2002/08/23/international/africa/world-briefing-africa.html","null","2002-08-23","NIGERIA: Government Opposes Stoning Sentence; SOUTH AFRICA: Trouble For Winnie Mandela;.","178","null","The New York Times","World","News","article","World Briefing: Africa","World Briefing: Africa"
"https://www.nytimes.com/2002/10/08/business/business-digest-266728.html","null","2002-10-08","","567","null","The New York Times","Business Day","Summary","article","BUSINESS DIGEST","BUSINESS DIGEST"
"https://www.nytimes.com/2002/01/30/business/company-news-fleetboston-reports-loss-after-write-offs.html","Bloomberg News","2002-01-30","FleetBoston Financial posts fourth-quarter loss of $507 million (S)","126","null","The New York Times","Business Day","News","article","FLEETBOSTON REPORTS LOSS AFTER WRITE-OFFS","COMPANY NEWS; FLEETBOSTON REPORTS LOSS AFTER WRITE-OFFS"
"https://www.nytimes.com/2002/03/26/business/nordic-telephone-companies-are-reconsidering-a-merger.html","Suzanne Kapner","2002-03-26","Nordic phone companies are talking mergers again, with Sonera of Finland and Telia of Sweden confirming that they are back at the bargaining table. Discussions between the two have gone nowhere before, and the region is littered with failed2","465","null","The New York Times","Business Day","News","article","Nordic Telephone Companies Are Reconsidering a Merger","Nordic Telephone Companies Are Reconsidering a Merger"
"https://www.nytimes.com/2002/10/15/world/terror-in-bali-terrorism-watch-al-qaeda-evolves-into-looser-network-experts-say.html","Douglas Frantz","2002-10-15","Intelligence and law enforcement officials in US and elsewhere are redefining thinking about Al Qaeda and threat it represent since rout of organization by US forces in Afghanistan year ago because followers have since dispersed throughout world t...","688","null","The New York Times","World","News","article","Al Qaeda Evolves Into Looser Network, Experts Say","TERROR IN BALI: TERRORISM WATCH; Al Qaeda Evolves Into Looser Network, Experts Say"
"https://www.nytimes.com/2002/11/28/technology/what-s-next-science-or-serendipity-unlocking-the-alchemy-of-ceramics.html","Anne Eisenberg","2002-11-28","Composition of ceramics makes them versatile enough to be used in range of items from ordinary tableware to telecommunications equipment; specialty ceramics are used for resonators, filters and other components that store, transfer and sort microw...","940","null","The New York Times","Technology","News","article","Science or Serendipity? Unlocking the Alchemy of Ceramics","WHAT'S NEXT; Science or Serendipity? Unlocking the Alchemy of Ceramics"
"https://www.nytimes.com/2002/12/12/business/company-news-navistar-president-to-become-chief-executive.html","Bloomberg News","2002-12-12","Navistar International Corp president Daniel Ustian will become chief executive, succeeding John Horne, who will remain chairman (S)","101","null","The New York Times","Business Day","News","article","NAVISTAR PRESIDENT TO BECOME CHIEF EXECUTIVE","COMPANY NEWS; NAVISTAR PRESIDENT TO BECOME CHIEF EXECUTIVE"
"https://www.nytimes.com/2002/03/15/world/cohen-is-appointed-times-foreign-editor.html","null","2002-03-15","Howell Raines, executive editor, announces appointment of Roger Cohen as foreign editor of The New York Times; Cohen has been acting foreign editor since Sept (S)","213","null","The New York Times","World","News","article","Cohen Is Appointed Times Foreign Editor","Cohen Is Appointed Times Foreign Editor"
"https://www.nytimes.com/2002/11/16/business/worldcom-beats-microsoft-for-ex-compaq-chief.html","Seth Schiesel","2002-11-16","Michael D Capellas agrees to become chairman and chief executive of Worldcom; insiders say Capellas, former Hewlett-Packard president, chose position over lucrative offer from Microsoft to become its president and chief operating officer; photos (...","925","null","The New York Times","Business Day","News","article","WorldCom Beats Microsoft for Ex-Compaq Chief","WorldCom Beats Microsoft for Ex-Compaq Chief"
"https://www.nytimes.com/2002/02/22/business/international-business-computer-associates-stock-drops-sharply-once-again.html","Alex Berenson","2002-02-22","","550","null","The New York Times","Business Day","News","article","Computer Associates Stock Drops Sharply Once Again","INTERNATIONAL BUSINESS; Computer Associates Stock Drops Sharply Once Again"
"https://www.nytimes.com/2002/09/19/business/company-briefs-960616.html","null","2002-09-19","","139","null","The New York Times","Business Day","News","article","COMPANY BRIEFS","COMPANY BRIEFS"
"https://www.nytimes.com/2002/01/07/business/lucent-names-kodaks-president-as-its-new-chief-executive.html","Sherri Day","2002-01-07","Ending a long-running search for a new leader, Lucent Technologies, the telecommunications gear maker, announced today that it had named Patricia Russo as its president and chief executive.","1621","null","The New York Times","Business Day","News","article","Lucent Names Kodak's President as Its New Chief Executive","Lucent Names Kodak's President as Its New Chief Executive"
"https://www.nytimes.com/2002/01/09/business/company-news-ad-marketer-says-profit-will-meet-reduced-forecast.html","Bloomberg News","2002-01-09","","124","null","The New York Times","Business Day","News","article","AD MARKETER SAYS PROFIT WILL MEET REDUCED FORECAST","COMPANY NEWS; AD MARKETER SAYS PROFIT WILL MEET REDUCED FORECAST"
"https://www.nytimes.com/2002/12/07/business/ibm-to-acquire-rational-in-big-move-into-software.html","Steve Lohr","2002-12-07","IBM takes significant step to increase its stake in software business with purchase of Rational Software Corp for $2.1 billion in cash; for IBM, acquisition is latest move by new chief exec Samuel J Palmisano to accelerate shift toward software an...","651","null","The New York Times","Business Day","News","article","I.B.M. to Acquire Rational In Big Move Into Software","I.B.M. to Acquire Rational In Big Move Into Software"
"https://www.nytimes.com/2002/02/20/international/world-briefing.html","null","2002-02-20","World Briefing","922","null","The New York Times","World","Summary","article","World Briefing","World Briefing"
"https://www.nytimes.com/2002/01/19/business/founders-say-the-idea-for-talk-was-sound.html","null","2002-01-19","Analysis of demise of Talk magazine; co-founder Tina Brown comments, interview; others in magazine industry question if venture, backed by Disney's Miramax Films and Hearst Magazines, was doomed from start; photo (M)","873","null","The New York Times","Business Day","An Analysis; News Analysis","article","Founders Say the Idea For Talk Was Sound","Founders Say the Idea For Talk Was Sound"
"https://www.nytimes.com/2002/08/22/business/technology-briefing-internet-starbucks-expands-web-network-service.html","Glenn NYT","2002-08-22","Starbucks Corp, in venture with T-Mobile International division of Deutsche Telekom and Hewlett-Packard Co, adds 700 high-speed wireless network service outlets in cities in New Jersey and Connecticut and in Atlanta, Boston, Denver, Philadelphia a...","153","null","The New York Times","Business Day","News","article","Technology Briefing | Internet: Starbucks Expands Web Network Service","Technology Briefing | Internet: Starbucks Expands Web Network Service"
"https://www.nytimes.com/2002/06/18/business/critics-christen-ship-project-as-an-off-course-uss-pork.html","Leslie Wayne","2002-06-18","Two years after federal government announced ambitious plan to build two mammoth passenger cruise ships, first in US shipyard since 1950's, project has failed at cost of $187 million to taxpayers; unfinished and unfloatable hulls lay in Pascagoula...","1441","null","The New York Times","Business Day","News","article","Critics Christen Ship Project As an Off-Course U.S.S. Pork","Critics Christen Ship Project As an Off-Course U.S.S. Pork"
"https://www.nytimes.com/2002/11/21/business/europe-panel-halts-review-of-pfizer-plan-for-takeover.html","Paul Meller","2002-11-21","European antitrust regulators suspend their review of Pfizer Inc's proposed $60 billion acquisition of Pharmacia, possibly delaying completion of deal until early next year; two companies say they expect to complete merger (M)","462","null","The New York Times","Business Day","News","article","Europe Panel Halts Review Of Pfizer Plan For Takeover","Europe Panel Halts Review Of Pfizer Plan For Takeover"
"https://www.nytimes.com/2002/04/16/business/technology-briefing-software-i2-chief-steps-down.html","Andrew NYT","2002-04-16","I2 Technologies says chief executive Greg Brady has resigned; Sanjiv Sidhu, founder and chairman, will serve as chief executive; photo (S)","89","null","The New York Times","Business Day","News","article","Technology Briefing | Software: I2 Chief Steps Down","Technology Briefing | Software: I2 Chief Steps Down"
"https://www.nytimes.com/2002/01/25/business/business-digest-302716.html","null","2002-01-25","","592","null","The New York Times","Business Day","Summary","article","BUSINESS DIGEST","BUSINESS DIGEST"
"https://www.nytimes.com/2002/06/05/business/edison-schools-gets-40-million-in-loans.html","null","2002-06-05","","148","null","The New York Times","Business Day","Summary","article","Edison Schools Gets $40 Million in Loans","Edison Schools Gets $40 Million in Loans"
"https://www.nytimes.com/2002/05/23/business/technology-briefing-software-sherwin-williams-will-use-linux.html","Steve NYT","2002-05-23","Sherwin-Williams will announce that it will use Linux, operating system that is distributed free, to run point-of-sale computers at its 2,500 stores (S)","94","null","The New York Times","Business Day","News","article","Technology Briefing | Software: Sherwin-Williams Will Use Linux","Technology Briefing | Software: Sherwin-Williams Will Use Linux"
"https://www.nytimes.com/2002/04/17/world/world-briefing-asia-india-one-day-national-strike.html","Saritha NYT","2002-04-17","Banks and state-owned companies in India are closed by one-day strike by estimated 10 million workers protesting sale of government companies and changing laws to make layoffs easier (S)","69","null","The New York Times","World","News","article","World Briefing | Asia: India: One-Day National Strike","World Briefing | Asia: India: One-Day National Strike"
"https://www.nytimes.com/2002/10/29/business/stocks-bounce-back-from-an-early-selloff.html","Jonathan Fuerbringer","2002-10-29","Stocks came under pressure today and bond prices rose as investors were surprised by an unexpectedly steep drop in consumer confidence, which fell its lowest level in nine years.","1583","null","The New York Times","Business Day","News","article","Stocks Bounce Back From an Early Sell-off","Stocks Bounce Back From an Early Sell-off"
"https://www.nytimes.com/2002/07/08/world/city-curfews-and-politics-strain-calm-in-west-bank.html","John Kifner","2002-07-08","Israeli Army continues to maintain full command of virtually all Palestinian areas of West Bank, with little sense on either side that stalemate is near end; military and government officials are speaking of keeping troops in Palestinian cities fo...","614","null","The New York Times","World","News","article","City Curfews And Politics Strain Calm In West Bank","City Curfews And Politics Strain Calm In West Bank"
"https://www.nytimes.com/2002/04/18/world/man-in-the-news-combative-point-man-on-latin-policy-otto-j-reich.html","Christopher Marquis","2002-04-18","","756","null","The New York Times","World","News","article","Man in the News; Combative Point Man on Latin Policy -- Otto J. Reich","Man in the News; Combative Point Man on Latin Policy -- Otto J. Reich"
"https://www.nytimes.com/2002/01/31/world/japan-premier-taking-heat-over-firing-of-minister.html","James Brooke","2002-01-31","Criticism of Prime Min Junichiro Koizumi of Japan mounts over his firing of popular Foreign Minister Makiko Tanaka; Koizumi's power derives primarily from high approval ratings in opinion polls; he now faces potential crisis, which he has acknowle...","639","null","The New York Times","World","News","article","Japan Premier Taking Heat Over Firing Of Minister","Japan Premier Taking Heat Over Firing Of Minister"
"https://www.nytimes.com/2002/03/02/world/russia-s-latest-export-bad-jokes-about-us-chickens.html","Michael Wines","2002-03-02","Russian Agriculture Min Aleksei V Gordeyev stops issuing permits for imports of American chicken, single most popular item from US; cites American use of hormones, antibiotics and preservatives, but Russian farmers are also battling deluge of chea...","776","null","The New York Times","World","News","article","Russia's Latest Export: Bad Jokes About U.S. Chickens","Russia's Latest Export: Bad Jokes About U.S. Chickens"
"https://www.nytimes.com/2002/09/26/business/world-business-briefing-europe-france-software-maker-cuts-outlook.html","Kerry NYT","2002-09-26","Shares in Dassault Systemes fall 18 percent after company warns for third time this year that its sales forecast for 2002 will be lower than expected; graph (S)","89","null","The New York Times","Business Day","News","article","World Business Briefing | Europe: France: Software Maker Cuts Outlook","World Business Briefing | Europe: France: Software Maker Cuts Outlook"
"https://www.nytimes.com/2002/02/04/business/the-weeks-economic-events.html","null","2002-02-04","MONDAYNone.","13","null","The New York Times","Business Day","News","article","The Week's Economic Events","The Week's Economic Events"
"https://www.nytimes.com/2002/10/03/technology/game-theory-armored-archer-or-navy-seal-2-paths-to-glory.html","Charles Herold","2002-10-03","Charles Herold reviews two video games: Socom: US Navy Seals, developed by Zipper Interactive, and Medieval: Total War, developed by Creative Assembly; photos (M)","1241","null","The New York Times","Technology","News","article","Armored Archer Or Navy Seal? 2 Paths to Glory","GAME THEORY; Armored Archer Or Navy Seal? 2 Paths to Glory"
"https://www.nytimes.com/2002/06/23/business/l-the-nest-refilled-669407.html","null","2002-06-23","Frances Burch letter reacts to June 16 article about college graduates' difficulty finding jobs, which leads to their returning to reside with their parents","144","null","The New York Times","Business Day","Letter","article","The Nest, Refilled","The Nest, Refilled"
"https://www.nytimes.com/2002/04/29/business/worldbusiness/IHT-latest-word-on-the-euro-symbol-message-board.html","null","2002-04-29","Regarding ""Whither the euro?"" iTech, March 18:. You can decide which keystrokes to use for the euro symbol in Microsoft Word. Go to Insert, then Symbol. Then select Font: (normal text) and scroll down till you find the symbol. Highlight the symb","895","null","International Herald Tribune","Business Day","null","article","Latest word on the euro symbol : message BOARD / Letters to the technology editor","Latest word on the euro symbol : message BOARD / Letters to the technology editor"
"https://www.nytimes.com/2002/08/01/technology/online-shopper-a-fee-friendly-bank-first-map-the-atm-s.html","Michelle Slatalla","2002-08-01","Michelle Slatalla Online Shopper column describes shopping for banks online; Bankrate.com gives users ability to compare rates and services at about 5,000 financial institutions nationwide; drawing (M)","1013","null","The New York Times","Technology","News","article","A Fee-Friendly Bank? First, Map the A.T.M.'s","ONLINE SHOPPER; A Fee-Friendly Bank? First, Map the A.T.M.'s"
"https://www.nytimes.com/2002/04/01/business/business-digest-324507.html","null","2002-04-01","","471","null","The New York Times","Business Day","Summary","article","BUSINESS DIGEST","BUSINESS DIGEST"
