"|","|__writer_name","|__pub_date","|__snippet","|__word_count","|__score","|__source","|__section_name","|__type_of_material","|__document_type","|__main_headline","|__print_headline"
"https://www.nytimes.com/2002/07/02/business/media-business-advertising-cingular-wireless-arrives-late-new-york-but-comes.html","Stuart Elliott","2002-07-02","Cingular Wireless is spending $20 million on advertising campaign to break into crowded New York cellular market; BBDO is developing campaign; photos (M)","880","null","The New York Times","Business Day","News","article","Cingular Wireless arrives late in New York, but comes bearing orange umbrellas and M&M's.","THE MEDIA BUSINESS: ADVERTISING; Cingular Wireless arrives late in New York, but comes bearing orange umbrellas and M&M's."
"https://www.nytimes.com/2002/03/26/world/close-to-departure-time-maneuvers-continue-over-whether-arafat-can-travel.html","Joel Brinkley","2002-03-26","Palestinians and White House maneuver over question of whether Yasir Arafat will attend Arab summit in Beirut, Lebanon, as deadline for meeting looms; Israelis remain pessimistic over whether Arafat will be allowed to attend, even as White House c...","1164","null","The New York Times","World","News","article","Close to Departure Time, Maneuvers Continue Over Whether Arafat Can Travel","Close to Departure Time, Maneuvers Continue Over Whether Arafat Can Travel"
"https://www.nytimes.com/2002/11/07/business/banking-reviving-a-bill-on-bankruptcy.html","Riva Atlas","2002-11-07","Some banking industry experts believe that Republican dominance of Senate increases chances of passage of new legislation concerning bankruptcy; banking industry lobbies strongly for overhaul of bankruptcy code that would make it more difficult fo...","221","null","The New York Times","Business Day","News","article","Banking; Reviving a Bill On Bankruptcy","Banking; Reviving a Bill On Bankruptcy"
"https://www.nytimes.com/2002/06/26/technology/technology-briefing-internet.html","null","2002-06-26","S.E.C. ISSUES WARNING ON FRAUD; EBAY NAMES NEW CHIEF OPERATING OFFICER;.","489","null","The New York Times","Technology","News","article","Technology Briefing: Internet","Technology Briefing: Internet"
"https://www.nytimes.com/2002/05/30/business/auditors-back-andersen-in-testimony-on-documents.html","Kurt Eichenwald","2002-05-30","Succession of Arthur Andersen auditors at Andersen's trail on charge of obstruction of justice trial in relation to Enron Corp testify that they did not consider urgings they received last fall to comply with firm's document policy to be code for ...","711","null","The New York Times","Business Day","News","article","Auditors Back Andersen In Testimony On Documents","Auditors Back Andersen In Testimony On Documents"
"https://www.nytimes.com/2002/05/15/business/news-corp-reports-a-loss-but-its-shares-soar.html","Seth Schiesel","2002-05-15","News Corp reports loss of $3.99 billion in quarter compared with earnings of $111 million year earlier; revenue increased 17.6 percent, to $3.85 billion, up from $3.27 billion year ago (M)","478","null","The New York Times","Business Day","News","article","News Corp. Reports a Loss, but Its Shares Soar","News Corp. Reports a Loss, but Its Shares Soar"
"https://www.nytimes.com/2002/08/13/business/company-news-wal-mart-says-weekly-sales-are-in-line-with-estimates.html","Bloomberg News","2002-08-13","Wal-Mart Stores Inc says last week's increase in sales at its discount stores open at least one year were within company's expectations; sales for total company are in line with its forecast for gain of 4 percent to 6 percent this month (S)","83","null","The New York Times","Business Day","News","article","WAL-MART SAYS WEEKLY SALES ARE IN LINE WITH ESTIMATES","COMPANY NEWS; WAL-MART SAYS WEEKLY SALES ARE IN LINE WITH ESTIMATES"
"https://www.nytimes.com/2002/04/30/business/world-business-briefing-europe-switzerland-abb-sells-bonds.html","Elizabeth NYT","2002-04-30","ABB Ltd begins selling $900 million worth of convertible bonds in plan to reduce its short-term financing problems; graph (S)","75","null","The New York Times","Business Day","News","article","World Business Briefing | Europe: Switzerland: ABB Sells Bonds","World Business Briefing | Europe: Switzerland: ABB Sells Bonds"
"https://www.nytimes.com/2002/06/11/business/worldbusiness/world-business-briefing-asia.html","null","2002-06-11","JAPAN: Machinery Orders Rose; CHINA: Electronics Merger; CHINA: Consulting Acquisition;.","539","null","The New York Times","Business Day","News","article","World Business Briefing: Asia","World Business Briefing: Asia"
"https://www.nytimes.com/2002/09/30/news/skirting-denial-sex-please-making-love-not-war-on-the-runway.html","Suzy Menkes","2002-09-30","","2371","null","The New York Times","World","News","article","Skirting denial /Sex, please : Making love, not war, on the runway","Skirting denial /Sex, please : Making love, not war, on the runway"
"https://www.nytimes.com/2002/11/20/business/singapore-and-us-near-a-trade-deal.html","Edmund Andrews","2002-11-20","US reaches tentative free-trade agreement with Singapore; new agreement, if completed and approved by Congress, would eliminate tariffs on about $33 billion in trade between two countries and would give American banks and service companies more ac...","743","null","The New York Times","Business Day","News","article","Singapore And U.S. Near A Trade Deal","Singapore And U.S. Near A Trade Deal"
"https://www.nytimes.com/2002/02/09/world/nation-challenged-journalists-pakistan-turns-up-heat-under-prime-suspect.html","Douglas Jehl","2002-02-09","journalists: pakistan turns up heat under a prime suspect in a reporter's kidn","660","null","The New York Times","World","News","article","Pakistan Turns Up Heat Under a Prime Suspect in a Reporter's Kidnapping","A NATION CHALLENGED: JOURNALISTS; Pakistan Turns Up Heat Under a Prime Suspect in a Reporter's Kidnapping"
"https://www.nytimes.com/2002/01/23/world/world-briefing-asia-north-korea-energy-crisis.html","Don NYT","2002-01-23","North Korean government says acute power shortage has afected nearly every aspect of economy and everyday life; cites natural disasters; blames United States for delays in construction of two nuclear actors under 1994 accord under which Korea agre...","82","null","The New York Times","World","News","article","World Briefing | Asia: North Korea: Energy Crisis","World Briefing | Asia: North Korea: Energy Crisis"
"https://www.nytimes.com/2002/10/13/business/bulletin-board-working-9-to-5-give-or-take.html","Macaulay Campbell","2002-10-13","Report by Proudfoot Consulting finds American businesses second to German companies in worker productivity among seven nations surveyed; American businesses are unproductive 38 percent of the time, losing equivalent of 86 workdays per employee in ...","169","null","The New York Times","Business Day","News","article","Working 9 to 5, Give or Take","BULLETIN BOARD; Working 9 to 5, Give or Take"
"https://www.nytimes.com/2002/08/16/world/us-protesting-rights-leader-s-sentence-halts-new-aid-to-egypt.html","Christopher Marquis","2002-08-16","Pres Bush sends letter to Pres Hosni Mubarak of Egypt warning that United States will not deliver any new aid to Egypt in protest against prosecution of leading human rights activist Saad Eddin Ibrahim; letter voices distress over treatment of Ibr...","542","null","The New York Times","World","News","article","U.S., Protesting Rights Leader's Sentence, Halts New Aid to Egypt","U.S., Protesting Rights Leader's Sentence, Halts New Aid to Egypt"
"https://www.nytimes.com/2002/01/26/international/no-qaeda-at-us-target-this-week-afghan-says.html","Craig Smith","2002-01-26","An Afghanistan governor said no Taliban or al Qaeda members were in the district where the Pentagon reported killing 15 fighters and capturing 27 others earlier this week.","255","null","The New York Times","World","News","article","No Qaeda at U.S. Target This Week, Afghan Says","No Qaeda at U.S. Target This Week, Afghan Says"
"https://www.nytimes.com/2002/05/09/business/vote-on-an-offshore-tax-plan-is-roiling-a-company-town.html","David Johnston","2002-05-09","Many New Britain, Conn, residents are upset by Stanley Works plan to become Bermuda company to save on taxes; opponents, including workers, residents and even some large investment funds, hope to turn shareholder vote on plan into referendum on wh...","1538","null","The New York Times","Business Day","News","article","Vote on an Offshore Tax Plan Is Roiling a Company Town","Vote on an Offshore Tax Plan Is Roiling a Company Town"
"https://www.nytimes.com/2002/10/06/world/west-presses-bosnia-voters-to-turn-out-nationalists.html","Daniel Simpson","2002-10-06","Bosnia's divided Serbs, Croats and Muslims vote for new government, under Western pressure to reject nationalist parties that led country into brutal war in 1992; international officials who have run Bosnia as virtual protectorate since West force...","608","null","The New York Times","World","News","article","West Presses Bosnia Voters To Turn Out Nationalists","West Presses Bosnia Voters To Turn Out Nationalists"
"https://www.nytimes.com/2002/12/18/world/world-briefing-europe-hungary-building-a-holocaust-museum.html","Peter Green","2002-12-18","Hungarian Prime Min Peter Medgyessy inaugurates work on Hungary's first Holocaust museum; Budapest museum, dedicated to more than 600,000 Hungarian Jews killed in World War II, will be housed in former synagogue (S)","64","null","The New York Times","World","News","article","World Briefing | Europe: Hungary: Building A Holocaust Museum","World Briefing | Europe: Hungary: Building A Holocaust Museum"
"https://www.nytimes.com/2002/08/30/world/world-briefing-the-world-voice-of-america-director-resigns.html","Felicity NYT","2002-08-30","Robert R Reilly resigns as director of Voice of America after nine months of controversy over plan to close five overseas offices; David Jackson is named to post (S)","81","null","The New York Times","World","News","article","World Briefing | The World: Voice Of America Director Resigns","World Briefing | The World: Voice Of America Director Resigns"
"https://www.nytimes.com/2002/02/22/world/after-attack-us-suspends-effort-to-end-war-in-sudan.html","Marc Lacey","2002-02-22","","749","null","The New York Times","World","News","article","After Attack, U.S. Suspends Effort to End War in Sudan","After Attack, U.S. Suspends Effort to End War in Sudan"
"https://www.nytimes.com/2002/12/16/business/worldbusiness/IHT-editors-choice-best-web-bets-from-a-personal-point.html","Manna Badiella","2002-12-16","Manna Kamio Badiella, an IHT editorial assistant, has given up pursuing an art career, but she hasn't lost her taste for ogling other people's creations. Here are some of her favorite creative, yet offbeat, Web sites. . *. www.mirrorproject.com. T...","1982","null","International Herald Tribune","Business Day","null","article","editor's CHOICE / Best Web bets, from a personal point of view : Unpretentious art","editor's CHOICE / Best Web bets, from a personal point of view : Unpretentious art"
"https://www.nytimes.com/2002/11/28/business/technology-briefing-hardware-credence-systems-cuts-225-jobs.html","Bloomberg News","2002-11-28","Credence Systems Corp cuts 225 jobs and reports wider-than-expected loss; also closes operations in Switzerland and Germany as part of reorganization; loss for period ended Oct 31 widened to $112 million from $60.2 million year earlier; sales rose...","130","null","The New York Times","Business Day","News","article","Technology Briefing | Hardware: Credence Systems Cuts 225 Jobs","Technology Briefing | Hardware: Credence Systems Cuts 225 Jobs"
"https://www.nytimes.com/2002/01/29/world/israeli-group-declares-limit-in-making-war-on-palestinians.html","Joel Greenberg","2002-01-29","More than 50 combat officers and soldiers in Israeli Army reserve say they will refuse to serve in West Bank and Gaza Strip, setting off heated debate in Israel over limits of civil disobedience; issue statement condemning military actions against...","483","null","The New York Times","World","News","article","Israeli Group Declares Limit In Making War On Palestinians","Israeli Group Declares Limit In Making War On Palestinians"
"https://www.nytimes.com/2002/04/09/business/the-media-business-advertising-addenda-accounts-460508.html","Jim Rutenberg","2002-04-09","Roundup of recent advertising account changes (S)","59","null","The New York Times","Business Day","News","article","Accounts","THE MEDIA BUSINESS: ADVERTISING -- ADDENDA; Accounts"
"https://www.nytimes.com/2002/05/10/business/world-business-briefing-europe-britain-rates-held-steady.html","Suzanne NYT","2002-05-10","Bank of England votes to keep interest rates at 4 percent (S)","123","null","The New York Times","Business Day","News","article","World Business Briefing | Europe: Britain: Rates Held Steady","World Business Briefing | Europe: Britain: Rates Held Steady"
"https://www.nytimes.com/2002/04/24/business/madstone-films-grows-by-acquiring-art-house-company.html","Jesse McKinley","2002-04-24","Madstone Films, three-year-old production company based in Lower Manhattan, acquires New Yorker Films, art-house company; financial terms undisclosed (S)","231","null","The New York Times","Business Day","News","article","Madstone Films Grows by Acquiring Art-House Company","Madstone Films Grows by Acquiring Art-House Company"
"https://www.nytimes.com/2002/03/04/business/banca-di-roma-is-close-to-acquiring-rival.html","Bloomberg News","2002-03-04","Banca di Roma and Bipop-Carire approve mergr","235","null","The New York Times","Business Day","News","article","Banca di Roma Is Close to Acquiring Rival","Banca di Roma Is Close to Acquiring Rival"
"https://www.nytimes.com/2002/10/06/business/personal-business-diary-the-suit-is-worth-a-thousand-words.html","Vivian Marino","2002-10-06","List of suggestions on proper attire at workplace, especially for people seeking to move up corporate ladder (S)","219","null","The New York Times","Business Day","News","article","The Suit Is Worth A Thousand Words","PERSONAL BUSINESS: DIARY; The Suit Is Worth A Thousand Words"
"https://www.nytimes.com/2002/10/30/business/oil-pipeline-forges-ahead-in-ecuador.html","Juan Forero","2002-10-30","300-mile-long, privately financed oil pipeline in Ecuador is 70 percent complete, and even most die-hard opponents acknowledge that stopping construction is next to impossible; announcement that Dusseldorf bank Westdeutsche Landesbank Girozentrale...","1187","null","The New York Times","Business Day","News","article","Oil Pipeline Forges Ahead in Ecuador","Oil Pipeline Forges Ahead in Ecuador"
"https://www.nytimes.com/2002/07/12/business/world-business-briefing-asia-japan-cuts-at-electronics-maker.html","Ken NYT","2002-07-12","World Business Briefing: Japan: Cuts A","81","null","The New York Times","Business Day","News","article","World Business Briefing | Asia: Japan: Cuts At Electronics Maker","World Business Briefing | Asia: Japan: Cuts At Electronics Maker"
"https://www.nytimes.com/2002/11/24/business/midstream-heading-out-to-pasture-buy-one.html","James Schembari","2002-11-24","James Schembari Midstream column on buying second home as early preparation for retirement; drawing (M)","917","null","The New York Times","Business Day","News","article","Heading Out to Pasture? Buy One","MIDSTREAM; Heading Out to Pasture? Buy One"
"https://www.nytimes.com/2002/03/07/business/world-business-briefing-asia-japan-capital-spending-and-profits-fall.html","Ken NYT","2002-03-07","Japanese companies cut capital investments by worse-than-expected 14.5 percent in fourth quarter; pretax profits fell 31.4 percent while sales fell 3.8 percent; capital spending makes up about 15 percent of Japan's economy (S)","81","null","The New York Times","Business Day","News","article","World Business Briefing | Asia: Japan: Capital Spending And Profits Fall","World Business Briefing | Asia: Japan: Capital Spending And Profits Fall"
"https://www.nytimes.com/2002/09/10/world/threats-and-responses-a-new-alert-fbi-warns-local-agencies-to-be-aware.html","David Johnston","2002-09-10","FBI issues advisory to local authorities warning of possible terrorist attacks on anniversary of September 11; senior governmnent officials say warnings are precautionary and not based on specific or credible threats; Bush administration officials...","312","null","The New York Times","World","News","article","F.B.I. Warns Local Agencies To Be Aware","THREATS AND RESPONSES: A NEW ALERT; F.B.I. Warns Local Agencies To Be Aware"
"https://www.nytimes.com/2002/07/17/business/survey-halted-drug-makers-seek-to-protect-hormone-sales.html","Melody Petersen","2002-07-17","ImpactRx survey shows that when female patients have asked in recent days whether they should continue taking Prempro, hormone replacement therapy, doctors have told roughly half of them to stop taking drug or switch to alternative treatment; surv...","862","null","The New York Times","Business Day","News","article","Survey Halted, Drug Makers Seek to Protect Hormone Sales","Survey Halted, Drug Makers Seek to Protect Hormone Sales"
"https://www.nytimes.com/2002/04/16/business/technology-briefing-hardware-unisys-earnings-drop-53.html","Bloomberg News","2002-04-16","Unisys Corp says first-quarter earnings fell 53 percent; net income fell to $32.7 million from $69.3 million year earlier; sales decreased 16 percent, to $1.36 billion (S)","100","null","The New York Times","Business Day","News","article","Technology Briefing | Hardware: Unisys Earnings Drop 53%","Technology Briefing | Hardware: Unisys Earnings Drop 53%"
"https://www.nytimes.com/2002/05/18/world/traces-terrorism-pakistan-bombing-2-deadly-attacks-show-signs-qaeda-revival.html","Raymond Bonner","2002-05-18","French and German investigators say they are nearly certain that recent car bombings in Djeerba, Tunisia, and Karachi, Pakistan, were work of Al Qaeda cells that have reactivated themselves since American war on Afghanistan; warn of more attacks o...","848","null","The New York Times","World","News","article","2 Deadly Attacks Show Signs of a Qaeda Revival","TRACES OF TERRORISM: THE PAKISTAN BOMBING; 2 Deadly Attacks Show Signs of a Qaeda Revival"
"https://www.nytimes.com/2002/07/18/business/coke-says-profit-rose-15-despite-weak-markets-abroad.html","Sherri Day","2002-07-18","Coca-Cola Co says second-quarter earnings increased 15 percent; net income rose to $1.29 billion compared with $1.12 billion year earlier; revenue increased 15 percent, to $5.37 billion from $4.65 billion; chief financial officer Gary P Fayard com...","578","null","The New York Times","Business Day","News","article","Coke Says Profit Rose 15% Despite Weak Markets Abroad","Coke Says Profit Rose 15% Despite Weak Markets Abroad"
"https://www.nytimes.com/2002/03/21/technology/news-watch-software-finally-a-way-to-itemize-star-trek-memorabilia.html","null","2002-03-21","Cataloging program called MyStuff helps collectors keep track of their inventory; photo (S)","136","null","The New York Times","Technology","News","article","Finally, a Way to Itemize Star Trek Memorabilia","NEWS WATCH: SOFTWARE; Finally, a Way to Itemize Star Trek Memorabilia"
"https://www.nytimes.com/2002/07/19/world/world-briefing-asia-japan-electoral-reform-approved.html","Howard French","2002-07-19","Lower house of Japanese Parliament approves bill that would sharply reduce longstanding disparity in country's proportional representation voting system (S)","91","null","The New York Times","World","News","article","World Briefing | Asia: Japan: Electoral Reform Approved","World Briefing | Asia: Japan: Electoral Reform Approved"
"https://www.nytimes.com/2002/11/02/business/the-markets-stocks-bonds-shares-rally-on-hope-fed-will-cut-rates-next-week.html","Jonathan Fuerbringer","2002-11-02","","999","null","The New York Times","Business Day","News","article","Shares Rally on Hope Fed Will Cut Rates Next Week","THE MARKETS: STOCKS & BONDS; Shares Rally on Hope Fed Will Cut Rates Next Week"
"https://www.nytimes.com/2002/09/28/your-money/IHT-world-of-investing-surprise-value-in-smallcaps.html","James Glassman","2002-09-28","Do you have the stomach, in this market, to search for bargains and actually buy some stocks? If so, the happiest hunting ground might be the worst major sector this year: small-capitalization growth stocks. .Through Sept. 23, mutual funds whose p...","6881","null","International Herald Tribune","Your Money","null","article","World of Investing : Surprise value in small-caps","World of Investing : Surprise value in small-caps"
"https://www.nytimes.com/2002/08/30/business/china-expected-to-sell-stakes-to-foreign-companies.html","Keith Bradsher","2002-08-30","China Securities Regulatory Commission assistant chairman Wang Jianxi says government is likely to allow sale of government stakes in publicly traded state-controlled enterprises to foreign companies, signaling what could be next big step in China...","1168","null","The New York Times","Business Day","News","article","China Expected to Sell Stakes To Foreign Companies","China Expected to Sell Stakes To Foreign Companies"
"https://www.nytimes.com/2002/05/01/business/company-news-dynegy-gets-900-million-credit-line.html","Bloomberg News","2002-05-01","Dynegy Inc posts first-quarter loss of $140 million, but obtains $900 million in credit to protect its energy trading business (S)","107","null","The New York Times","Business Day","News","article","DYNEGY GETS $900 MILLION CREDIT LINE","COMPANY NEWS; DYNEGY GETS $900 MILLION CREDIT LINE"
"https://www.nytimes.com/2002/01/25/international/afghan-leader-hints-at-need-for-more-peacekeeping-troops.html","Mark Landler","2002-01-25","Hamid Karzai edged closer to calling for the deployment of peacekeeping troops throughout his country today, as he welcomed the U.N.'s secretary general to Kabul.","818","null","The New York Times","World","News","article","Afghan Leader Hints at Need for More Peacekeeping Troops","Afghan Leader Hints at Need for More Peacekeeping Troops"
"https://www.nytimes.com/2002/11/28/technology/setting-up-from-bare-bones-to-multimedia-options-for-beginning-bloggers.html","Lisa Guernsey","2002-11-28","Instructions for setting up Web log, or blog, with some helpful sites and guides noted (M)","495","null","The New York Times","Technology","News","article","Setting Up; From Bare Bones to Multimedia: Options for Beginning Bloggers","Setting Up; From Bare Bones to Multimedia: Options for Beginning Bloggers"
"https://www.nytimes.com/2002/05/19/business/business-diary-an-italian-pen-designed-with-da-vinci-in-mind.html","null","2002-05-19","Omas, Italian company, offers pen based on drawing by Leonardo da Vinci; photo (S)","226","null","The New York Times","Business Day","News","article","An Italian Pen Designed With da Vinci in Mind","BUSINESS: DIARY; An Italian Pen Designed With da Vinci in Mind"
"https://www.nytimes.com/2002/11/08/world/world-briefing-asia-japan-rights-advocate-tells-of-detention-in-china.html","James NYT","2002-11-08","Japanese human rights advocate Hiroshi Kato, who was recently released from China, discloses details of detension by Chinese police; six-day detainment involved harsh interrogations, unreasonable sleeping conditions and threats of deportation to N...","77","null","The New York Times","World","News","article","World Briefing | Asia: Japan: Rights Advocate Tells Of Detention In China","World Briefing | Asia: Japan: Rights Advocate Tells Of Detention In China"
"https://www.nytimes.com/2002/06/21/business/demand-but-no-capital-at-nonprofit-hospitals.html","Reed Abelson","2002-06-21","Many nonprofit hospitals around country are finding it increasingly difficult to raise money they need to handle surprising growth in admissions; need for capital is becoming so intense that nonprofit hospitals are selling facilities to their for-...","1128","null","The New York Times","Business Day","News","article","Demand, but No Capital, at Nonprofit Hospitals","Demand, but No Capital, at Nonprofit Hospitals"
"https://www.nytimes.com/2002/02/08/world/citing-strife-us-delays-two-loans-to-haitians.html","Christopher Marquis","2002-02-08","Secretary of State Colin L Powell says United States will not free millions of dollars in loans and aid to Haitian government until it resolves deadlock and curbs political violence; his remarks signal Bush administration's growing exasperation wi...","693","null","The New York Times","World","News","article","Citing Strife, U.S. Delays Two Loans To Haitians","Citing Strife, U.S. Delays Two Loans To Haitians"
"https://www.nytimes.com/2002/09/19/business/company-news-kodak-sticks-to-its-second-half-estimate.html","Bloomberg News","2002-09-19","Eastman Kodak Co reiterates forecast that second-half profit will be $1.35 to $1.75 a share (S)","114","null","The New York Times","Business Day","News","article","KODAK STICKS TO ITS SECOND-HALF ESTIMATE","COMPANY NEWS; KODAK STICKS TO ITS SECOND-HALF ESTIMATE"
"https://www.nytimes.com/2002/08/02/news/stark-history-some-see-a-stunt-memory-becomes-battleground-in-budapests.html","Thomas Fuller","2002-08-02","","2321","null","The New York Times","World","News","article","Stark history / Some see a stunt : Memory becomes battleground in Budapest's House of Terror","Stark history / Some see a stunt : Memory becomes battleground in Budapest's House of Terror"
