"|","|__writer_name","|__pub_date","|__snippet","|__word_count","|__score","|__source","|__section_name","|__type_of_material","|__document_type","|__main_headline","|__print_headline"
"https://www.nytimes.com/2010/02/26/world/middleeast/26hebron.html","Isabel Kershner","2010-02-25","Dozens of Palestinian youths clashed with Israeli forces in Hebron for a fourth day Thursday over the inclusion of a hotly contested religious shrine on a list of Jewish heritage sites.","640","null","The New York Times","World","News","article","More Clashes Over Israeli Claim to Shrine","Clashes Over Shrine in West Bank Persist, but Don’t Escalate"
"https://www.nytimes.com/2010/02/26/business/global/26fidelity.html","Bettina Wassener","2010-02-25","The company said it had discovered a “pattern of behavior,” and the managers were also found to have put “their personal interests ahead of those of the company.”","431","null","The New York Times","Business Day","News","article","Fidelity Fires 2 Managers for Violating Ethics Code","Fidelity Fires 2 Managers For Violating Ethics Code"
"https://www.nytimes.com/2010/02/26/business/global/26rbs.html","Julia Werdigier","2010-02-26","The British bank set aside £1.3 billion for bonuses, up from £900 million a year earlier.","758","null","The New York Times","Business Day","News","article","Royal Bank of Scotland Narrows Loss and Adds to Bonuses","Royal Bank of Scotland Narrows Loss and Adds to Bonuses"
"https://www.nytimes.com/2010/02/26/business/26regulate.html","Sewell Chan","2010-02-26","Banking representatives and the Treasury secretary say that they have agreed on the need to get a bill through Congress this year.","917","null","The New York Times","Business Day","News","article","Traction for Banking Regulation","Traction For Banking Regulation"
"https://www.nytimes.com/2010/02/26/business/media/26adco.html","Stuart Elliott","2010-02-26","The Four A’s merged two conferences together this year, recognizing how specialists in different areas are collaborating more often on campaigns for clients.","687","null","The New York Times","Business Day","News","article","Bringing Groups Together to Revamp an Industry","Bringing Groups Together to Revamp an Industry"
"https://www.nytimes.com/2010/02/26/world/asia/26korea.html","null","2010-02-26","North Korea said on Friday that it has apprehended four South Koreans, the latest in a series of detentions where the North’s reclusive government held foreigners on charges of illegal entry.","166","null","The New York Times","World","News","article","Four South Koreans Detained in North","Four South Koreans Detained in North"
"https://www.nytimes.com/2010/02/27/world/asia/27myanmar.html","Thomas Fuller","2010-02-26","The Supreme Court in Myanmar refused an appeal to end the house arrest of the country’s leading dissident, Aung San Suu Kyi. ","444","null","The New York Times","World","News","article","Myanmar Denies Dissident’s Appeal","Burmese Dissident’s Appeal Is Denied"
"https://www.nytimes.com/2010/02/27/world/asia/27kabul.html","Alissa Rubin","2010-02-26","At least 18 people were killed in the Afghan capital on Friday by several suicide bombers in attacks claimed by the Taliban.","1018","null","The New York Times","World","News","article","Guesthouses Used by Foreigners in Kabul Hit in Deadly Attacks","Bombers Strike Against Foreigners at Kabul Guesthouses"
"https://www.nytimes.com/2010/02/27/business/global/27thaiauto.html","Thomas Fuller","2010-02-26","In a departure from previous years, General Motors and Ford have secured funding from local banks for expansion projects in Thailand.","758","null","International Herald Tribune","Business Day","News","article","2 Big U.S. Carmakers Turn to Local Banks for Thai Factories","2 Big U.S. Carmakers Turn to Local Banks for Thai Factories"
"https://www.nytimes.com/2010/02/27/business/economy/27econ.html","Javier Hernández","2010-02-26","Sales of existing homes fell 7.2 percent; analysts had expected an increase. Meanwhile, the first revision of G.D.P. for late 2009 shows that the economy grew at a 5.9 percent annual pace.","817","null","The New York Times","Business Day","News","article","January Existing Home Sales Drop Despite Tax Credit","January Existing Home Sales Drop Despite Tax Credit"
"https://www.nytimes.com/2010/02/27/world/europe/27turkey.html","Sabrina Tavernise","2010-02-26","Turkey’s prime minister, Recep Tayyip Erdogan,  declared that an investigation into alleged coup preparations  and the detention of some military officers was “for the benefit of the people.” ","460","null","The New York Times","World","News","article","Turkish Leader Defends Inquiry Into Possible Plot","Turkish Leader Defends Inquiry Into Possible Plot"
"https://www.nytimes.com/2010/02/28/jobs/28boss.html","Perry Garfinkel","2010-02-27","Ricardo Poma credits his relatives and his family history with inspiring him professionally.","606","null","The New York Times","Job Market","News","article","A Family’s Vision","A Family’s Vision"
"https://www.nytimes.com/2010/02/27/your-money/27money.html","Ron Lieber","2010-02-26","There’s bound to be another bubble and another one after that. A way to survive their collapses is to honestly assess your long-term goals.","1397","null","The New York Times","Your Money","News","article","Preparing for the Inevitable Bursting Bubble","Bubbles Burst, But Investors Can Be Ready"
"https://www.nytimes.com/2010/02/27/business/global/27oysters.html","Matthew Saltmarsh","2010-02-26","The reason that oyster thefts are rising harks back to a mysterious decimation of stocks a few years ago that hit the seed oysters.","1281","null","The New York Times","Business Day","News","article","In France, Gendarmes Are on Patrol Against Oyster Rustlers","In France, Gendarmes Are on Patrol Against Oyster Rustlers"
"https://www.nytimes.com/2010/02/27/world/middleeast/27diyala.html","Marc Santora","2010-02-26","Even after a call last week by a national Sunni political party to boycott, Sunnis continued to hang banners of their preferred candidates, including those barred from running.","1083","null","The New York Times","World","News","article","Iraqi Sunnis Pin Their Hopes on Elections","With Options Dwindling, Iraqi Sunnis Pin Their Hopes on Elections"
"https://www.nytimes.com/2010/02/27/business/global/27yuan.html","Keith Bradsher","2010-02-27","Even with higher factory wages, white-collar workers are still having to pitch in to meet shipping deadlines.","1097","null","The New York Times","Business Day","News","article","Defying Global Slump, China Has Labor Shortage","Chinese Plants Starting to Feel Labor Shortage"
"https://www.nytimes.com/2010/02/27/world/americas/27cuba.html","Marc Lacey","2010-02-27","At least four other prisoners who were arrested as part of a mass roundup of dissidents along with the dead dissident, Orlando Zapata Tamayo, have begun their own hunger strikes.","928","null","The New York Times","World","News","article","Dissident’s Death Ignites Protest Actions in Cuba","Dissident’s Death Ignites Protest Actions in Cuba"
"https://www.nytimes.com/2010/03/18/world/asia/18thai.html","Thomas Fuller","2010-03-17","Police said the number of protesters, many of whom are farmers from northeast Thailand, was down sharply to 20,000 people from more than 100,000 on Sunday.","503","null","The New York Times","World","News","article","Thailand Protests Continue, but Their Scale Diminishes","Thailand Protests Continue, But Their Scale Diminishes"
"https://www.nytimes.com/2010/03/18/business/economy/18econ.html","Javier Hernández","2010-03-17","Wholesale prices fell 0.6 percent in February as a big drop in energy prices offset higher food costs.","536","null","The New York Times","Business Day","News","article","Wholesale Prices Decline as Gasoline Leads the Way","Wholesale Prices Decline As Gasoline Leads the Way"
"https://www.nytimes.com/2010/03/18/world/asia/18pstan.html","Waqar Gillani","2010-03-17","The Americans, who traveled to Pakistan from the Washington suburbs and were detained in December, pleaded not guilty.","582","null","The New York Times","World","News","article","5 Americans Held in Pakistan Plead Not Guilty to Terrorism Charges","5 Americans Held in Pakistan Plead Not Guilty to Terrorism Charges"
"https://www.nytimes.com/2010/03/18/business/18auto.html","Nick Bunkley","2010-03-17","Christopher P. Liddell also said that a public offering for G.M. was possible this year, but that the company would first need to make a profit.","568","null","The New York Times","Business Day","News","article","G.M. Has ‘Reasonable Chance’ of Profit This Year, Its Chief Finance Officer Says","G.M. Has ‘Reasonable Chance’ of Profit This Year, Its Chief Finance Officer Says"
"https://www.nytimes.com/2010/03/18/world/europe/18merkel.html","Jack Ewing","2010-03-17","The German Chancellor adopted a harsh tone toward Greece Wednesday also saying that Europe needed better rules to police its members. ","378","null","The New York Times","World","News","article","Merkel Urges Tougher Rules for Euro Zone","Merkel Urges Tougher Rules for Euro Zone"
"https://www.nytimes.com/2010/03/18/world/asia/18myanmar.html","null","2010-03-17","Myanmar may be slowly moving away from years of authoritarianism and Soviet-style economic policies that have left most of its people in dire poverty.","1097","null","The New York Times","World","News","article","Change Comes to Myanmar, but Only on the Junta’s Terms","Inch at a Time, Burmese Junta Allows Change"
"https://www.nytimes.com/2010/03/18/world/europe/18euro.html","Steven Erlanger","2010-03-18","Some argue that severe cuts in public spending to whittle down euro-zone deficits could send unemployment rates surging and bring down governments.","1197","null","The New York Times","World","News","article","German Call for Austerity Has Europe Grumbling","German Calls For Austerity Have Europe Grumbling"
"https://www.nytimes.com/2010/03/18/business/global/18yukos.html","Andrew Kramer","2010-03-18","Rosneft, Russia’s state-owned oil company, is said to be concerned that a British court might seize assets to pay a $380 million award to Yukos Oil.","350","null","The New York Times","Business Day","News","article","Rosneft Stock Falls on Fear of Seizures","Rosneft Stock Falls on Fear Of Seizures"
"https://www.nytimes.com/2010/03/18/world/asia/18terror.html","David Sanger","2010-03-18","A recent drone strike killed a commander who helped plan the killing of C.I.A. staff at an Afghanistan base.","486","null","The New York Times","World","News","article","Drone Strike Said to Kill a Leader of Al Qaeda","Drone Strike Said to Kill A Leader Of Al Qaeda"
"https://www.nytimes.com/2010/03/18/technology/internet/18amazon.html","Motoko Rich","2010-03-18","As Apple builds its electronic bookstore, Amazon is trying to use its clout to hold on to its early lead in the market.","937","null","The New York Times","Technology","News","article","Amazon Threatens Publishers as Apple Looms","A Rift at Amazon On E-Book Prices"
"https://www.nytimes.com/2010/03/18/world/middleeast/18diplo.html","David Sanger","2010-03-18","The move would be a risky one for President Obama at a time when Prime Minister Benjamin Netanyahu’s coalition government is fragile and  Palestinians are deeply divided.","932","null","The New York Times","World","News","article","U.S. Mulls Own Plan for Mideast Talks","U.S. Mulls Own Plan for Mideast Talks"
"https://www.nytimes.com/2010/03/19/world/europe/19kidnap.html","Alan Cowell","2010-03-18","A harrowing saga of kidnappers, cops, ransom and surveillance that reached from Pakistan to Spain ended with arrests and the return of the 5-year-old hostage.","475","null","The New York Times","World","News","article","Young Hostage Freed After Wide Hunt","Young British Hostage Is Freed After International Hunt"
"https://www.nytimes.com/2010/03/19/world/middleeast/19iran.html","Nazila Fathi","2010-03-19","Iranian democracy advocates welcome a U.S. decision to lift sanctions on some online services, but they say they need more help in overcoming government roadblocks to information.","863","null","The New York Times","World","News","article","Iran’s Opposition Seeks More Help in Cyberwar With Government","Iran’s Opposition Seeks More Help in Cyberwar With Government"
"https://www.nytimes.com/2010/03/19/world/europe/19germany.html","Jack Ewing","2010-03-18","The leader of the Catholic Church in Bavaria discussed the molestation cases that have shaken Pope Benedict XVI’s home region.","705","null","The New York Times","World","News","article","German Archbishop  Expresses Shame Over Scandal","German Archbishop Expresses ‘Deep Shame’ Over Abuse Scandal"
"https://www.nytimes.com/2010/03/11/world/africa/11safrica.html","Celia Dugger","2010-03-10","In the London Evening Standard this week Winnie Mandikizela-Mandela described her former husband as a figurehead who had made a bad deal with South Africa’s former white rulers. ","575","null","The New York Times","World","News","article","Winnie Mandela’s Remarks Raise Stir","Quotes From Mandela’s Ex-Wife Cause Stir"
"https://www.nytimes.com/2010/03/12/world/asia/12tibet.html","Edward Wong","2010-03-11","China fears protests this week to mark the anniversaries of ethnic uprisings.","729","null","The New York Times","World","News","article","China Increases Security in Tibet to Prevent Protests","WORLD BRIEFING | ASIA; China: Security Increased in Tibet"
"https://www.nytimes.com/2010/03/12/world/africa/12somalia.html","null","2010-03-11","World Food Program officials said it would welcome an independent investigation into its Somalia operations after a report that up to half the food aid was being diverted.","456","null","The New York Times","World","News","article","U.N. to End Some Deals for Food to Somalia","U.N. to End Some Deals For Food To Somalia"
"https://www.nytimes.com/2010/03/12/business/12regulate.html","Sewell Chan","2010-03-11","Senator Bob Corker, a Republican on the Senate Banking Committee, called Senator Christopher J. Dodd’s announcement on Thursday “very disappointing.” ","1103","null","The New York Times","Business Day","News","article","Democrats Push Ahead on Finance Bill","Reform Bill At Impasse, Democrats Push Ahead"
"https://www.nytimes.com/2010/03/12/world/middleeast/12gaza.html","Fares Akram","2010-03-11","British officials took Paul Martin, a freelance filmmaker, to Israel after Hamas officials ended his 25-day detention.","238","null","The New York Times","World","News","article","Hamas Releases British Journalist","WORLD BRIEFING | MIDDLE EAST; Gaza: Hamas Releases British Journalist"
"https://www.nytimes.com/2010/03/12/world/middleeast/12biden.html","Ethan Bronner","2010-03-11","Uncertainty over talks with the Palestinians seems to have grown during the vice president’s visit.","692","null","The New York Times","World","News","article","Biden to Leave Mideast Amid Unease","Biden to Leave the Middle East Amid Uncertainty and Unease"
"https://www.nytimes.com/2010/03/12/business/global/12hedge.html","James Kanter","2010-03-11","The European Union rebutted criticism by the U.S. of its plans to tighten the rules on hedge funds.","613","null","International Herald Tribune","Business Day","News","article","The E.U. and U.S. Quarrel Over Hedge Funds","The E.U. and U.S, Quarrel Over Regulating Hedge Funds"
"https://www.nytimes.com/2010/03/12/business/media/12comcast.html","Edward Wyatt","2010-03-11","The agency wants to ensure that customers do not lose TV access because of fee disputes between broadcasters and cable companies.","442","null","The New York Times","Business Day","News","article","F.C.C. Ponders Action on Cable Fee Disputes","F.C.C. Ponders Action on Cable Fee Disputes"
"https://www.nytimes.com/2010/03/12/world/americas/12elderly.html","Ian Urbina","2010-03-12","No strangers to hardship, elderly Haitians find themselves distinctly vulnerable and emotionally burdened these days.","1122","null","The New York Times","World","News","article","Earthquake’s Burdens Weigh Heavily on Haiti’s Elderly","Earthquake’s Burdens Weigh Heavily on Haiti’s Elderly"
"https://www.nytimes.com/2010/03/12/business/global/12bp.html","Julia Werdigier","2010-03-12","The deal would give BP access to an area off the coast of Brazil that analysts expect to have great potential for oil discoveries.","429","null","The New York Times","Business Day","News","article","BP to Pay Devon $7 Billion for Fuel Assets","BP to Pay Devon $7 Billion for Fuel Assets"
"https://www.nytimes.com/2010/03/12/business/global/12hsbc.html","David Jolly","2010-03-12","HSBC’s private banking unit initially said that records on 10 or fewer clients were taken when the theft occurred three years ago.","360","null","The New York Times","Business Day","News","article","Bank Revises Number Affected by Data Theft","Bank Revises Number Affected by Data Theft"
"https://www.nytimes.com/2010/03/12/business/12views.html","null","2010-03-12","The market for private-label mortgage bonds in the United States might be ready for revival. A handful of firms are working on deals that could hit the market by June.","739","null","The New York Times","Business Day","News","article","Mortgage Bonds  Make a Comeback","null"
"https://www.nytimes.com/2010/03/12/business/12seed.html","William Neuman","2010-03-12","A Justice Department antitrust investigation of the seed industry is apparently focused on Monsanto.","1235","null","The New York Times","Business Day","News","article","Rapid Rise in Seed Prices Draws U.S. Scrutiny","A Growing Discontent"
"https://www.nytimes.com/2010/03/12/world/asia/12afghan.html","Alissa Rubin","2010-03-12","Fighting between Afghan subtribes raises questions about using tribes as part of a counterinsurgency strategy.","818","null","The New York Times","World","News","article","Afghan Tribal Rivalries Bedevil a U.S. Plan","Afghan Tribal Rivalries Bedevil a U.S. Plan"
"https://www.nytimes.com/2010/03/20/world/middleeast/20diplo.html","Mark Landler","2010-03-19","At an international meeting on Friday, the emphasis was on starting Israel’s indirect talks with the Palestinians.","1059","null","The New York Times","World","News","article","Clinton Calls Israel’s Moves to Ease Tension ‘Useful’","Clinton Calls Israel’s Steps to Cool Housing Dispute ‘Useful’"
"https://www.nytimes.com/2010/03/21/jobs/21bosses.html","null","2010-03-20","Eric Hippeau, chief executive of The Huffington Post, decided to become a journalist when he was 12 — on the day John F. Kennedy was assassinated.","663","null","The New York Times","Job Market","News","article","With Eyes Wide Open","With Eyes Wide Open"
"https://www.nytimes.com/2010/03/21/business/21digi.html","Randall Stross","2010-03-20","Evite became dominant in online invitations by being free to users. Paperless Post, a new rival, is going the pay route.","933","null","The New York Times","Business Day","News","article","They’re Not Waiting for an Invitation to Evite’s Party","They’re Not Waiting for an Invitation to Evite’s Party"
"https://www.nytimes.com/2010/03/21/business/economy/21view.html","Robert Frank","2010-03-20","To bolster the economy, Robert H. Frank suggests a tax on consumption of more than $500,000 a year by families earning more than $1 million.","926","null","The New York Times","Business Day","News","article","Hey, Big Spender: You Need a Surtax","Hey, Big Spender: You Need a Surtax"
"https://www.nytimes.com/2010/03/20/business/20lions.html","Michael de la Merced","2010-03-20","The offer by Carl Icahn, who owns about 18.9 percent of the film company, comes after Lions Gate’s rejection of his previous proposal for a 29.9 percent stake.","357","null","The New York Times","Business Day","News","article","Altering Tactics, Icahn Seeks All of Lions Gate","Altering Tactics, Icahn Seeks All of Lions Gate"
"https://www.nytimes.com/2010/03/20/business/20consumergene.html","Andrew Pollack","2010-03-20","One problem is that DNA scanning is often unable to offer meaningful predictions about a person’s risk for a disease.","1482","null","The New York Times","Business Day","News","article","Consumers Slow to Embrace the Age of Genomics","Outlook Uncertain"
"https://www.nytimes.com/2010/03/20/business/20organic.html","William Neuman","2010-03-20","The Department of Agriculture will begin enforcing rules on testing organically grown foods for pesticides, after an audit exposed gaps in the National Organic Program.","925","null","The New York Times","Business Day","News","article","U.S. Plans Spot Tests of Organic Products","U.S. Plans Spot Tests Of Organic Products"
"https://www.nytimes.com/2010/03/21/world/europe/21dagestan.html","Ellen Barry","2010-03-20","Fifty-eight police officers were killed last year in Dagestan by a combination of Islamist militants, alienated youth, and ordinary criminals.","1180","null","The New York Times","World","News","article","With Breakdown of Order in Russia’s Dagestan Region, Fear Stalks Police ","With Breakdown of Order in Russia’s Dagestan Region, Fear Stalks Police"
"https://www.nytimes.com/2010/03/21/world/asia/21china.html","Edward Wong","2010-03-20","Chinese officials often say in public and in the Chinese news media that the country is moving toward democracy.","474","null","The New York Times","World","News","article","Official in China Says Western-Style Democracy Won’t Take Root There","Legislative Official in China Says Western-Style Democracy Won’t Take Root There"
"https://www.nytimes.com/2010/03/21/world/europe/21russia.html","Michael Schwirtz","2010-03-20","The Kremlin clamped down on many protests by using the security services to put pressure on opposition groups and with minor concessions.","662","null","The New York Times","World","News","article","Russian Protests Seeking Ouster of Putin Fall Short","Russian Protests Seeking Ouster of Putin Fall Short of Predicted Turnout"
"https://www.nytimes.com/2010/03/13/your-money/13shortcuts.html","Alina Tugend","2010-03-13","Go easy on the detergent in dishwashers and washing machines, and never clean your oven the day before Thanksgiving.","1202","null","The New York Times","Your Money","News","article","For the Dishwasher’s Sake, Go Easy on the Detergent","For the Dishwasher’s Sake, Go Easy on the Detergent"
"https://www.nytimes.com/2010/03/13/world/asia/13prexy.html","Helene Cooper","2010-03-13","President Obama met with his war cabinet on Friday, and the issue of reconciling with the Taliban is gaining traction, even as administration officials debate whether the time is right. ","586","null","The New York Times","World","News","article","White House Weighs Talks With Taliban After Afghan Successes","White House Weighs Talks With Taliban After Afghan Successes"
"https://www.nytimes.com/2010/03/13/world/middleeast/13diplo.html","Mark Landler","2010-03-13","Secretary of State Hillary Rodham Clinton called Israel’s plans for new housing units for Jews in East Jerusalem “a deeply negative signal” about Israel-American relations.","727","null","The New York Times","World","News","article","Clinton Rebukes Israel on Housing Announcement","Housing Plan Harms Ties, Clinton Tells Netanyahu"
"https://www.nytimes.com/2010/03/13/business/13seed.html","William Neuman","2010-03-13","The Agriculture and Justice Departments will work together to address concerns about large companies dominating seeds, milk and livestock.","420","null","The New York Times","Business Day","News","article","Justice Dept. Tells Farmers It Will Press Agriculture Industry on Antitrust","Justice Dept. Tells Farmers It Will Press Agriculture Industry on Antitrust"
"https://www.nytimes.com/2010/03/14/business/14schools.html","Peter Goodman","2010-03-13","Commercial trade schools are under fire because they are attracting more students and Pell grants.","2467","null","The New York Times","Business Day","News","article","In Hard Times, Lured Into Trade School and Debt","In Hard Times, Lured Into Trade School and Debt"
"https://www.nytimes.com/2010/03/15/business/media/15pew.html","null","2010-03-15","Only 35 percent have a favorite site and 21 percent rely primarily on a single source, according to a survey by the Pew Research Center.","252","null","The New York Times","Business Day","News","article","Most Online News Readers Use 5 Sites or Fewer, Study Says","Most Online News Readers Use 5 Sites or Fewer, Study Says"
"https://www.nytimes.com/2010/03/15/business/media/15carr.html","David Carr","2010-03-15","With social media, a traditionally passive form of entertainment could someday become a conglomeration of professional production and multiple conversations.","947","null","The New York Times","Business Day","News","article","Talking Back to Your TV, Incessantly","Talking Back To Your TV, Incessantly"
"https://www.nytimes.com/2010/03/15/technology/15fedflix.html","Brian Stelter","2010-03-14","The International Amateur Scanning League has taken it upon itself to copy as much federal video as it can and put it online.","764","null","The New York Times","Technology","News","article","Duplicating Federal Videos for an Online Archive","Duplicating Federal Videos for an Online Archive"
"https://www.nytimes.com/2010/03/15/world/europe/15france.html","Steven Erlanger","2010-03-14","The results in a first round of regional elections point to a resounding defeat for the governing party of President Nicolas Sarkozy in the final round next Sunday.","725","null","The New York Times","World","News","article","Socialists Lead in Early Voting in France","Socialists Lead in Early Voting in France"
