"|","|__writer_name","|__pub_date","|__snippet","|__word_count","|__score","|__source","|__section_name","|__type_of_material","|__document_type","|__main_headline","|__print_headline"
"https://www.nytimes.com/2010/08/26/business/global/26engineer.html","Vikas Bajaj","2010-08-26","India, which is flooded with software engineers, lacks skilled professionals interested in overhauling the nation’s decaying highways, power plants and railroads.","1175","null","The New York Times","Business Day","News","article","A High-Tech Titan Plagued by Potholes","A High-Tech Titan Plagued by Potholes"
"https://www.nytimes.com/2010/08/26/business/economy/26fed.html","Sewell Chan","2010-08-26","Facing a a worrying low inflation rate and persistently high unemployment, Ben S. Bernanke may signal the Federal Reserve’s course in a speech Friday.","1078","null","The New York Times","Business Day","News","article","Bernanke to Offer Outlook as Fed Weighs Bolder Steps","Bernanke Expected to Sketch New Fed Action on Economy"
"https://www.nytimes.com/2010/08/26/business/economy/26trade.html","null","2010-08-26","Even with regulation, some federally insured banks say they will continue to make bets using their own money on behalf of clients.","1074","null","The New York Times","Business Day","News","article","Despite Reform, Banks Have Room for Risky Deals","Despite Reform, Banks Have Room For Risky Deals"
"https://www.nytimes.com/2010/08/27/world/middleeast/27bahrain.html","null","2010-08-26","The country appears to be reconsidering its decade-long flirtation with reform following a rash of police detentions.","1158","null","The New York Times","World","News","article","Crackdown in Bahrain Hints of End to Reforms","Security Crackdown in Bahrain Hints of End to Reforms"
"https://www.nytimes.com/2010/08/27/world/europe/27russia.html","Michael Schwirtz","2010-08-26","Environmentalists were handed a surprising victory when President Dmitri A. Medvedev postponed construction of a Moscow-St. Petersburg highway.","651","null","The New York Times","World","News","article","Kremlin Relents, for Now, to Foes of Highway","In Surprise, Russian President Blocks Forest Road Opposed by Environmentalists"
"https://www.nytimes.com/2010/08/27/business/energy-environment/27radar.html","Leora Vestel","2010-08-26","Goals clash as the Defense Department raises concerns that wind projects can interfere with radar operations.","1098","null","The New York Times","Business Day","News","article","Wind Turbine Projects Run Into Resistance","On the Radar, And That’s the Problem"
"https://www.nytimes.com/2010/08/27/world/asia/27iht-kiln.html","Choe Sang-Hun","2010-08-26","Roasting inside a charcoal kiln is an age-long tradition, and it has recently become something of a newfound craze among South Koreans.","994","null","The New York Times","World","News","article","Kiln Saunas Make a Comeback in South Korea","HOENGSEONG JOURNAL: With Charcoal as an Elixir, South Koreans Revitalize by Roasting in Kilns"
"https://www.nytimes.com/2010/09/15/world/asia/15kabul.html","Alissa Rubin","2010-09-14","It could take months to bring the bank into compliance with Afghan banking laws, said several officials.","631","null","The New York Times","World","News","article","More Trouble Ahead for Kabul Bank","More Problems Foreseen For Troubled Kabul Bank"
"https://www.nytimes.com/2010/09/15/business/15pentagon.html","Christopher Drew","2010-09-14","The changes are intended to rein in the ballooning cost of weapon systems and make military ships and planes more affordable.","828","null","The New York Times","Business Day","News","article","Pentagon Changes Rules to Cut Cost of Weapons","Pentagon Changes Rules To Cut Cost of Weapons"
"https://www.nytimes.com/2010/09/15/business/15egg.html","Gardiner Harris","2010-09-14","An Iowa farm received hundreds of positive results for salmonella in the two years before its eggs sickened more than 1,500 people, investigators said.","1070","null","The New York Times","Business Day","News","article","Salmonella at Egg Farm Traced to 2008","Salmonella Found in ’08 At Egg Farm"
"https://www.nytimes.com/2010/09/15/world/europe/15stuttgart.html","Michael Slackman","2010-09-15","A project to link Stuttgart to the European high-speed rail system is under way, but still faces strong opposition.","1197","null","The New York Times","World","News","article","Walls Fall in a German City, but This Time to Few Cheers","Walls Fall in a German City, but This Time to Few Cheers"
"https://www.nytimes.com/2010/09/15/business/15chocolate.html","Andrew Pollack","2010-09-15","Two separate groups are vying for credit in what some might consider the research arm of a chocolate war.","758","null","The New York Times","Business Day","News","article","Rival Candy Projects Both Parse Cocoa’s DNA","Candy Makers and Science Join to Parse Cocoa’s DNA"
"https://www.nytimes.com/2010/09/15/world/asia/15corruption.html","Mark Mazzetti","2010-09-15","The Obama administration is debating whether to make Afghanistan’s president, Hamid Karzai, a more central player in efforts to root out graft.","1040","null","The New York Times","World","News","article","U.S. Debates Karzai’s Place in Fighting Corruption","U.S. Debates Karzai’s Place In Graft Fight"
"https://www.nytimes.com/2010/09/15/world/americas/15mexico.html","Randal Archibold","2010-09-15","Cecilia Romero Castillo resigned after an attack threw an unwelcome spotlight on the often harsh treatment of migrants bound for the United States.","232","null","The New York Times","World","News","article","Mexican Official Quits","Mexican Official Quits"
"https://www.nytimes.com/2010/09/16/business/retirementspecial/16BALANCE.html","John Hanc","2010-09-15","Falls are a risk for older adults, accounting for 18,000 deaths a year among those 65 and up in the United States. But avoiding them is a learnable skill.","983","null","The New York Times","Business Day","News","article","Staying on Balance, With the Help of Exercises","Staying on Balance, With the Help of Exercises"
"https://www.nytimes.com/2010/09/16/world/middleeast/16mideast.html","Mark Landler","2010-09-15","Negotiations involving the Palestinian Authority, Israel and the United States moved to Israel on Wednesday even as militants in Gaza offered unspoken commentary of their own.","921","null","The New York Times","World","News","article","Amid Shelling, Mideast Peace Talks Drag","Amid Shelling, Mideast Peace Talks Drag"
"https://www.nytimes.com/2010/09/16/business/retirementspecial/16ESTATE.html","Deborah Jacobs","2010-09-15","A few options may be worth considering whether you think the estate-tax exemption will revert to $1 million on Jan. 1 or not.","1531","null","The New York Times","Business Day","News","article","Devising Strategies While the Estate Tax Is in Limbo","Devising Strategies While the Estate Tax Is in Limbo"
"https://www.nytimes.com/2010/09/16/business/retirementspecial/16INVEST.html","null","2010-09-15","Four financial advisers offer a variety of ideas for investing with significantly better yields than C.D.’s or money market funds while limiting risk.","1032","null","The New York Times","Business Day","News","article","Rethinking Investments After a Flight to Security","Investing After A Flight To Safety"
"https://www.nytimes.com/2010/09/16/business/global/16court.html","Matthew Saltmarsh","2010-09-15","Lawyers for George Soros said they were confident the European Court of Human Rights would clear the way for Mr. Soros to be exonerated in France.","912","null","The New York Times","Business Day","News","article","Soros to Get a Day in Court Over Insider Trading Case","Soros to Get a Day in Court Over Insider Trading Case"
"https://www.nytimes.com/2010/09/16/business/16craigslist.html","Claire Miller","2010-09-15","At a House Judiciary Committee hearing, Craigslist also defended its right to post sex-related ads as well as its efforts to fight sex trafficking.","769","null","The New York Times","Business Day","News","article","Craigslist Says It Has Shut Its Section for Sex Ads","Craigslist Says It Has Shut Its Section for Sex Ads"
"https://www.nytimes.com/2010/09/16/business/16columbia.html","Geraldine Fabrikant","2010-09-16","Columbia does not disclose the asset mix of its endowment, which is run by Nirmal Narvekar.","461","null","The New York Times","Business Day","News","article","Columbia’s Endowment Posts 17% Return","Columbia’s Endowment Posts 17% Return"
"https://www.nytimes.com/2010/09/16/business/16chase.html","Eric Dash","2010-09-16","Customers of the bank were prevented from gaining Internet access to their accounts.","498","null","The New York Times","Business Day","News","article","Online Woes Plague Chase for 2nd Day","Online Woes Plague Chase For 2nd Day"
"https://www.nytimes.com/2010/09/11/world/europe/11iht-veniceads.html","Elisabetta Povoledo","2010-09-13","This summer, the lagoon city's tolerance for being a huge backdrop to sell beverages and necklaces came to a boiling point.","1451","null","International Herald Tribune","World","News","article","Walls of Ads Test Venice's Patience","Walls of Ads Test Venice's Patience"
"https://www.nytimes.com/2010/09/11/technology/11bell.html","Ian Austen","2010-09-10","Bell Canada will pay $1.25 billion for the 85 percent of CTV that it did not own. In a separate deal, a holding company for the Thomson family will take an 85 percent stake in The Globe and Mail.","607","null","The New York Times","Technology","News","article","Bell Canada to Retake Control of Canadian TV Network","Bell Canada to Retake Control of Canadian TV Network"
"https://www.nytimes.com/2010/09/11/business/11fraud.html","Julie Creswell","2010-09-10","The adviser, Kenneth I. Starr, admitting that he cheated wealthy and elderly clients out of tens of millions of dollars.","918","null","The New York Times","Business Day","News","article","Guilty Plea in Fraud by Adviser to Stars","Guilty Plea In Fraud By Adviser To Stars"
"https://www.nytimes.com/2010/09/11/world/asia/11japan.html","Martin Fackler","2010-09-10","Hundreds of thousands of people listed as aged 100 years or over are actually missing and probably dead, the Justice Ministry said.","477","null","The New York Times","World","News","article","Japan’s Elderly Count Was Off by 234,000","Count Finds Japan’s Tally Of Elderly Is Too High"
"https://www.nytimes.com/2010/09/11/business/11shop.html","Stephanie Clifford","2010-09-10","Many families have trimmed their back-to-school budgets, dealing an unexpected blow to retailers.","1131","null","The New York Times","Business Day","News","article","Back-to-School Shoppers Focus on Necessities","Back to School, Back to Basics"
"https://www.nytimes.com/2010/09/12/your-money/12haggler.html","David Segal","2010-09-11","The ordeal of getting a computer hard drive repaired and returned was much worse than the original malfunction.","910","null","The New York Times","Your Money","News","article","Find Broken Computer. Return to Company. Repeat.","Find Broken Computer. Return to Company. Repeat."
"https://www.nytimes.com/2010/09/12/business/12suit.html","Andrew Martin","2010-09-11","When a Florida bank sued the analyst Richard X. Bove for his critique of its financial health, his colleagues and his employer abandoned him.","3506","null","The New York Times","Business Day","News","article","The Loneliest Analyst","The Loneliest Analyst"
"https://www.nytimes.com/2010/09/11/business/global/11auto.html","David Jolly","2010-09-11","The carmakers are paying back the government ahead of schedule because the bailout interest rates are rising as the companies’ profits climb.","376","null","The New York Times","Business Day","News","article","Two French Automakers Start to Repay Government","Two French Automakers Start to Repay Government"
"https://www.nytimes.com/2010/09/12/world/middleeast/12egypt.html","null","2010-09-11","Egypt’s military must decide whether to try to assure its status or to block President Hosni Mubarak’s son.","1213","null","The New York Times","World","News","article","Succession Gives Army a Stiff Test in Egypt","Succession Gives Army A Stiff Test In Egypt"
"https://www.nytimes.com/2010/09/12/business/global/12iceland.html","Bloomberg News","2010-09-11","A special committee has recommended that top leaders during the 2008 crisis be indicted on negligence charges.","295","null","The New York Times","Business Day","News","article","Iceland Considers Charges in Nation’s Banking Collapse","Iceland Considers Charges in Nation’s Banking Collapse"
"https://www.nytimes.com/2010/09/12/world/europe/12side-raids.html","null","2010-09-12","Kevin Kutz, director of public affairs at Microsoft’s headquarters in Redmond, Wash., issued the following statement about Microsoft’s role in antipiracy inquiries in Russia.","364","null","The New York Times","World","News","article","Statement by Microsoft","Statement by Microsoft"
"https://www.nytimes.com/2010/09/13/world/europe/13turkey.html","Sebnem Arsu","2010-09-12","A sweeping package of reforms handed a victory to the Islamist-rooted government.","1228","null","The New York Times","World","News","article","Turkish Reforms Pass by Wide Margin","Turkish Constitutional Changes Pass by a Wide Margin"
"https://www.nytimes.com/2010/10/01/business/global/01labor.html","Matthew Saltmarsh","2010-09-30","Job creation in advanced economies in the wake of the global economic crisis is increasingly being delayed, bringing a heightened threat of social unrest.","734","null","International Herald Tribune","Business Day","News","article","U.N. Agency Warns of Dangers of Slow Job Growth","U.N. Agency Warns of Dangers of Slow Job Growth"
"https://www.nytimes.com/2010/10/01/business/global/01welfare.html","Landon Thomas","2010-09-30","British politicians are moving very cautiously in limiting benefits like child subsidies or a winter heating allowance.","1278","null","The New York Times","Business Day","News","article","Amid Austerity, Britain Keeps Benefits","Amid Austerity Plans, Britain Keeps Welfare for the Well-Off"
"https://www.nytimes.com/2010/10/01/business/01rental.html","Thomas Kaplan","2010-10-01","The shareholders’ rejection of Hertz’s $1.46 billion takeover offer for Dollar Thrifty on Thursday cleared the way for a more lucrative deal of $1.53 billion with Avis.","421","null","The New York Times","Business Day","News","article","Dollar Thrifty Shareholders Vote Against Hertz Bid, Leaving Avis Standing","Dollar Thrifty Shareholders Vote Against Hertz Bid, Leaving Avis Standing"
"https://www.nytimes.com/2010/10/01/business/media/01times.html","null","2010-10-01","The New York Times Magazine will be led by Hugo Lindgren, the executive editor of Bloomberg Businessweek and an alumnus of New York magazine and George.","199","null","The New York Times","Business Day","News","article","The Times Names Editor for Magazine","The Times Names Editor For Magazine"
"https://www.nytimes.com/2010/10/01/business/01consumer.html","Sewell Chan","2010-10-01","The lack of a permanent director limits the the Consumer Financial Protection Bureau from writing rules governing consumer loans.","355","null","The New York Times","Business Day","News","article","Limits Emerge for a New Bureau Without a Director","Limits Emerge for a New Bureau Without a Director"
"https://www.nytimes.com/2010/10/02/world/americas/02ecuador.html","Simon Romero","2010-10-01","The resignation was submitted after President Rafael Correa, who was held captive by police officers on Thursday, vowed to overhaul the force.","570","null","The New York Times","World","News","article","Ecuador Police Chief Resigns After Uprising","Ecuador’s Police Chief Steps Down After an Uprising by Striking Officers"
"https://www.nytimes.com/2010/10/02/business/02auto.html","Bill Vlasic","2010-10-01","While sales were up, overall demand continued to be lower than automakers had expected it to be at this point in the recovery.","778","null","The New York Times","Business Day","News","article","New Models Help Sales for Automakers","New Models and Light Trucks Help September Sales for Automakers"
"https://www.nytimes.com/2010/10/03/business/economy/03view.html","Robert Shiller","2010-10-02","As managers try to ensure their companies’ survival, many are also refusing to take creative risks. But such a fortress mentality makes the unemployment problem only worse.","961","null","The New York Times","Business Day","News","article","The Survival of the Safest","The Survival Of the Safest"
"https://www.nytimes.com/2010/10/03/business/economy/03fund.html","Paul Lim","2010-10-03","Large companies may stand to benefit from their presence in fast-growing emerging markets like China.","678","null","The New York Times","Business Day","News","article","Stage Is Set (Again) for a Blue-Chip Revival","Stage Is Set (Again) For a Blue-Chip Revival"
"https://www.nytimes.com/2010/10/04/business/global/04iht-zamtel04.html","Matthew Saltmarsh","2010-10-03","What was supposed to be a simple privatization to place a decrepit company on a sound financial footing has degenerated into a nasty domestic feud.","1689","null","International Herald Tribune","Business Day","News","article","Privatization of Zambian Phone Company Degenerates Into a Feud","High Court to Look at Sale of Zambian Phone Company"
"https://www.nytimes.com/2010/10/04/world/middleeast/04mideast.html","Ethan Bronner","2010-10-03","An Israeli military court convicted two soldiers of forcing a 9-year-old Palestinian to check bags for explosives.","439","null","The New York Times","World","News","article","Israeli Soldiers Convicted of Using Boy as Shield","Two Israeli Soldiers Are Convicted of Using Palestinian Boy as Shield in Gaza War"
"https://www.nytimes.com/2010/10/04/technology/04pad.html","Steve Lohr","2010-10-04","After more than a decade, Dr. Tom Doerr and his brother, John, see a possible turning point for their business with Apple’s iPad and a national mandate for digital medical records.","1361","null","The New York Times","Technology","News","article","2 Brothers Await Broad Use of Medical E-Records","A Quest For Medical E-Records"
"https://www.nytimes.com/2010/10/04/business/media/04link.html","Noam Cohen","2010-10-04","Two online standouts in efforts to catalog content are evolving differently: IMDB is trying to increase its profile on the Internet, while Gracenote is moving further behind the scenes.","1128","null","The New York Times","Business Day","News","article","Obsessions With Minutiae Thrive as Databases","Obsessions With Minutiae Thrive as Databases"
"https://www.nytimes.com/2010/10/04/world/04currency.html","David Sanger","2010-10-04","A growing number of countries are retreating from some free-market rules that have guided international trade.","1319","null","The New York Times","World","News","article","More Countries Adopt China’s Tactics on Currency","More Countries Adopt the Tactics of China in Fight Over Currency Policies"
"https://www.nytimes.com/2010/10/04/business/media/04times.html","null","2010-10-04","The company intends to pay back a $250 million loan from the Mexican billionaire Carlos Slim Helú in early 2012, a spokeswoman confirmed.","195","null","The New York Times","Business Day","News","article","Times Co. to Repay Loan Early","Times Co. To Repay Loan Early"
"https://www.nytimes.com/2010/10/04/business/global/04escudo.html","Raphael Minder","2010-10-04","Pedro Passos Coelho, leader of the opposition Social Democrats, accused Prime Minister José Sócrates in an interview of breaking a pledge made in May not to raise taxes further.","610","null","International Herald Tribune","Business Day","News","article","Opposition Leader Fights Austerity Bill in Portugal","Opposition Leader Fights Austerity Bill in Portugal"
"https://www.nytimes.com/2010/10/05/business/global/05inside.html","Paul Taylor","2010-10-04","Harsher enforcement of Europe's much-abused budget rules may assuage the bloc's German paymaster, but it will not solve the euro zone's deeper problems.","771","null","International Herald Tribune","Business Day","News","article","E.U. Risks Making a Bad Situation Worse","E.U. Risks Making a Bad Situation Worse"
"https://www.nytimes.com/2010/10/05/world/asia/05thai.html","Thomas Fuller","2010-10-04","Thai judges on Monday appeared to quash the prospect of a lengthy second trial of the suspected arms dealer Viktor Bout, who is wanted in the U.S.","564","null","The New York Times","World","News","article","Suspected Arms Dealer Seems Closer to Extradition","WORLD BRIEFING | ASIA; Thailand: Arms-Dealing Suspect\nSeems Closer to U.S. Extradition"
"https://www.nytimes.com/2010/10/05/world/europe/05welfare.html","Landon Thomas","2010-10-04","A move to end universal payments is perhaps the most direct attack yet on the menu of middle class benefits that has long underpinned European welfare states.","942","null","The New York Times","World","News","article","In Sharp Change, Britain Will Reduce Child Benefits for the Middle Class","In Sharp Change, Britain Will Eliminate Child Benefits for the Middle Class"
"https://www.nytimes.com/2010/10/05/technology/companies/05skype.html","Peter Lattman","2010-10-04","Tony Bates will assume the top job at Skype as its new owners continue to put their stamp on the fast-growing company after buying it from eBay.","641","null","The New York Times","Technology","News","article","Cisco Executive Is Named Chief of Skype, as New Owners Build a Leadership Team","Cisco Executive Is Named Chief of Skype, as New Owners Build a Leadership Team"
"https://www.nytimes.com/2010/10/05/business/media/05adco.html","Brian Stelter","2010-10-04","MSNBC, now the No. 2 cable news channel, has a new tagline that embraces its progressive political identity.","861","null","The New York Times","Business Day","News","article","With Tagline, MSNBC Embraces a Political Identity","With Tagline, MSNBC Embraces a Political Identity"
"https://www.nytimes.com/2010/10/05/business/global/05potash.html","Ian Austen","2010-10-04","The study for Saskatchewan estimated that if BHP’s offer for the Potash Corporation was successful, provincial revenue would fall by about $1.96 billion over 10 years.","410","null","The New York Times","Business Day","News","article","Potash Deal Report Predicts Loss for Province","Potash Deal Report Predicts Loss for Province"
"https://www.nytimes.com/2010/10/05/world/middleeast/05iran.html","William Yong","2010-10-04","The sites of two senior clerics were blocked by government censors in a possible sign of a hardening political divide.","596","null","The New York Times","World","News","article","In Sign of Discord, Iran Blocks Web Sites of Some Clerics","WORLD BRIEFING | MIDDLE EAST; Iran: In Possible Sign of Discord,\nTop Clerics’ Web Sites Are Blocked"
"https://www.nytimes.com/2010/10/05/business/media/05follett.html","Julie Bosman","2010-10-04","E-book readers are used to paying less, but new titles from Ken Follett and James Patterson have bucked that trend.","721","null","The New York Times","Business Day","News","article","2 E-Books Cost More Than Amazon Hardcovers","In Turnaround, 2 E-Books Cost More Than Amazon Hardcovers"
"https://www.nytimes.com/2010/09/30/world/middleeast/30syria.html","Robert Worth","2010-09-30","A draft law regulating online media would clamp down on bloggers and other journalists.","1126","null","The New York Times","World","News","article","Web Tastes Freedom Inside Syria, and It’s Bitter","Online Media Taste Freedom Inside Syria, And It’s Bitter"
"https://www.nytimes.com/2010/09/30/world/asia/30pstan.html","Jane Perlez","2010-09-30","A video of executions by uniformed men sparked concerns over killings by Pakistani soldiers, who have U.S. support.","1276","null","The New York Times","World","News","article","Video Hints at Executions by Pakistanis","Video Hints At Executions By Pakistanis"
"https://www.nytimes.com/2010/10/01/business/01aig.html","Mary Walsh","2010-09-30","Under the plan, the Treasury Department will own 92.1 percent of A.I.G. before it begins to sell its shares to the public.","813","null","The New York Times","Business Day","News","article","A.I.G. Reaches Deal to Repay Treasury and Fed for Bailout","A.I.G. and U.S. Agree on Exit Plan, but Numbers Are Uncertain"
"https://www.nytimes.com/2010/10/01/world/middleeast/01iran.html","William Yong","2010-09-30","Families of three anti-government protesters who died at Iran’s Kahrizak prison have demanded the prosecution of those running the extra-legal detention center.","513","null","The New York Times","World","News","article","Kin of Detainees Seek Prosecution of Iran Officials","Kin of Iranian Detainees Seek Prosecution of High Officials"
"https://www.nytimes.com/2010/10/04/business/media/04adnewsletter3.html","null","2010-10-04","Alexander Interactive, New York, formed a unit, Canopy, to specialize in Web design for e-commerce businesses.","1047","null","The New York Times","Business Day","News","article","Accounts and People of Note in the Ad Industry","Webdenda"
"https://www.nytimes.com/2010/10/01/business/global/01ruble.html","Andrew Kramer","2010-09-30","The recession had already quieted the construction boom in Moscow, but its future suddenly became an open question when the Russian president abruptly fired Yuri Luzhkov.","1180","null","International Herald Tribune","Business Day","News","article","Mayor's Departure Could Slow Moscow's Growth","Mayor's Departure Could Slow Moscow's Growth"
